creationDate,orderId,categoryName,name,price,listPrice,quantity,productId,seller,data_extracao
2026-04-18 11:36:40,1625831208035-01,Aspiradores de Pó e Água | Eletroportáteis,"Extratora de sujeiras portátil wap spot cleaner w3 1450w 3 em 1 para tapetes, carpetes, estofados e colchões – cinza e roxo",59271,66589,1,2044877,loyalt,2026-04-22 01:38:51
2026-04-18 11:35:19,1625831208034-01,Camas | Quarto | Móveis,Cama Box Casal Suede + Colchão Molas Ensacadas Texas Prime Colchões 138x188x64cm Preto,87290,104390,1,2556591,webcontinentalmktplace,2026-04-22 01:38:51
2026-04-18 11:25:22,1625821208030-01,Camas | Quarto | Móveis,Cama Box Casal Conjugada Ortopédico Alpha Espuma,69900,77667,1,1555471,webcontinentalmktplace,2026-04-22 01:38:52
2026-04-18 11:23:30,1625821208029-01,"Multiprocessador | Liquidificadores, Batedeiras e Processadores | Eletroportáteis",Multiprocessador Philco 1000W 5 em 1 PMP10A 127V,26990,36990,1,1309501,Philco,2026-04-22 01:38:52
2026-04-18 11:17:24,1625821208027-01,Notebooks | Notebooks e Acessórios | Computadores e Informática,Notebook Positivo Vision C14 Lumina BAR Intel® Celeron® N4500 Windows 11 Home 8GB RAM 128GB eMMC 14” HD Tecla Link Cinza,209900,399900,1,1957465,lojapositivo,2026-04-22 01:38:52
2026-04-18 11:14:00,1625821208025-01,Carros de passeio | Pneus | Produtos automotivos,Pneu Aro 13 175/75R13 84T Royal Mile Royal Black,21691,21691,1,792277,pneubarato,2026-04-22 01:38:53
2026-04-18 11:13:11,1625821208023-01,"Caixas de Som Portáteis | Áudio | Cinema, TV e Áudio",Caixa de Som Amplificada Philco Bluetooth PCX4500 300W Bivolt,60490,60490,1,1899545,webcontinentalmktplace,2026-04-22 01:38:53
2026-04-18 11:13:07,1625821208022-01,Instrumentos Musicais | Meninos | Brinquedos,Microfone Waldman P-5800,5224,5224,1,2352344,webcontinentalmktplace,2026-04-22 01:38:53
2026-04-18 11:12:46,1625821208021-01,"Vitaminas, Minerais e Suplementos | Saúde e Bem Estar",Creatina Monohidratada Integralmedica 300g Neutro,4030,6200,1,2271061,webcontinentalmktplace,2026-04-22 01:38:53
2026-04-18 11:12:46,1625821208021-01,"Vitaminas, Minerais e Suplementos | Saúde e Bem Estar",Barra Proteína Vo2 Whey Bar 12 Unidades - Integralmedica Cookies And Cream,4940,7600,1,2330194,webcontinentalmktplace,2026-04-22 01:38:53
2026-04-18 11:10:18,1625821208019-01,Guarda-Roupa E Roupeiros | Quarto | Móveis,Guarda-Roupa Casal Madesa Reno 3 Portas de Correr com Espelho Cor:Rustic/Preto,122999,154990,1,3768,madesacms,2026-04-22 01:38:54
2026-04-18 11:08:23,1625821208018-01,"Cafeteiras e Máquinas de Expresso | Café, Chá e Expresso | Eletroportáteis",Cafeteira Elétrica Electrolux 30 Xícaras Experience Programável com Timer Cor Inox Preta (ECM25) 127V,23990,31990,1,1107449,electrolux,2026-04-22 01:38:54
2026-04-18 11:05:53,1625821208016-01,Multiuso | Móveis,Armário Multiuso 4 Portas 8 Prateleiras Dueto Doripel Branco S/V,39990,48990,1,43891,multilojaonline,2026-04-22 01:38:54
2026-04-18 10:59:50,1625821208014-01,Eletroportáteis,Chaleira elétrica elgin inox 2l preta 1200w jarra sem fio desligamento automático,5710,5710,1,2631621,loyalt,2026-04-22 01:38:54
2026-04-18 10:55:27,1625821208012-01,Sanduicheiras e Grelhas Elétricas | Eletroportáteis,Sanduicheira Elétrica Cadence Click 110V,9800,11490,2,1777975,webcontinentalmktplace,2026-04-22 01:38:55
2026-04-18 10:52:20,1625821208009-01,Bonecas | Meninas | Brinquedos,Cozinha Completa Toy Chef - SAMBA TOYS,18990,18990,1,1678931,minipreco,2026-04-22 01:38:55
2026-04-18 10:52:20,1625821208009-02,Secador de Cabelo | Cuidados com o Cabelo | Cosméticos e Perfumaria,Secador de Cabelo Britânia Viih Tube BSC21A Tourmaline Rosa Bivolt,17990,21990,1,1513738,multilojaonline,2026-04-22 01:38:55
2026-04-18 10:45:11,1625821208008-01,"Liquidificadores | Liquidificadores, Batedeiras e Processadores | Eletroportáteis","Liquidificador mondial turbo power l99-fr 2,2l 500w 3 velocidades vermelho",9990,10490,1,2045259,loyalt,2026-04-22 01:38:55
2026-04-18 10:41:48,1625821208007-01,Motorola | Smartphone | Celulares e Smartphones,Smartphone Motorola Moto G35 5G 256GB 12GB de RAM Coral,99900,119900,1,1455312,webfones,2026-04-22 01:38:56
2026-04-18 10:41:34,1625821208006-01,Cuidados com o Cabelo | Cosméticos e Perfumaria,Tsubaki Premium Moist E Repair - Shampoo 450ml,17700,17700,1,1897752,webcontinentalmktplace,2026-04-22 01:38:56
2026-04-18 10:39:14,1625821208004-01,Smartphone | Celulares e Smartphones,Celular samsung galaxy a07 tela 6.7” 256gb 4gb 90hz câmera dupla 50mp preto,93174,113197,1,2045348,loyalt,2026-04-22 01:38:56
2026-04-18 10:35:59,1625821208002-01,Femininos | Perfumes | Cosméticos e Perfumaria,Britney Spears Fantasy Eau De Parfum - 100Ml,21090,21090,1,1843727,webcontinentalmktplace,2026-04-22 01:38:57
2026-04-18 10:34:22,1625821208001-01,Fritadeiras Elétricas | Eletroportáteis,"Air Fryer Fritadeira Elétrica Digital Extream 5,5L Preto e Prata, 127v",32990,49900,1,1804573,tetrix,2026-04-22 01:38:57
2026-04-18 10:29:51,1625811207999-01,Fritadeiras Elétricas | Eletroportáteis,Fritadeira elétrica sem Óleo air fryer mondial afn40bi family inox 4l preta/inox,25900,30440,1,2046394,loyalt,2026-04-22 01:38:57
2026-04-18 10:25:15,1625811207995-01,Smartphone | Celulares e Smartphones,Celular samsung galaxy a07 tela 6.7” 256gb 4gb 90hz câmera dupla 50mp preto,93174,113197,1,2045348,loyalt,2026-04-22 01:38:57
2026-04-18 10:24:11,1625811207994-01,"Liquidificadores | Liquidificadores, Batedeiras e Processadores | Eletroportáteis",Liquidificador Britânia BLQ1380P Pro Maxx 6 Inox 3L 1200W 127V,13990,19990,1,18045,Philco,2026-04-22 01:38:57
2026-04-18 10:21:30,1625811207992-01,Fritadeiras Elétricas | Eletroportáteis,Fritadeira elétrica sem Óleo air fryer oven 2 em 1 mondial afon-12l-bi 12l digital – preta/inox,54900,58695,1,2047081,loyalt,2026-04-22 01:38:58
2026-04-18 10:21:06,1625811207990-01,Mochilas | Bolsas e Mochilas,Mochila Feminina Preta Média Executiva Casual Social Resistente Em Poliuretano - Majestic - Yins Brasil - Preto Preto,7900,7900,1,2553531,webcontinentalmktplace,2026-04-22 01:38:58
2026-04-18 10:18:42,1625811207988-01,"Cafeteiras e Máquinas de Expresso | Café, Chá e Expresso | Eletroportáteis",Moedor de Café Philco Grano Aroma PMC01i Inox 110V,10990,15990,1,79,Philco,2026-04-22 01:38:58
2026-04-18 10:18:07,1625811207986-01,Motorola | Smartphone | Celulares e Smartphones,Smartphone Motorola Moto G06 128GB 12GB de RAM Azul Marinho Smartphone Motorola Moto G06 128GB 12GB de RAM Laranja,68900,82900,1,2310773,webfones,2026-04-22 01:38:58
2026-04-18 10:15:02,1625811207985-01,"Aparelhos de Jantar | Louça, Copos e Talheres | Casa e Cozinha",APARELHO JANTAR JD DE CEREJAS  20PCS AE20-5B27 OXFORD,16990,39990,1,1853895,minipreco,2026-04-22 01:38:59
2026-04-18 10:14:28,1625811207984-01,Fones sem fio | Fones de Ouvido | Celulares e Smartphones,Fone De Ouvido Tws Bluetooth Branco,11390,19000,1,49769,funstock,2026-04-22 01:38:59
2026-04-18 10:07:20,1625811207981-02,"Bebedouros | Filtros, Bebedouros e Refrigeradores de Água | Eletroportáteis",Bebedouro Britânia BBE11P Aquaplus para 10L ou 20L Bivolt Bivolt,29990,47990,1,113043,Philco,2026-04-22 01:38:59
2026-04-18 10:07:20,1625811207981-01,Calculadoras | Material para Escritório | Papelaria,Mini Stepper WCT Fitness para Caminhada Fisioterapia com Monitor LCD e Regulador de Intensidade,30800,30800,1,2970978,webcontinentalmktplace,2026-04-22 01:38:59
2026-04-18 10:07:20,1625811207981-01,Fitness e Pilates | Esporte e Lazer,Disco Equilíbrio Inflável Balance Cushion 33cm Bomba Rosa,8999,8999,1,1523763,webcontinentalmktplace,2026-04-22 01:38:59
2026-04-18 10:03:21,1625811207977-01,"TVs | Cinema, TV e Áudio","Smart Tv Aiwa 32? Android, Hd, Comando De Voz, Dolby áudio, Hdr10 - Aws-tv-32-bl-02-a Tv 32 Android",89990,122290,1,1265813,webcontinentalmktplace,2026-04-22 01:39:00
2026-04-18 10:02:58,1625811207976-01,Fogões | Fogões e Cooktops | Eletrodomésticos,Fogão Esmaltec Ideal Super 5 Bocas Preto Bivolt 0104002937,102500,128125,1,2032570,webcontinental,2026-04-22 01:39:00
2026-04-18 09:54:24,1625811207974-01,Ventiladores | Eletroportáteis,Ventilador de mesa mondial maxis v30mxw 30cm 6 pás 3 velocidades 50w branco / azul,9350,11990,1,2044905,loyalt,2026-04-22 01:39:01
2026-04-18 09:53:55,1625811207973-01,Motorola | Smartphone | Celulares e Smartphones,Smartphone Motorola Moto G15 256GB 12GB de RAM Grafite,88900,109900,1,1330562,webfones,2026-04-22 01:39:01
2026-04-18 09:50:20,1625811207971-01,"Cafeteiras e Máquinas de Expresso | Café, Chá e Expresso | Eletroportáteis",Cafeteira Philco PCFE01 600ml 15 Cafezinhos 550W 127V,11990,17990,1,576462,Philco,2026-04-22 01:39:01
2026-04-18 09:49:02,1625811207970-01,Rack para TV | Sala de Estar | Móveis,Rack para TV até 55 Polegadas Madesa Copenhagen Cor:Cinza,19999,19999,1,3305,webcontinentalmktplace,2026-04-22 01:39:01
2026-04-18 09:45:44,1625811207968-01,"Cafeteiras e Máquinas de Expresso | Café, Chá e Expresso | Eletroportáteis",Cafeteira Philco PCF20A 720ml 20 Cafezinhos 650W 127V,17990,18990,1,802639,Philco,2026-04-22 01:39:02
2026-04-18 09:45:44,1625811207968-01,"Liquidificadores | Liquidificadores, Batedeiras e Processadores | Eletroportáteis",Liquidificador Philco PH900 Preto 1200W 127V,15990,19990,1,1303,Philco,2026-04-22 01:39:02
2026-04-18 09:45:44,1625811207968-02,Sanduicheiras e Grelhas Elétricas | Eletroportáteis,Grill e Sanduicheira Philco PGR21PI Maxx Clean 1000W 127V,16990,18990,1,3140,multilojaonline,2026-04-22 01:39:02
2026-04-18 09:42:56,1625811207966-01,"Batedeiras | Liquidificadores, Batedeiras e Processadores | Eletroportáteis",Batedeira planetária mondial bp-03 com 12 velocidades e 700w – preto,27050,34089,1,2047073,loyalt,2026-04-22 01:39:02
2026-04-18 09:42:35,1625811207965-01,Mochilas | Bolsas e Mochilas,Mochila OEM para Notebook Resistente à Água 48x33x16 Preto Unissex,5848,5848,2,2967502,webcontinentalmktplace,2026-04-22 01:39:02
2026-04-18 09:39:43,1625811207963-01,Máquinas de Lavar Roupas | Máquinas de Lavar e Secadoras | Eletrodomésticos,Centrifuga Roupas BCR15B Britânia Cesto Extragrande Inox 15Kg 220V,51990,65990,1,49772,Philco,2026-04-22 01:39:03
2026-04-18 09:35:09,1625811207962-01,Panelas | Panelas e Utensílios para Cozinhar | Casa e Cozinha,Jogo de Panelas Roma de Cerâmica Antiaderente 5 pçs Vermelha - Hauskraft,19295,59990,1,845513,minipreco,2026-04-22 01:39:03
2026-04-18 09:26:01,1625801207961-01,Utensílios de limpeza | Limpeza Doméstica | Casa e Cozinha,Mop Giratório com Cesto de Metal 9 Litros - DUARTES,6999,6999,1,1180361,minipreco,2026-04-22 01:39:03
2026-04-18 09:23:20,1625801207960-01,Rack para TV | Sala de Estar | Móveis,Rack para TV até 55 Polegadas Madesa Copenhagen Cor:Cinza,19999,19999,1,3305,webcontinentalmktplace,2026-04-22 01:39:03
2026-04-18 09:15:44,1625801207956-01,Objetos decorativos | Decoração | Casa e Cozinha,ESPELHO CHAO CAPELA 36X146CM PRETO EUROQUADROS,18999,18999,1,2519449,minipreco,2026-04-22 01:39:04
2026-04-18 09:11:14,1625801207951-01,Panelas de Arroz | Eletroportáteis Especiais | Eletroportáteis,Panela de Pressão Elétrica Electrolux por Rita Lobo 5L Preta Efficient c/ Timer (PCE20) 127V,36990,62990,1,1107818,electrolux,2026-04-22 01:39:04
2026-04-18 09:09:51,1625801207949-01,Iphone | Smartphone | Celulares e Smartphones,"iPhone 17 Pro Max (512GB) Prateado, Tela de 6,9"", 5G e Câmera de 48MP",1350000,1630000,1,1978346,shophub,2026-04-22 01:39:05
2026-04-18 09:08:57,1625801207948-01,Toalhas de Banho e Rosto | Cama e Banho | Casa e Cozinha,Toalha De Banho Canelada Gigante Banhão 70 X 140 Toalhas Beka - Cinza Cinza,2730,2730,3,1935190,webcontinentalmktplace,2026-04-22 01:39:05
2026-04-18 09:05:01,1625801207947-01,Roupa de Cama | Cama e Banho | Casa e Cozinha,Lençol Avulso Liso King Fusion Vivaldi Azul UN,7585,12999,1,128213,rovitex,2026-04-22 01:39:05
2026-04-18 09:02:56,1625801207945-01,Câmeras de Segurança | Sistemas de Segurança para Casa | Materiais de Construção,Kit Camera Ip Icsee Wifi + Cartão De Memória Sd 64gb,18240,19000,1,1419815,shophub,2026-04-22 01:39:06
2026-04-18 09:01:07,1625801207944-01,Cuidados com o Cabelo | Cosméticos e Perfumaria,Máquina de cortar cabelo bcr18t 18w titanium britânia com 9 acessórios 127v,9890,9890,1,2107247,loyalt,2026-04-22 01:39:06
2026-04-18 08:45:13,1625801207942-01,Cuidado Adulto | Saúde e Bem Estar,Hidratante facial em gel niina secrets by eudora niina skin hidragel,7792,9799,1,2062296,loyalt,2026-04-22 01:39:06
2026-04-18 08:45:13,1625801207942-02,Rosto | Pele | Cosméticos e Perfumaria,Água Micelar L'Oréal Paris Solução de Limpeza 5 em 1 400ml,4089,5649,1,846831,farmaciaindiana,2026-04-22 01:39:06
2026-04-18 08:45:13,1625801207942-02,Protetores Solares e Bronzeadores | Pele | Cosméticos e Perfumaria,Protetor Solar OAZ fps 70 200ml Protetor Solar OAZ 200ml  FPS70,5599,5599,1,840385,farmaciaindiana,2026-04-22 01:39:06
2026-04-18 08:44:15,1625801207941-01,Sanduicheiras e Grelhas Elétricas | Eletroportáteis,Sanduicheira Elétrica Cadence Click 220V,9800,11490,1,1777975,webcontinentalmktplace,2026-04-22 01:39:07
2026-04-18 08:43:03,1625801207939-01,Lavadoras de Alta Pressão | Eletrodomésticos,Lavadora de Alta Pressão Britânia 1300PSI 1300W BLPE2300 127V,25990,52990,1,2616931,Philco,2026-04-22 01:39:07
2026-04-18 08:24:28,1625791207935-01,"TVs | Cinema, TV e Áudio","Smart tv 32"" hd samsung h5000f sistema operacional tizen hdr purcolor",110164,142890,1,2046132,loyalt,2026-04-22 01:39:07
2026-04-18 08:11:01,1625791207932-01,Sanduicheiras e Grelhas Elétricas | Eletroportáteis,Sanduicheira e Grill Britânia BGRE01 2 em 1 750W 127V,9990,11990,1,732521,Philco,2026-04-22 01:39:08
2026-04-18 08:05:37,1625791207931-01,Colírios | Oftalmologia | Medicamentos,Lacrifilm Solução Oftamológica 10Ml Genom LACRIFILM SOL OFT 10,3019,3878,1,722887,farmaconde,2026-04-22 01:39:08
2026-04-18 07:59:04,1625791207930-01,Ventiladores | Eletroportáteis,Ventilador de Coluna Britânia BVT450 Maxx Force 160W 127V,18990,36290,1,155224,webcontinentalmktplace,2026-04-22 01:39:08
2026-04-18 07:36:00,1625791207929-01,Monitores e Diagnósticos de Saúde | Equipamentos e Artigos Médicos | Saúde e Bem Estar,Tiras Reagentes G-Tech Lite com 50 unidades,6990,8899,1,849741,farmaciaindiana,2026-04-22 01:39:08
2026-04-18 07:21:49,1625781207925-01,Sanduicheiras e Grelhas Elétricas | Eletroportáteis,Sanduicheira Grill Mondial Ultra Antiaderente S-13 Preto 220V,9990,9990,1,879975,webcontinentalmktplace,2026-04-22 01:39:09
2026-04-18 07:21:49,1625781207925-01,"Talheres e Porta-Talheres | Louça, Copos e Talheres | Casa e Cozinha","Panela de Pressão Panelux Alumínio 4,5L Polida Classic PANELA DE PRESSAO PANELUX ALUMINIO 4,5L",5390,6400,1,733462,webcontinentalmktplace,2026-04-22 01:39:09
2026-04-18 07:17:28,1625781207924-01,"Vitaminas | Vitaminas, Minerais e Suplementos | Saúde e Bem Estar",Colágeno Conlife Com Ácido Hialurônico Pote 300g,8990,11239,1,1199707,farmaconde,2026-04-22 01:39:09
2026-04-18 07:06:17,1625781207922-02,Secador de Cabelo | Cuidados com o Cabelo | Cosméticos e Perfumaria,Secador de Cabelos Philco Bivolt 2200W PSC2450 Íons Tourmaline Bivolt,20990,21990,1,1264491,Philco,2026-04-22 01:39:09
2026-04-18 07:06:17,1625781207922-01,Chapinhas e Pranchas | Cuidados com o Cabelo | Cosméticos e Perfumaria,Chapa Bivolt Ceramic Taiff Action 180°C Preto,11590,14000,1,28619,webcontinentalmktplace,2026-04-22 01:39:10
2026-04-18 06:28:55,1625771207919-01,Celulares e Smartphones,"Celular samsung galaxy a07 tela 6.7"" 128gb 4g 90hz câmera dupla 50mp verde",68536,68536,1,2652242,loyalt,2026-04-22 01:39:10
2026-04-18 05:51:25,1625771207917-01,Máquinas de Lavar Roupas | Máquinas de Lavar e Secadoras | Eletrodomésticos,Máquina de Lavar Electrolux 17kg Branca Essential Care com Cesto Inox e Jet&Clean (LED17) 127V,229900,324900,1,1107283,electrolux,2026-04-22 01:39:10
2026-04-18 05:11:29,1625761207916-01,Iphone | Smartphone | Celulares e Smartphones,"Apple iphone 15 128gb 6,1"" 48mp preto",436696,494333,1,2044993,loyalt,2026-04-22 01:39:10
2026-04-18 04:57:23,1625761207915-01,Caneta | Escrita | Papelaria,Kit Com 24 Canetas Coloridas Fine Line Ponta Fina 0.4 Mm Corpo Da Caneta Cinza,3148,3148,1,2279203,webcontinentalmktplace,2026-04-22 01:39:11
2026-04-18 04:43:35,1625761207914-01,"TVs | Cinema, TV e Áudio","Smart tv 43” samsung full hd un43f6000fgxzd, xbox cloud gaming, hdr, som em movimento virtual, ai energy mode, wi-fi e bluetooth",166296,206080,1,2046123,loyalt,2026-04-22 01:39:11
2026-04-18 03:08:08,1625741207913-01,Motorola | Smartphone | Celulares e Smartphones,Smartphone Motorola Edge 60 Pro 5G 256GB 24GB de RAM Azul,304900,349900,1,2595181,webfones,2026-04-22 01:39:11
2026-04-18 02:25:34,1625731207910-01,"Vitaminas, Minerais e Suplementos | Saúde e Bem Estar",Whey Pro Max Titanium Baunilha 1kg,12519,12519,1,830976,pensefarma,2026-04-22 01:39:11
2026-04-18 02:25:34,1625731207910-02,"Suplementos | Vitaminas, Minerais e Suplementos | Saúde e Bem Estar",Creatina - Max Titanium - 300g,5990,6990,1,139622,farmaciaindiana,2026-04-22 01:39:12
2026-04-18 01:11:26,1625721207903-01,Perfumes | Cosméticos e Perfumaria,Euphoria calvin klein - perfume feminino - eau de parfum,27536,41900,1,2062706,loyalt,2026-04-22 01:39:12
2026-04-18 01:05:24,1625721207900-01,Fogões | Fogões e Cooktops | Eletrodomésticos,Fogão 4 Bocas Mueller MFI4BC Automático Preto Fosco Bivolt,69990,79990,1,257186,multilojaonline,2026-04-22 01:39:12
2026-04-18 01:01:25,1625721207897-02,"Formas | Assadeiras, Fôrmas e Travessas | Casa e Cozinha",Conjunto de travessas refratárias marinex em vidro - 10 peças,11847,11847,2,2135902,loyalt,2026-04-22 01:39:12
2026-04-18 01:01:25,1625721207897-02,Potes | Utensílios para Cozinha | Casa e Cozinha,Conjunto de potes herméticos redondos electrolux em polipropileno – 4 peças,4436,4849,1,2045241,loyalt,2026-04-22 01:39:12
2026-04-18 01:01:25,1625721207897-01,Parafusadeiras | Ferramentas Elétricas | Materiais de Construção,Parafusadeira Philco Force PPF120MF 3 em 1 1500RPM Bivolt,27990,42990,1,672619,Philco,2026-04-22 01:39:13
2026-04-18 01:01:25,1625721207897-01,Ferro de Passar e Passadeiras | Eletroportáteis,Ferro de Passar a Vapor Britânia Ceramic BFV2000P Ferro de passar Britânia BFV2000P Ceramic Preto/Azul 220V,15990,16990,1,443,Philco,2026-04-22 01:39:13
2026-04-18 01:01:25,1625721207897-03,Potes | Utensílios para Cozinha | Casa e Cozinha,Potes Herméticos Electrolux de Plástico Branco Retangular com 20 Unidades,16900,27980,1,1108206,electrolux,2026-04-22 01:39:13
2026-04-18 00:53:20,1625721207895-01,"Tigelas | Louça, Copos e Talheres | Casa e Cozinha",Jogo 12 Bowl De Vidro Opalino Branco Quadrado Tigela Molho Sobremesa 12cm Em Casa Tem,10860,10860,1,1679283,webcontinentalmktplace,2026-04-22 01:39:13
2026-04-18 00:37:52,1625721207894-01,Fornos de Micro-Ondas | Eletrodomésticos,Microonda PMO38E Limpa Fácil 33 Litros Philco Branco 110V,82990,82990,1,1252606,webcontinentalmktplace,2026-04-22 01:39:13
2026-04-18 00:27:47,1625711207893-01,Panelas Elétricas | Eletroportáteis Especiais | Eletroportáteis,Panela Pressão Wap 5L Prosdócimo WPPE2 110V,39499,48000,2,2561927,webcontinentalmktplace,2026-04-22 01:39:14
2026-04-18 00:27:15,1625711207892-01,Celulares e Smartphones,"Celular samsung galaxy a07 tela 6.7"" 128gb 4g 90hz câmera dupla 50mp verde",68536,68536,1,2652242,loyalt,2026-04-22 01:39:14
2026-04-18 00:09:00,1625711207891-01,Cuidados com o Cabelo | Cosméticos e Perfumaria,Wella professionals oil reflections  smoothening Óleo capilar,7290,8900,1,2071335,loyalt,2026-04-22 01:39:14
2026-04-18 00:09:00,1625711207891-01,Panelas e Utensílios para Cozinhar | Casa e Cozinha,Conjunto de panelas 10 peças tramontina turim com revestimento antiaderente starflon max e tampas de vidro temperado - vermelho,27556,30229,1,2047989,loyalt,2026-04-22 01:39:14
2026-04-18 00:08:21,1625711207890-01,"Batedeiras | Liquidificadores, Batedeiras e Processadores | Eletroportáteis","Batedeira Mondial Prática 3,6 Litros B-44-B 400W Preta 220V",9990,11990,1,21139,multilojaonline,2026-04-22 01:39:14
2026-04-18 00:00:37,1625711207888-01,"Projetores | Cinema, TV e Áudio","Projetor Hy300 Pro 4k Wi-fi, Bluetooth, Streaming Integrado, Portátil, Imagem 130” Full Hd/4k",31980,31980,1,1990494,webcontinentalmktplace,2026-04-22 01:39:15
2026-04-17 23:56:11,1625711207886-01,"Jogos de Copos e Taças Mistos | Louça, Copos e Talheres | Casa e Cozinha",Jogo de Copo Dubai 480ML 6UN - NADIR,2990,3999,1,1151494,minipreco,2026-04-22 01:39:15
2026-04-17 23:56:11,1625711207886-01,Panelas | Panelas e Utensílios para Cozinhar | Casa e Cozinha,"Frigideira Wok Antiaderente com Tampa Grafite N24 2,8L - MTA",5999,5999,1,1757189,minipreco,2026-04-22 01:39:15
2026-04-17 23:53:33,1625711207884-01,Pincéis e rolos | Materiais de Pintura | Materiais de Construção,Tinta Aerossol Metálico 350ml - Tekbond Cromado,3290,3290,2,1343570,webcontinentalmktplace,2026-04-22 01:39:15
2026-04-17 23:53:33,1625711207884-01,Pincéis e rolos | Materiais de Pintura | Materiais de Construção,Tinta Aerossol Metálico 350ml - Tekbond Preto,3790,3790,4,1341212,webcontinentalmktplace,2026-04-22 01:39:15
2026-04-17 23:53:13,1625711207880-01,"Vitaminas | Vitaminas, Minerais e Suplementos | Saúde e Bem Estar",Vitamina B12 Nutrify 60 cápsulas,3671,3990,1,705952,mundoverde,2026-04-22 01:39:15
2026-04-17 23:53:13,1625711207880-03,Tintura e Coloração | Cuidados com o Cabelo | Cosméticos e Perfumaria,Tintura Wella Koleston 20 Preto,2399,2399,1,1206264,farmaconde,2026-04-22 01:39:16
2026-04-17 23:53:13,1625711207880-02,"Vitaminas, Minerais e Suplementos | Saúde e Bem Estar",Dr. Good Suplemento Alimentar Melatonina com 60 Gomas,5174,5174,1,1185337,pensefarma,2026-04-22 01:39:16
2026-04-17 23:53:13,1625711207880-04,Shampoos e Condicionadores | Higiene | Saúde e Bem Estar,Shampoo Clear Anticaspa Hidratação Intensiva Lv - 400ml,2469,3290,1,405752,farmaciaindiana,2026-04-22 01:39:16
2026-04-17 23:41:27,1625711207877-01,Ferramentas Elétricas | Materiais de Construção,Lavadora de alta pressão wap ousada wl 2610 ultra 1750psi 1500w – cinza e amarelo,42990,52490,1,2048180,loyalt,2026-04-22 01:39:17
2026-04-17 23:39:46,1625711207875-01,"Cafeteiras e Máquinas de Expresso | Café, Chá e Expresso | Eletroportáteis",Cafeteira Philco PCFE01 600ml 15 Cafezinhos 550W 127V,11990,17990,1,576462,Philco,2026-04-22 01:39:17
2026-04-17 23:39:46,1625711207875-02,Toalhas de Banho e Rosto | Cama e Banho | Casa e Cozinha,Jogo De Banho 4 Peças Coleção Verona Luxo Beka 100% Algodão Azul,5615,5615,1,1792779,webcontinentalmktplace,2026-04-22 01:39:17
2026-04-17 23:38:34,1625711207874-01,Panelas | Panelas e Utensílios para Cozinhar | Casa e Cozinha,"Panela de Pressão Magnific Grafite 4,5L - ALCAST",12472,16489,1,1155120,loyalt,2026-04-22 01:39:17
2026-04-17 23:35:33,1625711207873-01,"Cafeteiras e Máquinas de Expresso | Café, Chá e Expresso | Eletroportáteis",Cafeteira Britânia 18 Cafezinhos BCF19B 550W 127V,13990,21990,1,856850,webcontinentalmktplace,2026-04-22 01:39:18
2026-04-17 23:29:46,1625701207871-01,Smartphone | Celulares e Smartphones,Smartphone Realme C73 256GB 8GB de RAM Violet Parrot,129900,162900,1,2087013,webfones,2026-04-22 01:39:18
2026-04-17 23:27:01,1625701207870-01,"Áudio | Cinema, TV e Áudio",Fone de ouvido philips tat2500bk/00 intra-auricular true wireless bluetooth cancelamento de ruído 24h bateria preto,16639,19999,1,2047199,loyalt,2026-04-22 01:39:19
2026-04-17 23:23:20,1625701207869-01,Panelas | Panelas e Utensílios para Cozinhar | Casa e Cozinha,Jogo de Panelas Tramontina Turim 4 Peças em Alumínio Antiaderente Starflon Max Preto,22995,22995,1,153447,marinbrasil,2026-04-22 01:39:19
2026-04-17 23:19:40,1625701207868-01,"Liquidificadores | Liquidificadores, Batedeiras e Processadores | Eletroportáteis",Liquidificador mondial turbo glass l-1400 gi preto/inox 1400w com jarra de vidro,20590,23397,1,2045313,loyalt,2026-04-22 01:39:19
2026-04-17 23:11:56,1625701207867-01,Motorola | Smartphone | Celulares e Smartphones,Smartphone Motorola Moto G35 5G 256GB 12GB de RAM Coral,99900,119900,1,1455312,webfones,2026-04-22 01:39:19
2026-04-17 23:10:25,1625701207866-01,Xiaomi | Smartphone | Celulares e Smartphones,Xiaomi POCO X7 5G 512GB - 12GB Ram (Gray) Cinza - Pocophone,255900,315900,1,1412564,shophub,2026-04-22 01:39:20
2026-04-17 22:59:07,1625701207863-01,Smartphone | Celulares e Smartphones,Celular Motorola G06 Xt2535-3 4gb De Ram - 64gb - Tela 6.9 - Dual Sim Lte - Pantone Tendrill Verde,81505,81505,1,2709333,webcontinentalmktplace,2026-04-22 01:39:20
2026-04-17 22:44:30,1625701207858-01,Utensílios de limpeza | Limpeza Doméstica | Casa e Cozinha,Kit Pulverizador 2l Double Action Kers + Vmol 500ml Vonixx,16438,16438,1,1675094,webcontinentalmktplace,2026-04-22 01:39:20
2026-04-17 22:39:39,1625701207857-01,"Liquidificadores | Liquidificadores, Batedeiras e Processadores | Eletroportáteis","Liquidificador Oster 1400 Full Preto 3,2L 110V",21800,24990,1,1778169,webcontinentalmktplace,2026-04-22 01:39:20
2026-04-17 22:38:38,1625701207856-01,Notebooks | Notebooks e Acessórios | Computadores e Informática,"Notebook multi ub263 ultra, tela 15,6” hd, processador intel celeron n4020c, 4gb ram, 128gb emmc windows 11 home – cinza + fone de ouvido",155896,178383,1,2047103,loyalt,2026-04-22 01:39:21
2026-04-17 22:35:07,1625701207854-01,Escova Rotativa Modeladora | Cuidados com o Cabelo | Cosméticos e Perfumaria,Escova rotativa mondial erb-01 1200 w bivolt - preto/golden rose,14900,14900,1,2655119,loyalt,2026-04-22 01:39:21
2026-04-17 22:27:19,1625691207851-01,Sanduicheiras e Grelhas Elétricas | Eletroportáteis,Sanduicheira Inox Multiuso Oster 110V,17200,21990,1,2041074,webcontinentalmktplace,2026-04-22 01:39:21
2026-04-17 22:23:16,1625691207847-01,Celulares e Smartphones,"Celular samsung galaxy a17 4g tela 6.7"" 256gb super amoled câmera tripla 50mp azul",124696,152887,1,2295631,loyalt,2026-04-22 01:39:21
