creationDate,orderId,categoryName,name,price,listPrice,quantity,productId,seller,data_extracao
2026-05-10 22:25:34,1631211220139-01,"Colágeno | Vitaminas, Minerais e Suplementos | Saúde e Bem Estar",Ácido Hialurônico Com Colágeno Verisol 60 Comprimidos 1000mg Muwiz,5032,5990,1,1624119,webcontinentalmktplace,2026-05-11 20:43:37
2026-05-10 22:24:09,1631211220138-01,Aquecedores | Eletroportáteis,Aquecedor Mondial Termo Ceramica A-05 Preto/prata Aquecedor Mondial Termo Ceramica A-05 Aquecedor Ceramic-127v-preto/prata,17990,32690,1,880045,webcontinentalmktplace,2026-05-11 20:43:38
2026-05-10 22:23:02,1631211220137-01,Copa 2026,ENVELOPE COM 7 CROMOS - COPA DO MUNDO 2026,700,700,90,3038672,martinsfontespaulista,2026-05-11 20:43:38
2026-05-10 22:22:48,1631211220136-01,"Cafeteiras e Máquinas de Expresso | Café, Chá e Expresso | Eletroportáteis",Cafeteira Elétrica Electrolux 30 Xícaras Efficient Função Manter Aquecido Cor Inox Preta (ECM20) 127V,15990,20990,1,1107437,electrolux,2026-05-11 20:43:38
2026-05-10 22:21:32,1631211220134-01,Secadoras | Máquinas de Lavar e Secadoras | Eletrodomésticos,Secadora De Roupas Fischer Super Ciclo 8kg Prata 127V,47502,60900,1,1276839,webcontinentalmktplace,2026-05-11 20:43:39
2026-05-10 22:18:48,1631211220132-01,Smartwatches | Eletrônicos,Relógio Smartwatch Bluetooth D20,11163,11163,1,1568108,webcontinentalmktplace,2026-05-11 20:43:39
2026-05-10 22:15:54,1631211220128-01,Casa e Cozinha,Faqueiro Tramontina Laguna Aço Inox Com Facas Para Churrasco Acabamento Em Brilho 42 Peças 66906774,32461,32461,1,2620133,webcontinentalmktplace,2026-05-11 20:43:39
2026-05-10 22:15:54,1631211220128-02,"Jogos de Copos e Taças Mistos | Louça, Copos e Talheres | Casa e Cozinha",Conjunto de Taças Água Vinho Cristal 360ml 6 Peças Hauskraft,11190,19400,1,2723795,funstock,2026-05-11 20:43:40
2026-05-10 22:13:53,1631211220127-01,Celulares e Smartphones,"Smartphone motorola moto g35 5g coral 256gb 4gb ram + 8gb ram boost e camera 50mp com ai nfc tela 6.7"" com superbrilho",99778,139900,1,2137856,loyalt,2026-05-11 20:43:40
2026-05-10 22:06:45,1631211220126-01,Celulares e Smartphones,"Smartphone motorola moto g06 4g tela 6,9” 256gb câmera 50mp verde",75400,94900,1,2137865,loyalt,2026-05-11 20:43:41
2026-05-10 22:01:58,1631211220125-01,Rack para TV | Sala de Estar | Móveis,Rack para TV até 65 Polegadas Madesa Cancun Cor:Rustic/Preto,32999,49990,1,3343,madesacms,2026-05-11 20:43:41
2026-05-10 22:01:20,1631211220124-01,Ventiladores | Eletroportáteis,Ventilador de Coluna Mondial NVT-40C-8P-B Turbo 40CM 8 Pás Preto 127V 3799-01,27100,33875,1,856113,webcontinental,2026-05-11 20:43:41
2026-05-10 22:00:01,1631211220123-01,Celulares e Smartphones,"Celular samsung galaxy a17 4g tela 6.7"" 128gb super amoled câmera tripla 50mp preto",93496,137219,1,2295619,loyalt,2026-05-11 20:43:42
2026-05-10 21:59:07,1631211220121-01,Sanduicheiras e Grelhas Elétricas | Eletroportáteis,Sanduicheira cadence san400,7999,13999,2,1967110,loyalt,2026-05-11 20:43:42
2026-05-10 21:57:54,1631211220117-01,Protetores Solares e Bronzeadores | Pele | Cosméticos e Perfumaria,Protetor Solar Facial Principia Fps60 18% Filtros UV + 5% Niacinamida 40ml,4900,4900,1,833048,farmaciaindiana,2026-05-11 20:43:42
2026-05-10 21:57:54,1631211220117-01,Rosto | Pele | Cosméticos e Perfumaria,Creme Hidratante Principia CH-01 50g,3900,3900,1,1755641,farmaciaindiana,2026-05-11 20:43:42
2026-05-10 21:54:44,1631211220116-01,Carrinhos de Passeio | Bebês e Infantil,Travel System Galzerano Carrinho De Bebê Romano 1039 Com Bebê Conforto Cocoon Slim Preto E Cobre,99790,99790,1,2667248,webcontinentalmktplace,2026-05-11 20:43:42
2026-05-10 21:54:24,1631211220113-02,Ferramentas Elétricas | Materiais de Construção,Parafusadeira e furadeira wap wf12k3.2 bateria 12v bivolt,16900,20990,1,2046288,loyalt,2026-05-11 20:43:43
2026-05-10 21:54:24,1631211220113-01,Panificadora Elétrica | Eletroportáteis Especiais | Eletroportáteis,Panificadora Britânia Multipane 12 Programações 220V,56490,87990,1,2613483,webcontinentalmktplace,2026-05-11 20:43:43
2026-05-10 21:54:24,1631211220113-03,Ração e Petiscos | Pet Shop,"Ração Pedigree Cão Adulto Nutrição Essencial Sabor Carne 10,1Kg",9990,13490,2,1574132,farmaciaindiana,2026-05-11 20:43:43
2026-05-10 21:52:32,1631211220111-01,Casa e Cozinha,Fruteira De Chão Cozinha Montada Aço Preto Cesto Cobre Tampo Preto Roma - Cor: Preto,19800,19800,1,1973727,webcontinentalmktplace,2026-05-11 20:43:44
2026-05-10 21:52:32,1631211220111-02,"Bebedouros | Filtros, Bebedouros e Refrigeradores de Água | Eletroportáteis",Bebedouro Philco PBE14 10L e 20L Duas temperaturas Bivolt Bivolt,30990,41990,1,229737,Philco,2026-05-11 20:43:44
2026-05-10 21:50:01,1631211220110-01,Escova Rotativa Modeladora | Cuidados com o Cabelo | Cosméticos e Perfumaria,Escova Secadora Britânia BEC02PR Bivolt 4 em 1 1300W Bivolt,10990,19990,1,155346,Philco,2026-05-11 20:43:44
2026-05-10 21:48:06,1631211220108-01,Secadoras | Máquinas de Lavar e Secadoras | Eletrodomésticos,Secadora De Roupa Mueller Solaris 8kg 220V Branco,64900,77900,1,1992694,webcontinentalmktplace,2026-05-11 20:43:45
2026-05-10 21:45:13,1631211220106-01,Balcão | Cozinha | Móveis,Balcão 2 Portas 3 Gavetas sem Pia CZ601 Evidência Móveis Branco S/V,27990,34990,1,43713,multilojaonline,2026-05-11 20:43:45
2026-05-10 21:38:21,1631211220104-01,Perfumes | Cosméticos e Perfumaria,Body splash kiss ciclo cosméticos,3214,4599,1,2062612,loyalt,2026-05-11 20:43:45
2026-05-10 21:38:21,1631211220104-02,Perfumes | Cosméticos e Perfumaria,Perfume Jequiti Feminino Bem-me-quer Magia 25ml,1909,2599,1,1162573,farmaconde,2026-05-11 20:43:46
2026-05-10 21:31:14,1631211220102-01,Cobertores e Mantas | Cama e Banho | Casa e Cozinha,Manta De Microfibra Lisa Casal Rovitex Home Azul UN,4999,5999,2,2603171,rovitex,2026-05-11 20:43:46
2026-05-10 21:25:47,1631201220101-01,Fornos de Micro-Ondas | Eletrodomésticos,Micro-ondas Philco 28L Branco Pintura Limpa Fácil PMO30B 127V,48990,71990,1,2561895,Philco,2026-05-11 20:43:46
2026-05-10 21:17:35,1631201220099-02,Aquecedores | Eletroportáteis,Aquecedor Cadence Halógeno Lumiconfort 110V,21990,25990,1,1775091,multilojaonline,2026-05-11 20:43:47
2026-05-10 21:17:35,1631201220099-01,Sanduicheiras e Grelhas Elétricas | Eletroportáteis,Torradeira duo 127v 700w vermelha multi - go065,10990,10990,1,863456,loyalt,2026-05-11 20:43:47
2026-05-10 21:09:49,1631201220098-01,Chapinhas e Pranchas | Cuidados com o Cabelo | Cosméticos e Perfumaria,Chapa Bivolt Ceramic Taiff Action 180°C Preto,10990,14990,1,28619,farmaciaindiana,2026-05-11 20:43:47
2026-05-10 21:08:24,1631201220097-01,"Mixers | Liquidificadores, Batedeiras e Processadores | Eletroportáteis",Mixer 3 em 1 Electrolux Preto 400W com Tecnologia TruFlow (EIB10) 220V,18990,31990,1,1107399,electrolux,2026-05-11 20:43:48
2026-05-10 21:07:19,1631201220095-01,Eletroportáteis,Purificador de Água electrolux pe15p bivolt - preto,55900,55900,1,2046188,loyalt,2026-05-11 20:43:48
2026-05-10 21:02:24,1631201220087-01,Guarda-Roupa E Roupeiros | Quarto | Móveis,Guarda Roupa Solteiro 6 Portas 2 Gavetas Sidney Doripel Preto S/V,53990,65990,1,250111,multilojaonline,2026-05-11 20:43:48
2026-05-10 21:02:23,1631201220085-02,Fritadeiras Elétricas | Eletroportáteis,Air Fryer Oven Philco PFR2200 4 em 1 Preta 127V,49990,79990,1,17905,Philco,2026-05-11 20:43:49
2026-05-10 21:02:23,1631201220085-01,Aspiradores de Pó e Água | Eletroportáteis,Aspirador de pó e Água wap gtw10 com bocal de sopro 10 litros - 1400w,22900,35900,1,2046355,loyalt,2026-05-11 20:43:49
2026-05-10 21:00:53,1631201220084-01,Celulares e Smartphones,"Smartphone motorola moto g06 4g tela 6,9” 128gb câmera 50mp azul marinho",69878,83092,1,2047097,loyalt,2026-05-11 20:43:49
2026-05-10 21:00:23,1631201220083-01,Aspiradores de Pó e Água | Eletroportáteis,Aspirador de Pó Vertical 2 em 1 Philco 1450W PAS1600P 127V,14990,27990,1,129612,Philco,2026-05-11 20:43:49
2026-05-10 20:58:25,1631201220081-01,Aquecedores | Eletroportáteis,Aquecedor Mondial Termo Ceramica A-05 Preto/prata Aquecedor Mondial Termo Ceramica A-05220v Preto/prata,32690,32690,1,880045,webcontinentalmktplace,2026-05-11 20:43:50
2026-05-10 20:58:25,1631201220081-01,Torneiras | Hidráulico | Materiais de Construção,Torneira Elétrica Fame Elegance 4 Temperaturas De Bancada Preta 220v,24990,24990,1,1296314,webcontinentalmktplace,2026-05-11 20:43:50
2026-05-10 20:52:19,1631201220079-01,"TVs | Cinema, TV e Áudio","Smart Tv Aiwa 32? Android, Hd, Comando De Voz, Dolby áudio, Hdr10 - Aws-tv-32-bl-02-a Tv 32 Android",89990,122290,1,1265813,webcontinentalmktplace,2026-05-11 20:43:50
2026-05-10 20:49:00,1631201220076-01,Celulares e Smartphones,"Smartphone motorola moto g35 5g coral 256gb 4gb ram + 8gb ram boost e camera 50mp com ai nfc tela 6.7"" com superbrilho",99778,139900,1,2137856,loyalt,2026-05-11 20:43:50
2026-05-10 20:48:42,1631201220075-01,Fornos de Micro-Ondas | Eletrodomésticos,Micro-ondas Electrolux 23L cor Inox Efficient com Descongelamento Assistido (ME23S) 127V,72900,78900,1,1107443,electrolux,2026-05-11 20:43:51
2026-05-10 20:45:28,1631201220072-02,"Vitaminas, Minerais e Suplementos | Saúde e Bem Estar",Creatina Monohidratada Integral Médica 300g,8251,8251,1,2148616,webcontinentalmktplace,2026-05-11 20:43:51
2026-05-10 20:45:28,1631201220072-01,Rosto | Pele | Cosméticos e Perfumaria,Glow Hidratande Facial Ollie FPS50 Dourado 30ml,13999,13999,1,2576755,farmaciaindiana,2026-05-11 20:43:52
2026-05-10 20:44:41,1631201220070-01,Sanduicheiras e Grelhas Elétricas | Eletroportáteis,Sanduicheira cadence san400,7999,13999,1,1967110,loyalt,2026-05-11 20:43:52
2026-05-10 20:43:02,1631201220069-01,Fritadeiras Elétricas | Eletroportáteis,"Fritadeira Elétrica Sem Óleo Mondial New Pratic AF-31 3,5L 1500W Preta 127V 76426-01",19990,32990,1,826019,minipreco,2026-05-11 20:43:52
2026-05-10 20:41:06,1631201220066-01,Produto Update,Válvula Alternadora de Pressão para Caixa D Água Blukit,13990,13990,1,74049,webcontinentalmktplace,2026-05-11 20:43:52
2026-05-10 20:41:06,1631201220066-02,Fornos de Micro-Ondas | Eletrodomésticos,Micro-ondas Electrolux 20L cor Inox Espelhado com Função Tira Odor (MT30S) 220V,59900,76900,1,1107292,electrolux,2026-05-11 20:43:53
2026-05-10 20:39:31,1631201220065-01,Hidratante | Higiene | Saúde e Bem Estar,Perfume Qimmah Lattafa Edp Feminino 100ml,16590,16590,1,2709216,webcontinentalmktplace,2026-05-11 20:43:53
2026-05-10 20:38:25,1631201220064-01,Aspiradores de Pó e Água | Eletroportáteis,Aspirador de Pó Vertical 2 em 1 Philco 1450W PAS1600P 220V,14990,27990,1,129612,Philco,2026-05-11 20:43:53
2026-05-10 20:34:08,1631201220062-01,Perfumes | Cosméticos e Perfumaria,Perfume Amor Amor Cacharel Eau de Toilette com 30ml,17717,17717,1,1179339,pensefarma,2026-05-11 20:43:54
2026-05-10 20:33:43,1631201220061-01,Escova Secadora | Cuidados com o Cabelo | Cosméticos e Perfumaria,Escova Secadora Britania Soft BES13VD Verde Bivolt 1300W Bivolt,11990,18990,1,1526,Philco,2026-05-11 20:43:54
2026-05-10 20:31:20,1631201220060-01,Celulares e Smartphones,"Smartphone motorola moto g35 5g coral 256gb 4gb ram + 8gb ram boost e camera 50mp com ai nfc tela 6.7"" com superbrilho",99778,139900,1,2137856,loyalt,2026-05-11 20:43:54
2026-05-10 20:30:55,1631201220059-01,Mochilas | Bolsas e Mochilas,Mochila Militar Tática OEM 50 Litros em Oxford Verde Impermeável com Patch,18525,18525,1,2972877,webcontinentalmktplace,2026-05-11 20:43:55
2026-05-10 20:28:59,1631191220056-01,Fogões | Fogões e Cooktops | Eletrodomésticos,Fogão 4 Bocas Mueller MFI4BC Automático Preto Fosco Bivolt,69990,79990,1,257186,multilojaonline,2026-05-11 20:43:55
2026-05-10 20:20:49,1631191220052-02,Cuidados com o Cabelo | Cosméticos e Perfumaria,Kit Shampoo + Condicionador Haskell Cavalo Forte 300ml,7990,7990,1,1740781,farmaciaindiana,2026-05-11 20:43:55
2026-05-10 20:20:49,1631191220052-02,Cremes e Máscaras pra cabelo | Cuidados com o Cabelo | Cosméticos e Perfumaria,Máscara Capilar Haskell Mandioca 300g M?scara Capilar Haskell Mandioca 300g,5445,5445,1,831424,farmaciaindiana,2026-05-11 20:43:55
2026-05-10 20:20:49,1631191220052-02,Cremes e Máscaras pra cabelo | Cuidados com o Cabelo | Cosméticos e Perfumaria,Máscara para Cabelo Haskell Cavalo Forte 250g,5390,5390,1,714706,farmaciaindiana,2026-05-11 20:43:55
2026-05-10 20:20:49,1631191220052-01,Cuidado Adulto | Saúde e Bem Estar,Serum facial creamy - vitamina c,8420,8420,1,2640410,loyalt,2026-05-11 20:43:56
2026-05-10 20:20:26,1631191220049-03,"Sabonetes Líquidos, Óleos e Loções | Corpo e Banho | Cosméticos e Perfumaria",Bio-Oil 60ml Bio Oil 60 Ml.,4979,6299,1,853784,farmaciaindiana,2026-05-11 20:43:56
2026-05-10 20:20:26,1631191220049-02,Depilação | Depilação e Aparelhos de Barbear | Cosméticos e Perfumaria,Depilador Philco Aqua Deluxe Plus PDP02R Bivolt,17990,21990,1,1577,Philco,2026-05-11 20:43:57
2026-05-10 20:18:45,1631191220048-01,Chapinhas e Pranchas | Cuidados com o Cabelo | Cosméticos e Perfumaria,Chapinha | prancha taiff titanium 450 colors 230°c com emissão de Íons laranja - bivolt,41900,49990,1,2299562,loyalt,2026-05-11 20:43:57
2026-05-10 20:15:28,1631191220043-01,"Liquidificadores | Liquidificadores, Batedeiras e Processadores | Eletroportáteis",Liquidificador Electrolux 1300W 3.2L Efficient TriForce 12 Velocidades Preto (EBL1300) 127V,18990,22990,1,1957422,electrolux,2026-05-11 20:43:58
2026-05-10 20:13:19,1631191220041-01,Circulador de ar | Eletroportáteis,Umidificador Aromatizador Difusor Infantil Gatinho Luz Rgb,4237,4237,1,1970887,webcontinentalmktplace,2026-05-11 20:43:58
2026-05-10 20:13:19,1631191220041-02,Ferro de Passar e Passadeiras | Eletroportáteis,Ferro de passar a vapor arno ultragliss plus com spray e base durilium airglide – azul,28070,33558,1,2045204,loyalt,2026-05-11 20:43:58
2026-05-10 20:13:08,1631191220040-01,"Liquidificadores | Liquidificadores, Batedeiras e Processadores | Eletroportáteis",Liquidificador Philco PH900  Vermelho 1200W 127V,11990,19990,1,1302,Philco,2026-05-11 20:43:59
2026-05-10 20:12:51,1631191220039-01,Panelas de Arroz | Eletroportáteis Especiais | Eletroportáteis,Panela de Pressão Elétrica Electrolux por Rita Lobo 6L Preta Experience Digital (PCC20) 220V,52990,81990,1,1107558,electrolux,2026-05-11 20:43:59
2026-05-10 20:10:02,1631191220038-01,Panelas Elétricas | Eletroportáteis Especiais | Eletroportáteis,Panela elétrica de arroz philco ph10p visor glass 10 xícaras - inox,20900,21945,1,2655335,loyalt,2026-05-11 20:43:59
2026-05-10 20:08:39,1631191220037-01,Sanduicheiras e Grelhas Elétricas | Eletroportáteis,Sanduicheira cadence san400,7999,13999,1,1967110,loyalt,2026-05-11 20:43:59
2026-05-10 20:08:39,1631191220037-01,Escova Secadora | Cuidados com o Cabelo | Cosméticos e Perfumaria,Escova secadora philco advance pes25sr com cabo giratório bivolt 1300w - cinza e rosa,11900,11900,1,2299556,loyalt,2026-05-11 20:43:59
2026-05-10 20:04:09,1631191220035-01,Cortina de Ar | Eletrodomésticos,Cortina De Ar 90cm Com Controle Remoto Monofásico Ca1209c 220v - Eos 220v,55643,55643,2,1134654,webcontinentalmktplace,2026-05-11 20:44:00
2026-05-10 19:59:30,1631191220034-01,Suportes para Notebook | Notebooks e Acessórios | Computadores e Informática,Suporte Articulado Para Monitor Fortrek Fk425s 17-32,14816,14816,1,1639711,webcontinentalmktplace,2026-05-11 20:44:00
2026-05-10 19:59:16,1631191220033-01,Fritadeiras Elétricas | Eletroportáteis,Fritadeira Air Fry Britânia Oven BFR2100 4 em 1 Preta 1800W 220V,49990,70990,1,17909,Philco,2026-05-11 20:44:00
2026-05-10 19:58:30,1631191220032-01,Ar-condicionado | Eletrodomésticos,Ventilador de mesa mondial turbo nvt408pb 40cm 8 pás 3 velocidades preto/prata,17056,19940,1,2044902,loyalt,2026-05-11 20:44:01
2026-05-10 19:57:54,1631191220031-01,Smartphone | Celulares e Smartphones,Smartwatch Iwo8 Lite S Versão W34 Troca Pulseira Tela 44mm,10990,10990,1,1333042,webcontinentalmktplace,2026-05-11 20:44:01
2026-05-10 19:51:13,1631191220030-01,Casa e Cozinha,Blender Portátil Sem Fio Cadence Agitaê,15990,15990,1,3102794,webcontinentalmktplace,2026-05-11 20:44:01
2026-05-10 19:48:28,1631191220026-01,"Vitaminas, Minerais e Suplementos | Saúde e Bem Estar",Creatina Monohidratada Integral Médica 300g,8251,8251,1,2148616,webcontinentalmktplace,2026-05-11 20:44:02
2026-05-10 19:44:46,1631191220024-01,Fritadeiras Elétricas | Eletroportáteis,Air Fryer Oven Britânia 11L 8 Funções 1800W BAF11A 110V,39490,54990,1,2782970,webcontinentalmktplace,2026-05-11 20:44:02
2026-05-10 19:44:39,1631191220023-01,"Batedeiras | Liquidificadores, Batedeiras e Processadores | Eletroportáteis",Batedeira mondial prática black b-44 com 3 velocidades – preta,8218,10395,1,2046400,loyalt,2026-05-11 20:44:02
2026-05-10 19:44:33,1631191220022-01,Misturadores | Hidráulico | Materiais de Construção,Torneira Elétrica Lumen De Parede Branca Zagonel 220V,26990,26990,2,2265735,webcontinentalmktplace,2026-05-11 20:44:03
2026-05-10 19:36:51,1631191220021-01,Escova Rotativa Modeladora | Cuidados com o Cabelo | Cosméticos e Perfumaria,Escova secadora philco pes19sg 1300w bivolt prata,14900,23587,1,2655123,loyalt,2026-05-11 20:44:03
2026-05-10 19:35:09,1631191220020-01,"Sabonetes Líquidos, Óleos e Loções | Corpo e Banho | Cosméticos e Perfumaria",Refil Sabonete Líquido Bebê Tradicional - Granado - 250ml,1769,2099,2,143042,farmaciaindiana,2026-05-11 20:44:03
2026-05-10 19:34:49,1631191220019-01,Panelas e Utensílios para Cozinhar | Casa e Cozinha,"Panela de pressão tramontina 4,5 litros vancouver effect revestimento antiaderente starflon max preto",18990,21989,1,2046323,loyalt,2026-05-11 20:44:03
2026-05-10 19:34:31,1631191220018-01,Motorola | Smartphone | Celulares e Smartphones,Smartphone Motorola Moto G35 5G 256GB 12GB de RAM Coral,109900,149900,1,1455312,webfones,2026-05-11 20:44:04
2026-05-10 19:29:22,1631181220014-01,"Vitaminas, Minerais e Suplementos | Saúde e Bem Estar",Whey Protein Dr Peanut 100% - Max Titanium Bueníssimo 900g,11499,15590,1,831755,farmaciaindiana,2026-05-11 20:44:04
2026-05-10 19:29:22,1631181220014-01,Fitness e Pilates | Esporte e Lazer,Coqueteleira Pro Dux 800ml,2500,2500,1,2441563,farmaciaindiana,2026-05-11 20:44:04
2026-05-10 19:28:25,1631181220012-01,Guarda-Roupa E Roupeiros | Quarto | Móveis,Guarda Roupa Casal 8 Portas 4 Gavetas Paris Maxel Móveis Preto S/V,119990,145990,1,734158,multilojaonline,2026-05-11 20:44:05
2026-05-10 19:24:50,1631181220009-01,Pressão Alta | Cardiológicos | Medicamentos,"Venzer HCT 16/12,5mg Caixa 90 Comprimidos",17482,20694,1,2548993,farmaconde,2026-05-11 20:44:05
2026-05-10 19:24:50,1631181220009-02,Colesterol | Cardiológicos | Medicamentos,Sinvastatina 40Mg Com 30 comprimidos Sandoz,2540,14686,1,1159969,pensefarma,2026-05-11 20:44:05
2026-05-10 19:24:26,1631181220008-01,Armário | Cozinha | Móveis | Cozinhas Compactas,Armário de Cozinha Compacta Madesa Emilly Pop com Balcão Cor:Rustic/Preto,72999,113999,1,3621,madesacms,2026-05-11 20:44:05
2026-05-10 19:23:21,1631181220007-01,Objetos decorativos | Decoração | Casa e Cozinha,ESPELHO CHAO CAPELA 36X146CM PRETO EUROQUADROS,18999,18999,1,2519449,minipreco,2026-05-11 20:44:06
2026-05-10 19:19:45,1631181220003-02,Roupa de Cama | Cama e Banho | Casa e Cozinha,Jogo de Cobre Leito Queen 3 Peças Lar E Lazer Bege UN,12999,12999,1,2656149,rovitex,2026-05-11 20:44:06
2026-05-10 19:19:45,1631181220003-03,"Chaleiras Elétricas | Café, Chá e Expresso | Eletroportáteis",Chaleira elétrica mondial pratic ce-06 com capacidade de 2l - inox,10494,10494,1,2047078,loyalt,2026-05-11 20:44:06
2026-05-10 19:19:45,1631181220003-01,Escovas | Cuidados com o Cabelo | Cosméticos e Perfumaria,Modelador De Cachos Taiff Curves 25mm Bivolt Preto E Cobre Bivolt,22490,26600,1,1591568,webcontinentalmktplace,2026-05-11 20:44:07
2026-05-10 19:19:45,1631181220003-01,Roupa de Cama | Cama e Banho | Casa e Cozinha,Jogo De Cama Duplo Queen 140 Fios Cloe Realce Premium Sultan,15290,15290,1,2432396,webcontinentalmktplace,2026-05-11 20:44:07
2026-05-10 19:16:42,1631181219998-01,Impressoras | Impressoras e Acessórios | Computadores e Informática,Impressora Multifuncional Ecotank L3250 Epson Impressora Multifuncional Ecotank L3250 Preto Bivolt,189990,189990,1,1965849,multilojaonline,2026-05-11 20:44:07
2026-05-10 19:14:49,1631181219997-01,Cuidados com o Cabelo | Cosméticos e Perfumaria,Secador De Cabelos Black Purple Scn-01 220v/60hz .,12990,12990,1,2293649,webcontinentalmktplace,2026-05-11 20:44:07
2026-05-10 19:07:12,1631181219995-01,Salas De Jantar com 4 cadeiras | Sala de Jantar | Móveis,Conjunto Sala de Jantar Madesa Talita Mesa Tampo de Madeira com 4 Cadeiras Cor:Rustic/Crema/Bege Marrom,47999,86990,1,3502,madesacms,2026-05-11 20:44:08
2026-05-10 19:05:19,1631181219994-01,Salas De Jantar com 4 cadeiras | Sala de Jantar | Móveis,Conjunto Sala de Jantar Mesa Tampo de Vidro 4 Cadeiras Rustic/Cinza/Silver Anne Madesa Cor:Rustic/Cinza/Silver,87999,156990,1,45183,madesacms,2026-05-11 20:44:08
2026-05-10 19:04:16,1631181219992-01,Misturadores | Hidráulico | Materiais de Construção,Torneira Elétrica Lumen De Parede Branca Zagonel 220V,26990,26990,1,2265735,webcontinentalmktplace,2026-05-11 20:44:08
2026-05-10 19:04:16,1631181219992-01,Limpeza Doméstica | Casa e Cozinha,Varal De Chão Com Abas Retrátil Slim Mor,10196,10196,1,1379181,webcontinentalmktplace,2026-05-11 20:44:08
2026-05-10 18:59:31,1631181219990-01,"Liquidificadores | Liquidificadores, Batedeiras e Processadores | Eletroportáteis",Blender Dream Rosé Gold 2 Jarras Cadence 110V,17690,18990,1,1777903,webcontinentalmktplace,2026-05-11 20:44:09
2026-05-10 18:58:28,1631181219989-01,Fones de Ouvido | Celulares e Smartphones,Fone de Ouvido Earbud Aiwa AWS-EB-04-P Bluetooth IPX4 ANC - 26 Horas de Bateria,12900,20690,1,1280443,webcontinentalmktplace,2026-05-11 20:44:09
2026-05-10 18:55:35,1631181219987-01,Toalhas de Banho e Rosto | Cama e Banho | Casa e Cozinha,Toalha De Banho Sense Altenburg Cinza UN,6999,8999,1,1781455,rovitex,2026-05-11 20:44:09
2026-05-10 18:55:35,1631181219987-01,Toalhas de Banho e Rosto | Cama e Banho | Casa e Cozinha,Toalha de Banho Favo Altenburg Marrom UN,7999,9999,1,2120759,rovitex,2026-05-11 20:44:09
2026-05-10 18:53:19,1631181219986-01,Misturadores | Hidráulico | Materiais de Construção,Torneira Elétrica Lorenzetti Loren Easy De Bancada Branca 127v,19990,19990,1,1580209,webcontinentalmktplace,2026-05-11 20:44:10
2026-05-10 18:53:04,1631181219984-02,"Colheres, Espátulas e Escumadeiras | Panelas e Utensílios para Cozinhar | Casa e Cozinha",Escumadeira Softta em Silicone Cinza 25851160 Tramontina,2500,2500,1,1979208,casadoinox2,2026-05-11 20:44:10
2026-05-10 18:53:04,1631181219984-01,"Colheres, Espátulas e Escumadeiras | Panelas e Utensílios para Cozinhar | Casa e Cozinha",Colher Para Servir Tramontina Softta Em Silicone Cinza Tramontina,3107,3107,3,2155577,webcontinentalmktplace,2026-05-11 20:44:10
2026-05-10 18:53:04,1631181219984-01,"Colheres, Espátulas e Escumadeiras | Panelas e Utensílios para Cozinhar | Casa e Cozinha",Espátula Tramontina Softta Vazada Em Silicone Cinza,2134,2134,1,1897221,webcontinentalmktplace,2026-05-11 20:44:10
2026-05-10 18:53:04,1631181219984-01,Aquecedores | Eletroportáteis,Aquecedor de Ar Mondial A-08 Cinza 127V,13990,16990,1,880098,webcontinentalmktplace,2026-05-11 20:44:10
2026-05-10 18:52:59,1631181219981-01,Sanduicheiras e Grelhas Elétricas | Eletroportáteis,Sanduicheira cadence san400,7999,13999,1,1967110,loyalt,2026-05-11 20:44:11
2026-05-10 18:52:59,1631181219981-02,Aquecedores | Eletroportáteis,Aquecedor Britânia AB1500P 2 em 1 127V,8990,13990,1,136434,Philco,2026-05-11 20:44:11
2026-05-10 18:52:59,1631181219981-03,"Chaleiras Elétricas | Café, Chá e Expresso | Eletroportáteis","Chaleira Elétrica Cadence  CEL821 1,8L Inox 110 V",9990,12990,1,2642305,multilojaonline,2026-05-11 20:44:11
2026-05-10 18:50:44,1631181219979-01,Salas De Jantar com 4 cadeiras | Sala de Jantar | Móveis,Conjunto Sala de Jantar Madesa Talita Mesa Tampo de Madeira com 4 Cadeiras Cor:Rustic/Crema/Bege Marrom,47999,86990,1,3502,madesacms,2026-05-11 20:44:12
2026-05-10 18:50:41,1631181219978-01,Eletrodomésticos,Frigobar HQ 76 Litros Preto BC-76 110V,83222,87667,1,2231747,webcontinentalmktplace,2026-05-11 20:44:12
2026-05-10 18:48:28,1631181219976-01,"TVs | Cinema, TV e Áudio","Smart tv 50"" 4k philips 50pug7300/78 uhd titan os pixel precise comando de voz preta",196466,229661,1,2046119,loyalt,2026-05-11 20:44:12
2026-05-10 18:47:07,1631181219975-01,Geladeiras e Freezers | Eletrodomésticos,Freezer vertical consul cvu18gb 1 porta - 121l,222474,244333,1,2046682,loyalt,2026-05-11 20:44:13
2026-05-10 18:46:58,1631181219974-01,Caixas de Som | Periféricos | Computadores e Informática,Caixa Som Portatil Dance Letron Com Led e Controle Remoto 2000w,169000,169000,1,832502,minipreco,2026-05-11 20:44:13
2026-05-10 18:46:49,1631181219973-01,Samsung | Smartphone | Celulares e Smartphones,Smartphone Samsung Galaxy A26 5G 256GB 8GB de RAM Verde,146900,159900,1,1962246,webfones,2026-05-11 20:44:14
2026-05-10 18:45:39,1631181219972-01,Cuidados com o Cabelo | Cosméticos e Perfumaria,Kit shampoo + tratamento antiqueda + leave-in lola cosmetics rapunzel,8342,14470,1,2070698,loyalt,2026-05-11 20:44:14
2026-05-10 18:43:17,1631181219970-01,Máquinas de Lavar e Secadoras | Eletrodomésticos,Secadora Mueller Sun 8 Kg Design Moderno 6 Cabides Branco 220V,59990,59990,1,2838995,webcontinentalmktplace,2026-05-11 20:44:14
2026-05-10 18:40:24,1631181219965-01,Fogões | Fogões e Cooktops | Eletrodomésticos,Fogão 4 Bocas Dako Supreme Titanio Bivolt,94990,119990,1,1714299,multilojaonline,2026-05-11 20:44:15
2026-05-10 18:39:35,1631181219964-01,Aspiradores de Pó e Água | Eletroportáteis,Aspirador Vertical com Fio Electrolux 1450W 2 em 1 Plus Filtro Hepa Azul  (STK14) 127V,19900,30990,1,1107270,electrolux,2026-05-11 20:44:15
