creationDate,orderId,categoryName,name,price,listPrice,quantity,productId,seller,data_extracao
2026-07-07 10:47:32,1645021251879-02,Cozinha Industrial | Eletrodomésticos,Arara de Roupas Dupla com Prateleira em Metal Organizador de Chão Branco Yeet,12750,12750,1,3182709,webcontinentalmktplace,2026-07-10 16:48:24
2026-07-07 10:45:20,1645021251871-01,Rosto | Pele | Cosméticos e Perfumaria,NIVEA Hidratante Facial 7 em 1 Beleza Radiante 100g,2999,3890,2,130698,farmaciaindiana,2026-07-10 16:48:24
2026-07-07 10:42:36,1645021251869-01,Motorola | Smartphone | Celulares e Smartphones,Smartphone Motorola Moto G15 256GB 12GB de RAM Grafite,99900,99900,1,1330562,webfones,2026-07-10 16:48:24
2026-07-07 10:37:44,1645021251868-01,Cartões de Memória | Armazenamento de Dados | Computadores e Informática,Cartão de Memória Micro SDXC Canvas Select Plus 64GB Classe 10 Kingston,14296,14296,1,3347903,webcontinentalmktplace,2026-07-10 16:48:24
2026-07-07 10:35:48,1645021251866-01,Lenço Umedecido | Higiene | Saúde e Bem Estar,Lenço Umedecido Pampers Cheirinho Bebê,3709,5390,1,850030,farmaciaindiana,2026-07-10 16:48:25
2026-07-07 10:28:00,1645011251865-01,Aspiradores de Pó e Água | Eletroportáteis,Aspirador pó e Água electrolux hidrolux awd01 1400w 5l com acessórios preto,20497,45800,1,2044874,loyalt,2026-07-10 16:48:25
2026-07-07 10:26:34,1645011251864-01,Serras | Ferramentas Elétricas | Materiais de Construção,Serrote Jack Professional Bi-Material Irwin,14490,19300,1,808555,funstock,2026-07-10 16:48:25
2026-07-07 10:25:53,1645011251863-01,Motorola | Smartphone | Celulares e Smartphones,Smartphone Motorola Moto G15 256GB 12GB de RAM Grafite,99900,99900,1,1330562,webfones,2026-07-10 16:48:25
2026-07-07 10:22:21,1645011251861-01,Ar-condicionado | Eletrodomésticos,Aquecedor de ambiente mondial a-08 com controle de temperatura - cinza,11400,11400,2,3389503,loyalt,2026-07-10 16:48:25
2026-07-07 10:19:42,1645011251859-01,Cuidados com o Cabelo | Cosméticos e Perfumaria,Progressiva Sem Formol Zap All Time Organica + Sache + Óleo Reparador,7980,7980,1,3105038,webcontinentalmktplace,2026-07-10 16:48:25
2026-07-07 10:17:59,1645011251858-01,"Cadeiras de Bebê, Assentos e Acessórios | Bebês e Infantil",Cadeira de Alimentação Portátil Minnie Camping 6m-15kg Multikids - BB657 BB657,14900,22990,1,2043832,compreja,2026-07-10 16:48:26
2026-07-07 10:16:33,1645011251857-01,Ar-condicionado | Eletrodomésticos,Ventilador de mesa mondial turbo nvt408pb 40cm 8 pás 3 velocidades preto/prata,16892,20895,1,2044902,loyalt,2026-07-10 16:48:26
2026-07-07 10:10:46,1645011251850-01,Puff | Sala de Estar | Móveis,"Banco Estofado Rubi 1,20m Suede Cinza - Clique Decorações",26091,26091,1,2569969,webcontinentalmktplace,2026-07-10 16:48:26
2026-07-07 10:01:34,1645011251844-01,Depuradores e Coifas | Eletrodomésticos,Depurador de Ar Continental 80cm Inox Alto Poder de Sucção e 3 Velocidades (DC8PG) 127V,40900,42900,1,2723110,electrolux,2026-07-10 16:48:26
2026-07-07 09:59:09,1645011251843-01,"TVs | Cinema, TV e Áudio","Smart tv 32"" hd philco p32crb roku tv hdr10 dolby audio",90537,90537,1,3389497,loyalt,2026-07-10 16:48:26
2026-07-07 09:48:31,1645011251842-01,Fornos de Micro-Ondas | Eletrodomésticos,Micro-ondas Britânia 28L Branco Espelhado Limpa Fácil BMO30 127V,49990,64990,1,2082586,Philco,2026-07-10 16:48:27
2026-07-07 09:39:08,1645011251839-01,Pipoqueiras | Eletroportáteis,Pipoqueira Britânia Pop Time 110V,12990,28590,1,1802578,webcontinentalmktplace,2026-07-10 16:48:27
2026-07-07 09:32:49,1645011251833-01,"TVs | Cinema, TV e Áudio","Smart tv 4k 50"" lg ultra hd 50ua8550psa com processador a7 gen8 ai, otimizador de jogos, wi-fi, bluetooth, webos 25 e controle smart magic",218679,280692,1,3133209,loyalt,2026-07-10 16:48:27
2026-07-07 09:29:12,1645001251832-01,Camas | Quarto | Móveis,Base Cama Box Solteiro Comum Marrom,31000,31000,2,2283730,webcontinentalmktplace,2026-07-10 16:48:27
2026-07-07 09:14:32,1645001251823-01,Panelas e Utensílios para Cozinhar | Casa e Cozinha,Conjunto de frigideiras 3 peças tramontina caribe em alumínio com revestimento interno e externo antiaderente starflon max - preto/cinza,7490,9588,1,2047800,loyalt,2026-07-10 16:48:27
2026-07-07 09:10:56,1645001251818-01,Computadores e Informática | Teste,TESTE - NÃO COMPRAR TESTE DOAÇÃO - NÃO COMPRAR TESTE DOAÇÃO,10,10,1,22387,1,2026-07-10 16:48:28
2026-07-07 08:55:22,1645001251810-01,Tablets | Eletrônicos,"Tablet samsung galaxy a11 wi-fi tela 8.7"" 90hz 64gb câmera 8mp prata",108047,134900,1,2045360,loyalt,2026-07-10 16:48:28
2026-07-07 08:40:22,1645001251808-01,Fraldas | Bebês e Infantil,Kit 2 Fraldas Babysec Ultrasec Hiper Galinha Pintadinha XG com 56 unidades,16148,16148,1,2119143,pensefarma,2026-07-10 16:48:28
2026-07-07 08:34:42,1645001251807-01,Objetos decorativos | Decoração | Casa e Cozinha,ESPELHO CHAO CAPELA 36X146CM PRETO EUROQUADROS,18999,18999,1,2519449,minipreco,2026-07-10 16:48:28
2026-07-07 08:27:27,1644991251803-01,Aspiradores de Pó e Água | Eletroportáteis,Aspirador pó e Água electrolux hidrolux awd01 1400w 5l com acessórios preto,20497,32233,1,2046759,loyalt,2026-07-10 16:48:29
2026-07-07 08:16:25,1644991251800-01,Motorola | Smartphone | Celulares e Smartphones,Smartphone Motorola Moto G15 256GB 12GB de RAM Grafite,99900,99900,1,1330562,webfones,2026-07-10 16:48:29
2026-07-07 08:11:37,1644991251799-01,Bonecos | Meninos | Brinquedos,Kit 12 Brinquedos de Dinossauros Mini Dino Jurassic Park em Borracha King Imports,4690,4690,1,3252578,webcontinentalmktplace,2026-07-10 16:48:29
2026-07-07 08:03:04,1644991251796-03,Saúde Da Mulher | Medicamentos,Absorvente para Seios Concare 30 Unidades,1890,2119,1,1289469,farmaconde,2026-07-10 16:48:29
2026-07-07 08:03:04,1644991251796-02,Cuidados com a Saúde | Bebês e Infantil,Creme Preventivo de Assaduras - Bepantol Baby - 30g,1890,2884,1,142729,farmaciaindiana,2026-07-10 16:48:29
2026-07-07 08:03:04,1644991251796-01,Enxoval | Bebês e Infantil,Travesseiro Anatômico para Bebês - Viscoelástico BUB10700,7999,7999,1,10104,bumerangbrinquedos,2026-07-10 16:48:30
2026-07-07 07:23:16,1644981251794-01,Aspiradores de Pó e Água | Eletroportáteis,Aspirador de Pó Vertical Britânia Filtro Ciclone 1400W BAS1500V 127V,13990,21990,1,129584,Philco,2026-07-10 16:48:30
2026-07-07 06:54:03,1644981251793-01,"Chaleiras Elétricas | Café, Chá e Expresso | Eletroportáteis","Chaleira Elétrica 1,9 Litros Cadence 220V",14990,25500,1,2280094,funstock,2026-07-10 16:48:30
2026-07-07 06:23:29,1644971251787-01,Mesa de centro | Sala de Estar | Móveis,Mesa Lateral Multifuncional com Rodinhas Porta Revistas Retangular Tampo MDF Aço Yeet,15269,15269,1,3200687,webcontinentalmktplace,2026-07-10 16:48:30
2026-07-07 06:16:30,1644971251786-01,Fones de Ouvido | Celulares e Smartphones,Fone Bluetooth M10 Sem Fio Display Powerbank Fone Preto,2990,2990,3,1906116,webcontinentalmktplace,2026-07-10 16:48:31
2026-07-07 03:59:58,1644951251785-01,"Chaleiras Elétricas | Café, Chá e Expresso | Eletroportáteis","Chaleira Elétrica Inox 1,8l 1000w Base Removível CE-01 Agratto 127V",6012,6012,1,828554,webcontinentalmktplace,2026-07-10 16:48:31
2026-07-07 03:34:27,1644951251784-01,Fritadeiras Elétricas | Eletroportáteis,Air Fryer Kitchen Art 16L 4 em 1 com Espeto Rotisserie KAF16A 127V,54990,66990,1,1420374,Philco,2026-07-10 16:48:31
2026-07-07 03:02:37,1644941251779-01,"TVs | Cinema, TV e Áudio","Smart tv 65” tcl qled 4k ultra hd 65p7k com sistema operacional google tv, hdr10+, hdmi 2.1, chromecast built-in, dolby vision e atmos",368450,410292,1,2047651,loyalt,2026-07-10 16:48:32
2026-07-07 02:36:35,1644941251775-01,Ar-condicionado | Eletrodomésticos,AQUECEDOR TERMO CERAMICA 127V A-05 2150-01 MONDIAL,18999,18999,1,1725073,minipreco,2026-07-10 16:48:32
2026-07-07 02:05:33,1644931251773-01,Escova Rotativa Modeladora | Cuidados com o Cabelo | Cosméticos e Perfumaria,Escova rotativa mondial erb-01 1200 w bivolt - preto/golden rose,14420,14420,1,2655119,loyalt,2026-07-10 16:48:32
2026-07-07 01:44:29,1644931251772-01,Crenças | Esoterismo | Livros,BARALHO CIGANO LENORMAND TRADICIONAL,18500,18500,1,696278,martinsfontespaulista,2026-07-10 16:48:32
2026-07-07 01:35:21,1644931251771-01,Lanterna | Elétrica | Materiais de Construção,Lanterna Recarregável Vonder 2 Led 1W 80/100LM Bateria Litio,3590,3590,2,94665,guimepa,2026-07-10 16:48:32
2026-07-07 01:27:19,1644921251770-01,Produto Update,Aerolin 100mcg/dose spray 200 doses,2575,2715,7,150149,pensefarma,2026-07-10 16:48:33
2026-07-07 00:58:56,1644921251762-01,"TVs | Cinema, TV e Áudio",Smart TV 32” Philco PTV32K34RKGB LED Roku TV Bivolt,99990,119990,1,1015290,Philco,2026-07-10 16:48:33
2026-07-07 00:34:49,1644921251755-01,Fritadeiras Elétricas | Eletroportáteis,"Air Fryer Electrolux 5,6L Efficient por Rita Lobo (EAF40) 127V",32990,49990,1,1264959,electrolux,2026-07-10 16:48:33
2026-07-07 00:24:09,1644911251750-01,Lavadoras de Alta Pressão | Eletrodomésticos,Máquina De Lavar Roupas Midea 11kg Inverter Healthguard Wi-fi Titanium MF201W110WB/GK-01 220V,299889,322111,8,1968822,webcontinentalmktplace,2026-07-10 16:48:34
2026-07-07 00:24:09,1644911251750-01,Lavadoras de Alta Pressão | Eletrodomésticos,Máquina De Lavar Roupas Midea 11kg Slim Healthguard Wi-fi Conectada Smarthome Inverter Branca 220V,269990,279990,25,2051508,webcontinentalmktplace,2026-07-10 16:48:34
2026-07-07 00:24:09,1644911251750-01,Lavadoras de Alta Pressão | Eletrodomésticos,Máquina De Lavar Roupas Midea 11kg Slim Healthguard Wi-fi Conectada Smarthome Inverter Branca 110V,269990,279990,24,2034941,webcontinentalmktplace,2026-07-10 16:48:34
2026-07-07 00:21:59,1644911251745-01,"Suplementos | Vitaminas, Minerais e Suplementos | Saúde e Bem Estar",Suplemento em Pó de Fibras Prebiotic Nutrify 210g,8900,9500,1,2048657,nutrifyafter,2026-07-10 16:48:34
2026-07-07 00:21:59,1644911251745-01,"Vitaminas | Vitaminas, Minerais e Suplementos | Saúde e Bem Estar",Vitamina B12 Nutrify em Gotas 20ml,5200,5200,2,1288586,nutrifyafter,2026-07-10 16:48:34
2026-07-07 00:21:59,1644911251745-01,"Suplementos | Vitaminas, Minerais e Suplementos | Saúde e Bem Estar",Creatina Monohidratada 100% Creatine Nutrify 300g,10100,11000,3,1294508,nutrifyafter,2026-07-10 16:48:34
2026-07-07 00:21:59,1644911251745-01,"Vitaminas, Minerais e Suplementos | Saúde e Bem Estar",Magnesium Inositol 300g Nutrify,19100,20500,2,2048597,nutrifyafter,2026-07-10 16:48:34
2026-07-07 00:21:59,1644911251745-01,"Vitaminas | Vitaminas, Minerais e Suplementos | Saúde e Bem Estar",Vitamina D3K2 Nutrify em Gotas 20ml,10100,10500,2,1311989,nutrifyafter,2026-07-10 16:48:34
2026-07-07 00:21:59,1644911251745-01,"Suplementos | Vitaminas, Minerais e Suplementos | Saúde e Bem Estar",Vitamina Coenzima Q10 Nutrify 60 cápsulas,11700,12000,1,2048522,nutrifyafter,2026-07-10 16:48:34
2026-07-07 00:21:59,1644911251745-01,"Suplementos | Vitaminas, Minerais e Suplementos | Saúde e Bem Estar",Ômega 3 TG Ultra Concentrado Nutrify,12400,13500,1,2048521,nutrifyafter,2026-07-10 16:48:34
2026-07-07 00:21:59,1644911251745-01,"Antioxidantes | Vitaminas, Minerais e Suplementos | Saúde e Bem Estar",Vitamina Curcumina Nutrify 30 cápsulas,11200,12000,2,1288555,nutrifyafter,2026-07-10 16:48:34
2026-07-07 00:07:40,1644911251744-01,"Talheres e Porta-Talheres | Louça, Copos e Talheres | Casa e Cozinha",Faqueiro New Color Inox Azul 24 Peças - TRAMONTINA,6999,6999,1,1624335,minipreco,2026-07-10 16:48:35
2026-07-06 23:55:48,1644911251743-01,"Talheres e Porta-Talheres | Louça, Copos e Talheres | Casa e Cozinha",Faqueiro 16 peças tramontina laguna em aço inox,6170,7788,2,2047953,loyalt,2026-07-10 16:48:35
2026-07-06 23:54:50,1644911251742-01,"Sabonetes Líquidos, Óleos e Loções | Corpo e Banho | Cosméticos e Perfumaria",Sabonete Granado Enxofre 90g,839,899,2,727589,farmaciaindiana,2026-07-10 16:48:35
2026-07-06 23:54:50,1644911251742-01,"Sabonetes Líquidos, Óleos e Loções | Corpo e Banho | Cosméticos e Perfumaria",Sabonete Infantil Granado Bebe Hipoalergênico Lavanda 90g,649,679,2,727759,farmaciaindiana,2026-07-10 16:48:35
2026-07-06 23:54:50,1644911251742-01,Corpo e Banho | Cosméticos e Perfumaria,Sabonete Granado Glicerina Terrapeutics Gengibre 90g,589,599,1,836510,farmaciaindiana,2026-07-10 16:48:35
2026-07-06 23:54:50,1644911251742-01,"Sabonetes Líquidos, Óleos e Loções | Corpo e Banho | Cosméticos e Perfumaria",Sabonete Granado 90g Terrapia Castanha do Brasil SAB GRANADO 90G TERR,589,599,1,726304,farmaciaindiana,2026-07-10 16:48:35
2026-07-06 23:54:50,1644911251742-01,"Sabonetes Líquidos, Óleos e Loções | Corpo e Banho | Cosméticos e Perfumaria",Sabonete Granado 90g Terrapia Calêndula SAB GRANADO 90G TERR,589,599,1,729434,farmaciaindiana,2026-07-10 16:48:35
2026-07-06 23:24:22,1644901251701-01,Celulares e Smartphones,Carregador Tipo C Turbo MDM para Celular e Tablet Rapido Preto 1 Unidade,5072,5072,1,3259903,webcontinentalmktplace,2026-07-10 16:48:36
2026-07-06 23:22:37,1644901251699-02,"Chaleiras Elétricas | Café, Chá e Expresso | Eletroportáteis","Chaleira Elétrica Britânia 1,6L 1500W Base 360° BCHE01 220V",9990,14990,1,827672,Philco,2026-07-10 16:48:36
2026-07-06 23:22:37,1644901251699-01,Sanduicheiras e Grelhas Elétricas | Eletroportáteis,Sanduicheira E Grill Britânia Inox 2 Em 1 BGR25B 220V,9990,17590,1,2033528,webcontinentalmktplace,2026-07-10 16:48:36
2026-07-06 23:21:27,1644901251698-01,Hidráulico | Materiais de Construção,Torneira Elétrica Loren Easy de 5500 Watts 220 Volts 7550036 Lorenzetti Torn.elet.loren Easy 550,16042,20052,1,2630745,webcontinentalmktplace,2026-07-10 16:48:37
2026-07-06 23:21:21,1644901251697-01,Sapateira | Quarto | Móveis,Sapateira Organizadora Com Assento e 2 Portas Multiuso Califórnia Multimóveis MP6059 Branco,31999,33999,1,3043814,multimoveis,2026-07-10 16:48:37
2026-07-06 23:16:58,1644901251686-01,Carros de passeio | Pneus | Produtos automotivos,Pneu Aro 15 185/60R15 84H TH-93 Townhall,24470,24470,2,856725,pneubarato,2026-07-10 16:48:37
2026-07-06 23:14:06,1644901251683-01,Fritadeiras Elétricas | Eletroportáteis,"Fritadeira Air Fryer Britânia 4,2L 1500W BFR38 Dura Mais 220V",21990,30990,1,419530,Philco,2026-07-10 16:48:38
2026-07-06 23:07:52,1644901251666-01,Carros de passeio | Pneus | Produtos automotivos,Pneu Aro 15 185/60R15 84H TH-93 Townhall,24470,24470,2,856725,pneubarato,2026-07-10 16:48:38
2026-07-06 22:55:38,1644901251653-01,"Batedeiras | Liquidificadores, Batedeiras e Processadores | Eletroportáteis",Batedeira Planetária Philco Concept 5L 900W Turbo PBP90A - 220V,29990,56090,1,2121986,webcontinentalmktplace,2026-07-10 16:48:38
2026-07-06 22:48:58,1644901251651-01,Eletrodomésticos,"AIR FRYER DUO ANALÓGICA 4,2L 127V GAABOR",24990,24990,3,2332409,minipreco,2026-07-10 16:48:39
2026-07-06 22:48:58,1644901251651-02,"Liquidificadores | Liquidificadores, Batedeiras e Processadores | Eletroportáteis",Liquidificador Portátil Recarregável 6 Lâminas 380ml Azul,4999,4999,1,1972494,webcontinentalmktplace,2026-07-10 16:48:39
2026-07-06 22:46:36,1644901251650-01,Sanduicheiras e Grelhas Elétricas | Eletroportáteis,Sanduicheira e Grill Britânia BGRE01 2 em 1 750W 127V,7990,13990,1,732521,Philco,2026-07-10 16:48:39
2026-07-06 22:46:36,1644901251650-01,"Mixers | Liquidificadores, Batedeiras e Processadores | Eletroportáteis",Mixer Philco PMX1000 4 Lâminas Pro Maxx 2 e 1 500W 127V,13990,20990,1,155370,Philco,2026-07-10 16:48:39
2026-07-06 22:44:38,1644901251649-01,Cuidados com o Cabelo | Cosméticos e Perfumaria,Secador de Cabelo Philco Titanium Travel 750W Bivolt,7990,12090,1,1778340,webcontinentalmktplace,2026-07-10 16:48:40
2026-07-06 22:40:33,1644901251648-01,"Tintas, Cartuchos e Toners de Impressora | Impressoras e Acessórios | Computadores e Informática","Smartwatch Imilab Imiki SF1 Tela AMOLED 1.78"" Frequência Cardíaca Bateria 240h Dourado",30548,30548,1,3543694,webcontinentalmktplace,2026-07-10 16:48:40
2026-07-06 22:39:33,1644901251646-01,Secador de Cabelo | Cuidados com o Cabelo | Cosméticos e Perfumaria,Secador de cabelos philco psc3500 4 em 1 dobrável Íon tourmaline 3 temperaturas + 3 velocidades 1450w dourado,41097,54890,1,2137823,loyalt,2026-07-10 16:48:40
2026-07-06 22:37:49,1644901251644-01,Aquecedores | Eletroportáteis,Aquecedor Britânia AB1500P 2 em 1 127V,13990,17990,1,136434,Philco,2026-07-10 16:48:41
2026-07-06 22:35:01,1644901251639-01,"Batedeiras | Liquidificadores, Batedeiras e Processadores | Eletroportáteis",Batedeira mondial prática black b-44 com 3 velocidades – preta,8230,17980,1,2046400,loyalt,2026-07-10 16:48:41
2026-07-06 22:32:20,1644901251638-01,Cobertores e Mantas | Cama e Banho | Casa e Cozinha,Manta De Microfibra Lisa Casal Rovitex Home Azul UN,4999,5999,1,2603171,rovitex,2026-07-10 16:48:41
2026-07-06 22:32:20,1644901251638-01,Cobertores e Mantas | Cama e Banho | Casa e Cozinha,Manta De Microfibra Lisa Solteiro Rovitex Home Cinza UN,4299,4999,1,2604769,rovitex,2026-07-10 16:48:41
2026-07-06 22:29:18,1644891251637-01,Escova Rotativa Modeladora | Cuidados com o Cabelo | Cosméticos e Perfumaria,Escova Secadora Britânia 4 em 1 BELLA01 1300W Bivolt Bivolt,9990,15990,1,229761,Philco,2026-07-10 16:48:42
2026-07-06 22:20:22,1644891251635-01,Caminhonete e SUV | Pneus | Produtos automotivos,Pneu Aro 16 235/70R16 106T Royal A/T Royal Black,60170,60170,2,1622783,pneubarato,2026-07-10 16:48:42
2026-07-06 22:18:10,1644891251634-01,Camas | Quarto | Móveis,Cama Solteiro Bicama Ditália Bb-28 Preto,41846,55990,1,2253186,webcontinentalmktplace,2026-07-10 16:48:42
2026-07-06 22:15:22,1644891251633-01,Motorola | Smartphone | Celulares e Smartphones,Smartphone Motorola Moto G06 256GB 12GB de RAM Bege,88700,99900,1,2526656,webfones,2026-07-10 16:48:43
2026-07-06 22:10:17,1644891251627-01,Fogões elétricos | Fogões e Cooktops | Eletrodomésticos,Fogão 5 Bocas Mueller Fratello Vetro MFV5BB Preto Bivolt,119990,139990,1,136161,multilojaonline,2026-07-10 16:48:43
2026-07-06 22:05:34,1644891251625-02,Fritadeiras Elétricas | Eletroportáteis,"Fritadeira Air Fryer Philco PFR15PI Redstone 4,4L 1500W 127V",28990,44990,1,390417,Philco,2026-07-10 16:48:43
2026-07-06 22:05:34,1644891251625-01,Panelas Elétricas | Eletroportáteis Especiais | Eletroportáteis,Panela elétrica de arroz mondial pe-43 6 xícaras - preta/inox,18900,20790,1,2046312,loyalt,2026-07-10 16:48:44
2026-07-06 22:00:34,1644891251624-01,Aspiradores de Pó e Água | Eletroportáteis,Aspirador Vertical com Fio Electrolux 1450W 2 em 1 Plus Filtro Hepa Azul  (STK14) 127V,17990,30990,1,1107270,electrolux,2026-07-10 16:48:44
2026-07-06 21:54:44,1644891251620-01,Pisos | Construção | Materiais de Construção,"Piso Vinílico em Manta Pequim Kapazi | 0,5mm de Espessura | Rolo 2m x 25m (50m²)",119190,119190,1,2038317,tfatr2,2026-07-10 16:48:45
2026-07-06 21:54:13,1644891251619-01,Smartphone | Celulares e Smartphones,"Celular samsung galaxy a07 tela 6.7"" 128gb 4g 90hz câmera dupla 50mp violeta",69937,88778,1,2047260,loyalt,2026-07-10 16:48:45
2026-07-06 21:53:48,1644891251617-02,"Formas | Assadeiras, Fôrmas e Travessas | Casa e Cozinha",Conjunto de travessas refratárias marinex em vidro - 10 peças,12257,14988,1,2135902,loyalt,2026-07-10 16:48:45
2026-07-06 21:53:48,1644891251617-01,Fornos Elétricos | Eletrodomésticos,Forno Elétrico Fischer Gourmet Grill II 44L  Prata 220 V,79990,99990,1,49234,multilojaonline,2026-07-10 16:48:45
2026-07-06 21:51:28,1644891251613-01,Lavadoras de Alta Pressão | Eletrodomésticos,Lavadora de Alta Pressão Electrolux 1650PSI 1400W EasyWash com Engate Rápido (QWS1650) 220V,35990,47990,1,1107952,electrolux,2026-07-10 16:48:46
2026-07-06 21:51:28,1644891251613-02,Travesseiros | Cama e Banho | Casa e Cozinha,Travesseiro ECO Impermeável Branco 45X65CM - HEDRONS,1999,1999,3,781149,minipreco,2026-07-10 16:48:46
2026-07-06 21:49:45,1644891251608-01,Esfregões e Mops | Limpeza Doméstica | Casa e Cozinha,Mop Pocket Esfregão Lavanderia Limpeza Prática 360° Mor Azul,7463,7463,1,1294598,webcontinentalmktplace,2026-07-10 16:48:46
2026-07-06 21:49:45,1644891251608-01,Cestos | Limpeza Doméstica | Casa e Cozinha,Cesto Telado Para Roupas 30 L Com Tampa Preta Para Lavanderia E Banheiro,3100,3100,1,2147821,webcontinentalmktplace,2026-07-10 16:48:46
2026-07-06 21:49:45,1644891251608-02,Produto Update,Bepantriz Pomada 30g,1332,2841,1,152712,pensefarma,2026-07-10 16:48:47
2026-07-06 21:49:45,1644891251608-02,Colesterol | Cardiológicos | Medicamentos,Rosuvastatina Calcica 20Mg Com 30 Comprimidos Genérico Legrand,2880,21185,2,1160315,pensefarma,2026-07-10 16:48:47
2026-07-06 21:49:45,1644891251608-02,Diabetes | Medicamentos | Saúde e Bem Estar,Glifage Xr 500mg com 30 comprimidos,1038,1220,2,1162068,pensefarma,2026-07-10 16:48:47
2026-07-06 21:49:45,1644891251608-02,Cremes Dentais | Higiene Bucal | Higiene | Saúde e Bem Estar,Creme Dental Colgate Total 12 Antitártaro 90g,1332,1332,2,1796509,pensefarma,2026-07-10 16:48:47
2026-07-06 21:49:45,1644891251608-04,Anticoagulante | Sistema Circulatório | Medicamentos,Bissulfato de Clopidogrel 75mg Ranbaxy Genérico Caixa 30 Comprimidos,2959,7864,2,2124707,farmaconde,2026-07-10 16:48:48
2026-07-06 21:49:45,1644891251608-03,Higiene | Saúde e Bem Estar,Creme Hidratante Nivea Lata 145g,4990,4990,1,830941,farmaciaindiana,2026-07-10 16:48:48
2026-07-06 21:49:45,1644891251608-03,Shampoos e Condicionadores | Higiene | Saúde e Bem Estar,Shampoo Dove Reconstrução + Aminoácido 600ml,4379,4379,2,1746918,farmaciaindiana,2026-07-10 16:48:48
2026-07-06 21:49:45,1644891251608-03,Shampoos e Condicionadores | Higiene | Saúde e Bem Estar,Condicionador Dove Hidratação + Hialuron-VIT 600ml,4999,4999,2,1783152,farmaciaindiana,2026-07-10 16:48:48
2026-07-06 21:49:45,1644891251608-03,Lenço Umedecido | Higiene | Saúde e Bem Estar,Lenço Umedecido Babysec Galinha Pintadinha Ultrafresh 192 Unidades,2509,3499,1,1372609,farmaciaindiana,2026-07-10 16:48:48
2026-07-06 21:47:10,1644891251607-01,Perfumes | Cosméticos e Perfumaria,Asad bourbon lattafa eau de parfum masculino 100ml,30990,38900,1,2315933,loyalt,2026-07-10 16:48:48
2026-07-06 21:44:35,1644891251606-01,"Áudio | Cinema, TV e Áudio",Fone de ouvido xiaomi redmi buds 6 play bluetooth - preto,12320,15741,1,2048260,loyalt,2026-07-10 16:48:49
2026-07-06 21:42:04,1644891251604-01,Travesseiros | Cama e Banho | Casa e Cozinha,TRAVESSEIRO BLEND 200 FIOS 50X70CM 1317000110002 BELLA ENXOVAIS,5990,5990,2,1739224,minipreco,2026-07-10 16:48:49
2026-07-06 21:40:02,1644891251602-01,"Formas | Assadeiras, Fôrmas e Travessas | Casa e Cozinha",Conjunto de travessas refratárias marinex em vidro - 10 peças,12257,14988,1,2135902,loyalt,2026-07-10 16:48:49
2026-07-06 21:36:48,1644891251601-01,Eletroportáteis,Panificadora Britânia Multipane Branca 127V 064301015,79990,79990,1,1503894,webcontinentalmktplace,2026-07-10 16:48:49
2026-07-06 21:30:39,1644891251598-02,Coolers | Utensílios para Cozinha | Casa e Cozinha,Bolsa Termica Marmita Lancheira Multiuso Alça Trabalho Passeio Academia Dois Compartimentos Azul,5848,5848,1,1873788,webcontinentalmktplace,2026-07-10 16:48:50
2026-07-06 21:30:39,1644891251598-01,Torradeiras | Eletroportáteis,Torradeira Britânia Tosta Pane 3 em 1 Inox 7 Níveis 850W 127V,10990,15990,1,94736,Philco,2026-07-10 16:48:50
2026-07-06 21:29:21,1644881251596-01,"Áudio | Cinema, TV e Áudio",Fone de ouvido bluetooth philips tat1209bk/00 com microfone - preto,12510,27800,1,2047200,loyalt,2026-07-10 16:48:50
2026-07-06 21:28:18,1644881251595-01,Fornos de Micro-Ondas | Eletrodomésticos,Micro-ondas Philco 25L 1100W PM27 Limpa Fácil 220V,53990,67990,1,810079,Philco,2026-07-10 16:48:51
2026-07-06 21:26:09,1644881251593-01,Cadeiras Gamer | Artigos Gamer | Computadores e Informática,Fone De Ouvido Via Bluetooth Tws E10 A Prova Dágua,5900,12600,1,1483251,webcontinentalmktplace,2026-07-10 16:48:51
2026-07-06 21:24:27,1644881251592-01,"Vitaminas | Vitaminas, Minerais e Suplementos | Saúde e Bem Estar",Adeforte Turbo Solução Oral 1 Ampola Oral 3ml,3779,4399,1,1590256,farmaconde,2026-07-10 16:48:51
2026-07-06 21:21:51,1644881251590-01,Cozinhas Compactas | Cozinha | Móveis,Armário de Cozinha Compacta 120cm Rustic/Cinza Easy Madesa Cor:Rustic/Cinza,44999,79990,1,302650,madesacms,2026-07-10 16:48:52
2026-07-06 21:21:18,1644881251589-01,Potes | Utensílios para Cozinha | Casa e Cozinha,Potes Herméticos Electrolux de Plástico Branco Retangular com 20 Unidades,12900,31800,1,1108206,electrolux,2026-07-10 16:48:52
2026-07-06 21:19:46,1644881251588-01,"TVs | Cinema, TV e Áudio","Smart tv 32"" lg hd 32lr600bpsa com processador a5 ger 6 ai, alexa integrado, lg channels, webos 23, compatível com controle smart magic",112955,140292,1,3133212,loyalt,2026-07-10 16:48:52
2026-07-06 21:18:17,1644881251585-01,Celulares e Smartphones,"Smartphone motorola moto g06 4g tela 6,9” 128gb câmera 50mp azul marinho",69878,88778,1,2047097,loyalt,2026-07-10 16:48:52
2026-07-06 21:13:41,1644881251582-01,Secador de Cabelo | Cuidados com o Cabelo | Cosméticos e Perfumaria,Secador de Cabelos Philco 2100W PSA3300 Íons Tourmaline 127V,12990,23990,1,771689,Philco,2026-07-10 16:48:53
2026-07-06 21:12:40,1644881251579-01,"Chaleiras Elétricas | Café, Chá e Expresso | Eletroportáteis","Chaleira Elétrica Inox 1,8l 1000w Base Removível CE-01 Agratto 127V",6012,6012,1,828554,webcontinentalmktplace,2026-07-10 16:48:53
2026-07-06 21:08:31,1644881251578-01,Bicicletas Infantis | Bicicleta e Ciclismo | Esporte e Lazer | Brinquedos | Meninas | Esporte e Lazer,Bicicleta Aro 12 Charm Bicicleta Nathor Charm Aro 12 Rosa/Tiffany,24990,41800,1,10410,funstock,2026-07-10 16:48:54
2026-07-06 21:07:51,1644881251577-01,Aspiradores de Pó e Água | Eletroportáteis,Aspirador Pó e Água Electrolux 1400w 18L Smart com Função Sopro Cinza (A10N1) 127V,25990,41990,1,1108011,electrolux,2026-07-10 16:48:54
