creationDate,orderId,categoryName,name,price,listPrice,quantity,productId,seller,data_extracao
2026-07-09 19:38:27,1645591253581-01,"Caixas de Som Portáteis | Áudio | Cinema, TV e Áudio",Speaker Philco PBS220BT Extreme Bluetooth 5.3 Flash Light 220W Bivolt,45990,53990,1,301756,Philco,2026-07-10 16:45:09
2026-07-09 19:37:30,1645591253580-01,Balcão | Cozinha | Móveis,Balcão Cozinha Gabinete Pia 150Cm 3 Portas Preto/branco,46639,52999,1,882810,webcontinentalmktplace,2026-07-10 16:45:09
2026-07-09 19:37:07,1645591253579-01,"Formas | Assadeiras, Fôrmas e Travessas | Casa e Cozinha",Conjunto de travessas refratárias marinex em vidro - 10 peças,12257,14988,1,2135902,loyalt,2026-07-10 16:45:09
2026-07-09 19:35:20,1645591253578-01,Potes | Utensílios para Cozinha | Casa e Cozinha,Potes Herméticos Electrolux de Plástico Cinza Escuro Retangular com 8 Unidades,5490,9990,1,1108053,electrolux,2026-07-10 16:45:10
2026-07-09 19:33:55,1645591253577-01,"Batedeiras | Liquidificadores, Batedeiras e Processadores | Eletroportáteis",Batedeira mondial premium vermelha bella massa inox b-29 np com 4 velocidades e 500w,12300,12300,1,2046410,loyalt,2026-07-10 16:45:10
2026-07-09 19:32:10,1645591253576-01,Protetores Solares e Bronzeadores | Pele | Cosméticos e Perfumaria,Protetor Solar Facial Principia FPS60 PS-01 40ml,4899,4899,1,904318,farmaconde,2026-07-10 16:45:10
2026-07-09 19:24:00,1645581253572-01,Cuidados com o Cabelo | Cosméticos e Perfumaria,Escova para Cabelo Fitagem Cachos Vibrantes No 2443 Rosa Ricca,4495,4495,1,3371429,webcontinentalmktplace,2026-07-10 16:45:11
2026-07-09 19:24:00,1645581253572-03,Felicidade | Autoajuda | Livros,TALVEZ VOCÊ DEVA CONVERSAR COM ALGUÉM,8980,8980,1,289782,martinsfontespaulista,2026-07-10 16:45:11
2026-07-09 19:24:00,1645581253572-02,Frigideiras | Panelas e Utensílios para Cozinhar | Casa e Cozinha,Frigideira Tramontina Loreto Antiaderente Vermelha,3990,9800,1,25756,funstock,2026-07-10 16:45:12
2026-07-09 19:20:48,1645581253571-01,Mesas De Jantar | Sala de Jantar | Móveis,Mesa De Jantar Thais 70x70 Cm Com Granito Ocre Itabira Com 4 Cadeiras 063 Preto - Artefamol,57834,57834,1,2228826,webcontinentalmktplace,2026-07-10 16:45:12
2026-07-09 19:18:06,1645581253568-01,Fones de Ouvido | Celulares e Smartphones,Fone de Ouvido Bluetooth Drift OEX Cinza,12990,25500,1,28494,funstock,2026-07-10 16:45:12
2026-07-09 19:17:34,1645581253566-01,Panelas Elétricas | Eletroportáteis Especiais | Eletroportáteis,"Panela Philco PPN24A Redstone com Tampa de Vidro 4,6L Bivolt",20990,26390,1,705850,webcontinentalmktplace,2026-07-10 16:45:13
2026-07-09 19:13:09,1645581253565-01,"Formas | Assadeiras, Fôrmas e Travessas | Casa e Cozinha",Conjunto de travessas refratárias marinex em vidro - 10 peças,12257,14988,2,2135902,loyalt,2026-07-10 16:45:13
2026-07-09 19:12:49,1645581253564-01,Mesas De Jantar | Sala de Jantar | Móveis,Kit Mesa Eiffel Branca Quadrada 80cm + 04 Cadeiras Eiffel.,89900,89900,1,1926799,webcontinentalmktplace,2026-07-10 16:45:13
2026-07-09 19:08:02,1645581253558-01,Misturadores | Hidráulico | Materiais de Construção,Torneira Elétrica Lorenzetti Loren Easy 127V,22999,22999,1,1663659,minipreco,2026-07-10 16:45:14
2026-07-09 19:06:57,1645581253557-01,Adaptadores | Periféricos | Computadores e Informática,Aquecedor Elétrico Quartzo 800W 2 Níveis Portátil Cinza Startools 220V,18998,18998,1,3359486,webcontinentalmktplace,2026-07-10 16:45:14
2026-07-09 19:06:49,1645581253556-01,"Cafeteiras e Máquinas de Expresso | Café, Chá e Expresso | Eletroportáteis","Cafeteira Tramontina com Coador de Aço Inox 0,40 L",14595,14595,1,153489,marinbrasil,2026-07-10 16:45:15
2026-07-09 18:57:07,1645581253553-01,Celulares e Smartphones,"Smartphone samsung galaxy a26 tela 6.7"" 256gb 5g câmera tripla 50mp preto",159900,197210,1,2046064,loyalt,2026-07-10 16:45:15
2026-07-09 18:55:59,1645581253552-01,Smartphone | Celulares e Smartphones,"Smartphone samsung galaxy s25 fe 5g tela 6,7” amoled 256gb 8gb ram câmera 50mp jetblack",349900,457652,1,2045402,loyalt,2026-07-10 16:45:15
2026-07-09 18:55:32,1645581253551-01,Curativos | Primeiros Socorros | Saúde e Bem Estar,"Fita Microporosa Cremer Branca 2,5Cmx90M",767,767,8,1188176,pensefarma,2026-07-10 16:45:16
2026-07-09 18:55:32,1645581253551-01,Curativos | Primeiros Socorros | Saúde e Bem Estar,Compressa de Gaze Estéril 13 Fios Herika America com 10 Unidades,225,225,17,1162818,pensefarma,2026-07-10 16:45:16
2026-07-09 18:55:32,1645581253551-01,"Vitaminas | Vitaminas, Minerais e Suplementos | Saúde e Bem Estar",Compressa Gaze Nexcare 5un COMPR GAZE NEXCARE 5UN,327,327,6,722105,pensefarma,2026-07-10 16:45:16
2026-07-09 18:52:05,1645581253550-01,Celulares e Smartphones,"Celular samsung galaxy a07 tela 6.7"" 128gb 4g 90hz câmera dupla 50mp verde",68500,133112,1,2652242,loyalt,2026-07-10 16:45:16
2026-07-09 18:51:15,1645581253548-01,Cuidados com o Cabelo | Cosméticos e Perfumaria,Kit shampoo + tratamento antiqueda + leave-in lola cosmetics rapunzel,9270,14470,1,2070698,loyalt,2026-07-10 16:45:16
2026-07-09 18:51:15,1645581253548-02,"Vitaminas | Vitaminas, Minerais e Suplementos | Saúde e Bem Estar",Suplemento Vitamínico Adeforte Turbo com Biotina 2 Ampolas de 3ml Cada,4608,4654,2,1633902,farmaciaindiana,2026-07-10 16:45:17
2026-07-09 18:50:05,1645581253547-01,Carros de passeio | Pneus | Produtos automotivos,Pneu Aro 14 185/65R14 86H Bravuris 5HM Barum,34670,34670,2,817474,pneubarato,2026-07-10 16:45:17
2026-07-09 18:49:26,1645581253546-01,Aquecedores | Eletroportáteis,Aquecedor A óleo Mondial A-06 -220v-preto/prata,49800,69989,1,880153,webcontinentalmktplace,2026-07-10 16:45:17
2026-07-09 18:49:16,1645581253545-01,Motorola | Smartphone | Celulares e Smartphones,"Smartphone motorola moto g06 4g tela 6,9” 128gb câmera 50mp laranja",73350,88778,1,2047101,loyalt,2026-07-10 16:45:18
2026-07-09 18:45:10,1645581253544-01,Carrinhos de Passeio | Bebês e Infantil,Carrinho de Bebê Burigotto Lui de 0 até 15kg para Passeio Rosê,76890,76890,1,1051450,webcontinentalmktplace,2026-07-10 16:45:18
2026-07-09 18:44:16,1645581253542-01,"Formas | Assadeiras, Fôrmas e Travessas | Casa e Cozinha",Conjunto de travessas refratárias marinex em vidro - 10 peças,12257,14988,1,2135902,loyalt,2026-07-10 16:45:19
2026-07-09 18:44:16,1645581253542-02,Sanduicheiras e Grelhas Elétricas | Eletroportáteis,Sanduicheira e Grill Britânia BGRE01 2 em 1 750W 220V,7990,13990,1,732521,Philco,2026-07-10 16:45:19
2026-07-09 18:37:27,1645581253538-01,Motorola | Smartphone | Celulares e Smartphones,Smartphone Motorola Moto G35 5G 256GB 12GB de RAM Coral,134900,149900,1,1455312,webfones,2026-07-10 16:45:19
2026-07-09 18:36:27,1645581253537-01,Mesas De Jantar | Sala de Jantar | Móveis,Mesa De Jantar Ambiente Thais 70x70 Cm Com Granito Ocre Itabira Com 4 Cadeiras 050 Preto – Artefamol,53535,53535,1,2226486,webcontinentalmktplace,2026-07-10 16:45:20
2026-07-09 18:34:09,1645581253536-01,Panelas | Panelas e Utensílios para Cozinhar | Casa e Cozinha,"Frigideira Wok Antiaderente com Tampa Grafite N24 2,8L - MTA",5999,5999,2,1757189,minipreco,2026-07-10 16:45:20
2026-07-09 18:33:46,1645581253535-01,Pele | Cosméticos e Perfumaria,Principia kit - protetor solar facial + sérum + gel de limpeza facial,16815,17700,1,2069711,loyalt,2026-07-10 16:45:21
2026-07-09 18:28:47,1645571253534-01,Celulares e Smartphones,"Smartphone motorola moto g06 4g tela 6,9” 128gb câmera 50mp azul marinho",68000,88778,1,2047097,loyalt,2026-07-10 16:45:21
2026-07-09 18:27:11,1645571253533-01,Mesas De Jantar | Sala de Jantar | Móveis,Mesa De Jantar Redonda 1m 1588 Carraro Freijó/preto,49999,69148,1,2384464,webcontinentalmktplace,2026-07-10 16:45:21
2026-07-09 18:26:47,1645571253532-01,"Áudio | Cinema, TV e Áudio","Caixa de som portátil jbl xtreme 4 com 30 w rms + 2 tweeters, bluetooth 5.3 e resistência à Água ip67 - azul",162216,194145,1,2046963,loyalt,2026-07-10 16:45:22
2026-07-09 18:26:36,1645571253531-01,Fogões | Fogões e Cooktops | Eletrodomésticos,Fogão 4 Bocas De Piso Braslar New Sirius 2023 Branco,51900,59990,1,892268,webcontinentalmktplace,2026-07-10 16:45:22
2026-07-09 18:25:41,1645571253529-01,"Acessórios de Áudio e Vídeo para Casa | Cinema, TV e Áudio",Rádio Retrô Bluetooth OEM AD-3199 com Usb Microsd Entrada Auxiliar Bivolt Preto,12282,12282,1,2991894,webcontinentalmktplace,2026-07-10 16:45:22
2026-07-09 18:25:41,1645571253529-02,Guarda-Roupa E Roupeiros | Quarto | Móveis,Guarda-Roupa Casal 3 Portas de Correr com Espelho Rustic/Branco Nobre Madesa Cor:Rustic/Branco,89999,114999,1,814367,madesacms,2026-07-10 16:45:23
2026-07-09 18:20:25,1645571253528-01,Computadores e Informática,Cabo Guitarra Ninja L P10/P10 90° 6.10m 0.20mm Santo Angelo,8390,15000,1,2034301,funstock,2026-07-10 16:45:23
2026-07-09 18:17:38,1645571253527-01,Fornos Elétricos | Eletrodomésticos,Forno Elétrico Britânia BFE41P 36L 1500W 127V,35990,58990,1,125563,Philco,2026-07-10 16:45:24
2026-07-09 18:06:20,1645571253525-01,Computadores e Informática | Teste,TESTE - NÃO COMPRAR TESTE DOAÇÃO - NÃO COMPRAR TESTE DOAÇÃO,10,10,1,22387,1,2026-07-10 16:45:24
2026-07-09 18:03:11,1645571253524-01,Fogões | Fogões e Cooktops | Eletrodomésticos,Fogão 4 Bocas Continental Branco Automático com TOPLimpaFácil (FC4IB) Premium Bivolt,99900,135900,1,1107335,electrolux,2026-07-10 16:45:24
2026-07-09 17:57:52,1645571253521-01,Cômoda | Quarto | Móveis,"Cômoda bartira diplomata + 5 gavetas trava de segurança e espaço para tv de até 42"" - 90cm de largura",49900,52395,1,2655124,loyalt,2026-07-10 16:45:25
2026-07-09 17:56:09,1645571253520-01,Smartphone | Celulares e Smartphones,"Smartphone Xiaomi Redmi Note 14 - 256GB, 8GB RAM, Dual SIM, Tela 6.67 - Preto",161415,189900,1,1286850,webcontinentalmktplace,2026-07-10 16:45:25
2026-07-09 17:55:04,1645571253519-01,Escadas | Ferramentas Manuais | Materiais de Construção,Escada Aluminio Real 5d Domestica,25988,25988,1,1934470,webcontinentalmktplace,2026-07-10 16:45:26
2026-07-09 17:55:04,1645571253519-01,Camping | Esporte e Lazer,Lanterna Tática Policial Led Cree Recarregável 22000w X9-t6,8489,8489,1,1070873,webcontinentalmktplace,2026-07-10 16:45:26
2026-07-09 17:53:58,1645571253518-01,Bolsas e Mochilas,Kit Mochilete Lancheira Estojo Terra da Fantasia,13790,23100,1,1313072,funstock,2026-07-10 16:45:26
2026-07-09 17:40:02,1645571253510-01,Rack para TV | Sala de Estar | Móveis,Rack Tv 50 Pol 136cm Bancada Para Sala Korelli M20 - D'rossi Cor Cinamomo E Off White,33590,33590,2,2451350,webcontinentalmktplace,2026-07-10 16:45:26
2026-07-09 17:38:36,1645571253509-01,Cozinha Industrial | Eletrodomésticos,"Frigideira Philco Ppn20a Revestimento Redstone 1,1l",16790,16790,1,2651632,webcontinentalmktplace,2026-07-10 16:45:27
2026-07-09 17:35:18,1645571253508-01,"Cafeteiras e Máquinas de Expresso | Café, Chá e Expresso | Eletroportáteis",Cafeteira elétrica mondial dolce arome vidro c-43-20x-si 20 xícaras 550w – preto/inox,14200,15943,1,2045087,loyalt,2026-07-10 16:45:27
2026-07-09 17:30:38,1645571253505-01,"Batedeiras | Liquidificadores, Batedeiras e Processadores | Eletroportáteis",Batedeira mondial prática black b-44 com 3 velocidades – preta,7990,17980,1,2046400,loyalt,2026-07-10 16:45:27
2026-07-09 17:30:14,1645571253504-01,Aspiradores de Pó e Água | Eletroportáteis,Aspirador de Pó Vertical Britânia Filtro Ciclone 1400W BAS1500V 220V,13990,21990,1,129584,Philco,2026-07-10 16:45:28
2026-07-09 17:25:16,1645561253499-02,"Cafeteiras e Máquinas de Expresso | Café, Chá e Expresso | Eletroportáteis",Cafeteira elétrica mondial smart coffee c-42 com 2 xícaras vermelha,14200,16049,1,2045072,loyalt,2026-07-10 16:45:28
2026-07-09 17:25:16,1645561253499-01,"Cafeteiras e Máquinas de Expresso | Café, Chá e Expresso | Eletroportáteis",Cafeteira Nescafé Dolce Gusto Mini Me Preta 220V,40990,57900,1,3094055,webcontinentalmktplace,2026-07-10 16:45:29
2026-07-09 17:23:02,1645561253496-02,Panelas de Pressão Elétricas | Eletroportáteis Especiais | Eletroportáteis,Panela de Pressão Digital Philco 6L Inox Preta 127V,41990,60990,1,1346,Philco,2026-07-10 16:45:29
2026-07-09 17:23:02,1645561253496-01,Panelas | Panelas e Utensílios para Cozinhar | Casa e Cozinha,Jogo de Panelas Revestimento Ceramica Indução 11 peças Extream Alphaville Marmol Vulkano,59900,69900,1,1976922,tetrix,2026-07-10 16:45:29
2026-07-09 17:22:24,1645561253495-01,Motorola | Smartphone | Celulares e Smartphones,"Smartphone motorola moto g06 4g tela 6,9” 128gb câmera 50mp laranja",73350,88778,1,2047101,loyalt,2026-07-10 16:45:30
2026-07-09 17:21:22,1645561253494-01,Antiparasitários | Medicamentos,Pediletan 10mg/ml Loção Tópica Frasco 60ml,2299,3233,4,1290015,farmaconde,2026-07-10 16:45:30
2026-07-09 17:18:37,1645561253493-01,Fones de Ouvido | Celulares e Smartphones,Fone Bluetooth M10 Sem Fio Display Powerbank Fone Preto,2990,2990,1,1906116,webcontinentalmktplace,2026-07-10 16:45:30
2026-07-09 17:15:32,1645561253491-01,Penteadeiras | Quarto | Móveis,Penteadeira Camarim Suspensa Essenza Preto Fosco - Pr Móveis Preto Fosco,40934,40934,1,2372837,webcontinentalmktplace,2026-07-10 16:45:31
2026-07-09 17:14:17,1645561253490-01,Cremes e Máscaras pra cabelo | Cuidados com o Cabelo | Cosméticos e Perfumaria,Óleo + Sérum Bifásico Finalizador Dove Bond Repair Reparação Intensa 110ml,3359,4899,1,836167,farmaciaindiana,2026-07-10 16:45:31
2026-07-09 17:14:17,1645561253490-01,Cremes e Máscaras pra cabelo | Cuidados com o Cabelo | Cosméticos e Perfumaria,Defrizante SoftHair 240ml Tutano Com Queratina Defrizante SoftHair Tutano Com Queratina 240ml,2590,2590,1,831234,farmaciaindiana,2026-07-10 16:45:31
2026-07-09 17:14:17,1645561253490-01,Shampoos e Condicionadores | Higiene | Saúde e Bem Estar,Kit Palmolive Hydrate Ácido Hialurônico Shampoo + Condicionador 350ml Cada,1599,2399,1,2686159,farmaciaindiana,2026-07-10 16:45:31
2026-07-09 17:14:17,1645561253490-01,Cremes e Máscaras pra cabelo | Cuidados com o Cabelo | Cosméticos e Perfumaria,Máscara Nutritiva Lola Bossa Crespos e Cachos 450g,5490,5490,1,2333222,farmaciaindiana,2026-07-10 16:45:31
2026-07-09 17:14:17,1645561253490-01,Cremes e Máscaras pra cabelo | Cuidados com o Cabelo | Cosméticos e Perfumaria,Creme Pentear Soul Power Curly On Cream 800g Creme Pent Soul Power 800G Curly On Cream,4390,4999,1,836110,farmaciaindiana,2026-07-10 16:45:31
2026-07-09 17:14:17,1645561253490-01,Cremes e Máscaras pra cabelo | Cuidados com o Cabelo | Cosméticos e Perfumaria,Kit Lola Bossa Crespos & Cachos Creme Modelador 500g + Gelatina 500g,8990,8990,1,3260531,farmaciaindiana,2026-07-10 16:45:31
2026-07-09 17:14:17,1645561253490-01,Cremes e Máscaras pra cabelo | Cuidados com o Cabelo | Cosméticos e Perfumaria,Máscara Capilar Salon Line Tô Podendo Bio Reconstrução Fortalecedora 1Kg,2699,2699,1,833161,farmaciaindiana,2026-07-10 16:45:31
2026-07-09 17:14:04,1645561253489-01,Carrinhos de Passeio | Bebês e Infantil,Carrinho de bebê Passeio Beyond 2 em 1 Assento Moisés 0-15kg Preto com Cinza Multikids Baby - BB428OUT [Reembalado] BB428OUT,74995,149990,1,65902,compreja,2026-07-10 16:45:31
2026-07-09 17:13:30,1645561253488-01,Secador de Cabelo | Cuidados com o Cabelo | Cosméticos e Perfumaria,Secador de Cabelos Britânia Bivolt 2100W BSC2200 Bivolt,9990,19990,1,1132265,Philco,2026-07-10 16:45:32
2026-07-09 17:12:33,1645561253487-01,Smartphone | Celulares e Smartphones,Smartphone Realme C73 256GB 8GB de RAM Forest Owl,129900,162900,1,2087014,webfones,2026-07-10 16:45:32
2026-07-09 17:12:32,1645561253486-01,Video Games | Eletrônicos,Game Stick Retrô 2.4g Wireless Mini Game 64gb 20.000 Jogos,14532,14532,1,2656656,webcontinentalmktplace,2026-07-10 16:45:32
2026-07-09 17:12:26,1645561253485-01,Pipoqueiras | Eletroportáteis,Pipoqueira Britânia Pop Time 127V,12990,27990,1,806,Philco,2026-07-10 16:45:34
2026-07-09 17:10:19,1645561253484-01,Iphone | Smartphone | Celulares e Smartphones,"iPhone 17 Pro Max (256GB) Azul-intenso, Tela de 6,9"", 5G e Câmera de 48MP",989000,1030000,1,1978337,shophub,2026-07-10 16:45:34
2026-07-09 17:09:47,1645561253483-01,Mesas De Jantar | Sala de Jantar | Móveis,Mesa Redonda 90x90 Mel/off White Slin Viero Mel/off White,35899,45198,1,2307673,webcontinentalmktplace,2026-07-10 16:45:34
2026-07-09 17:04:59,1645561253479-01,Panelas Elétricas | Eletroportáteis Especiais | Eletroportáteis,Panela elétrica de arroz mondial bianca rice npe-05 5 xícaras - branca,14900,18194,1,2046316,loyalt,2026-07-10 16:45:35
2026-07-09 16:55:49,1645561253473-02,Olhos | Maquiagem | Cosméticos e Perfumaria,Dueto Luisance Sobrancelhas Perfeitas,2190,2190,1,831205,farmaciaindiana,2026-07-10 16:45:35
2026-07-09 16:55:49,1645561253473-02,Antirrugas | Rosto | Pele | Cosméticos e Perfumaria,Creme Facial Nivea Antissinais 100g,2989,3890,1,847982,farmaciaindiana,2026-07-10 16:45:35
2026-07-09 16:55:49,1645561253473-01,Olhos | Maquiagem | Cosméticos e Perfumaria,Lápis Vult Preto Intenso.1g,2362,2362,1,2230599,pensefarma,2026-07-10 16:45:35
2026-07-09 16:55:20,1645561253472-01,Escova Secadora | Cuidados com o Cabelo | Cosméticos e Perfumaria,Escova Secadora Philco Pure Hairbrush PES15 Soft Gold Íons Bivolt,20990,20990,1,867,Philco,2026-07-10 16:45:36
2026-07-09 16:38:25,1645561253467-01,"Batedeiras | Liquidificadores, Batedeiras e Processadores | Eletroportáteis",Batedeira mondial prática black b-44 com 3 velocidades – preta,7990,17980,1,2046400,loyalt,2026-07-10 16:45:36
2026-07-09 16:38:25,1645561253467-02,Aspiradores de Pó e Água | Eletroportáteis,Aspirador de Pó Vertical 2 em 1 Philco 1450W PAS1600P 127V,13990,27990,1,129612,Philco,2026-07-10 16:45:36
2026-07-09 16:38:25,1645561253467-02,"Liquidificadores | Liquidificadores, Batedeiras e Processadores | Eletroportáteis",Liquidificador Britânia BLQ1380P Pro Maxx 6 Inox 3L 1200W 127V,13990,20990,1,18045,Philco,2026-07-10 16:45:36
2026-07-09 16:38:25,1645561253467-03,Colchas e Edredons | Cama e Banho | Casa e Cozinha,Edredom Solteiro Coberdrom Sherpa-mantinha Everest 1 Peça - Apricot,13640,13640,1,1587964,webcontinentalmktplace,2026-07-10 16:45:37
2026-07-09 16:32:43,1645561253466-01,"Cafeteiras e Máquinas de Expresso | Café, Chá e Expresso | Eletroportáteis",Cafeteira Dolce Gusto Genio S Basic Branco para Cápsulas com Painel LED 220V,43990,65990,1,3153529,webcontinentalmktplace,2026-07-10 16:45:37
2026-07-09 16:24:40,1645551253463-01,"Batedeiras | Liquidificadores, Batedeiras e Processadores | Eletroportáteis",Batedeira mondial prática black b-44 com 3 velocidades – preta,7990,17980,1,2046400,loyalt,2026-07-10 16:45:37
2026-07-09 16:24:40,1645551253463-01,"Liquidificadores | Liquidificadores, Batedeiras e Processadores | Eletroportáteis",Liquidificador mondial turbo full black l900fb preto 900w com 5 velocidades,10656,12733,1,2045261,loyalt,2026-07-10 16:45:37
2026-07-09 16:19:12,1645551253461-01,Secador de Cabelo | Cuidados com o Cabelo | Cosméticos e Perfumaria,Secador de Cabelos Britânia Bivolt 2100W BSC2200 Bivolt,9990,19990,1,1132265,Philco,2026-07-10 16:45:38
2026-07-09 16:15:58,1645551253458-01,Cobertores e Mantas | Cama e Banho | Casa e Cozinha,Manta Flannel Casal Lar E Lazer Preto UN,4999,4999,1,2656019,rovitex,2026-07-10 16:45:38
2026-07-09 16:15:09,1645551253457-01,Pipoqueiras | Eletroportáteis,Pipoqueira Britânia Pop Time 127V,12990,27990,1,806,Philco,2026-07-10 16:45:39
2026-07-09 16:13:21,1645551253456-01,Colchões | Quarto | Móveis,Colchão Solteiro 88cm Espuma D20 Supreme Gazin Marrom S/V,24590,24590,1,1965724,multilojaonline,2026-07-10 16:45:39
2026-07-09 16:08:36,1645551253452-01,"Vitaminas | Vitaminas, Minerais e Suplementos | Saúde e Bem Estar",Sarcoplex C/30 Sachês 21G SARCOPLEX 21G 30SCH,32168,39072,1,720320,farmaconde,2026-07-10 16:45:39
2026-07-09 16:08:07,1645551253451-01,Camas | Quarto | Móveis,Cama Articulada Casal 4 Prateleiras 2 Nichos CM8014 Tecnomobili Branco S/V,103590,121990,1,324470,multilojaonline,2026-07-10 16:45:39
2026-07-09 16:07:57,1645551253450-01,"Cafeteiras e Máquinas de Expresso | Café, Chá e Expresso | Eletroportáteis",Cafeteira Elétrica C-44-32x-sdi 127v,22900,22900,1,879962,webcontinentalmktplace,2026-07-10 16:45:40
2026-07-09 16:07:28,1645551253448-01,Computadores e Informática | Teste,TESTE - NÃO COMPRAR TESTE DOAÇÃO - NÃO COMPRAR TESTE DOAÇÃO,10,10,1,22387,1,2026-07-10 16:45:40
2026-07-09 16:05:44,1645551253446-01,Computadores e Informática | Teste,TESTE - NÃO COMPRAR TESTE DOAÇÃO - NÃO COMPRAR TESTE DOAÇÃO,10,10,1,22387,1,2026-07-10 16:45:41
2026-07-09 16:04:48,1645551253445-01,"Aparelhos, Navalhas e Lâminas | Depilação e Aparelhos de Barbear | Cosméticos e Perfumaria",Barbeador Rscw-389B 3W Lamina Inox Recarregável 2V,4490,4490,1,2098303,webcontinentalmktplace,2026-07-10 16:45:41
2026-07-09 16:00:21,1645551253443-01,Guarda-Roupa E Roupeiros | Quarto | Móveis,Guarda-Roupa Infantil Madesa Enzo 2 Portas de Correr Cor:Branco,59999,106990,1,3106,madesacms,2026-07-10 16:45:42
2026-07-09 16:00:07,1645551253442-01,"Formas | Assadeiras, Fôrmas e Travessas | Casa e Cozinha",Conjunto de travessas refratárias marinex em vidro - 10 peças,12257,14988,1,2135902,loyalt,2026-07-10 16:45:42
2026-07-09 15:58:48,1645551253441-01,Celulares e Smartphones,"Celular samsung galaxy a17 4g tela 6.7"" 128gb super amoled câmera tripla 50mp preto",96900,116900,1,2295619,loyalt,2026-07-10 16:45:42
2026-07-09 15:33:16,1645551253437-01,Impressoras | Impressoras e Acessórios | Computadores e Informática,Impressora Multifuncional Canon G3110 Colorida Preto Bivolt,99900,119900,1,1803968,webfones,2026-07-10 16:45:43
2026-07-09 15:29:16,1645541253432-03,"Pratos | Louça, Copos e Talheres | Casa e Cozinha",Prato Fundo Astral Duralex,696,1114,4,69634,tfdbn2,2026-07-10 16:45:43
2026-07-09 15:29:16,1645541253432-04,"Formas | Assadeiras, Fôrmas e Travessas | Casa e Cozinha",Forma Silicone Bolo Pudim Torta Assadeira Air Fryer Vazada Redonda Reutilizavel Antiaderente Confeitaria,2387,2387,1,2109965,webcontinentalmktplace,2026-07-10 16:45:43
2026-07-09 15:29:16,1645541253432-04,Impressoras e Acessórios | Computadores e Informática,Kit de Frio OEM Geométrica 100% Lã Antialérgica com Touca Luva Touch e Protetor de Pescoço Adulto,4785,4785,1,3491918,webcontinentalmktplace,2026-07-10 16:45:43
2026-07-09 15:29:16,1645541253432-02,Panelas | Panelas e Utensílios para Cozinhar | Casa e Cozinha,"Panela de Pressão Magnific Vermelha 4,5L - ALCAST",12257,17880,1,1154606,loyalt,2026-07-10 16:45:44
2026-07-09 15:29:16,1645541253432-01,"Formas | Assadeiras, Fôrmas e Travessas | Casa e Cozinha",ASSADEIRA REDONDA BOROSSILICATO 2000ML YANGZI,1990,3999,1,2650817,minipreco,2026-07-10 16:45:44
2026-07-09 15:29:16,1645541253432-01,"Formas | Assadeiras, Fôrmas e Travessas | Casa e Cozinha",ASSADEIRA RETANGULAR BOROSILICATO 2000ML YANGZI,1990,3999,1,2650818,minipreco,2026-07-10 16:45:44
2026-07-09 15:29:16,1645541253432-05,Tapetes | Decoração | Casa e Cozinha,Tapete Cozinha Base Antiderrapante Tapetes Junior Cinza UN,1583,3499,3,2336532,rovitex,2026-07-10 16:45:44
2026-07-09 15:18:14,1645541253431-01,"Bebedouros | Filtros, Bebedouros e Refrigeradores de Água | Eletroportáteis",Purificador de Água Philco Bivolt PPU11 Água Natural e Gelada Bivolt,39990,81990,1,1323828,Philco,2026-07-10 16:45:45
2026-07-09 15:16:25,1645541253430-01,Fritadeiras Elétricas | Eletroportáteis,"Air Fryer Fritadeira Elétrica Digital Extream 5,5L Preto e Prata, 127v",29900,39900,1,1804573,tetrix,2026-07-10 16:45:45
2026-07-09 15:12:52,1645541253428-01,Carrinhos de Passeio | Bebês e Infantil,Carrinho de bebê Passeio Beyond 2 em 1 Assento Moisés 0-15kg Preto com Cinza Multikids Baby - BB428OUT [Reembalado] BB428OUT,74995,149990,1,65902,compreja,2026-07-10 16:45:45
2026-07-09 15:08:46,1645541253426-01,Fornos de Micro-Ondas | Eletrodomésticos,Micro-ondas 33L Philco PMO38B Limpa Fácil 1400W 127V,59990,72990,1,1244246,Philco,2026-07-10 16:45:46
2026-07-09 15:08:46,1645541253426-01,Freezer | Geladeiras e Freezers | Eletrodomésticos,Freezer Horizontal Philco 299L PFH300B 2 em 1 A e A+ 220V,239990,287990,1,828637,Philco,2026-07-10 16:45:46
2026-07-09 15:08:43,1645541253424-02,Potes | Utensílios para Cozinha | Casa e Cozinha,Potes Herméticos Electrolux de Plástico Branco Retangular com 20 Unidades,12900,31800,1,1108206,electrolux,2026-07-10 16:45:46
2026-07-09 15:08:43,1645541253424-01,Sanduicheiras e Grelhas Elétricas | Eletroportáteis,Sanduicheira fast grill e sandwich mondial s-12 750w - preta,8745,10890,1,2046172,loyalt,2026-07-10 16:45:46
2026-07-09 15:02:17,1645541253414-01,Smartphone | Celulares e Smartphones,"Smartphone samsung galaxy s25 fe 5g tela 6,7” amoled 256gb 8gb ram câmera 50mp jetblack",349900,457652,1,2045402,loyalt,2026-07-10 16:45:47
2026-07-09 14:59:00,1645541253412-01,"Cafeteiras e Máquinas de Expresso | Café, Chá e Expresso | Eletroportáteis",Cafeteira Nescafé Dolce Gusto Genio S Basic Branca 110V,43990,65900,1,3093619,webcontinentalmktplace,2026-07-10 16:45:47
2026-07-09 14:57:35,1645541253408-01,Fraldas | Bebês e Infantil,Fralda Descartável Mamypoko Calça Superproteção XG 24 Unidades,3490,4499,2,1149739,farmaciaindiana,2026-07-10 16:45:47
2026-07-09 14:56:03,1645541253406-02,Garrafas Térmicas | Utensílios para Cozinha | Casa e Cozinha,"Garrafa Termica 1,0L Magic Magic Lumina 9751 Termolar 52998",13178,13178,1,1422633,webcontinentalmktplace,2026-07-10 16:45:48
2026-07-09 14:56:03,1645541253406-01,Cortadores de Cabelo | Cosméticos e Perfumaria,Máquina De Cabelo E Barba Multi-Styler Gcx623 Sport USB Bivolt,10990,10990,1,151027,loyalt,2026-07-10 16:45:48
2026-07-09 14:55:14,1645541253404-01,Segurança do Bebê | Bebês e Infantil,"Tapete De Atividades Inflável água, Sensorial, Almofada.",4900,4900,1,2268922,webcontinentalmktplace,2026-07-10 16:45:48
