creationDate,orderId,categoryName,name,price,listPrice,quantity,productId,seller,data_extracao
2026-05-09 22:14:56,1630971219598-01,Sanduicheiras e Grelhas Elétricas | Eletroportáteis,Sanduicheira cadence san400,7999,13999,1,1967110,loyalt,2026-05-11 20:44:54
2026-05-09 22:11:17,1630971219597-01,Cozinha Industrial | Eletrodomésticos,Geladeira Portátil 25l Mini Cooler Refrigera E Aquece Bivolt Para Carro Camping,120000,120000,1,2661264,webcontinentalmktplace,2026-05-11 20:44:54
2026-05-09 22:10:07,1630971219595-01,Cuidados com o Cabelo | Cosméticos e Perfumaria,Elseve liso dos sonhos kit - condicionador + shampoo + máscara capilar + creme para pentear + sérum leave-in,12826,15925,1,2073406,loyalt,2026-05-11 20:44:54
2026-05-09 22:08:38,1630971219594-01,Torneiras Elétricas | Instalações para Casa | Materiais de Construção,Torneira Elétrica Lorenzetti LorenEasy Branco Torneira Elétrica Lorenzetti LorenEasy de Parede 127V 4800W Branco,16590,16590,1,76099,webcontinentalmktplace,2026-05-11 20:44:54
2026-05-09 22:07:54,1630971219593-01,Motorola | Smartphone | Celulares e Smartphones,Smartphone Motorola Moto G35 5G 256GB 12GB de RAM Coral,109900,149900,1,1455312,webfones,2026-05-11 20:44:54
2026-05-09 22:03:33,1630971219592-01,Cama e Banho | Casa e Cozinha,Jogo Cama Lençol Unique Casal Padrão 400 Fios Ponto Palito 3 Peças - Rosê,5539,6924,1,1071020,webcontinentalmktplace,2026-05-11 20:44:54
2026-05-09 21:56:37,1630971219590-01,Camas | Quarto | Móveis,Cama Box Conjugado Solteiro 88cm Supreme Gazin Natural Cinza S/V,45590,53990,1,2495647,multilojaonline,2026-05-11 20:44:54
2026-05-09 21:56:13,1630971219589-01,Motorola | Smartphone | Celulares e Smartphones,Smartphone Motorola Moto G56 5G 256GB 24GB de RAM Cinza,149900,154900,1,1965436,webfones,2026-05-11 20:44:55
2026-05-09 21:53:12,1630971219585-01,Cuidado Adulto | Saúde e Bem Estar,Gel creme hidratante para a área dos olhos hydro boost neutrogena,6511,8499,1,2074821,loyalt,2026-05-11 20:44:55
2026-05-09 21:53:12,1630971219585-02,Rosto | Pele | Cosméticos e Perfumaria,Kit Beleza Cicatricure Sérum Clareador Vit C 30ml + Cicatricure Contorno Dos Olhos Blur & Filler 15g,14136,14136,1,1185406,pensefarma,2026-05-11 20:44:55
2026-05-09 21:53:12,1630971219585-03,"Sabonetes Líquidos, Óleos e Loções | Corpo e Banho | Cosméticos e Perfumaria",Hidratante Jequiti Sensi Hidratação Prolongada Pele Seca 220ml,1399,1999,1,1158173,farmaconde,2026-05-11 20:44:55
2026-05-09 21:53:12,1630971219585-03,Cremes | Bem-Estar | Saúde e Bem Estar,Hidratante para as Mãos e Pés Petally Silicone 250g,1499,1499,1,2120188,farmaconde,2026-05-11 20:44:55
2026-05-09 21:53:08,1630971219584-01,Mochilas | Bolsas e Mochilas,Mochila OEM Feminina com Zíper de Grande Capacidade Pu 29 e 5x25 e 5x10cm Preto,4032,4032,1,2969880,webcontinentalmktplace,2026-05-11 20:44:55
2026-05-09 21:51:58,1630971219583-01,Perfumes | Cosméticos e Perfumaria,Sabah al ward al wataniah eau de parfum feminino,18990,27707,1,2315564,loyalt,2026-05-11 20:44:55
2026-05-09 21:37:04,1630971219577-01,Freezer | Geladeiras e Freezers | Eletrodomésticos,Freezer Horizontal Philco 143 Litros 2 Em 1 Branco Pfh160b - 127v,139990,167990,1,844933,Philco,2026-05-11 20:44:55
2026-05-09 21:35:36,1630971219576-01,"Cafeteiras e Máquinas de Expresso | Café, Chá e Expresso | Eletroportáteis",Cafeteira expresso arno dolce gusto genio s plus dgs2 - preta,62390,71295,1,2045097,loyalt,2026-05-11 20:44:55
2026-05-09 21:28:02,1630961219575-01,Cremes e Máscaras pra cabelo | Cuidados com o Cabelo | Cosméticos e Perfumaria,Tônico Capilar Gota Dourada Para Crescimento 100ml,1458,1458,2,834611,pensefarma,2026-05-11 20:44:55
2026-05-09 21:26:33,1630961219573-01,Cuidados com o Cabelo | Cosméticos e Perfumaria,Escova Elétrica 5 em 1 Secadora Chapinha Modelador de Cachos Tecnologia Iônica 360°,24600,24600,1,2749083,webcontinentalmktplace,2026-05-11 20:44:56
2026-05-09 21:24:29,1630961219571-01,"Alto-Falantes | Áudio | Cinema, TV e Áudio",Caixa de Som Speaker Philco PBS220BT 220W Preto Bivolt,53990,54990,1,1965891,multilojaonline,2026-05-11 20:44:56
2026-05-09 21:22:53,1630961219569-01,Balcão | Cozinha | Móveis,Balcão Cozinha Armário Gabinete De Pia 160 Cm Estela E Balcão Para Microondas E Forno Elétrico Lilian Branco,89390,89390,1,2382697,webcontinentalmktplace,2026-05-11 20:44:56
2026-05-09 21:22:53,1630961219569-01,Cozinha Industrial | Eletrodomésticos,Escorredor de Louças Pratos Cozinha Duplo Cromado Preto em Aço Antiferrugem com Dois Andares Porta,5685,5685,1,2941961,webcontinentalmktplace,2026-05-11 20:44:56
2026-05-09 21:22:53,1630961219569-01,"Talheres e Porta-Talheres | Louça, Copos e Talheres | Casa e Cozinha",Jogo De Talher Faqueiro Ipanema Aço Inox 24 Peças Tramontina Vermelho,6966,6966,1,1664165,webcontinentalmktplace,2026-05-11 20:44:56
2026-05-09 21:19:43,1630961219566-01,Panelas Elétricas | Eletroportáteis Especiais | Eletroportáteis,Panela De Pressão Elétrica Midea 5L Nutripro Inox PP5MS2 220V,35900,42900,1,1856717,webcontinentalmktplace,2026-05-11 20:44:56
2026-05-09 21:19:25,1630961219565-01,Máquinas de Lavar Roupas | Máquinas de Lavar e Secadoras | Eletrodomésticos,Tanquinho De Lavar Roupa 10Kg Britânia Semiautomático BLR03 110V,43990,54990,1,2613234,webcontinentalmktplace,2026-05-11 20:44:57
2026-05-09 21:16:51,1630961219561-01,"Liquidificadores | Liquidificadores, Batedeiras e Processadores | Eletroportáteis",Liquidificador mondial turbo full black l900fb preto 900w com 5 velocidades,10890,12495,1,2045261,loyalt,2026-05-11 20:44:57
2026-05-09 21:16:51,1630961219561-03,Sanduicheiras e Grelhas Elétricas | Eletroportáteis,Sanduicheira e Grill Britânia BGR27I Press 2 em 1 850W 127V,11990,21990,1,7570,Philco,2026-05-11 20:44:57
2026-05-09 21:16:51,1630961219561-02,Toalhas de Mesa | Decoração | Casa e Cozinha,TOALHA MESA TERMICA BEER 137X100CM ZA2TMCBE KAPAZI,1299,1299,2,846265,minipreco,2026-05-11 20:44:57
2026-05-09 21:14:50,1630961219560-01,Celulares e Smartphones,"Celular samsung galaxy a17 4g tela 6.7"" 128gb super amoled câmera tripla 50mp preto",93496,137219,1,2295619,loyalt,2026-05-11 20:44:57
2026-05-09 21:13:17,1630961219558-01,Depuradores e Coifas | Eletrodomésticos,Depurador e Exaustor de Ar Slim 80 cm Prata Suggar 110V,41900,41900,1,1914315,webcontinentalmktplace,2026-05-11 20:44:57
2026-05-09 21:09:14,1630961219551-01,Cooktops | Fogões e Cooktops | Eletrodomésticos,Cooktop Britânia BCT5P 5 bocas Bivolt,34990,57990,1,18347,Philco,2026-05-11 20:44:57
2026-05-09 21:09:14,1630961219551-01,Sanduicheiras e Grelhas Elétricas | Eletroportáteis,Grill e Sanduicheira Philco PGR21PI Maxx Clean 1000W 220V,10990,23990,1,3140,Philco,2026-05-11 20:44:57
2026-05-09 21:09:14,1630961219551-01,"Batedeiras | Liquidificadores, Batedeiras e Processadores | Eletroportáteis",Batedeira Philco Planetária PHP500 Turbo 220V,29990,52990,1,131059,Philco,2026-05-11 20:44:57
2026-05-09 21:09:14,1630961219551-01,Panelas de Arroz | Eletroportáteis Especiais | Eletroportáteis,Panela de Arroz Britânia PA5 Prime Preta 220V,12990,22990,1,1189,Philco,2026-05-11 20:44:57
2026-05-09 21:06:34,1630961219549-01,"Caixas de Som Portáteis | Áudio | Cinema, TV e Áudio",Speaker Philco PBS220BT Extreme Bluetooth 5.3 Flash Light 220W Bivolt,35990,47990,1,301756,Philco,2026-05-11 20:44:57
2026-05-09 21:04:10,1630961219547-01,"Áudio | Cinema, TV e Áudio","Caixa de som jbl flip 7 com bluetooth e à prova d`água, potência 35w preta - bivolt",69597,69597,1,2046950,loyalt,2026-05-11 20:44:58
2026-05-09 21:03:52,1630961219546-01,Sofás | Sala de Estar | Móveis,Sofá 4 Lugares Retrátil Reclinável 270cm Veludo Bogotá Requinte Veludo Marrom S/V,242990,294990,1,2454129,multilojaonline,2026-05-11 20:44:58
2026-05-09 21:03:25,1630961219545-01,Brinquedos,Biscoito Piraquê Leite Maltado 132g Black,529,529,11,1965060,farmaciaindiana,2026-05-11 20:44:58
2026-05-09 21:03:25,1630961219545-01,Cremes Dentais | Higiene Bucal | Higiene | Saúde e Bem Estar,Creme Dental Close Up 70g Triple Menta CR DENT CLOSE UP TR,339,349,1,724992,farmaciaindiana,2026-05-11 20:44:58
2026-05-09 21:03:25,1630961219545-01,Cremes Dentais | Higiene Bucal | Higiene | Saúde e Bem Estar,Creme Dental Close Up Triple Menta Americana 70g CR DENT CLOSE UP 70G,339,349,1,727581,farmaciaindiana,2026-05-11 20:44:58
2026-05-09 21:03:25,1630961219545-01,Enxaguantes Bucais | Higiene Bucal | Higiene | Saúde e Bem Estar,Enxaguante Bucal Colgate Plax Sem Álcool Melancia 60ml,499,789,1,2480347,farmaciaindiana,2026-05-11 20:44:58
2026-05-09 21:03:25,1630961219545-01,Protetores Solares e Bronzeadores | Pele | Cosméticos e Perfumaria,Macarrão Espaguete Sêmola Santa Amália 500gr N8,529,539,2,832488,farmaciaindiana,2026-05-11 20:44:58
2026-05-09 21:03:25,1630961219545-01,Corpo e Banho | Cosméticos e Perfumaria,Sabonete Em Barra Nivea Nutrição da Natureza Óleo de Abacate e Camomila 80g,529,529,1,1565823,farmaciaindiana,2026-05-11 20:44:58
2026-05-09 21:03:25,1630961219545-01,Corpo e Banho | Cosméticos e Perfumaria,Sabonete Nivea Nutrição da Natureza Manteiga de Karité e Lima da Pérsia 80g,529,529,1,1732980,farmaciaindiana,2026-05-11 20:44:58
2026-05-09 21:03:25,1630961219545-01,Corpo e Banho | Cosméticos e Perfumaria,Sabonete Em Barra Nivea Nutrição da Natureza Manteiga de Cacau e Jasmin 80g,529,529,1,1633901,farmaciaindiana,2026-05-11 20:44:58
2026-05-09 21:03:25,1630961219545-01,Corpo e Banho | Cosméticos e Perfumaria,Sabonete Em Barra Nivea Nutrição da Natureza Óleo de Jojoba e Framboesa 80g,529,529,1,1733376,farmaciaindiana,2026-05-11 20:44:58
2026-05-09 21:03:25,1630961219545-01,Dor E Febre | Analgésicos | Medicamentos,Neosaldina Muscular Max 4 Comprimidos,796,884,1,1243461,farmaciaindiana,2026-05-11 20:44:58
2026-05-09 21:03:25,1630961219545-01,Corpo e Banho | Cosméticos e Perfumaria,Sabonete Líquido Sveda Amora e Orquídea Negra 290ml,799,999,1,2524542,farmaciaindiana,2026-05-11 20:44:58
2026-05-09 21:03:25,1630961219545-01,"Aparelhos, Navalhas e Lâminas | Depilação e Aparelhos de Barbear | Cosméticos e Perfumaria",Aparelho de Barbear Enox 2 Lâminas c/ 5un,899,899,1,726486,farmaciaindiana,2026-05-11 20:44:58
2026-05-09 21:03:25,1630961219545-01,Escovas de Dentes e Acessórios | Higiene Bucal | Higiene | Saúde e Bem Estar,Limpador de Língua Hillo Sortido,899,899,1,846934,farmaciaindiana,2026-05-11 20:44:58
2026-05-09 21:03:25,1630961219545-01,Antialérgicos | Alergias E Infecções | Medicamentos,Antialérgico Histamin Caixa 20 comprimidos Histamin 2mg 20 Comprimidos,924,1961,1,2426119,farmaciaindiana,2026-05-11 20:44:58
2026-05-09 21:03:25,1630961219545-01,Dor E Febre | Analgésicos | Medicamentos,Analgésico Doril 500mg + 30mg 6 Comprimidos Doril 500mg 6 Comprimidos,1169,1359,1,2427194,farmaciaindiana,2026-05-11 20:44:58
2026-05-09 21:00:10,1630961219543-01,"Alto-Falantes | Áudio | Cinema, TV e Áudio",Caixa de Som Speaker Philco PBS220BT 220W Preto Bivolt,53990,54990,1,1965891,multilojaonline,2026-05-11 20:44:58
2026-05-09 20:52:49,1630961219542-01,"Liquidificadores | Liquidificadores, Batedeiras e Processadores | Eletroportáteis",Liquidificador Philco PH900  Vermelho 1200W 220V,11990,19990,1,1302,Philco,2026-05-11 20:44:58
2026-05-09 20:52:41,1630961219541-01,"Acessórios de Áudio e Vídeo para Casa | Cinema, TV e Áudio",Radio De Carro Som Automotivo Mp3 Player Bluetooth,9899,9899,1,2654453,webcontinentalmktplace,2026-05-11 20:44:58
2026-05-09 20:51:33,1630961219540-01,Sanduicheiras e Grelhas Elétricas | Eletroportáteis,Sanduicheira cadence san400,7999,13999,1,1967110,loyalt,2026-05-11 20:44:58
2026-05-09 20:51:11,1630961219539-01,Óculos VR | Artigos Gamer | Computadores e Informática,Óculos De Sol Ray-ban Rb3647-n 9069-a5 51-22 145 Round Double Bridge Rosê,78800,78800,1,2363642,webcontinentalmktplace,2026-05-11 20:44:59
2026-05-09 20:50:01,1630961219538-01,Motorola | Smartphone | Celulares e Smartphones,Smartphone Motorola Moto G86 5G 256GB 24GB de RAM Vermelho,184900,192900,1,2078330,webfones,2026-05-11 20:44:59
2026-05-09 20:49:14,1630961219537-01,Bolsas | Bolsas e Mochilas,Bolsa Feminina Baguete de Ombro OEM Boho Chic Couro Sintético 23x12x5 cm Marrom Adulto,5955,5955,1,3111841,webcontinentalmktplace,2026-05-11 20:44:59
2026-05-09 20:48:04,1630961219536-01,Sistemas de som | Produtos automotivos,Subwoofer De 12 Polegadas 300w,28210,28210,2,1114769,webcontinentalmktplace,2026-05-11 20:44:59
2026-05-09 20:39:10,1630961219532-01,Sanduicheiras e Grelhas Elétricas | Eletroportáteis,Sanduicheira cadence san400,7999,13999,1,1967110,loyalt,2026-05-11 20:44:59
2026-05-09 20:38:51,1630961219530-02,Escova Rotativa Modeladora | Cuidados com o Cabelo | Cosméticos e Perfumaria,Escova secadora mondial space shine es-20 tourmaline Íon 1300w bivolt grafite,10296,10296,1,2655120,loyalt,2026-05-11 20:44:59
2026-05-09 20:38:51,1630961219530-01,Computadores e Informática,Hub USBC HDMI 4K USB 30 5Gbps 20cm Vinik HCHUC 20,8790,16100,1,2036496,funstock,2026-05-11 20:44:59
2026-05-09 20:37:47,1630961219528-02,"TVs | Cinema, TV e Áudio",Smart tv 55” semp 55s62 4k uhd led google tv,223496,279928,1,2299577,loyalt,2026-05-11 20:44:59
2026-05-09 20:37:47,1630961219528-01,Fogões | Fogões e Cooktops | Eletrodomésticos,"Fogão 4 bocas Electrolux Preto Experience Mesa de Vidro, 2 Fornos e Grade de Ferro Fundido (FE4DB) 127V",224900,244900,1,2481157,electrolux,2026-05-11 20:44:59
2026-05-09 20:33:27,1630961219524-01,Livros,Álbum De Figurinhas Panini Copa do Mundo 2026,2490,2490,1,2714059,farmaciaindiana,2026-05-11 20:44:59
2026-05-09 20:33:27,1630961219524-01,Papelaria,Envelope Figurinhas Panini Copa do Mundo 2026,700,700,4,2714295,farmaciaindiana,2026-05-11 20:44:59
2026-05-09 20:33:27,1630961219524-01,Rosto | Pele | Cosméticos e Perfumaria,Gel de Limpeza Facial Principia GL-03 200ml,4400,4400,1,2333258,farmaciaindiana,2026-05-11 20:44:59
2026-05-09 20:33:27,1630961219524-02,"Vitaminas, Minerais e Suplementos | Saúde e Bem Estar",Whey Protein Isolado Iso-X Protein Complex X-Pro Nutrition 2kg - Sabor Chocolate,15900,15900,1,2531892,webcontinentalmktplace,2026-05-11 20:45:00
2026-05-09 20:33:27,1630961219524-03,Rosto | Pele | Cosméticos e Perfumaria,"Sérum facial anti-idade principia - rn-0,3",5520,5520,1,2073596,loyalt,2026-05-11 20:45:00
2026-05-09 20:30:49,1630961219519-01,Camas | Quarto | Móveis,Cama Box Casal 138 Tecido Marrom Com Colchão Paris Molas Preto 66x138x188,109900,109900,1,1902013,webcontinentalmktplace,2026-05-11 20:45:00
2026-05-09 20:25:56,1630951219516-01,Frigideiras | Panelas e Utensílios para Cozinhar | Casa e Cozinha,Frigideira Antiaderente Grande 26cm X 12cm Com Tampa Belmar,14950,14950,1,1055785,webcontinentalmktplace,2026-05-11 20:45:00
2026-05-09 20:25:56,1630951219516-01,Colecionáveis | Artigos Gamer | Computadores e Informática,Colchão Inflável Casal Queen Raised Com Bomba Lítio Usb Vg Plus Preto,38719,43999,1,2241347,webcontinentalmktplace,2026-05-11 20:45:00
2026-05-09 20:25:56,1630951219516-02,Aspiradores Robô | Aspiradores de Pó e Água | Eletroportáteis,Robô Aspirador de Pó WAP Robot W100C,70162,70162,1,1659604,wap2025,2026-05-11 20:45:00
2026-05-09 20:25:20,1630951219514-01,Cômoda | Quarto | Móveis,Cômoda 6 Gavetas 1 Porta com Pés Milão Benetil Cinamomo S/V,70590,79990,1,1720284,multilojaonline,2026-05-11 20:45:00
2026-05-09 20:18:16,1630951219511-01,Fritadeiras Elétricas | Eletroportáteis,"Fritadeira Elétrica Mondial com Óleo Big Fry FT-07 2,5L   Preto 110 V",32990,42990,1,452215,multilojaonline,2026-05-11 20:45:00
2026-05-09 20:16:46,1630951219509-01,"TVs | Cinema, TV e Áudio","Smart tv 55"" 4k samsung 55u8600f crystal hdr tizen alexa e xbox gaming",270296,330645,1,2046116,loyalt,2026-05-11 20:45:00
2026-05-09 20:14:44,1630951219506-01,Celulares e Smartphones,Relógio Smartwatch Bluetooth Iwo8 Lite Notificações Para Ios E - Branco,10990,10990,1,2090125,webcontinentalmktplace,2026-05-11 20:45:00
2026-05-09 20:13:14,1630951219505-01,Cozinhas Completas | Cozinha | Móveis,Cozinha Completa Madesa Reims 260002 com Armário e Balcão Cor:Preto/Rustic,149999,197990,1,3731,madesacms,2026-05-11 20:45:00
2026-05-09 20:13:14,1630951219505-01,Rack para TV | Sala de Estar | Móveis,Rack para TV até 65 Polegadas Madesa Londres com Pés Preto Cor:Preto Texturizado,42999,66990,1,3151,madesacms,2026-05-11 20:45:00
2026-05-09 20:05:56,1630951219503-01,Tablets | Eletrônicos,"Tablet samsung galaxy a11 wi-fi tela 8.7"" 90hz 64gb câmera 8mp prata",94536,119900,1,2045360,loyalt,2026-05-11 20:45:00
2026-05-09 20:02:35,1630951219501-01,Panelas Elétricas | Eletroportáteis Especiais | Eletroportáteis,Panela Elétrica Britânia Multifunções BPE06 Redstone 127V,19990,33990,1,1093,Philco,2026-05-11 20:45:01
2026-05-09 20:02:18,1630951219499-02,Panelas | Panelas e Utensílios para Cozinhar | Casa e Cozinha,"PANELA PRESSAO ANTIADERENTE COM VISOR 4,5L MTA",19999,19999,1,2243536,minipreco,2026-05-11 20:45:01
2026-05-09 20:02:18,1630951219499-01,Protetores Solares e Bronzeadores | Pele | Cosméticos e Perfumaria,Kit Isdin Facial Protetor Solar Fusion Water Color Média Fps50 50ml + Água Micelar 4 em 1 400ml,12392,13633,1,2617114,farmaciaindiana,2026-05-11 20:45:01
2026-05-09 20:00:51,1630951219498-01,Serras | Ferramentas Elétricas | Materiais de Construção,Serra Circular 1100w Para Madeira E Construção Civil Profissional Multifuncional 127v,26800,26800,1,2322848,webcontinentalmktplace,2026-05-11 20:45:01
2026-05-09 19:57:31,1630951219494-01,Hidráulico | Materiais de Construção,Chuveiro Loren Bello Ultra Com Cano Lorenzetti Azul 6800w 220V,12957,12957,2,2537868,webcontinentalmktplace,2026-05-11 20:45:01
2026-05-09 19:56:09,1630951219491-01,Fornos Elétricos | Eletrodomésticos,Forno Elétrico 50L Philco PFE52P Dupla resistência 220V,39990,65990,1,155174,Philco,2026-05-11 20:45:01
2026-05-09 19:56:01,1630951219490-01,Eletroportáteis,Massageador Tens Fisioterapia Acupuntura Aparelho Eletroestimulador Tonificador Muscular Portatil Digital,5127,5127,1,1229826,webcontinentalmktplace,2026-05-11 20:45:01
2026-05-09 19:54:48,1630951219488-01,Camas | Quarto | Móveis,Cama Box Solteiro 88cm Molas Ensacadas Macau Gazin Chumbo/Preto S/V,73990,99990,1,2535443,multilojaonline,2026-05-11 20:45:01
2026-05-09 19:48:46,1630951219486-01,Máquinas de Lavar Roupas | Máquinas de Lavar e Secadoras | Eletrodomésticos,"Mini Máquina De Lavar Roupas Dobrável Portátil 6,5l Bivolt Para Viagem E Espaços Pequenos 6,5 Litros lilás",24542,24542,1,2675036,webcontinentalmktplace,2026-05-11 20:45:01
2026-05-09 19:48:35,1630951219485-01,Escadas | Ferramentas Manuais | Materiais de Construção,Escada Alumínio 7 Degraus Mor,29990,29990,1,69862,minipreco,2026-05-11 20:45:01
2026-05-09 19:47:50,1630951219484-01,Pet Shop,Tapete Higiênico Mr. Dry para Cães 30 Unidades,6065,6384,2,2387143,farmaciaindiana,2026-05-11 20:45:02
2026-05-09 19:46:26,1630951219483-01,"Cafeteiras e Máquinas de Expresso | Café, Chá e Expresso | Eletroportáteis",Cafeteira Elétrica Electrolux 30 Xícaras Experience Programável com Timer Cor Inox Preta (ECM25) 220V,21990,31990,1,1107449,electrolux,2026-05-11 20:45:02
2026-05-09 19:42:31,1630951219481-01,Aspiradores de Pó e Água | Eletroportáteis,Aspirador de pó vertical 2 em 1 mondial turbo cycle ap36 1100w - vermelho,13900,17745,1,2047066,loyalt,2026-05-11 20:45:02
2026-05-09 19:41:20,1630951219480-01,Celulares e Smartphones,"Smartphone motorola moto g06 4g tela 6,9” 256gb câmera 50mp verde",75400,94900,1,2137865,loyalt,2026-05-11 20:45:02
2026-05-09 19:40:39,1630951219479-01,Kits de Teclado e Mouse | Periféricos | Computadores e Informática,Teclado Brazil PC Qwerty Português Brasil Preto,2437,2437,1,2345962,webcontinentalmktplace,2026-05-11 20:45:02
2026-05-09 19:37:04,1630951219477-01,Desodorante | Higiene | Saúde e Bem Estar,Desodorante Antitranspirante Principia AD-02 70ml,4400,4400,1,848382,farmaciaindiana,2026-05-11 20:45:03
2026-05-09 19:32:24,1630951219475-01,"Vitaminas | Vitaminas, Minerais e Suplementos | Saúde e Bem Estar",Suplemento Alimentar Vitamina B12 60 Comprimidos Mastigáveis,3899,5437,1,1679023,farmaciaindiana,2026-05-11 20:45:03
2026-05-09 19:29:14,1630941219474-01,"Acessórios de Áudio e Vídeo para Casa | Cinema, TV e Áudio",Fone De Ouvido Bluetooth Ultrapods Pro Wireless 5.3 - Azul,5544,6600,1,2643124,webcontinentalmktplace,2026-05-11 20:45:03
2026-05-09 19:28:57,1630941219473-01,Enxoval | Bebês e Infantil,Manta Bebê Bene Casa Dots New 100x70cm Com Bordado Peach Elefantinho,8190,8190,1,2244276,webcontinentalmktplace,2026-05-11 20:45:03
2026-05-09 19:28:57,1630941219473-01,Enxoval | Bebês e Infantil,Toalha Capuz Bebê 70x70 Toque Aveludado Super Macia,2890,2890,1,1470882,webcontinentalmktplace,2026-05-11 20:45:03
2026-05-09 19:23:52,1630941219469-02,Pele | Cosméticos e Perfumaria,Principia kit - gel de limpeza + protetor solar fps60,7828,9785,1,2072159,loyalt,2026-05-11 20:45:03
2026-05-09 19:23:52,1630941219469-01,Cuidados com o Cabelo | Cosméticos e Perfumaria,Kit Eudora Volume Imediato Shampoo Siàge 250ml + Condicionador 200ml + Máscara Capilar 250g,11758,11758,1,3089527,farmaciaindiana,2026-05-11 20:45:03
2026-05-09 19:23:36,1630941219468-01,"TVs | Cinema, TV e Áudio","Smart Tv Aiwa 32? Android, Hd, Comando De Voz, Dolby áudio, Hdr10 - Aws-tv-32-bl-02-a Tv 32 Android",89990,122290,1,1265813,webcontinentalmktplace,2026-05-11 20:45:03
2026-05-09 19:22:16,1630941219466-02,Fornos de Micro-Ondas | Eletrodomésticos,Micro-ondas Philco 25L 1100W PM27 Limpa Fácil 127V,47990,67990,1,810079,Philco,2026-05-11 20:45:03
2026-05-09 19:22:16,1630941219466-01,Sanduicheiras e Grelhas Elétricas | Eletroportáteis,Sanduicheira mondial master grill s-20 - preto/inox,9900,10490,1,2046165,loyalt,2026-05-11 20:45:03
2026-05-09 19:16:37,1630941219465-01,"Cafeteiras e Máquinas de Expresso | Café, Chá e Expresso | Eletroportáteis",Cafeteira expresso arno dolce gusto genio s plus dgs2 - preta,62390,71295,1,2045097,loyalt,2026-05-11 20:45:03
2026-05-09 19:16:19,1630941219463-01,Bonecos | Meninos | Brinquedos,Kit 4 Bonecos Dragon Ball Z Action Figure Esféras Do Dragão,4990,4990,1,1852189,webcontinentalmktplace,2026-05-11 20:45:03
2026-05-09 19:16:11,1630941219462-01,Celulares e Smartphones,Smartphone Xiaomi Redmi Note 14 128GB 6GB Azul,139900,139900,1,1962335,webcontinentalmktplace,2026-05-11 20:45:04
2026-05-09 19:12:59,1630941219458-01,Cuidados com o Cabelo | Cosméticos e Perfumaria,Secador De Cabelos Philco 4 Em 1 Dobrável Motor BLDC PSC3500 220V,56090,56090,1,2293766,webcontinentalmktplace,2026-05-11 20:45:04
2026-05-09 19:05:59,1630941219455-02,Secadoras | Máquinas de Lavar e Secadoras | Eletrodomésticos,Secadora de Roupas Electrolux 11Kg Cor Inox Essential Care com Função Antirrugas (STH11) 220V,249900,305900,1,1107347,electrolux,2026-05-11 20:45:04
2026-05-09 19:05:59,1630941219455-01,Fornos de Micro-Ondas | Eletrodomésticos,Micro-ondas 33L Philco Limpa Fácil PMO38E 1400W 220V,59990,93990,1,1756743,Philco,2026-05-11 20:45:04
2026-05-09 19:05:59,1630941219455-01,"Cafeteiras e Máquinas de Expresso | Café, Chá e Expresso | Eletroportáteis","Cafeteira Expresso Philco 1,2L 20 Bar 950W PCF04A 220V",39990,82990,1,2434924,Philco,2026-05-11 20:45:04
2026-05-09 19:05:38,1630941219454-01,Ventiladores | Eletroportáteis,Ventilador De Mesa Mondial 06 Pás Vent 30Cm 127V/60Hz,10990,14430,1,1987642,webcontinentalmktplace,2026-05-11 20:45:04
2026-05-09 18:57:16,1630941219450-01,Cuidados com o Cabelo | Cosméticos e Perfumaria,Wella professionals oil reflections  light Óleo capilar,7188,8900,1,2070996,loyalt,2026-05-11 20:45:04
2026-05-09 18:52:22,1630941219449-01,Ventiladores | Eletroportáteis,Ventilador Coluna Mondial Vent 40cm Vsp-40c-nb 127v/60hz,18490,24390,1,880101,webcontinentalmktplace,2026-05-11 20:45:04
2026-05-09 18:50:27,1630941219448-01,Máquinas de lavar louça e secadoras de pratos | Eletrodomésticos,Lava-Louças Electrolux 14 Serviços Preta Experience com Função Higienizar Compras (LL14P) 220V,429900,429900,1,1148182,electrolux,2026-05-11 20:45:04
2026-05-09 18:48:56,1630941219447-01,Monitores | Computadores e Informática,"Monitor Led 21,5"" 22wr-75 Full Hd 75hz Preto Widescreen Brazil Pc",31558,37569,1,1624989,webcontinentalmktplace,2026-05-11 20:45:04
2026-05-09 18:38:38,1630941219441-01,Infantil - Literatura | Infantil | Livros,O ENCONTRO DA CIDADE CRIANÇA COM O SERTÃO MENINO,6100,6100,1,298126,martinsfontespaulista,2026-05-11 20:45:04
2026-05-09 18:38:38,1630941219441-01,Infantil - Artes | Infantil | Livros,UM FOTÓGRAFO DIFERENTE CHAMADO DEBRET,8100,8100,1,283434,martinsfontespaulista,2026-05-11 20:45:04
2026-05-09 18:38:38,1630941219441-02,Papelaria,Envelope Figurinhas Panini Copa do Mundo 2026,700,700,10,2714295,farmaciaindiana,2026-05-11 20:45:05
2026-05-09 18:37:41,1630941219440-01,Relógios Masculinos | Relógios,Relogio Digital Infantil Menino Silicone Criança + Caixa Qualidade Premium Silicone Ajustavel Preto,14390,14390,1,2259561,webcontinentalmktplace,2026-05-11 20:45:05
2026-05-09 18:36:03,1630941219439-01,Femininos | Perfumes | Cosméticos e Perfumaria,Perfume Feminino Bonjour Senorita Tous 90 ML Eau De Toilette,52353,68059,1,1397284,vipshop,2026-05-11 20:45:05
2026-05-09 18:33:21,1630941219437-01,Fornos de Micro-Ondas | Eletrodomésticos,Micro-ondas Philco 25L 1100W PM27 Limpa Fácil 127V,47990,67990,1,810079,Philco,2026-05-11 20:45:05
2026-05-09 18:29:59,1630931219436-01,"Mixers | Liquidificadores, Batedeiras e Processadores | Eletroportáteis",Mixer mondial pratic m-15-r 2 em 1 com copo medidor vermelho – 200 w,8590,10290,1,2655355,loyalt,2026-05-11 20:45:05
2026-05-09 18:23:24,1630931219435-01,Mochilas | Bolsas e Mochilas,MOCHILA INFANTIL MASCULINO AVENGERS MS46419AG MAXLOG,5995,11990,1,783145,minipreco,2026-05-11 20:45:05
