creationDate,orderId,categoryName,name,price,listPrice,quantity,productId,seller,data_extracao
2026-07-10 16:42:08,1645801254063-01,Cômoda | Quarto | Móveis,Cômoda Multiuso Liza 02 Portas 03 Gavetas Briz Branco,51900,61059,1,1365296,webcontinentalmktplace,2026-07-10 16:43:34
2026-07-10 16:42:08,1645801254063-01,Cozinha Industrial | Eletrodomésticos,Cesto Organizador Dobrável Multiuso Sortido 70x40cm em Poliéster com Estruturas Reforçadas Cinza,3290,3290,1,3108207,webcontinentalmktplace,2026-07-10 16:43:34
2026-07-10 16:42:08,1645801254063-01,Bolsas e Capas | Notebooks e Acessórios | Computadores e Informática,Tapete Passadeira 2 00 X 0 60 Retangular 60 X 200 Felpudo Rosa Bebê OEM,5984,5984,1,2985682,webcontinentalmktplace,2026-07-10 16:43:34
2026-07-10 16:42:08,1645801254063-01,Cobertores e Mantas | Cama e Banho | Casa e Cozinha,Manta Casal Microfibra Lisa Celta,3674,3674,2,1223003,webcontinentalmktplace,2026-07-10 16:43:34
2026-07-10 16:39:17,1645801254060-01,Ar-condicionado | Eletrodomésticos,Ventilador de coluna mondial vtx-40c-8p 40 cm com 3 velocidades - preto,24948,30440,1,2044922,loyalt,2026-07-10 16:43:34
2026-07-10 16:34:20,1645801254059-01,Fornos de Micro-Ondas | Eletrodomésticos,Micro-ondas Britânia 28L Branco Espelhado Limpa Fácil BMO30 127V,49990,64990,1,2082586,Philco,2026-07-10 16:43:34
2026-07-10 16:18:21,1645791254049-01,Fornos de Micro-Ondas | Eletrodomésticos,Micro-ondas britânia bmo23 20l limpa fácil 1100w preto/branco,46968,52526,1,2612357,loyalt,2026-07-10 16:43:34
2026-07-10 16:13:58,1645791254048-01,Fornos de Micro-Ondas | Eletrodomésticos,Micro-ondas britânia bmo23 20l limpa fácil 1100w preto/branco,46968,52526,1,2612357,loyalt,2026-07-10 16:43:34
2026-07-10 16:13:47,1645791254046-01,Salas De Jantar com 4 cadeiras | Sala de Jantar | Móveis,Conjunto Sala de Jantar Madesa Talita Mesa Tampo de Madeira com 4 Cadeiras Cor:Rustic/Preto/Sintético Preto,47999,86990,1,3502,madesacms,2026-07-10 16:43:35
2026-07-10 16:13:11,1645791254045-01,Motorola | Smartphone | Celulares e Smartphones,Smartphone Motorola Moto G15 256GB 12GB de RAM Grafite,99900,99900,1,1330562,webfones,2026-07-10 16:43:35
2026-07-10 16:11:01,1645791254042-01,Fogões | Fogões e Cooktops | Eletrodomésticos,Fogão 4 Bocas Atlas Coliseum Plus Mesa Inox Preto,62990,62990,1,3106652,webcontinentalmktplace,2026-07-10 16:43:35
2026-07-10 16:03:18,1645791254037-01,Roupa de Cama | Cama e Banho | Casa e Cozinha,Jogo de Cama 150 Fios Casal 4 Peças Lar E Lazer Azul UN,5999,5999,1,2655967,rovitex,2026-07-10 16:43:36
2026-07-10 16:01:26,1645791254036-01,"Batedeiras | Liquidificadores, Batedeiras e Processadores | Eletroportáteis",Batedeira mondial prática black b-44 com 3 velocidades – preta,7990,10957,1,2046400,loyalt,2026-07-10 16:43:36
2026-07-10 15:59:55,1645791254028-02,Armário | Cozinha | Móveis,Armário De Cozinha Completa Ferrara 6 Portas 1 Gaveta Freijó / Grafite Freijo Cinza,87900,97667,1,892849,webcontinentalmktplace,2026-07-10 16:43:36
2026-07-10 15:59:55,1645791254028-01,Fritadeiras Elétricas | Eletroportáteis,Air Fryer Philco 16L 4 em 1 Painel Digital PAF16A 127V,59990,100990,1,1359968,Philco,2026-07-10 16:43:36
2026-07-10 15:46:50,1645791254018-01,"Alto-Falantes | Áudio | Cinema, TV e Áudio",Caixa de som Amplificada Philco Exbass 2100W PCX21000 Bivolt,176990,247990,1,1811945,Philco,2026-07-10 16:43:36
2026-07-10 15:43:05,1645791254013-01,Emagrecer | Medicamentos,Besomed Caixa 60 Comprimidos BESOMED 60S ALMEIDA PRADO,4889,5524,2,2507831,farmaconde,2026-07-10 16:43:37
2026-07-10 15:37:44,1645791254011-01,Aspiradores de Pó e Água | Eletroportáteis,Aspirador de Pó Vertical Britânia Filtro Ciclone 1400W BAS1500V 127V,13990,21990,1,129584,Philco,2026-07-10 16:43:37
2026-07-10 15:24:33,1645781254007-01,Celulares e Smartphones,"Smartphone samsung galaxy a26 tela 6.7"" 256gb 5g câmera tripla 50mp preto",159900,197210,1,2046064,loyalt,2026-07-10 16:43:37
2026-07-10 15:09:29,1645781254003-01,Fraldas | Bebês e Infantil,Fralda Descartável Pampers Confort Sec XG 86 Unidades,15099,15099,1,3245186,farmaciaindiana,2026-07-10 16:43:37
2026-07-10 15:09:29,1645781254003-02,Fraldas | Bebês e Infantil,Fralda Pampers ConfortSec Bag Super XG 58 Unidades FR PAMPERS CONFORTSEC BAG SUPER XG 58U,11289,11289,1,845873,farmaconde,2026-07-10 16:43:38
2026-07-10 14:53:22,1645781253996-01,Máquinas de Lavar Roupas | Máquinas de Lavar e Secadoras | Eletrodomésticos,Máquina de Lavar Electrolux 13kg Branca Essential Care com Cesto Inox e Jet&Clean (LED13) 127V,179900,283900,1,1107329,electrolux,2026-07-10 16:43:38
2026-07-10 14:51:26,1645781253995-01,"Cadeiras de Bebê, Assentos e Acessórios | Bebês e Infantil",Cadeira Portátil De Alimentação Burigotto Kiwi De 6 Meses Até 15 Kg Baby Blue Azul,24190,24190,1,1070139,webcontinentalmktplace,2026-07-10 16:43:38
2026-07-10 14:50:38,1645781253994-01,Motorola | Smartphone | Celulares e Smartphones,Smartphone Motorola Moto G06 256GB 12GB de RAM Bege,88700,99900,2,2526656,webfones,2026-07-10 16:43:38
2026-07-10 14:50:25,1645781253991-01,"Chaleiras Elétricas | Café, Chá e Expresso | Eletroportáteis","Chaleira elétrica electrolux efficiente eek10 1,8l - aço escovado",15347,18590,1,2045216,loyalt,2026-07-10 16:43:38
2026-07-10 14:50:25,1645781253991-02,"Mixers | Liquidificadores, Batedeiras e Processadores | Eletroportáteis",Mixer 3 em 1 Electrolux Preto 400W com Tecnologia TruFlow (EIB10) 127V,22990,31990,1,1107399,electrolux,2026-07-10 16:43:38
2026-07-10 14:45:22,1645781253989-01,Amamentação e Alimentação | Bebês e Infantil,Fórmula Infantil NAN Comfor HMO de 6 a 12 meses 800g,7869,7869,2,1110762,farmaciaindiana,2026-07-10 16:43:39
2026-07-10 14:44:17,1645781253988-01,Camping | Esporte e Lazer,Lanterna Cabeça Led Cree T6 2 Baterias Carregador Veicular,8489,8489,1,1340519,webcontinentalmktplace,2026-07-10 16:43:39
2026-07-10 14:41:04,1645781253987-01,"TVs | Cinema, TV e Áudio",Smart Tv 58” Philco 4K LED PTV58G70R2CSGBL Roku Dolby Áudio Bivolt,301990,390990,1,133852,Philco,2026-07-10 16:43:39
2026-07-10 14:39:38,1645781253986-01,Smartphone | Celulares e Smartphones,"Celular samsung galaxy a07 tela 6.7"" 128gb 4g 90hz câmera dupla 50mp violeta",69937,88778,1,2047260,loyalt,2026-07-10 16:43:39
2026-07-10 14:38:23,1645781253985-01,Aspiradores Robô | Aspiradores de Pó e Água | Eletroportáteis,Robô Aspirador Electrolux 4 em 1 Wi-Fi Experience até 2h Azul (ERB44) Bivolt,134990,178990,1,1910223,electrolux,2026-07-10 16:43:39
2026-07-10 14:35:42,1645781253984-01,Ar-condicionado | Eletrodomésticos,AQUECEDOR OLEO EOS 127V EAQ02O OSCAR,49000,49000,1,3005022,minipreco,2026-07-10 16:43:39
2026-07-10 14:35:23,1645781253983-01,Secador de Cabelo | Cuidados com o Cabelo | Cosméticos e Perfumaria,Secador de Cabelo Style Black 2000W,24990,29990,1,1305543,lojataiff2,2026-07-10 16:43:40
2026-07-10 14:30:34,1645781253982-01,Panelas de Pressão | Panelas e Utensílios para Cozinhar | Casa e Cozinha,Panela De Pressão 7 Litros Alumínio - Grafite,10790,10790,1,1057635,webcontinentalmktplace,2026-07-10 16:43:40
2026-07-10 14:21:41,1645771253981-01,Potes | Utensílios para Cozinha | Casa e Cozinha,Potes Herméticos Electrolux de Plástico Cinza Retangular com 12 Unidades,9990,10900,1,1108208,electrolux,2026-07-10 16:43:40
2026-07-10 14:20:18,1645771253980-01,Chapinhas e Pranchas | Cuidados com o Cabelo | Cosméticos e Perfumaria,Chapinha | prancha taiff red ion 200°c preto/vermelho - bivolt,17900,17900,1,2299558,loyalt,2026-07-10 16:43:40
2026-07-10 14:18:48,1645771253979-01,Celulares e Smartphones,"Celular samsung galaxy a17 4g tela 6.7"" 128gb super amoled câmera tripla 50mp preto",96900,116900,1,2295619,loyalt,2026-07-10 16:43:40
2026-07-10 14:17:37,1645771253978-01,Tapetes | Decoração | Casa e Cozinha,Passadeira Quarto Felpudo Peludo Mesclado Cinza 60 X 180 Cm,7200,7200,1,1071668,webcontinentalmktplace,2026-07-10 16:43:41
2026-07-10 14:16:47,1645771253977-01,Máquinas de Massa Manuais | Panelas e Utensílios para Cozinhar | Casa e Cozinha,Grampeador Manual Profissional Alta Pressão com Gatilho Fixação Firme para Artesanato Yeet,2960,2960,1,3526766,webcontinentalmktplace,2026-07-10 16:43:42
2026-07-10 14:08:54,1645771253976-01,"Chaleiras Elétricas | Café, Chá e Expresso | Eletroportáteis","Chaleira Elétrica Philco 1,8L Painel Digital PCH18B 127V",17990,34990,1,1379260,Philco,2026-07-10 16:43:42
2026-07-10 14:05:54,1645771253975-01,Amamentação e Alimentação | Bebês e Infantil,Ninho Fases 1+ Lata 800g,4199,5599,7,1289991,farmaconde,2026-07-10 16:43:42
2026-07-10 14:03:19,1645771253974-01,Escadas | Ferramentas Manuais | Materiais de Construção,Escada Alumínio 7 Degraus Mor,29990,29990,1,69862,minipreco,2026-07-10 16:43:43
2026-07-10 14:00:26,1645771253973-01,Celulares e Smartphones,"Smartphone motorola edge 60 pro 5g cinza 512gb, 12gb ram + 12gb ram boost, tela 6.7"" 120hz, câmera sony lytia 700c 50mp e dimensity 8350 extreme",332000,409900,1,2987879,loyalt,2026-07-10 16:43:43
2026-07-10 13:59:51,1645771253972-01,Smartphone | Celulares e Smartphones,USADO iPhone 11 128 GB Preto Bom,139900,139900,1,2772779,armazemcircular,2026-07-10 16:43:43
2026-07-10 13:58:52,1645771253971-01,Colchas e Edredons | Cama e Banho | Casa e Cozinha,Cobre Leito Mistral Casal 7 Peças Azul Marinho,27724,27724,1,1472534,webcontinentalmktplace,2026-07-10 16:43:43
2026-07-10 13:58:20,1645771253970-01,"Vitaminas | Vitaminas, Minerais e Suplementos | Saúde e Bem Estar",Suplemento Vitamínico Adeforte Turbo com Biotina 2 Ampolas de 3ml Cada,4608,4654,1,1633902,farmaciaindiana,2026-07-10 16:43:44
2026-07-10 13:57:24,1645771253969-01,Estojos | Material Escolar | Papelaria,Estojo Escolar Feminino/ Masculino Box Juvenil Martelasse Organizador Grande Jumbo Box 2 Compartimentos Cor:preto 330,3585,3585,1,2542317,webcontinentalmktplace,2026-07-10 16:43:44
2026-07-10 13:53:04,1645771253968-01,Fornos de Micro-Ondas | Eletrodomésticos,Micro-ondas Philco 25L 1100W PM27 Limpa Fácil 127V,53990,67990,1,810079,Philco,2026-07-10 16:43:44
2026-07-10 13:51:40,1645771253967-01,Amamentação e Alimentação | Bebês e Infantil,Fórmula Infantil Aptamil 0-12 meses RR 800g,10539,10539,1,830977,farmaconde,2026-07-10 16:43:45
2026-07-10 13:50:30,1645771253966-01,Amamentação e Alimentação | Bebês e Infantil,Kit 2 Ninho Fases 1+ 800g cada,9598,10798,3,1110743,farmaciaindiana,2026-07-10 16:43:45
2026-07-10 13:49:58,1645771253964-02,Cama e Banho | Casa e Cozinha,Jogo de Lençol Luar Queen 3 Peças Malha 100% Algodão Estampado - Cinza Geométrico,9380,9380,1,1412117,shophub,2026-07-10 16:43:45
2026-07-10 13:49:58,1645771253964-02,Cama e Banho | Casa e Cozinha,Jogo de Lençol Luar Queen 3 Peças Malha 100% Algodão Estampado - Azul Marinho Geométrico,9380,9380,1,1412115,shophub,2026-07-10 16:43:45
2026-07-10 13:49:58,1645771253964-01,Roupa de Cama | Cama e Banho | Casa e Cozinha,Kit Jogo de Lençol Graz Queen 3 Peças 100% Algodão Malha Rosa,9998,9998,1,2748401,webcontinentalmktplace,2026-07-10 16:43:45
2026-07-10 13:48:10,1645771253963-01,Depuradores e Coifas | Eletrodomésticos,Depurador Slim Suggar Dps161pr 60cm 3 Velocidades Prata 127v,39889,55000,1,844625,webcontinentalmktplace,2026-07-10 16:43:46
2026-07-10 13:47:02,1645771253962-01,Fogões | Fogões e Cooktops | Eletrodomésticos,Fogão 4 Bocas Atlas Mônaco Top Glass Mesa de Vidro Preto Bivolt,86990,114990,1,3078478,multilojaonline,2026-07-10 16:43:46
2026-07-10 13:47:01,1645771253961-01,Motorola | Smartphone | Celulares e Smartphones,Smartphone Motorola Moto G86 5G 256GB 24GB de RAM Grafite,184900,199900,1,2593234,webfones,2026-07-10 16:43:47
2026-07-10 13:46:47,1645771253959-02,Pipoqueiras | Eletroportáteis,Pipoqueira Elétrica Sem Óleo Philco  1200W PPIE01A 127V,15990,19990,1,1132264,Philco,2026-07-10 16:43:47
2026-07-10 13:46:47,1645771253959-01,"Liquidificadores | Liquidificadores, Batedeiras e Processadores | Eletroportáteis",Liquidificador mondial turbo full black l900fb preto 900w com 5 velocidades,10656,12733,1,2045261,loyalt,2026-07-10 16:43:47
2026-07-10 13:45:08,1645771253958-01,Aquecedores | Eletroportáteis,Aquecedor Britânia AB1500P 2 em 1 127V,13990,17990,1,136434,Philco,2026-07-10 16:43:47
2026-07-10 13:42:00,1645771253957-01,Panificadora Elétrica | Eletroportáteis Especiais | Eletroportáteis,Panificadora Britânia Digital 12 Programas 3L BPNE01 220V,54990,83990,1,765836,Philco,2026-07-10 16:43:48
2026-07-10 13:41:18,1645771253956-01,Celulares e Smartphones,"Celular samsung galaxy a17 4g tela 6.7"" 256gb super amoled câmera tripla 50mp cinza",120667,143971,1,2295617,loyalt,2026-07-10 16:43:48
2026-07-10 13:40:06,1645771253955-01,Fornos Elétricos | Eletrodomésticos,Microondas Philco PMO30P Limpa Fácil 28L Preto 110 V,69990,79990,1,1965847,multilojaonline,2026-07-10 16:43:48
2026-07-10 13:39:44,1645771253954-01,Celulares e Smartphones,Carregador por Indução MDM Base 15W sem Cabo para Celular Homologado Anatel,5230,6378,1,3202531,webcontinentalmktplace,2026-07-10 16:43:48
2026-07-10 13:37:15,1645771253952-01,Cobertores e Mantas | Cama e Banho | Casa e Cozinha,Edredom Júlia Casal Super King 03 Peças Tecido Dupla Face Microfibra 200 Fios Floral - Lilac,28227,28227,1,2431225,webcontinentalmktplace,2026-07-10 16:43:48
2026-07-10 13:36:54,1645771253951-01,Secador de Cabelo | Cuidados com o Cabelo | Cosméticos e Perfumaria,Secador de Cabelos Britânia Bivolt 2100W BSC2200 Bivolt,9990,19990,1,1132265,Philco,2026-07-10 16:43:48
2026-07-10 13:36:48,1645771253948-03,Ferramentas Elétricas | Materiais de Construção,PARAFUSADEIRA FURADEIRA IMPACTO RECARREGAVEL 21V STARTOOLS,19999,19999,1,2909063,minipreco,2026-07-10 16:43:49
2026-07-10 13:36:48,1645771253948-02,"Liquidificadores | Liquidificadores, Batedeiras e Processadores | Eletroportáteis",Liquidificador Britânia Diamante Preto 900W 220V,17990,18990,1,1911,Philco,2026-07-10 16:43:49
2026-07-10 13:36:48,1645771253948-02,Secador de Cabelo | Cuidados com o Cabelo | Cosméticos e Perfumaria,Secador de Cabelos Britânia Bivolt 2100W BSC2200 Bivolt,9990,19990,1,1132265,Philco,2026-07-10 16:43:49
2026-07-10 13:36:48,1645771253948-02,Pipoqueiras | Eletroportáteis,Pipoqueira Britânia Pop Time 220V,12990,27990,1,806,Philco,2026-07-10 16:43:49
2026-07-10 13:36:48,1645771253948-01,"Cafeteiras e Máquinas de Expresso | Café, Chá e Expresso | Eletroportáteis",Cafeteira Elétrica Electrolux 30 Xícaras Efficient Função Manter Aquecido Cor Inox Preta (ECM20) 220V,15990,20990,1,1107437,electrolux,2026-07-10 16:43:49
2026-07-10 13:19:40,1645761253947-01,Cabeceiras | Quarto | Móveis,Criado-Mudo 2 Gavetas Branco Madesa,29999,29999,1,1794410,webcontinentalmktplace,2026-07-10 16:43:49
2026-07-10 13:19:10,1645761253946-01,Motorola | Smartphone | Celulares e Smartphones,Smartphone Motorola Moto G15 256GB 12GB de RAM Verde,159900,159900,1,1330562,webfones,2026-07-10 16:43:50
2026-07-10 13:18:51,1645761253945-01,Materiais de Pintura | Materiais de Construção,"Massa Corrida 25kg 14,8L Balde IP22 50614361 Branco para Ambientes Internos Suvinil",11508,11508,1,3132880,webcontinentalmktplace,2026-07-10 16:43:50
2026-07-10 13:17:29,1645761253944-01,Celulares e Smartphones,"Smartphone motorola moto g06 4g tela 6,9” 128gb câmera 50mp azul marinho",68000,88778,1,2047097,loyalt,2026-07-10 16:43:50
2026-07-10 13:16:46,1645761253943-01,Cuecas | Vestuário,Cueca Boxer Sem Costura Zee Rucci Preto M,3499,5499,2,2120355,rovitex,2026-07-10 16:43:50
2026-07-10 13:13:03,1645761253942-01,"Processadores de Alimentos | Liquidificadores, Batedeiras e Processadores | Eletroportáteis",Processador Philco 420W Jarra Para 500ml PMN04A 110V,11990,29690,1,2045902,webcontinentalmktplace,2026-07-10 16:43:51
2026-07-10 13:05:50,1645761253941-01,Iphone | Smartphone | Celulares e Smartphones,"iPhone 17 Apple (256GB) Azul-Névoa, Tela de 6,3"", 5G e Câmera de 48MP",655500,690000,1,1978339,shophub,2026-07-10 16:43:51
2026-07-10 13:02:17,1645761253940-01,Camas | Quarto | Móveis,FM POWER RACERS 99001/99018/24 - 10 CHEVY CAMARO SS VINHO Maisto,6999,6999,1,54428,bumerangbrinquedos,2026-07-10 16:43:51
2026-07-10 12:59:53,1645761253939-01,Panelas | Panelas e Utensílios para Cozinhar | Casa e Cozinha,"PANELA PRESSAO CERAMICA PRESSURE 4,2L BRINOX",24999,24999,1,2261131,minipreco,2026-07-10 16:43:52
2026-07-10 12:59:05,1645761253938-01,Cozinha Industrial | Eletrodomésticos,Fogão Industrial Venâncio A Gás Glp 6 Bocas - 3 Simples 3 Duplas 30x30 Parede E6 14804,141233,141233,1,2633168,webcontinentalmktplace,2026-07-10 16:43:52
2026-07-10 12:57:14,1645761253937-01,Potes | Utensílios para Cozinha | Casa e Cozinha,Potes Herméticos Electrolux de Plástico Branco Retangular com 20 Unidades,12900,31800,1,1108206,electrolux,2026-07-10 16:43:52
2026-07-10 12:49:05,1645761253936-01,Toalhas de Banho e Rosto | Cama e Banho | Casa e Cozinha,Toalha De Banho Extra Maciez Classic Appel Rosa UN,4999,5999,1,2704010,rovitex,2026-07-10 16:43:52
2026-07-10 12:49:05,1645761253936-01,Toalhas de Banho e Rosto | Cama e Banho | Casa e Cozinha,Toalha De Banho Sense Altenburg Azul UN,6649,8999,1,1755995,rovitex,2026-07-10 16:43:52
2026-07-10 12:49:05,1645761253936-01,Roupa de Cama | Cama e Banho | Casa e Cozinha,Jogo De Cama Chevron Queen Lar E Lazer Rosa UN,5473,10999,1,1630353,rovitex,2026-07-10 16:43:52
2026-07-10 12:49:05,1645761253936-01,Roupa de Cama | Cama e Banho | Casa e Cozinha,Jogo De Cama 3 Peças Color Art Solteiro Corttex Azul UN,4999,6999,1,2656514,rovitex,2026-07-10 16:43:52
2026-07-10 12:39:14,1645761253935-01,"Liquidificadores | Liquidificadores, Batedeiras e Processadores | Eletroportáteis","Liquidificador mondial power l-550 1,9l 550w 2 velocidades pulsar preto",7990,9860,1,2045329,loyalt,2026-07-10 16:43:53
2026-07-10 12:36:20,1645761253934-01,Máquinas de Lavar Roupas | Máquinas de Lavar e Secadoras | Eletrodomésticos,Máquina de Lavar Electrolux 15kg Branca Essential Care com Cesto Inox e Jet&Clean (LED15) 220V,199900,316900,1,1107327,electrolux,2026-07-10 16:43:53
2026-07-10 12:31:47,1645761253933-01,Celulares e Smartphones,"Smartphone motorola moto g06 4g tela 6,9” 128gb câmera 50mp azul marinho",68000,88778,1,2047097,loyalt,2026-07-10 16:43:53
2026-07-10 12:25:31,1645751253932-01,Fogões | Fogões e Cooktops | Eletrodomésticos,Fogão 4 Bocas Atlas Coliseum Plus Mesa De Inox A Gás Manual Preto,65005,80900,1,2782165,webcontinentalmktplace,2026-07-10 16:43:53
2026-07-10 12:25:17,1645751253931-01,"Cafeteiras e Máquinas de Expresso | Café, Chá e Expresso | Eletroportáteis",Cafeteira Elétrica Electrolux 30 Xícaras Experience Programável com Timer Cor Inox Preta (ECM25) 220V,25990,31990,1,1107449,electrolux,2026-07-10 16:43:54
2026-07-10 12:23:21,1645751253929-02,Smartphone | Celulares e Smartphones,USADO iPhone 11 128 GB Preto Bom,139900,139900,1,2772779,armazemcircular,2026-07-10 16:43:54
2026-07-10 12:23:21,1645751253929-01,Chapinhas e Pranchas | Cuidados com o Cabelo | Cosméticos e Perfumaria,Chapinha | prancha taiff style 210°c preto - bivolt,18900,18900,1,2299554,loyalt,2026-07-10 16:43:55
2026-07-10 12:18:23,1645751253928-01,Chaleiras de Fogão | Panelas e Utensílios para Cozinhar | Casa e Cozinha,"Chaleira A5 Silver 2,5L Fundo Duplo  Inox S/V",6990,9990,1,823666,multilojaonline,2026-07-10 16:43:55
2026-07-10 12:12:17,1645751253926-02,Ração e Petiscos | Pet Shop,"Ração Foster One Cão Adulto Raças Médias Grandes Carne Arroz 10,1kg",7290,7290,2,1180566,farmaciaindiana,2026-07-10 16:43:56
2026-07-10 12:12:17,1645751253926-01,Chapinhas e Pranchas | Cuidados com o Cabelo | Cosméticos e Perfumaria,Prancha Chapinha Profissional Titânio Nº64,7790,7790,1,1878890,webcontinentalmktplace,2026-07-10 16:43:56
2026-07-10 12:10:32,1645751253925-01,Escova Secadora | Cuidados com o Cabelo | Cosméticos e Perfumaria,Escova Secadora Britania Soft BES13VD Verde Bivolt 1300W Bivolt,11990,18990,1,1526,Philco,2026-07-10 16:43:56
2026-07-10 12:05:56,1645751253923-01,Tablets | Eletrônicos,Tablet M8 Wi-fi 4GB RAM + 64GB + Tela 8 Pol + Android 13 + Octa-Core Multi - NB426OUT [Reembalado] NB426OUT,99900,99900,1,758441,compreja,2026-07-10 16:43:56
2026-07-10 12:03:02,1645751253921-01,"Filtros, Bebedouros e Refrigeradores de Água | Eletroportáteis",Purificador Electrolux Água Gelada 3 Níveis Cinza Efficient Eletrônico (PE15X) - Bivolt Bivolt,58990,69990,1,1107901,electrolux,2026-07-10 16:43:57
2026-07-10 12:00:33,1645751253919-01,Máquinas de Massa Manuais | Panelas e Utensílios para Cozinhar | Casa e Cozinha,Kit Formão 4 Peças para Marcenaria e Entalhe em Madeira Profissional Utibom,5750,5750,1,3178503,webcontinentalmktplace,2026-07-10 16:43:57
2026-07-10 12:00:33,1645751253919-02,Fornos Elétricos | Eletrodomésticos,Plaina Industrial 82mm 500w M1902b 220v Makita,67390,67390,1,2557025,guimepa,2026-07-10 16:43:57
2026-07-10 11:56:44,1645751253918-01,Balcão | Cozinha | Móveis,Balcão Gabinete Pia Cozinha 3 Portas 1 Gaveta,53992,62999,1,885794,webcontinentalmktplace,2026-07-10 16:43:58
2026-07-10 11:56:44,1645751253918-01,Armário | Cozinha | Móveis,Kit Cozinha 6 Portas Ambiente Apolo Freijó Gris - Kits Paraná,32392,32392,1,2538631,webcontinentalmktplace,2026-07-10 16:43:58
2026-07-10 11:55:39,1645751253917-01,Fixador e Limpeza Dentadura | Cuidado Adulto | Saúde e Bem Estar,Fixador de Dentadura Corega Creme Tripla Ação 2 Unidades,4999,4999,1,1748691,farmaconde,2026-07-10 16:43:58
2026-07-10 11:53:31,1645751253916-01,Shampoos e Condicionadores | Higiene | Saúde e Bem Estar,Kit Shampoo 375ml + Condicionador Elseve Óleo Extraordinário 170ml,3319,3899,3,381881,farmaciaindiana,2026-07-10 16:43:58
2026-07-10 11:52:22,1645751253914-01,Painel | Sala de Estar | Móveis,Painel para TV até 60 Polegadas 1 Porta Bento DJ Móveis Freijó/Off White S/V,46590,63990,1,95163,multilojaonline,2026-07-10 16:43:59
2026-07-10 11:50:29,1645751253913-01,Panelas de Pressão | Panelas e Utensílios para Cozinhar | Casa e Cozinha,Panela De Pressão 7 Litros Alumínio - Grafite,10790,10790,1,1057635,webcontinentalmktplace,2026-07-10 16:43:59
2026-07-10 11:44:31,1645751253912-01,Iphone | Smartphone | Celulares e Smartphones,"iPhone 17 Apple (256GB) Preto, Tela de 6,3"", 5G e Câmera de 48MP",655500,690000,1,1978376,shophub,2026-07-10 16:44:00
2026-07-10 11:42:57,1645751253911-01,Celulares e Smartphones,Smartphone Xiaomi Redmi Note 14 128GB 6GB Azul,118915,139900,1,1962335,webcontinentalmktplace,2026-07-10 16:44:00
2026-07-10 11:42:38,1645751253910-01,Celulares e Smartphones,"Smartphone motorola moto g06 4g tela 6,9” 256gb câmera 50mp bege",78300,100936,1,2988250,loyalt,2026-07-10 16:44:00
2026-07-10 11:38:48,1645751253908-01,Motorola | Smartphone | Celulares e Smartphones,Smartphone Motorola Moto G15 256GB 12GB de RAM Grafite,99900,99900,1,1330562,webfones,2026-07-10 16:44:00
2026-07-10 11:37:48,1645751253907-01,Fritadeiras Elétricas | Eletroportáteis,"Fritadeira Air Fryer Philco PFR15PI Redstone 4,4L 1500W 220V",28990,44990,1,390417,Philco,2026-07-10 16:44:01
2026-07-10 11:36:21,1645751253905-01,Potes | Utensílios para Cozinha | Casa e Cozinha,Conjunto de potes 10 peças electrolux em polipropileno com fechamento hermético,7790,11988,1,2136289,loyalt,2026-07-10 16:44:01
2026-07-10 11:36:21,1645751253905-02,"Chaleiras Elétricas | Café, Chá e Expresso | Eletroportáteis","Chaleira Elétrica 1,9 Litros Cadence 220V",14990,25500,1,2280094,funstock,2026-07-10 16:44:02
2026-07-10 11:28:07,1645741253903-01,Fogões | Fogões e Cooktops | Eletrodomésticos,Fogão Itatiaia 5 Bocas Automático Star New Branco Bivolt,95900,95900,1,2602318,webcontinentalmktplace,2026-07-10 16:44:02
2026-07-10 11:27:54,1645741253902-01,Perfumes | Cosméticos e Perfumaria,Sabah al ward al wataniah eau de parfum feminino,17990,27707,1,2315564,loyalt,2026-07-10 16:44:02
2026-07-10 11:26:46,1645741253900-01,Casinhas e Tocas | Pet Shop,Casa Cachorro Pet Madeira 57x55 Casinha Cachorro Porte Médio,17990,17990,1,1481667,webcontinentalmktplace,2026-07-10 16:44:03
2026-07-10 11:26:46,1645741253900-02,Ração e Petiscos | Pet Shop,"Ração para Cães Filhotes Pedigree Carne, Frango e Cereais 2,7kg",4741,4990,2,2120969,farmaciaindiana,2026-07-10 16:44:03
2026-07-10 11:25:31,1645741253898-01,Travesseiros | Cama e Banho | Casa e Cozinha,Travesseiro ECO Impermeável Branco 45X65CM - HEDRONS,1999,1999,2,781149,minipreco,2026-07-10 16:44:03
2026-07-10 11:24:30,1645741253897-01,Video Games | Eletrônicos,Game Stick Retrô 2.4g Wireless Mini Game 64gb 20.000 Jogos,14532,14532,1,2656656,webcontinentalmktplace,2026-07-10 16:44:04
2026-07-10 11:20:00,1645741253895-01,Varal | Utilidades Domésticas | Casa e Cozinha,VARAL CHAO ABAS BUENOS AIRES ACO PRETO 1.33M X 53CM X 95CM 9981 MAXEB,5990,5990,1,2117336,minipreco,2026-07-10 16:44:04
2026-07-10 11:16:46,1645741253893-01,Máquinas de Lavar Roupas | Máquinas de Lavar e Secadoras | Eletrodomésticos,Máquina de Lavar Electrolux 17kg Branca Essential Care com Cesto Inox e Jet&Clean (LED17) 127V,209900,324900,1,1107283,electrolux,2026-07-10 16:44:04
2026-07-10 11:16:18,1645741253890-01,Enxoval | Bebês e Infantil,Kit de Saquinhos Organizadores Maternidade Multiuso com Zíper Plástico Azul com 8 Unidades OEM,3135,3135,2,3462573,webcontinentalmktplace,2026-07-10 16:44:04
2026-07-10 11:16:18,1645741253890-03,Banho do Bebê | Bebês e Infantil,Sabonete Líquido Infantil J&J Baby 400ml Glicerina Camomila SAB LIQ INF J&J BABY 400ML GLICERINA CAM,3939,3939,2,798647,farmaconde,2026-07-10 16:44:05
2026-07-10 11:16:18,1645741253890-02,Shampoos e Condicionadores | Higiene | Saúde e Bem Estar,Shampoo Tradicional Johnson's Baby - 400ml,3310,3310,2,141154,pensefarma,2026-07-10 16:44:05
2026-07-10 11:16:18,1645741253890-02,Produtos de Pele para Bebês | Produtos para Cuidados de Bebês e Crianças | Saúde e Bem Estar,Kit Bepantriz Pomada para Assaduras Dexpantenol 30g (3 Unidades),3877,3877,1,2327522,pensefarma,2026-07-10 16:44:05
