creationDate,orderId,categoryName,name,price,listPrice,quantity,productId,seller,data_extracao
2026-04-19 20:30:07,1626161208768-01,Pipoqueiras | Eletroportáteis,Pipoqueira Elétrica Ar Quente Máquina Fazer Pipoca Sem Óleo 110V,8290,8290,1,2359999,webcontinentalmktplace,2026-04-22 01:36:53
2026-04-19 20:29:25,1626151208767-01,Óculos VR | Artigos Gamer | Computadores e Informática,Armação Óculos De Grau Masculino Empório Armani Ea4115 5759,49800,49800,1,2242375,webcontinentalmktplace,2026-04-22 01:36:54
2026-04-19 20:29:23,1626151208766-01,Perfumes | Cosméticos e Perfumaria,Giorgio Armani Stronger With You Eau De Toilette - Perfume Masculino 50 Ml,47900,71900,1,1268245,webcontinentalmktplace,2026-04-22 01:36:54
2026-04-19 20:29:12,1626151208765-01,"Acessórios de Áudio e Vídeo para Casa | Cinema, TV e Áudio",Fone de Ouvido Bluetooth Xiaomi Redmi Airdots 2 Estéreo sem Fio com Conexão 5.0 e Autonomia Até 12,2990,2990,1,2973152,webcontinentalmktplace,2026-04-22 01:36:54
2026-04-19 20:26:54,1626151208763-01,Smartphone | Celulares e Smartphones,Smartwatch Iwo8 Lite S Versão W34 Troca Pulseira Tela 44mm,10990,10990,1,1333042,webcontinentalmktplace,2026-04-22 01:36:54
2026-04-19 20:26:03,1626151208762-01,"Suplementos | Vitaminas, Minerais e Suplementos | Saúde e Bem Estar",Kit 3 Magnésio L-Treonato 300mg 60 doses,8721,21786,1,1939004,miligrama,2026-04-22 01:36:54
2026-04-19 20:26:03,1626151208762-01,Medicamentos | Saúde e Bem Estar,Lactobacillus Gasseri 120 Cápsulas,9260,12700,1,65931,miligrama,2026-04-22 01:36:54
2026-04-19 20:19:50,1626151208759-01,"Chaleiras Elétricas | Café, Chá e Expresso | Eletroportáteis","Chaleira elétrica electrolux efficiente eek10 1,8l - aço escovado",14456,14456,1,2045216,loyalt,2026-04-22 01:36:55
2026-04-19 20:19:50,1626151208759-02,Panelas | Panelas e Utensílios para Cozinhar | Casa e Cozinha,Jogo de Panelas Tramontina Linz 7 Peças Alumínio Starflon Max Mocaccino,37695,37695,1,2040157,marinbrasil,2026-04-22 01:36:55
2026-04-19 20:13:07,1626151208756-01,Motorola | Smartphone | Celulares e Smartphones,Smartphone Motorola Moto G15 256GB 12GB de RAM Grafite,88900,109900,1,1330562,webfones,2026-04-22 01:36:55
2026-04-19 20:08:03,1626151208755-01,Camas | Quarto | Móveis,Cama Box King 193cm Molas Ensacadas Soft Pillow Love Story HF25 Gazin Base 2CEN Bege/Marrom S/V,219990,275990,1,2520079,multilojaonline,2026-04-22 01:36:55
2026-04-19 20:03:44,1626151208754-01,Panelas | Panelas e Utensílios para Cozinhar | Casa e Cozinha,"PANELA PRESSAO CERAMICA PRESSURE 4,2L BRINOX",24999,24999,1,2261131,minipreco,2026-04-22 01:36:56
2026-04-19 20:01:49,1626151208753-01,"Cafeteiras e Máquinas de Expresso | Café, Chá e Expresso | Eletroportáteis",Cafeteira expresso arno dolce gusto genio s dgs5 basic automática multibebidas – grafite,49816,62895,1,2045102,loyalt,2026-04-22 01:36:56
2026-04-19 20:01:49,1626151208753-01,Fornos de Micro-Ondas | Eletrodomésticos,Forno de micro-ondas lg neochef ms3033d com função limpa fácil e receitas pré-programadas - 30 litros,81848,88345,1,2046995,loyalt,2026-04-22 01:36:56
2026-04-19 19:56:30,1626151208752-01,Panelas e Utensílios para Cozinhar | Casa e Cozinha,Jogo de panelas tramontina sicilia 5 peças revestimento antiaderente starflon excellent avelã,54990,73490,1,2048040,loyalt,2026-04-22 01:36:56
2026-04-19 19:55:30,1626151208751-01,Malas | Bolsas e Mochilas,MALA VIAGEM RODAS 360 AZUL N18 P YS21057A-PP YINS,24995,24995,1,1280220,minipreco,2026-04-22 01:36:56
2026-04-19 19:53:10,1626151208750-01,Bicicletas | Bicicleta e Ciclismo | Esporte e Lazer,Bicicleta Aro 29 Dropp Sport Aero Aço Carbono 21 Vel Marchas Freio A Disco - Branco e Azul,61000,69900,1,2015437,webcontinentalmktplace,2026-04-22 01:36:57
2026-04-19 19:51:54,1626151208749-01,Motorola | Smartphone | Celulares e Smartphones,Smartphone Motorola Moto G15 256GB 12GB de RAM Grafite,88900,109900,1,1330562,webfones,2026-04-22 01:36:57
2026-04-19 19:47:41,1626151208748-01,"Cafeteiras e Máquinas de Expresso | Café, Chá e Expresso | Eletroportáteis",Cafeteira Elétrica Electrolux 30 Xícaras Experience Programável com Timer Cor Inox Preta (ECM25) 127V,23990,31990,1,1107449,electrolux,2026-04-22 01:36:57
2026-04-19 19:46:23,1626151208745-01,"Multiprocessador | Liquidificadores, Batedeiras e Processadores | Eletroportáteis",Multiprocessador Philco 1000W 5 em 1 PMP10A 127V,26990,36990,1,1309501,Philco,2026-04-22 01:36:58
2026-04-19 19:45:49,1626151208743-01,"Bebedouros | Filtros, Bebedouros e Refrigeradores de Água | Eletroportáteis",Bebedouro Britânia BBE11P Aquaplus para 10L ou 20L Bivolt Bivolt,29990,47990,1,113043,Philco,2026-04-22 01:36:58
2026-04-19 19:43:46,1626151208740-01,Ração e Petiscos | Pet Shop,"Ração Whiskas Adulto Sabor Carne 2,7kg",4741,4990,2,2120949,farmaciaindiana,2026-04-22 01:36:58
2026-04-19 19:43:46,1626151208740-02,"Canecas | Louça, Copos e Talheres | Casa e Cozinha",Caneca Chopp de Vidro 500ML - MAHALO,995,2490,2,1191055,minipreco,2026-04-22 01:36:58
2026-04-19 19:37:55,1626151208739-01,"Bebedouros | Filtros, Bebedouros e Refrigeradores de Água | Eletroportáteis",Bebedouro Britânia BBE11P Aquaplus para 10L ou 20L Bivolt Bivolt,29990,47990,1,113043,Philco,2026-04-22 01:36:59
2026-04-19 19:31:54,1626151208738-01,Ferramentas e Acessórios | Camping | Esporte e Lazer,Fogareiro Tripé Para Disco Chama Simples Preto,24000,24000,1,1964016,webcontinentalmktplace,2026-04-22 01:36:59
2026-04-19 19:28:44,1626141208737-01,Armário | Cozinha | Móveis | Cozinhas Compactas,Armário de Cozinha Compacta Madesa Emilly Pop com Balcão Cor:Rustic/Preto,72999,113999,1,3621,madesacms,2026-04-22 01:36:59
2026-04-19 19:28:19,1626141208736-01,Pele | Cosméticos e Perfumaria,Principia kit - protetor solar facial + sérum + gel de limpeza facial,13452,16815,1,2069711,loyalt,2026-04-22 01:36:59
2026-04-19 19:28:11,1626141208735-01,Esporte e Lazer | Meninos | Brinquedos,Bola de Futebol N°5 Real Madrid Futebol e Magia 1615,11999,11999,1,1143749,bumerangbrinquedos,2026-04-22 01:37:00
2026-04-19 19:17:00,1626141208734-01,Amamentação e Alimentação | Bebês e Infantil,Nestogeno 2 Lata 800g,5490,5490,5,1208965,farmaconde,2026-04-22 01:37:00
2026-04-19 19:08:03,1626141208732-01,Churrasqueiras e Acessórios | Artigos para Churrasco | Casa e Cozinha,Churrasqueira Montana,14990,14990,1,28741,webcontinentalmktplace,2026-04-22 01:37:00
2026-04-19 19:08:03,1626141208732-01,Cozinha Industrial | Eletrodomésticos,Disco Picanheira Côncava Alça de Madeira Chapa,19912,19912,1,1173261,webcontinentalmktplace,2026-04-22 01:37:00
2026-04-19 19:06:47,1626141208727-01,Escova Rotativa Modeladora | Cuidados com o Cabelo | Cosméticos e Perfumaria,Escova Secadora Cadence Linda e Leve 4 em 1 1200W Preto Bivolt,9990,12990,1,2345929,multilojaonline,2026-04-22 01:37:00
2026-04-19 19:06:47,1626141208727-04,Fornos de Micro-Ondas | Eletrodomésticos,Micro-ondas midea mhp20b mastercook 20l 1050w painel touch branco,47736,57108,1,2047025,loyalt,2026-04-22 01:37:01
2026-04-19 19:06:47,1626141208727-03,Aquecedores | Eletroportáteis,Aquecedor Britânia AB 1200W 127V,19990,36290,1,1463,webcontinentalmktplace,2026-04-22 01:37:02
2026-04-19 19:06:47,1626141208727-02,Secador de Cabelo | Cuidados com o Cabelo | Cosméticos e Perfumaria,Secador de Cabelo Philco Titanium Travel 750W Bivolt,6990,16990,1,1318,Philco,2026-04-22 01:37:02
2026-04-19 18:52:21,1626141208725-01,Ferramentas e Equipamentos | Produtos automotivos,Lavadora De Alta Pressão 48v Sem Fio Portátil Multifuncional P- Limpeza De Carros E Mais,19990,19990,1,2091048,webcontinentalmktplace,2026-04-22 01:37:02
2026-04-19 18:51:45,1626141208724-01,"Pratos | Louça, Copos e Talheres | Casa e Cozinha",PRATO FUNDO ARBO PORCELANA 21CM 96580072 TRAMONTINA,890,1799,6,875589,minipreco,2026-04-22 01:37:02
2026-04-19 18:51:45,1626141208724-01,"Jogos de Copos e Taças Mistos | Louça, Copos e Talheres | Casa e Cozinha",Copo de Vidro 220ML - MAHALO,295,899,6,1174299,minipreco,2026-04-22 01:37:02
2026-04-19 18:50:46,1626141208723-01,"TVs | Cinema, TV e Áudio","Smart TV 50"" Philco QLED UHD Roku P50CRA Bivolt",189990,239990,1,2673338,Philco,2026-04-22 01:37:03
2026-04-19 18:50:09,1626141208722-01,"Acessórios de Áudio e Vídeo para Casa | Cinema, TV e Áudio",Amazon Echo Dot 5th Gen Com Assistente Virtual Alexa,66276,78900,1,1898738,webcontinentalmktplace,2026-04-22 01:37:03
2026-04-19 18:49:41,1626141208721-01,Aspiradores de Pó e Água | Eletroportáteis,Aspirador de Pó Vertical com Fio Electrolux 1450W 2 em 1 Filtro HEPA Branco (STK14B) 220V,18990,30990,1,1108180,electrolux,2026-04-22 01:37:03
2026-04-19 18:37:01,1626141208720-01,Máquinas de Lavar Roupas | Máquinas de Lavar e Secadoras | Eletrodomésticos,"Tanquinho de roupas semiautomático 20,1kg colormaq lcs20 com 6 programas de lavagem e reúso de Água - prata",68016,75231,1,2044982,loyalt,2026-04-22 01:37:03
2026-04-19 18:33:05,1626141208717-01,Lavanderia | Móveis,Armário Multiuso 2 Portas Pequeno Castanho Off White - Poquema,17200,17200,1,2205146,webcontinentalmktplace,2026-04-22 01:37:04
2026-04-19 18:28:16,1626131208715-01,"TVs | Cinema, TV e Áudio","Smart tv 65"" 4k samsung 65u8600f crystal hdr tizen alexa e xbox gaming",363896,440895,1,2046112,loyalt,2026-04-22 01:37:04
2026-04-19 18:27:20,1626131208714-01,Cômoda | Quarto | Móveis,Cômoda 5 Gavetas 1 Porta Zurique Evidência Móveis Cinamomo S/V,30590,42990,1,259251,multilojaonline,2026-04-22 01:37:04
2026-04-19 18:26:39,1626131208712-02,Ar-condicionado | Eletrodomésticos,Ar Condicionado Aiwa Split High Wall High Inverter 12.000 Btus Frio AWS-AC-12F-EU 220V,195993,279990,1,2659833,webcontinentalmktplace,2026-04-22 01:37:05
2026-04-19 18:26:39,1626131208712-02,"Projetores | Cinema, TV e Áudio",Projetor Led Portátil Hdmi Cinema Em Casa Em Até 60,26500,26500,1,1969862,webcontinentalmktplace,2026-04-22 01:37:05
2026-04-19 18:26:39,1626131208712-01,Fogões elétricos | Fogões e Cooktops | Eletrodomésticos,Fogão 5 Bocas Mueller Fratello Vetro MFV5BB Titânio Bivolt,109990,134990,1,136322,multilojaonline,2026-04-22 01:37:05
2026-04-19 18:23:17,1626131208710-01,Motorola | Smartphone | Celulares e Smartphones,Smartphone Motorola Moto G35 5G 256GB 12GB de RAM Coral,99900,119900,1,1455312,webfones,2026-04-22 01:37:05
2026-04-19 18:21:38,1626131208709-01,"Mixers | Liquidificadores, Batedeiras e Processadores | Eletroportáteis",Mixer De Alimentos Cinza Lunar Inox 600W 3 Em 1 Copo 700ml Elgin 220V,14118,14118,1,1860863,webcontinentalmktplace,2026-04-22 01:37:05
2026-04-19 18:15:54,1626131208706-01,Fritadeiras Elétricas | Eletroportáteis,Air Fryer Oven Electrolux por Rita Lobo 12L Digital Vermelha Escura Experience 1700W (EAF86) 220V,54990,87990,1,1804762,electrolux,2026-04-22 01:37:06
2026-04-19 18:09:11,1626131208705-01,Panelas e Utensílios para Cozinhar | Casa e Cozinha,POTE TRAVA 450ML 3305 JAGUAR,599,599,8,813399,minipreco,2026-04-22 01:37:06
2026-04-19 18:06:56,1626131208704-01,Iphone | Smartphone | Celulares e Smartphones,Apple iPhone 11 Pro 256GB Cinza - Muito Bom Usado,198891,198891,1,3011492,eurenovo,2026-04-22 01:37:06
2026-04-19 18:03:07,1626131208699-02,Rosto | Maquiagem | Cosméticos e Perfumaria,Solução Micelar Demaquilante Sensibio H2O 500ml,11499,13399,1,742797,farmaconde,2026-04-22 01:37:06
2026-04-19 18:03:07,1626131208699-01,Rosto | Pele | Cosméticos e Perfumaria,"Gel de Limpeza Facial Suave Principia Skincare GL-02 11,5% Tensoativos + 10% Glicerina + 1% PCA Sódio 200ml",4496,4496,1,2454445,pensefarma,2026-04-22 01:37:07
2026-04-19 18:03:07,1626131208699-01,Rosto | Pele | Cosméticos e Perfumaria,Principia Gel de Limpeza Skincare 13% Tensoativos + 2% Ácido salicílico + 5% Glicerina com 200ML,4541,4541,1,2450289,pensefarma,2026-04-22 01:37:07
2026-04-19 17:56:36,1626131208697-01,"Caixas de Som Portáteis | Áudio | Cinema, TV e Áudio",Caixa De Som Led Bluetooth Portátil,8849,8849,2,2654337,webcontinentalmktplace,2026-04-22 01:37:07
2026-04-19 17:56:08,1626131208696-01,Câmeras de Segurança | Sistemas de Segurança para Casa | Materiais de Construção,Camera Smart Ip Wifi Icsee Speed Dome Full Hd,13990,13990,1,2092707,webcontinentalmktplace,2026-04-22 01:37:07
2026-04-19 17:53:37,1626131208694-01,Pesca | Esporte e Lazer,Kit 2 Molinete Marine Sports Prisma Fd 5000 Carretel Extra,34845,34845,1,2432019,webcontinentalmktplace,2026-04-22 01:37:07
2026-04-19 17:52:14,1626131208692-01,Celulares e Smartphones,"Smartphone samsung galaxy a36 5g violeta 128gb, 6gb ram, câmera tripla até 50mp, tela super amoled 6.7"", ip67, nfc, recursos ai e snapdragon 6 gen 3",165662,227880,1,2046047,loyalt,2026-04-22 01:37:08
2026-04-19 17:51:41,1626131208690-01,Xiaomi | Smartphone | Celulares e Smartphones,Xiaomi Redmi 13C 128GB Preto Muito Bom,74151,74151,1,2997191,eurenovo,2026-04-22 01:37:08
2026-04-19 17:51:41,1626131208690-02,Panelas Elétricas | Eletroportáteis Especiais | Eletroportáteis,Panela de Pressão Elétrica Digital - 5L 14 Funções 9 Dispositivos de Segurança 900W 110V,47900,82098,1,2045685,webcontinentalmktplace,2026-04-22 01:37:08
2026-04-19 17:51:32,1626131208687-01,Cuidados com o Cabelo | Cosméticos e Perfumaria,Kit Eico Babosa Aloevera Shampoo com 450ml + Condicionador com 400ml,3219,3219,1,1220878,pensefarma,2026-04-22 01:37:08
2026-04-19 17:51:32,1626131208687-01,Cuidados com o Cabelo | Cosméticos e Perfumaria,Kit Eico Shampoo+Condicionador Salao Em Casa 450ml,3164,3164,1,1168888,pensefarma,2026-04-22 01:37:08
2026-04-19 17:51:32,1626131208687-03,Malas | Bolsas e Mochilas,Kit Viagem 3 Frascos Porta Creme Shampoo Condicionador 60ml,2691,2691,2,1926542,webcontinentalmktplace,2026-04-22 01:37:09
2026-04-19 17:51:32,1626131208687-02,"Sabonetes Líquidos, Óleos e Loções | Corpo e Banho | Cosméticos e Perfumaria",Loção Hidratante Infantil Johnsons Baby Regular Frasco 200ml,3799,3799,1,1196903,farmaconde,2026-04-22 01:37:09
2026-04-19 17:51:32,1626131208687-02,Cremes e Máscaras pra cabelo | Cuidados com o Cabelo | Cosméticos e Perfumaria,Creme de Tratamento Infantil Salon Line SOS Cachos Kids Pote 500g,2190,2190,1,1199841,farmaconde,2026-04-22 01:37:09
2026-04-19 17:51:32,1626131208687-02,Fraldas | Bebês e Infantil,Fralda Pampers Confortsec Bag Super XXXG 44 unidades FR PAMPERS CONFORTSEC BAG SUPER XXXG 44U,11399,12665,1,724326,farmaconde,2026-04-22 01:37:09
2026-04-19 17:47:41,1626131208686-01,Miniaturas | Meninos | Brinquedos,CARRO CONTROLE REMOTO SMART DRIVER SPIDERMAN 58002 CANDIDE,6990,6990,1,1798330,minipreco,2026-04-22 01:37:09
2026-04-19 17:41:14,1626131208683-01,Camas | Quarto | Móveis,Cama Box Casal 138cm Molas Ensacadas Macau Gazin Chumbo/Preto S/V,92990,129990,1,2519882,multilojaonline,2026-04-22 01:37:09
2026-04-19 17:39:32,1626131208681-01,Fones de Ouvido | Celulares e Smartphones,Fone Ouvido Sem Fio Branco Airpro Silicone Compatível Com Samsung A04,2999,2999,1,1971020,webcontinentalmktplace,2026-04-22 01:37:10
2026-04-19 17:35:06,1626131208678-02,"Aparelhos de Jantar | Louça, Copos e Talheres | Casa e Cozinha",Aparelho de jantar 20 peças tramontina canyon porcelana marmorizada,21624,28069,1,2046332,loyalt,2026-04-22 01:37:10
2026-04-19 17:35:06,1626131208678-01,Panelas | Panelas e Utensílios para Cozinhar | Casa e Cozinha,Jogo de Panelas Roma de Cerâmica Antiaderente 5 pçs Vermelha - Hauskraft,19295,59990,1,845513,minipreco,2026-04-22 01:37:10
2026-04-19 17:35:06,1626131208678-01,"Talheres e Porta-Talheres | Louça, Copos e Talheres | Casa e Cozinha",JOGO COLHER CHA NEW KOLOR INOX VERMELHO 3UN 23167370 TRAMONTINA,5,799,9,801256,minipreco,2026-04-22 01:37:10
2026-04-19 17:35:06,1626131208678-01,"Talheres e Porta-Talheres | Louça, Copos e Talheres | Casa e Cozinha",JOGO GARFO SOBREMESA TULUM INOX OFF WHITE 3UN 23275380 TRAMONTINA,95,799,2,801143,minipreco,2026-04-22 01:37:10
2026-04-19 17:35:06,1626131208678-01,"Talheres e Porta-Talheres | Louça, Copos e Talheres | Casa e Cozinha",JOGO COLHER CHA IPANEMA VERDE INOX 10UN 23367 420 TRAMONTINA ETIQ,283,283,3,797518,minipreco,2026-04-22 01:37:10
2026-04-19 17:30:42,1626131208677-01,Bolsas e Mochilas,Mochila Para Notebook Executiva Spartan Isiway Psm1600100 Preto U,5690,5690,1,1137830,webcontinentalmktplace,2026-04-22 01:37:10
2026-04-19 17:30:35,1626131208676-01,Ferramentas Elétricas | Materiais de Construção,Lavadora de alta pressão wap ousada wl 2610 ultra 1750psi 1500w – cinza e amarelo,42990,52490,1,2048186,loyalt,2026-04-22 01:37:11
2026-04-19 17:27:51,1626121208671-02,"Formas | Assadeiras, Fôrmas e Travessas | Casa e Cozinha",Conjunto de assadeiras refratárias quadradas sempre em vidro sodacal – 3 peças,6168,6168,1,2655651,loyalt,2026-04-22 01:37:11
2026-04-19 17:27:51,1626121208671-01,"Talheres e Porta-Talheres | Louça, Copos e Talheres | Casa e Cozinha",JOGO COLHER CHA NEW KOLOR INOX VERMELHO 3UN 23167370 TRAMONTINA,5,799,20,801256,minipreco,2026-04-22 01:37:11
2026-04-19 17:27:51,1626121208671-01,"Talheres e Porta-Talheres | Louça, Copos e Talheres | Casa e Cozinha",JOGO GARFO SOBREMESA TULUM INOX OFF WHITE 3UN 23275380 TRAMONTINA,95,799,4,801143,minipreco,2026-04-22 01:37:11
2026-04-19 17:21:44,1626121208670-01,Amamentação e Alimentação | Bebês e Infantil,Kit Mamadeira My First 150ml + Mamadeira Rosa 300ml NUK KIT MAMAD NUK MY FIR,9499,9499,1,726888,farmaciaindiana,2026-04-22 01:37:11
2026-04-19 17:21:44,1626121208670-01,Fraldas | Bebês e Infantil,Fralda Huggies Supreme Care P - 48 Fraldas Fralda Huggies Supreme Care Mega P c/ 48 Unidades,4999,6399,1,725001,farmaciaindiana,2026-04-22 01:37:11
2026-04-19 17:21:44,1626121208670-01,Assadura | Pele E Mucosa | Medicamentos,Babymed Pomada Rosa 45g,1144,1850,1,846844,farmaciaindiana,2026-04-22 01:37:11
2026-04-19 17:18:20,1626121208669-01,Aspiradores de Pó e Água | Eletroportáteis,Aspirador de Pó Vertical com Fio Electrolux 1450W 2 em 1 Filtro HEPA Branco (STK14B) 220V,18990,30990,1,1108180,electrolux,2026-04-22 01:37:12
2026-04-19 17:17:35,1626121208668-01,Pneus | Produtos automotivos,Pneu aro 13 goodyear direction 2 touring 175/70 82t,31107,36289,1,2655470,loyalt,2026-04-22 01:37:12
2026-04-19 17:17:16,1626121208667-01,Romance - Estrangeiro | Literatura Estrangeira | Livros,KIT BABI A. SETTE: SENHORITA AURORA + O BEIJO DA NEVE,8990,8990,1,814021,martinsfontespaulista,2026-04-22 01:37:12
2026-04-19 17:12:29,1626121208664-01,"Vitaminas, Minerais e Suplementos | Saúde e Bem Estar",Whey Protein Integralmedica My Whey 900g Pote Baunilha,9490,14600,1,2276256,webcontinentalmktplace,2026-04-22 01:37:12
2026-04-19 17:10:37,1626121208663-01,Cuidados com o Cabelo | Cosméticos e Perfumaria,"Escova Secadora Modeladora Alisadora Multifuncional 3 Em 1 - Seca, Alisa E Modela Com Facilidade 220V",19790,19790,1,2665248,webcontinentalmktplace,2026-04-22 01:37:13
2026-04-19 17:08:41,1626121208662-01,Cuidados com o Cabelo | Cosméticos e Perfumaria,Secador De Cabelos Dobrável Cadence Plié Bivolt,6600,7490,1,2293706,webcontinentalmktplace,2026-04-22 01:37:13
2026-04-19 17:05:53,1626121208661-01,Panificadora Elétrica | Eletroportáteis Especiais | Eletroportáteis,Panificadora 19 programas gallant 600w 220v branca (gpa1e19a_220br),45875,45875,1,2051739,loyalt,2026-04-22 01:37:13
2026-04-19 16:59:14,1626121208657-01,"Bebedouros | Filtros, Bebedouros e Refrigeradores de Água | Eletroportáteis",Purificador de Água Philco Bivolt PPU11 Água Natural e Gelada Bivolt,39990,81990,1,1323828,Philco,2026-04-22 01:37:13
2026-04-19 16:54:26,1626121208656-01,Máquinas de Lavar Roupas | Máquinas de Lavar e Secadoras | Eletrodomésticos,Máquina de Lavar Electrolux 15kg Branca Essential Care com Cesto Inox e Jet&Clean (LED15) 127V,199900,316900,1,1107327,electrolux,2026-04-22 01:37:14
2026-04-19 16:44:21,1626121208654-01,Cuidados com o Cabelo | Cosméticos e Perfumaria,Revlon uniq one coconut hair tretmeant - leave-in,7130,13110,1,2060983,loyalt,2026-04-22 01:37:14
2026-04-19 16:43:22,1626121208653-01,"Jogos de Copos e Taças Mistos | Louça, Copos e Talheres | Casa e Cozinha",Copo Poema 300ML - NADIR,195,790,6,1146979,minipreco,2026-04-22 01:37:15
2026-04-19 16:41:09,1626121208652-01,Ventiladores | Eletroportáteis,Ventilador Britânia BVT491 Tecnologia Maxx Force 174W 127V,14990,25990,1,268610,Philco,2026-04-22 01:37:15
2026-04-19 16:26:49,1626111208647-01,Aspiradores de Pó e Água | Eletroportáteis,Aspirador de pó e Água wap gtw10 com bocal de sopro 10 litros - 1400w,23990,37499,1,2046355,loyalt,2026-04-22 01:37:15
2026-04-19 16:19:46,1626111208644-01,Celulares e Smartphones,"Smartphone motorola moto g06 4g tela 6,9” 128gb câmera 50mp azul marinho",69878,83092,1,2047097,loyalt,2026-04-22 01:37:16
2026-04-19 16:14:08,1626111208643-01,Cama e Banho | Casa e Cozinha,Jogo Cama Lençol Unique Casal Padrão 400 Fios Ponto Palito 3 Peças - Cinza,6990,6990,1,1087408,loyalt,2026-04-22 01:37:16
2026-04-19 16:06:10,1626111208639-01,Celulares e Smartphones,"Celular samsung galaxy a17 4g tela 6.7"" 128gb super amoled câmera tripla 50mp preto",93496,137219,1,2295619,loyalt,2026-04-22 01:37:16
2026-04-19 16:05:44,1626111208638-01,Fogões | Fogões e Cooktops | Eletrodomésticos,Fogão 4 Bocas De Piso Braslar New Sirius 2023 Branco,59990,59990,1,892268,webcontinentalmktplace,2026-04-22 01:37:16
2026-04-19 16:05:30,1626111208637-01,Aspiradores Robô | Aspiradores de Pó e Água | Eletroportáteis,Aspirador Robô Philco 3 Em 1 Antiqueda Bivolt MOP PAS26P Bivolt,76990,76990,1,1734337,webcontinentalmktplace,2026-04-22 01:37:16
2026-04-19 15:58:10,1626111208632-01,Hidráulico | Materiais de Construção,Chuveiro Zagonel Optima Turbo Eletrônico Branco 220v - 7700w,33990,33990,1,2290196,webcontinentalmktplace,2026-04-22 01:37:17
2026-04-19 15:58:10,1626111208632-02,Escovas de Dentes e Acessórios | Higiene Bucal | Higiene | Saúde e Bem Estar,Escova Dental Oral B Elétrica Pro-Saúde Power,7990,10999,2,831535,farmaciaindiana,2026-04-22 01:37:17
2026-04-19 15:58:10,1626111208632-02,Escovas de Dentes e Acessórios | Higiene Bucal | Higiene | Saúde e Bem Estar,Escova Interdental Powerdent Interdent Cônico 3 a 7mm + Refis 6 unidades,1699,1699,1,832410,farmaciaindiana,2026-04-22 01:37:17
2026-04-19 15:58:10,1626111208632-02,Escovas de Dentes e Acessórios | Higiene Bucal | Higiene | Saúde e Bem Estar,Escova Interdental Powerdent Refil Cônico 3-7mm 6 Unidades,969,1049,1,833615,farmaciaindiana,2026-04-22 01:37:17
2026-04-19 15:57:56,1626111208631-01,Sofás | Sala de Estar | Móveis,"Sofá Retrátil E Reclinável 3 Lugares Verona 1,80m - élpis Móveis Veludo Cinza",111290,111290,1,2372712,webcontinentalmktplace,2026-04-22 01:37:17
2026-04-19 15:47:01,1626111208624-02,Limpeza Doméstica | Casa e Cozinha,Porta Papel Higiênico De Chão Cromado Para 4 Rolos Mali,4999,4999,1,2309014,webcontinentalmktplace,2026-04-22 01:37:17
2026-04-19 15:47:01,1626111208624-01,Fornos Elétricos | Eletrodomésticos,Forno Elétrico Philco PFE44P Dupla Resistência 44L 220V,32990,49990,1,143109,Philco,2026-04-22 01:37:18
2026-04-19 15:47:01,1626111208624-01,Escova Rotativa Modeladora | Cuidados com o Cabelo | Cosméticos e Perfumaria,Escova Rotativa Philco Cabeça Removível 1300W Bivolt PERE01 Bivolt,19990,22990,1,2032418,Philco,2026-04-22 01:37:18
2026-04-19 15:46:30,1626111208623-01,Hidráulico | Materiais de Construção,Torneira Cozinha Filtro Purificante Parede Bica Móvel Alavanca Cromado Abs Luxo,10799,10799,1,2372016,webcontinentalmktplace,2026-04-22 01:37:18
2026-04-19 15:44:52,1626111208622-01,Panelas Elétricas | Eletroportáteis Especiais | Eletroportáteis,Panela elétrica de arroz mondial bianca rice npe-05 5 xícaras - branca,14031,16489,1,2046316,loyalt,2026-04-22 01:37:18
2026-04-19 15:32:18,1626111208617-01,Fraldas | Bebês e Infantil,Fralda Baby Sec Ultra Hiper M Com 72 Unidades FR BABYSEC ULTRA HIPER M 72UN,6990,6990,1,725061,farmaconde,2026-04-22 01:37:19
2026-04-19 15:20:05,1626101208614-01,Fornos de Micro-Ondas | Eletrodomésticos,Micro-ondas Britânia 28L Branco Espelhado Limpa Fácil BMO30 127V,47990,64990,1,2082586,Philco,2026-04-22 01:37:19
2026-04-19 15:18:18,1626101208613-01,Roupa de Cama | Cama e Banho | Casa e Cozinha,Jogo De Cama 200 Fios Queen 4 Peças Lar E Lazer Roxo UN,6999,6999,1,2656035,rovitex,2026-04-22 01:37:19
2026-04-19 15:18:18,1626101208613-01,Roupa de Cama | Cama e Banho | Casa e Cozinha,Jogo De Cama 200 Fios Queen 4 Peças Lar E Lazer Azul UN,6999,6999,1,2656130,rovitex,2026-04-22 01:37:19
2026-04-19 15:18:18,1626101208613-01,Roupa de Cama | Cama e Banho | Casa e Cozinha,Jogo De Cama 200 Fios Queen 4 Peças Lar E Lazer Rosa UN,6999,6999,1,2656128,rovitex,2026-04-22 01:37:19
2026-04-19 15:10:34,1626101208610-01,"Cafeteiras e Máquinas de Expresso | Café, Chá e Expresso | Eletroportáteis",Cafeteira Elétrica 15 Xícaras Jarra de Vidro c/ Filtro Reutilizável e Colher Dosadora 550W 127v- Multi - GO035OUT [Remanufaturado] GO035OUT,9592,11990,1,2279013,compreja,2026-04-22 01:37:20
2026-04-19 15:10:31,1626101208609-01,Kits de Teclado e Mouse | Periféricos | Computadores e Informática,Combo Teclado e Mouse Recarregável Sem Fio Preto Multi - TC402 TC402,24990,24990,1,2464153,compreja,2026-04-22 01:37:20
2026-04-19 15:03:03,1626101208605-01,"Suplementos | Vitaminas, Minerais e Suplementos | Saúde e Bem Estar",WHEY  PROTEIN CONCENTRADO 80% HD - CAVEIRA PRETA WHEY 80% HD - COOKIES,17990,17990,1,768783,blackskullusa,2026-04-22 01:37:20
2026-04-19 15:02:30,1626101208604-01,Iphone | Smartphone | Celulares e Smartphones,"Apple iphone 15 128gb 6,1"" 48mp preto",436696,494333,1,2044993,loyalt,2026-04-22 01:37:21
2026-04-19 14:57:25,1626101208602-02,Ferro de Passar e Passadeiras | Eletroportáteis,Ferro De Passar Cadence 2 Em 1 Laranja 110V,7100,8990,1,1777955,webcontinentalmktplace,2026-04-22 01:37:21
2026-04-19 14:57:25,1626101208602-02,Churrasqueiras e Acessórios | Artigos para Churrasco | Casa e Cozinha,Churrasqueira Montana,14990,14990,1,28741,webcontinentalmktplace,2026-04-22 01:37:21
