creationDate,orderId,categoryName,name,price,listPrice,quantity,productId,seller,data_extracao
2026-04-20 23:10:12,1626421209419-01,"Batedeiras | Liquidificadores, Batedeiras e Processadores | Eletroportáteis",Batedeira planetária mondial bp-03 com 12 velocidades e 700w – preto,27050,34089,1,2047073,loyalt,2026-04-22 01:35:23
2026-04-20 23:06:18,1626421209416-01,Furadeira | Ferramentas Elétricas | Materiais de Construção,Furadeira Britânia BFUE04 Função impacto 850W 127V,10990,23990,1,1711975,Philco,2026-04-22 01:35:23
2026-04-20 22:59:53,1626421209411-02,Jogos | Artigos Gamer | Computadores e Informática,Mini Video Game Portatil 400 Jogos Internos Gamer Sup Box Plus Preto,6489,6489,1,1865756,webcontinentalmktplace,2026-04-22 01:35:23
2026-04-20 22:59:53,1626421209411-01,Fritadeiras Elétricas | Eletroportáteis,"Fritadeira airfryer philips walita série 1000 xl 6,2l 1700w grelha removível preto",38376,52395,1,2047204,loyalt,2026-04-22 01:35:23
2026-04-20 22:59:53,1626421209411-01,Ferramentas Elétricas | Materiais de Construção,Parafusadeira e furadeira wap wf12k3.2 bateria 12v bivolt,12900,20990,1,2046288,loyalt,2026-04-22 01:35:23
2026-04-20 22:57:09,1626421209408-01,"Cafeteiras e Máquinas de Expresso | Café, Chá e Expresso | Eletroportáteis",Cafeteira Britânia Duo Coffee 127V,10990,13990,1,2295,Philco,2026-04-22 01:35:24
2026-04-20 22:56:37,1626421209405-01,Cortadores de Cabelo | Cosméticos e Perfumaria,Máquina de cortar cabelo mondial hair stylo cr-02 4 com pentes prata/preta,4990,6990,1,2299552,loyalt,2026-04-22 01:35:24
2026-04-20 22:55:32,1626421209404-01,Cozinha Industrial | Eletrodomésticos,Suqueira De Cristal 3 Litros Dispenser De Vidro Para Bebidas Com Pé E Tampa,18700,18700,1,2589417,webcontinentalmktplace,2026-04-22 01:35:24
2026-04-20 22:55:05,1626421209403-01,"TVs | Cinema, TV e Áudio","Smart tv 50"" 4k philips 50pug7300/78 uhd titan os pixel precise comando de voz preta",196466,229661,1,2046119,loyalt,2026-04-22 01:35:25
2026-04-20 22:50:37,1626421209401-01,Motorola | Smartphone | Celulares e Smartphones,"Smartphone motorola moto g06 4g tela 6,9” 128gb câmera 50mp laranja",69878,83104,1,2047101,loyalt,2026-04-22 01:35:25
2026-04-20 22:49:25,1626421209399-01,"Vitaminas, Minerais e Suplementos | Saúde e Bem Estar",Termogênico Em Capsulas Dimethylex Edição Limitada 60 Caps Under Labz,9990,9990,1,1945072,webcontinentalmktplace,2026-04-22 01:35:25
2026-04-20 22:41:01,1626421209398-01,Escova Rotativa Modeladora | Cuidados com o Cabelo | Cosméticos e Perfumaria,Escova rotativa mondial erb-01 1200 w bivolt - preto/golden rose,14900,14900,1,2655119,loyalt,2026-04-22 01:35:25
2026-04-20 22:40:18,1626421209397-01,"TVs | Cinema, TV e Áudio","Smart tv 50"" 4k philips 50pug7300/78 uhd titan os pixel precise comando de voz preta",196466,229661,1,2046119,loyalt,2026-04-22 01:35:26
2026-04-20 22:34:39,1626421209395-01,Perfumes | Cosméticos e Perfumaria,Perfume Gabriela Sabatini Eau de Toilette - 60ml,12200,12299,1,290700,farmaciaindiana,2026-04-22 01:35:26
2026-04-20 22:30:00,1626421209394-01,Fritadeiras Elétricas | Eletroportáteis,"Air Fryer Fritadeira Elétrica Digital Extream 4,3L Branco com Prata",28900,39900,1,1804566,tetrix,2026-04-22 01:35:26
2026-04-20 22:23:54,1626411209393-01,Lixeiras | Limpeza Doméstica | Casa e Cozinha,Lixeira Com Tampa Para Banheiro Cozinha 5litros Haus Preta,3661,3661,1,1229138,webcontinentalmktplace,2026-04-22 01:35:26
2026-04-20 22:22:43,1626411209392-01,"Áudio | Cinema, TV e Áudio","Caixa amplificada mondial cm-550 com bluetooth, usb rádio fm e função tws - 550w",56056,66783,1,2295608,loyalt,2026-04-22 01:35:27
2026-04-20 22:19:48,1626411209390-01,"TVs | Cinema, TV e Áudio",Smart TV 32” Philco PTV32K34RKGB LED Roku TV Bivolt,99990,119990,1,1015290,Philco,2026-04-22 01:35:27
2026-04-20 22:17:57,1626411209389-01,Celulares e Smartphones,"Smartphone motorola moto g06 4g tela 6,9” 128gb câmera 50mp azul marinho",69878,83092,1,2047097,loyalt,2026-04-22 01:35:27
2026-04-20 22:15:18,1626411209384-02,Brinquedos,Carro Controle Com Fio Escavadeira Escala DM BRASIL,9990,9990,1,795830,minipreco,2026-04-22 01:35:28
2026-04-20 22:15:18,1626411209384-03,Cozinha | Móveis,Conjunto Mesa e 4 Cadeiras Talita Indekes Freijo/Off/Linho S/V,52990,60990,1,1727080,multilojaonline,2026-04-22 01:35:28
2026-04-20 22:15:18,1626411209384-01,Mini Veículos Para Pilotar | Meninos | Brinquedos,Escavadeira Infantil Gigante Escavator Roma ROM1780,26999,26999,1,9341,bumerangbrinquedos,2026-04-22 01:35:28
2026-04-20 22:15:07,1626411209383-01,Câmeras de Segurança | Sistemas de Segurança para Casa | Materiais de Construção,Câmera De Wifi Ip Lampada Full Hd Visão Noturna,7890,7890,1,2105442,webcontinentalmktplace,2026-04-22 01:35:28
2026-04-20 22:11:51,1626411209378-01,"Formas | Assadeiras, Fôrmas e Travessas | Casa e Cozinha",Conjunto de travessas refratárias marinex em vidro - 10 peças,11847,11847,1,2135902,loyalt,2026-04-22 01:35:29
2026-04-20 22:11:51,1626411209378-02,"Jogos de Copos e Taças Mistos | Louça, Copos e Talheres | Casa e Cozinha",Taça Vinho Enoteca 615ML - NDI,895,1990,2,1148753,minipreco,2026-04-22 01:35:29
2026-04-20 22:06:21,1626411209372-01,"Filtros, Bebedouros e Refrigeradores de Água | Eletroportáteis",Geladeira consul cycle defrost 334l duplex crd37eb freezer supercapacidade e gelo extra branca,189379,270944,1,2046683,loyalt,2026-04-22 01:35:29
2026-04-20 22:06:19,1626411209371-01,Motorola | Smartphone | Celulares e Smartphones,"Smartphone motorola moto g06 4g tela 6,9” 128gb câmera 50mp laranja",69878,83104,1,2047101,loyalt,2026-04-22 01:35:29
2026-04-20 22:00:15,1626411209367-01,"Liquidificadores | Liquidificadores, Batedeiras e Processadores | Eletroportáteis","Liquidificador mondial power l-550 1,9l 550w 2 velocidades pulsar preto",7990,8789,1,2045329,loyalt,2026-04-22 01:35:30
2026-04-20 21:58:01,1626411209363-02,Limpeza Doméstica | Casa e Cozinha,Mop Giratório Menalux com Cesto Inox e Refil Extra de Microfibra,15990,15990,1,1143538,electrolux,2026-04-22 01:35:30
2026-04-20 21:58:01,1626411209363-01,Escova Rotativa Modeladora | Cuidados com o Cabelo | Cosméticos e Perfumaria,Escova secadora philco pes19sg 1300w bivolt prata,16900,16900,1,2655123,loyalt,2026-04-22 01:35:30
2026-04-20 21:58:01,1626411209363-01,Aspiradores de Pó e Água | Eletroportáteis,Aspirador de pó vertical electrolux stk17 1600w 2em1 cyclonic power azul,26577,26577,1,2046754,loyalt,2026-04-22 01:35:30
2026-04-20 21:55:21,1626411209361-01,Iphone | Smartphone | Celulares e Smartphones,"iPhone 17 Pro Max (1TB) Azul-intenso, Tela de 6,9"", 5G e Câmera de 48MP",1489000,2239000,1,1978374,shophub,2026-04-22 01:35:30
2026-04-20 21:49:04,1626411209351-01,Ferramentas Elétricas | Materiais de Construção,Parafusadeira e furadeira wap wf12k3.2 bateria 12v bivolt,12900,20990,1,2046288,loyalt,2026-04-22 01:35:31
2026-04-20 21:48:41,1626411209350-01,Emagrecer | Medicamentos,Orlistate 120mg Caixa 84 Cápsulas,11680,38676,1,1207415,farmaconde,2026-04-22 01:35:31
2026-04-20 21:47:33,1626411209348-01,Celulares e Smartphones,"Smartphone motorola moto g35 5g coral 256gb 4gb ram + 8gb ram boost e camera 50mp com ai nfc tela 6.7"" com superbrilho",113014,139900,1,2137856,loyalt,2026-04-22 01:35:31
2026-04-20 21:46:08,1626411209346-01,"TVs | Cinema, TV e Áudio","Smart tv 32"" hd samsung h5000f sistema operacional tizen hdr purcolor",110164,142890,1,2046132,loyalt,2026-04-22 01:35:32
2026-04-20 21:37:09,1626411209340-01,"Vitaminas, Minerais e Suplementos | Saúde e Bem Estar",Whey Protein Integralmedica My Whey 900g Pote Baunilha,9490,14600,1,2276256,webcontinentalmktplace,2026-04-22 01:35:32
2026-04-20 21:37:09,1626411209340-01,"Vitaminas, Minerais e Suplementos | Saúde e Bem Estar",Creatina Integralmedica 120 Cápsulas Sem Sabor,2990,4600,1,2243383,webcontinentalmktplace,2026-04-22 01:35:32
2026-04-20 21:36:01,1626411209339-01,Máquinas de Lavar Roupas | Máquinas de Lavar e Secadoras | Eletrodomésticos,Tanquinho de roupas 20kg suggar lavamax eco le2001/2002pr com 6 programas de lavagem – prata,67600,75076,1,2299575,loyalt,2026-04-22 01:35:32
2026-04-20 21:31:58,1626411209336-01,"TVs | Cinema, TV e Áudio","Smart tv 32"" hd samsung h5000f sistema operacional tizen hdr purcolor",110164,142890,1,2046132,loyalt,2026-04-22 01:35:32
2026-04-20 21:29:25,1626401209335-01,Ventiladores | Eletroportáteis,Ventilador de Coluna Britânia BVT450 Maxx Force 160W 127V,18990,36290,1,155224,webcontinentalmktplace,2026-04-22 01:35:33
2026-04-20 21:29:25,1626401209335-01,Camas | Quarto | Móveis,Beliche Perola Plus 088 Freijó J.a Freijó,46199,52799,1,1362864,webcontinentalmktplace,2026-04-22 01:35:33
2026-04-20 21:29:22,1626401209334-01,Relógios Masculinos | Relógios,Relogio Digital Prova Dagua + Caixa + Oculos Sol Proteção Uv Esportivo Preto Original Alarme Data,20990,20990,1,1812972,webcontinentalmktplace,2026-04-22 01:35:33
2026-04-20 21:29:18,1626401209332-02,Cama e Banho | Casa e Cozinha,Jogo cama lençol unique casal padrão micro percal 400 fios ponto palito 3 peças - avelã,6990,6990,1,2315394,loyalt,2026-04-22 01:35:33
2026-04-20 21:29:18,1626401209332-01,Computadores de Mesa | Computadores e Informática,Lençol Impermeável para Colchão Lencol Impermeavel Matelado com Elastico em Toda Volta Microfibra,3448,3448,2,2967192,webcontinentalmktplace,2026-04-22 01:35:33
2026-04-20 21:29:18,1626401209332-01,Roupa de Cama | Cama e Banho | Casa e Cozinha,Jogo De Lençol Ayla Casal Padrão 3 Peças Microfibra Estampada Floral - Azul Sereno,7887,7887,1,1985043,webcontinentalmktplace,2026-04-22 01:35:33
2026-04-20 21:29:18,1626401209332-01,Roupa de Cama | Cama e Banho | Casa e Cozinha,Jogo De Lençol Ayla Casal Padrão 3 Peças Microfibra Estampada Floral - Lavanda,7887,7887,1,2431616,webcontinentalmktplace,2026-04-22 01:35:33
2026-04-20 21:27:49,1626401209331-01,Chapinhas e Pranchas | Cuidados com o Cabelo | Cosméticos e Perfumaria,Chapinha | prancha taiff red ion 200°c preto/vermelho - bivolt,16839,16839,1,2299558,loyalt,2026-04-22 01:35:34
2026-04-20 21:24:43,1626401209330-01,Celulares e Smartphones,"Smartphone motorola moto g06 4g tela 6,9” 128gb câmera 50mp azul marinho",69878,83092,1,2047097,loyalt,2026-04-22 01:35:34
2026-04-20 21:22:31,1626401209329-01,Lancheiras | Bolsas e Mochilas,LANCHEIRA JUVENIL FEMININA RB PINK RB24550 SEMAX,4995,9990,1,795728,minipreco,2026-04-22 01:35:34
2026-04-20 21:22:31,1626401209329-01,Lancheiras | Bolsas e Mochilas,LANCHEIRA JUVENIL FEMININA RB ROXA RB24523 SEMAX,4995,9990,1,795704,minipreco,2026-04-22 01:35:34
2026-04-20 21:18:31,1626401209327-01,Motorola | Smartphone | Celulares e Smartphones,"Smartphone motorola moto g06 4g tela 6,9” 128gb câmera 50mp laranja",69878,83104,1,2047101,loyalt,2026-04-22 01:35:34
2026-04-20 21:17:00,1626401209324-02,"Formas | Assadeiras, Fôrmas e Travessas | Casa e Cozinha",Conjunto de travessas refratárias marinex em vidro - 10 peças,11847,11847,1,2135902,loyalt,2026-04-22 01:35:35
2026-04-20 21:17:00,1626401209324-01,Potes | Utensílios para Cozinha | Casa e Cozinha,Potes Herméticos Electrolux de Plástico Branco Retangular com 10 Unidades,8990,15900,1,1108205,electrolux,2026-04-22 01:35:35
2026-04-20 21:16:12,1626401209323-01,Ferramentas Elétricas | Materiais de Construção,Parafusadeira e furadeira wap wf12k3.2 bateria 12v bivolt,12900,20990,1,2046288,loyalt,2026-04-22 01:35:35
2026-04-20 21:15:20,1626401209322-01,Barracas | Camping | Esporte e Lazer,"Barraca De Camping Acampamento Mor Iglu 4 Pessoas - Ref 9033 - Medidas 2,10x2,10x1,30 Metros Tamanho Unico Cor Azul",19899,19899,1,2091240,webcontinentalmktplace,2026-04-22 01:35:35
2026-04-20 21:13:20,1626401209320-01,Carros de passeio | Pneus | Produtos automotivos,Pneu Aro 15 185/60R15 84H TH-93 Townhall,25690,25690,4,856725,pneubarato,2026-04-22 01:35:36
2026-04-20 21:12:14,1626401209315-01,"Caixas de Som Portáteis | Áudio | Cinema, TV e Áudio",Speaker Extreme Britânia BBS200BT Flash Lights TWS 200W Bivolt,29990,65990,1,671150,Philco,2026-04-22 01:35:36
2026-04-20 21:12:14,1626401209315-01,Ventiladores | Eletroportáteis,Ventilador Philco PVT490 Turbo Maxx Force 160W 127V,15990,21990,1,1429,Philco,2026-04-22 01:35:36
2026-04-20 21:06:06,1626401209310-01,Má Digestão | Estômago E Gastrointestinais | Medicamentos,Leite De Magnésia Phillips Tradicional 120ml,1949,1949,1,2426127,farmaciaindiana,2026-04-22 01:35:36
2026-04-20 21:05:05,1626401209309-01,Potes | Utensílios para Cozinha | Casa e Cozinha,Moedor de café wolff de aço inox manual com estampa madeira,7559,12400,1,2056956,loyalt,2026-04-22 01:35:36
2026-04-20 20:59:34,1626401209305-01,Motorola | Smartphone | Celulares e Smartphones,Smartphone Motorola Moto G35 5G 256GB 12GB de RAM Coral,99900,119900,1,1455312,webfones,2026-04-22 01:35:37
2026-04-20 20:59:11,1626401209304-01,Celulares e Smartphones,"Celular samsung galaxy a07 tela 6.7"" 128gb 4g 90hz câmera dupla 50mp verde",68536,68536,1,2652242,loyalt,2026-04-22 01:35:37
2026-04-20 20:58:46,1626401209302-01,Fornos de Micro-Ondas | Eletrodomésticos,Micro-ondas Britânia 33L Preto e Branco Limpa Fácil BMO38 127V,57990,77990,1,2530655,Philco,2026-04-22 01:35:37
2026-04-20 20:58:42,1626401209300-02,Utilidades Domésticas | Casa e Cozinha,Pipoqueira Microondas Sem Oleo Balde De Pipoca Fitness Balde Facil 2 Em 1 Com Tigela Ez Popcorn Pratico Com Alça,4590,4590,1,1343045,webcontinentalmktplace,2026-04-22 01:35:37
2026-04-20 20:58:42,1626401209300-01,Panelas Elétricas | Eletroportáteis Especiais | Eletroportáteis,Panela elétrica de arroz philco ph5 visor glass 5 xícaras - preta/inox,15070,17589,1,2047130,loyalt,2026-04-22 01:35:38
2026-04-20 20:54:43,1626401209296-01,Fogões | Fogões e Cooktops | Eletrodomésticos,Fogão 5 bocas consul cfs5vbe com mesa de vidro e acendimento automático preto - bivolt,146748,190803,1,2046667,loyalt,2026-04-22 01:35:38
2026-04-20 20:52:58,1626401209295-01,Mesas De Jantar | Sala de Jantar | Móveis,Mesa Olímpia 120cm Rufato Off White,41990,56999,1,891361,webcontinentalmktplace,2026-04-22 01:35:38
2026-04-20 20:47:14,1626401209293-01,Ferramentas Elétricas | Materiais de Construção,Parafusadeira e furadeira wap wf12k3.2 bateria 12v bivolt,12900,20990,1,2046288,loyalt,2026-04-22 01:35:38
2026-04-20 20:45:48,1626401209290-01,"Cafeteiras e Máquinas de Expresso | Café, Chá e Expresso | Eletroportáteis",Cafeteira expresso arno dolce gusto genio s dgs5 basic automática multibebidas – grafite,49816,62895,1,2045102,loyalt,2026-04-22 01:35:38
2026-04-20 20:43:15,1626401209286-01,Roupa de Cama | Cama e Banho | Casa e Cozinha,Jogo Cama Lençol Casal 200 Fios 4 Peças Preto,8473,12104,1,1628990,webcontinentalmktplace,2026-04-22 01:35:39
2026-04-20 20:43:15,1626401209286-02,Potes | Utensílios para Cozinha | Casa e Cozinha,Potes Herméticos Electrolux de Plástico Branco Retangular com 10 Unidades,8990,15900,1,1108205,electrolux,2026-04-22 01:35:39
2026-04-20 20:42:26,1626401209284-01,"Cafeteiras e Máquinas de Expresso | Café, Chá e Expresso | Eletroportáteis",Cafeteira Elétrica Electrolux Digital 38 Xícaras Experience Programável com Timer Cor Inox (ECM30) 220V,32990,39990,1,1107247,electrolux,2026-04-22 01:35:39
2026-04-20 20:40:24,1626401209279-01,Panelas | Panelas e Utensílios para Cozinhar | Casa e Cozinha,PIPOQUEIRA MR COOK ALUMINIO PRETA N22 1050510016 MEGA ALUMINIO,5999,5999,1,797317,minipreco,2026-04-22 01:35:39
2026-04-20 20:39:20,1626401209278-01,Motorola | Smartphone | Celulares e Smartphones,"Smartphone motorola moto g06 4g tela 6,9” 128gb câmera 50mp laranja",69878,83104,1,2047101,loyalt,2026-04-22 01:35:40
2026-04-20 20:34:01,1626401209275-01,Ferramentas Elétricas | Materiais de Construção,Parafusadeira e furadeira wap wf12k3.2 bateria 12v bivolt,12900,20990,1,2046288,loyalt,2026-04-22 01:35:41
2026-04-20 20:32:23,1626401209274-01,Ar-condicionado | Eletrodomésticos,Ventilador de mesa mondial turbo nvt408pb 40cm 8 pás 3 velocidades preto/prata,17056,19940,1,2044901,loyalt,2026-04-22 01:35:41
2026-04-20 20:30:59,1626401209273-01,Faz de Conta | Meninas | Brinquedos,Gelateria Rosa Tateti 0340,14999,14999,1,1827462,bumerangbrinquedos,2026-04-22 01:35:41
2026-04-20 20:30:05,1626401209271-01,Guarda-Roupa E Roupeiros | Quarto | Móveis,Guarda-roupa Casal Easy Slim 8 Portas Amendoa Clean/off Whit,112990,129990,1,2233040,webcontinentalmktplace,2026-04-22 01:35:41
2026-04-20 20:26:44,1626391209265-02,Ferramentas Manuais | Materiais de Construção,Jogo Chaves Combinadas Crv 12 Peças 6-22mm Sparta,8890,8890,1,2872078,guimepa,2026-04-22 01:35:42
2026-04-20 20:26:44,1626391209265-03,Ferramentas Elétricas | Materiais de Construção,Parafusadeira e furadeira wap wf12k3.2 bateria 12v bivolt,12900,20990,1,2046288,loyalt,2026-04-22 01:35:42
2026-04-20 20:26:44,1626391209265-01,Chaves | Ferramentas Manuais | Materiais de Construção,Kit De Ferramentas 46 Peças Soquetes De Aço Chaves Catraca Reversível Multiuso Maleta Resistente,4990,4990,1,1808758,webcontinentalmktplace,2026-04-22 01:35:42
2026-04-20 20:25:04,1626391209263-01,Fornos Elétricos | Eletrodomésticos,Forno Elétrico de Bancada Nardelli Top 60 Litros Função Grill Preto 110V,48778,56744,1,844358,webcontinentalmktplace,2026-04-22 01:35:43
2026-04-20 20:22:18,1626391209260-01,Celulares e Smartphones,"Celular samsung galaxy a17 4g tela 6.7"" 256gb super amoled câmera tripla 50mp cinza",124696,166365,1,2295617,loyalt,2026-04-22 01:35:43
2026-04-20 20:20:21,1626391209259-01,Motorola | Smartphone | Celulares e Smartphones,"Smartphone motorola moto g06 4g tela 6,9” 128gb câmera 50mp laranja",69878,83104,1,2047101,loyalt,2026-04-22 01:35:43
2026-04-20 20:19:59,1626391209257-01,"Liquidificadores | Liquidificadores, Batedeiras e Processadores | Eletroportáteis",Liquidificador mondial turbo full black l900fb preto 900w com 5 velocidades,10890,12495,1,2045261,loyalt,2026-04-22 01:35:43
2026-04-20 20:18:59,1626391209256-01,Celulares e Smartphones,"Celular samsung galaxy a56 tela super amoled 6.7"" 128gb 5g câmera tripla até 50mp vídeo hdr e recursos ai verde",191870,233189,1,2047234,loyalt,2026-04-22 01:35:44
2026-04-20 20:18:08,1626391209254-01,"Áudio | Cinema, TV e Áudio",Fone de ouvido philips tat2500bk/00 intra-auricular true wireless bluetooth cancelamento de ruído 24h bateria preto,16639,19999,2,2047199,loyalt,2026-04-22 01:35:44
2026-04-20 20:14:34,1626391209252-01,Secadoras | Máquinas de Lavar e Secadoras | Eletrodomésticos,Secadora de Parede Fischer Super Ciclo 8 Kg com Timer Contínuo Branco 220V,61845,61845,1,2040124,marinbrasil,2026-04-22 01:35:44
2026-04-20 20:13:56,1626391209251-01,"Talheres e Porta-Talheres | Louça, Copos e Talheres | Casa e Cozinha",Kit Talher Belize Preto 21PCS SIMONAGGIO,3990,3990,1,797375,minipreco,2026-04-22 01:35:44
2026-04-20 20:13:56,1626391209251-01,"Pratos | Louça, Copos e Talheres | Casa e Cozinha",APARELHO JANTAR LOLA 12PCS AMD8-5190 OXFORD,9990,19990,1,2232603,minipreco,2026-04-22 01:35:44
2026-04-20 20:11:09,1626391209249-01,Celulares e Smartphones,"Smartphone motorola edge 60 fusion 5g cinza 256gb, 8gb ram, tela 6,7"", câmera sony lytia 700c 50mp, gorilla glass 7i, dimensity 7300, ip69 e ip68",215072,240196,1,2137868,loyalt,2026-04-22 01:35:45
2026-04-20 20:09:02,1626391209248-01,Máquinas de Lavar Roupas | Máquinas de Lavar e Secadoras | Eletrodomésticos,Tanquinho de roupas semiautomática colormaq lcs15 branco com 8 programas de lavagem - 15kg,56680,66649,1,2044995,loyalt,2026-04-22 01:35:45
2026-04-20 20:08:41,1626391209247-01,"Projetores | Cinema, TV e Áudio",Projetor Led Portátil Hdmi Cinema Em Casa Em Até 60,26500,26500,1,1969862,webcontinentalmktplace,2026-04-22 01:35:45
2026-04-20 20:07:09,1626391209246-01,Escova Rotativa Modeladora | Cuidados com o Cabelo | Cosméticos e Perfumaria,Escova Rotativa Philco 5 em 1 Bivolt 1300W PER03 Bivolt,26990,31990,1,2544170,Philco,2026-04-22 01:35:46
2026-04-20 20:04:54,1626391209244-01,Celulares e Smartphones,"Smartphone motorola moto g35 5g cinza 256gb 4gb ram + 8gb ram boost e camera 50mp com ai nfc tela 6.7"" com superbrilho",113014,139900,1,2047099,loyalt,2026-04-22 01:35:46
2026-04-20 20:03:27,1626391209243-01,Motorola | Smartphone | Celulares e Smartphones,Smartphone Motorola Moto G35 5G 256GB 12GB de RAM Coral,99900,119900,1,1455312,webfones,2026-04-22 01:35:46
2026-04-20 20:00:59,1626391209240-01,Serras | Ferramentas Elétricas | Materiais de Construção,Serra Circular 1400w Com Guia Laser E Disco De Corte Esc-1400 Evald 110V,34903,34903,1,2232762,webcontinentalmktplace,2026-04-22 01:35:46
2026-04-20 19:56:11,1626391209239-01,Ferramentas Elétricas | Materiais de Construção,Parafusadeira e furadeira wap wf12k3.2 bateria 12v bivolt,12900,20990,1,2046288,loyalt,2026-04-22 01:35:47
2026-04-20 19:56:11,1626391209239-01,Aspiradores de Pó e Água | Eletroportáteis,Aspirador vertical mondial ap40b 2 em 1 1500w filtro ciclone lavável preto e laranja,17900,18795,1,2046409,loyalt,2026-04-22 01:35:47
2026-04-20 19:55:33,1626391209238-01,Fogões | Fogões e Cooktops | Eletrodomésticos,Fogão 5 Bocas Atlas Mônaco Top Automático Mesa Inox Titanium Bivolt,124890,124890,1,2818508,webcontinentalmktplace,2026-04-22 01:35:47
2026-04-20 19:53:15,1626391209235-01,Fogões elétricos | Fogões e Cooktops | Eletrodomésticos,Fogão 5 Bocas Mueller Fratello Vetro MFV5BB Titânio Bivolt,109990,134990,1,136322,multilojaonline,2026-04-22 01:35:47
2026-04-20 19:52:47,1626391209234-01,Cooktops | Fogões e Cooktops | Eletrodomésticos,Cooktop 5 bocas electrolux ke5gr efficient mesa de vidro grade de aço fosco bivolt,62296,69011,1,2045244,loyalt,2026-04-22 01:35:47
2026-04-20 19:51:42,1626391209233-01,Panelas de Arroz | Eletroportáteis Especiais | Eletroportáteis,Panela de Arroz Elétrica Electrolux por Rita Lobo 2L Preta Efficient Visor Glass (ERC10) 127V,20990,30990,1,1108181,electrolux,2026-04-22 01:35:48
2026-04-20 19:46:14,1626391209231-01,Armário | Cozinha | Móveis,Armário Cozinha Completa Golden 6 Portas 1 Gaveta,39900,44334,1,894310,webcontinentalmktplace,2026-04-22 01:35:48
2026-04-20 19:44:45,1626391209230-01,Depilação | Depilação e Aparelhos de Barbear | Cosméticos e Perfumaria,Depilador Philco Aqua Deluxe Plus PDP02R Bivolt,16990,21990,1,1577,Philco,2026-04-22 01:35:48
2026-04-20 19:44:23,1626391209229-01,Ferramentas Elétricas | Materiais de Construção,Parafusadeira e furadeira wap wf12k3.2 bateria 12v bivolt,12900,20990,1,2046288,loyalt,2026-04-22 01:35:48
2026-04-20 19:43:26,1626391209227-01,"Bebedouros | Filtros, Bebedouros e Refrigeradores de Água | Eletroportáteis",Bebedouro Britânia BBE11P Aquaplus para 10L ou 20L Bivolt Bivolt,29990,47990,1,113043,Philco,2026-04-22 01:35:49
2026-04-20 19:39:06,1626391209223-02,Panelas e Utensílios para Cozinhar | Casa e Cozinha,"Panela de pressão clock 4,5 litros eco polida fechamento interno prata",9871,12590,1,2655622,loyalt,2026-04-22 01:35:49
2026-04-20 19:39:06,1626391209223-02,Ferramentas Elétricas | Materiais de Construção,Parafusadeira e furadeira wap wf12k3.2 bateria 12v bivolt,12900,20990,1,2046288,loyalt,2026-04-22 01:35:49
2026-04-20 19:39:06,1626391209223-02,"Cafeteiras e Máquinas de Expresso | Café, Chá e Expresso | Eletroportáteis",Cafeteira elétrica mondial dolce arome vidro c-43-20x-si 20 xícaras 550w – preto/inox,12590,15740,1,2045074,loyalt,2026-04-22 01:35:49
2026-04-20 19:39:06,1626391209223-01,"Mixers | Liquidificadores, Batedeiras e Processadores | Eletroportáteis",Mixer De Alimentos Cinza Lunar Inox 600W 3 Em 1 Copo 700ml Elgin 220V,14118,14118,1,1860863,webcontinentalmktplace,2026-04-22 01:35:49
2026-04-20 19:35:16,1626391209222-01,"TVs | Cinema, TV e Áudio","Smart tv 32"" hd samsung h5000f sistema operacional tizen hdr purcolor",110164,142890,1,2046132,loyalt,2026-04-22 01:35:49
2026-04-20 19:34:30,1626391209221-01,Perfumes | Cosméticos e Perfumaria,Yara lattafa eau de parfum feminino 100ml,32990,42757,1,2310625,loyalt,2026-04-22 01:35:50
2026-04-20 19:30:21,1626391209220-01,Sanduicheiras e Grelhas Elétricas | Eletroportáteis,Sanduicheira Elétrica Cadence Click 110V,9800,11490,1,1777975,webcontinentalmktplace,2026-04-22 01:35:50
2026-04-20 19:30:21,1626391209220-01,Fritadeiras Elétricas | Eletroportáteis,Fritadeira Oster Oven Fryer 12L 3 Em 1 110V,64400,74990,1,1778154,webcontinentalmktplace,2026-04-22 01:35:50
2026-04-20 19:28:21,1626381209219-01,Fornos Elétricos | Eletrodomésticos,Forno elétrico mondial line grand family ii frn-52 com 52 litros – preto,44200,52500,1,2047083,loyalt,2026-04-22 01:35:50
2026-04-20 19:28:21,1626381209219-01,Ar-condicionado | Eletrodomésticos,Ventilador de mesa mondial super power 40cm vsp40 b 6 pás 3 velocidades preto,15590,18655,1,2044903,loyalt,2026-04-22 01:35:50
2026-04-20 19:22:45,1626381209213-01,Guarda-Roupa E Roupeiros | Quarto | Móveis,Guarda-roupa Casal Bergamo 6 Portas 9 Gavetas - Branco,67142,78990,1,1587071,webcontinentalmktplace,2026-04-22 01:35:50
2026-04-20 19:21:52,1626381209212-01,"Formas | Assadeiras, Fôrmas e Travessas | Casa e Cozinha",Conjunto de travessas refratárias marinex em vidro - 10 peças,11847,11847,1,2135902,loyalt,2026-04-22 01:35:51
2026-04-20 19:20:41,1626381209211-01,Fornos de Micro-Ondas | Eletrodomésticos,Micro-ondas Britânia 28L Branco Espelhado Limpa Fácil BMO30 127V,47990,64990,1,2082586,Philco,2026-04-22 01:35:51
2026-04-20 19:16:25,1626381209207-01,"Formas | Assadeiras, Fôrmas e Travessas | Casa e Cozinha",Conjunto de travessas refratárias marinex em vidro - 10 peças,11847,11847,1,2135902,loyalt,2026-04-22 01:35:51
2026-04-20 19:16:25,1626381209207-01,"Liquidificadores | Liquidificadores, Batedeiras e Processadores | Eletroportáteis",Liquidificador mondial turbo power l-99 fb copo san cristal 3 velocidades 550w preto,9990,10989,1,2046388,loyalt,2026-04-22 01:35:51
