creationDate,orderId,categoryName,name,price,listPrice,quantity,productId,seller,data_extracao
2026-07-14 11:10:30,1646701256159-01,Bolsas | Bolsas e Mochilas,Bolsa Mala Fitness Esportiva de Viagem 51x26x22cm Impermeável com Compartimento para Calçado Azul,6750,6750,1,3111935,webcontinentalmktplace,2026-07-18 00:22:02
2026-07-14 11:09:55,1646701256158-01,Fritadeiras Elétricas | Eletroportáteis,"Air Fryer Fritadeira Elétrica Extream 5,5L Preto e Cobre, Air Fryer Fritadeira Elétrica Digital Extream 5,5L Preto e Cobre, 220v",29900,39900,1,1360370,tetrix,2026-07-18 00:22:02
2026-07-14 11:05:30,1646701256157-01,Escova Rotativa Modeladora | Cuidados com o Cabelo | Cosméticos e Perfumaria,Escova Secadora Britânia 4 em 1 BELLA01 1300W Bivolt Bivolt,9990,15990,1,229761,Philco,2026-07-18 00:22:03
2026-07-14 11:05:30,1646701256157-01,Chapinhas e Pranchas | Cuidados com o Cabelo | Cosméticos e Perfumaria,Prancha Britânia Bivolt Temperatura até 230° Bella BPRE01A Bivolt,11990,24990,1,1569978,Philco,2026-07-18 00:22:03
2026-07-14 10:26:31,1646691256156-01,Motorola | Smartphone | Celulares e Smartphones,Smartphone Motorola Moto G35 5G 256GB 12GB de RAM Coral,104900,134900,1,1455312,webfones,2026-07-18 00:22:04
2026-07-14 10:17:42,1646691256154-01,Limpeza Doméstica | Casa e Cozinha,Varal de Chão Slim de Aço Preto - MOR,4990,4990,1,1479977,minipreco,2026-07-18 00:22:04
2026-07-14 10:17:42,1646691256154-02,Conjuntos e Kits | Cuidados com o Cabelo | Cosméticos e Perfumaria,Kit Travel Shine Rosa Philco – Prancha + Secador Bivolt,12990,18990,1,991,Philco,2026-07-18 00:22:05
2026-07-14 10:02:31,1646691256153-01,Academia | Esporte e Lazer,Bicicleta Ergométrica Vertical Gallant Flow (GBE1HBTB-PT),54700,68375,1,1194797,webcontinental,2026-07-18 00:22:05
2026-07-14 09:59:09,1646691256152-01,"Acessórios de Áudio e Vídeo para Casa | Cinema, TV e Áudio",Fone de Ouvido sem Fio Aquilae Compatível com Iphone 7 8 X Xr Xs 11 12 13 14 15 16 in-ear,3682,3682,2,2975863,webcontinentalmktplace,2026-07-18 00:22:06
2026-07-14 09:46:14,1646691256147-01,"Chaleiras Elétricas | Café, Chá e Expresso | Eletroportáteis",Chaleira Elétrica Mondial Pratic Inox Ce-06 127v Inox,9990,13990,1,879862,webcontinentalmktplace,2026-07-18 00:22:06
2026-07-14 09:42:19,1646691256146-01,Lavadoras de Alta Pressão | Eletrodomésticos,Lavadora de Alta Pressão 1800psi Philco Force 1600W PLP2800 127V,35990,59990,1,2335372,Philco,2026-07-18 00:22:07
2026-07-14 09:42:17,1646691256144-02,Shampoos e Condicionadores | Higiene | Saúde e Bem Estar,Condicionador Eudora 200ml 4D Reconstrói Fios COND EUDORA 200ML 4D RECONSTROI FIOS,4089,5499,2,715927,farmaciaindiana,2026-07-18 00:22:07
2026-07-14 09:42:17,1646691256144-01,Shampoos e Condicionadores | Higiene | Saúde e Bem Estar,Shampoo Siàge Eudora Reconstrói os Fios Frasco 400ml,7299,7299,2,903686,farmaconde,2026-07-18 00:22:08
2026-07-14 09:34:29,1646691256142-01,Fritadeiras Elétricas | Eletroportáteis,Fritadeira elétrica sem Óleo air fryer mondial afn40bi family inox 4l preta/inox,25647,30136,1,2046394,loyalt,2026-07-18 00:22:09
2026-07-14 09:08:17,1646681256134-01,Hidratante | Higiene | Saúde e Bem Estar,NIVEA Loção Deo-Hidratante Corporal Milk Hidratação Profunda 200ml,1409,2190,1,131322,farmaciaindiana,2026-07-18 00:22:09
2026-07-14 09:08:17,1646681256134-01,"Sabonetes Líquidos, Óleos e Loções | Corpo e Banho | Cosméticos e Perfumaria",Bio-Oil 60ml Bio Oil 60 Ml.,4919,6299,1,853784,farmaciaindiana,2026-07-18 00:22:09
2026-07-14 09:08:17,1646681256134-01,Desodorante | Higiene | Saúde e Bem Estar,Desodorante Antitranspirante Aerossol Nivea Men Derma Control Defende 150ml,1199,1799,1,2118894,farmaciaindiana,2026-07-18 00:22:09
2026-07-14 09:08:17,1646681256134-01,Desodorante | Higiene | Saúde e Bem Estar,NIVEA Desodorante Antitranspirante Roll On Pearl & Beauty 50ml Desodorante Nivea Rollon Pearl Beauty 50ml,799,1099,1,833143,farmaciaindiana,2026-07-18 00:22:09
2026-07-14 09:03:42,1646681256131-01,Aspiradores de Pó e Água | Eletroportáteis,Aspirador de Pó Vertical Sem Fio Electrolux Ergorapido 2 em 1 Cyclone até 21 min Branco (ERG21) Bivolt,50990,107990,1,1107380,electrolux,2026-07-18 00:22:10
2026-07-14 09:03:12,1646681256130-01,"Liquidificadores | Liquidificadores, Batedeiras e Processadores | Eletroportáteis","Liquidificador Britânia BLQE01 2 copos 2,6L 900W 127V",12990,18990,1,263867,Philco,2026-07-18 00:22:10
2026-07-14 08:55:22,1646681256122-01,Computadores e Informática | Teste,TESTE - NÃO COMPRAR TESTE DOAÇÃO - NÃO COMPRAR TESTE DOAÇÃO,10,10,1,22387,1,2026-07-18 00:22:11
2026-07-14 08:53:46,1646681256117-01,Computadores e Informática | Teste,TESTE - NÃO COMPRAR TESTE DOAÇÃO - NÃO COMPRAR TESTE DOAÇÃO,10,10,2,22387,1,2026-07-18 00:22:12
2026-07-14 08:49:28,1646681256115-01,"Áudio | Cinema, TV e Áudio",Fone de ouvido philips tat2500bk/00 intra-auricular true wireless bluetooth cancelamento de ruído 24h bateria preto,16958,19889,1,2047199,loyalt,2026-07-18 00:22:12
2026-07-14 08:38:24,1646681256101-01,Cortinas e Varões | Instalações para Casa | Materiais de Construção,"Cortina Microfibra Com Voil 3,00x2,50 Para Trilho Suíço branco",16665,20323,1,1193145,webcontinentalmktplace,2026-07-18 00:22:13
2026-07-14 08:27:59,1646671256099-02,"Chaleiras Elétricas | Café, Chá e Expresso | Eletroportáteis","Chaleira Elétrica Inox 1,8l 1000w Base Removível CE-01 Agratto Chaleira Elétrica Inox 1,8l 1000w Base Removível CE-02 Agratto 220V",5885,5885,1,828554,webcontinentalmktplace,2026-07-18 00:22:13
2026-07-14 08:27:59,1646671256099-01,"Liquidificadores | Liquidificadores, Batedeiras e Processadores | Eletroportáteis",Liquidificador Britânia BLQ1380P Pro Maxx 6 Inox 3L 1200W 220V,13990,20990,1,18045,Philco,2026-07-18 00:22:14
2026-07-14 08:06:20,1646671256093-01,Fritadeiras Elétricas | Eletroportáteis,Air Fryer Britânia Compacta 2L 1000W Sem Óleo BAF20A 220V,20990,25990,1,1380991,Philco,2026-07-18 00:22:15
2026-07-14 08:02:05,1646671256092-01,Aspiradores de Pó e Água | Eletroportáteis,Aspirador de Pó Vertical Britânia Filtro Ciclone 1400W BAS1500V 220V,13990,21990,1,129584,Philco,2026-07-18 00:22:15
2026-07-14 08:01:37,1646671256091-01,"Mixers | Liquidificadores, Batedeiras e Processadores | Eletroportáteis",Mixer britânia bmx400p 3 em 1 400w - preto,17390,20691,1,2137875,loyalt,2026-07-18 00:22:16
2026-07-14 07:29:08,1646661256088-01,Bonecos | Meninos | Brinquedos,Kit 4 Bonecos Dragon Ball Z Action Figure Esféras Do Dragão,4990,4990,1,1881131,webcontinentalmktplace,2026-07-18 00:22:16
2026-07-14 07:22:28,1646661256087-01,Bicicletas | Bicicleta e Ciclismo | Esporte e Lazer,Bicicleta 29 Dropp Sport Aço 21 Marchas Freio A Disco Preto+vermelho,62211,69900,1,1067047,webcontinentalmktplace,2026-07-18 00:22:17
2026-07-14 07:16:38,1646661256086-01,Fritadeiras Elétricas | Eletroportáteis,"Fritadeira elétrica britânia bfr51 gold 5,5l 1500w air flow preta",25647,35890,1,2604477,loyalt,2026-07-18 00:22:18
2026-07-14 07:16:35,1646661256085-01,Bicicletas | Bicicleta e Ciclismo | Esporte e Lazer,Bicicleta 29 Aço 21 Marchas Freio A Disco Branco+preto,62211,69900,1,1103426,webcontinentalmktplace,2026-07-18 00:22:19
2026-07-14 06:55:49,1646661256079-01,"Liquidificadores | Liquidificadores, Batedeiras e Processadores | Eletroportáteis",Liquidificador mondial turbo power l-99 fb copo san cristal 3 velocidades 550w preto,9990,12198,1,2046388,loyalt,2026-07-18 00:22:19
2026-07-14 06:43:19,1646661256077-01,Panelas de Pressão | Panelas e Utensílios para Cozinhar | Casa e Cozinha,"Panela de pressão Grafite Tramontina 4,5L Linha Vancouver",21990,45100,1,25653,funstock,2026-07-18 00:22:20
2026-07-14 06:04:56,1646651256076-01,Cabos USB | Cabos | Computadores e Informática,Cabo De Dados Usb / Tipo-c 5a Carregamento Turbo,900,900,1,3114566,webcontinentalmktplace,2026-07-18 00:22:20
2026-07-14 04:55:26,1646641256074-01,"Liquidificadores | Liquidificadores, Batedeiras e Processadores | Eletroportáteis","Liquidificador electrolux ebl1000 efficient triforce 1000w 2,7l cinza",14990,16390,1,2045267,loyalt,2026-07-18 00:22:21
2026-07-14 04:14:19,1646631256070-01,"Caixas de Som Portáteis | Áudio | Cinema, TV e Áudio",Caixa De Som Altomex Charge5 *bluetooth Al-g20,14590,14590,1,2398528,webcontinentalmktplace,2026-07-18 00:22:21
2026-07-14 03:47:43,1646631256069-01,Tablets | Eletrônicos,"Tablet Positivo Vision Tab 7 Minions - Octa-Core 3GB RAM 64GB, 7” IPS, Android 14  Go, Wi-fi - Capa e Bolsa - Preto",57900,69900,1,1265844,lojapositivo,2026-07-18 00:22:22
2026-07-14 03:35:48,1646631256068-01,Power Bank | Acessórios para Celular | Celulares e Smartphones,Carregador Portátil MDM Inteligente com Display Digital e Cabos Usb C e Lightning,11118,13559,1,3200810,webcontinentalmktplace,2026-07-18 00:22:22
2026-07-14 02:28:15,1646611256065-01,"Baterias | Baterias, Pilhas e Carregadores | Eletrônicos",Bateria De 12v Max Bl1016 Li-ion Makita,21790,21790,1,1584335,loyalt,2026-07-18 00:22:23
2026-07-14 02:24:40,1646611256064-01,Parafusadeiras | Ferramentas Elétricas | Materiais de Construção,Parafusadeira Furadeira De Impacto A Bateria 12 Volts + Carregador - Hp333dwyx3 - Makita,67718,67718,1,2026423,webcontinentalmktplace,2026-07-18 00:22:23
2026-07-14 02:03:35,1646611256062-01,Misturadores | Hidráulico | Materiais de Construção,Torneira Eletrica Loren Easy Lorenzetti 220V 5500W,23810,23810,1,1650519,webcontinentalmktplace,2026-07-18 00:22:24
2026-07-14 01:41:47,1646611256061-01,Celulares e Smartphones,"Smartphone motorola moto g06 4g tela 6,9” 256gb câmera 50mp bege",77532,99900,1,2988250,loyalt,2026-07-18 00:22:24
2026-07-14 01:37:33,1646611256060-01,Motorola | Smartphone | Celulares e Smartphones,"Smartphone motorola moto g06 4g tela 6,9” 128gb câmera 50mp laranja",73350,88778,1,2047101,loyalt,2026-07-18 00:22:25
2026-07-14 00:56:47,1646601256053-01,Escova Rotativa Modeladora | Cuidados com o Cabelo | Cosméticos e Perfumaria,Escova Rotativa Philco 5 em 1 Bivolt 1300W PER03 Bivolt,20990,33990,1,2544170,Philco,2026-07-18 00:22:25
2026-07-14 00:52:24,1646601256051-02,Pele | Cosméticos e Perfumaria,"Kit Loção Hidratante Cetaphil Pele Sensível, Normal a Seca 473ml + Loção de Limpeza 100ml",8990,13490,1,2701008,farmaciaindiana,2026-07-18 00:22:26
2026-07-14 00:52:24,1646601256051-01,Pele | Cosméticos e Perfumaria,Principia kit - protetor solar fps60 + sérum mix-01 + tônico + gel de limpeza + sérum ah-2,27550,29000,1,2072047,loyalt,2026-07-18 00:22:26
2026-07-14 00:52:24,1646601256051-01,"Vitaminas, Minerais e Suplementos | Saúde e Bem Estar",Whey Protein Integralmedica My Whey 900g Pote Morango,12080,15100,1,2271234,loyalt,2026-07-18 00:22:26
2026-07-14 00:44:57,1646601256049-01,"Cafeteiras e Máquinas de Expresso | Café, Chá e Expresso | Eletroportáteis",Cafeteira Elétrica Cadence Single Caf230 Preto-vermelho,10800,10800,1,3039310,webcontinentalmktplace,2026-07-18 00:22:27
2026-07-14 00:44:57,1646601256049-02,"Batedeiras | Liquidificadores, Batedeiras e Processadores | Eletroportáteis",Batedeira mondial premium vermelha bella massa inox b-29 np com 4 velocidades e 500w,11400,11400,1,2046410,loyalt,2026-07-18 00:22:27
2026-07-14 00:36:55,1646601256046-01,"Vitaminas, Minerais e Suplementos | Saúde e Bem Estar",Creatina Integralmedica 120 Cápsulas Sem Sabor,3760,4700,2,2243383,webcontinentalmktplace,2026-07-18 00:22:28
2026-07-14 00:36:55,1646601256046-01,"Colágeno | Vitaminas, Minerais e Suplementos | Saúde e Bem Estar",Ácido Hialurônico Com Colágeno Verisol 60 Comprimidos 1000mg Muwiz,4672,5990,1,1624119,webcontinentalmktplace,2026-07-18 00:22:28
2026-07-14 00:36:55,1646601256046-03,Olhos | Maquiagem | Cosméticos e Perfumaria,Gel para Sobrancelhas Ruby Rose Melu,1118,1118,1,1158773,pensefarma,2026-07-18 00:22:28
2026-07-14 00:36:55,1646601256046-02,"Suplementos | Vitaminas, Minerais e Suplementos | Saúde e Bem Estar",Complex Magnésio 3 Em 1 Health Labs 60 Cápsulas,3899,3899,2,830839,farmaciaindiana,2026-07-18 00:22:29
2026-07-14 00:09:22,1646591256041-01,Sanduicheiras e Grelhas Elétricas | Eletroportáteis,Grill e Sanduicheira Philco PGR21PI Maxx Clean 1000W 220V,11990,25990,1,3140,Philco,2026-07-18 00:22:30
2026-07-14 00:09:22,1646591256041-02,"Liquidificadores | Liquidificadores, Batedeiras e Processadores | Eletroportáteis",Liquidificador mondial turbo power l-99 fb copo san cristal 3 velocidades 550w preto,9990,11990,1,2046388,loyalt,2026-07-18 00:22:30
2026-07-14 00:08:10,1646591256040-01,Motorola | Smartphone | Celulares e Smartphones,"Smartphone motorola moto g06 4g tela 6,9” 128gb câmera 50mp laranja",73350,88778,1,2047101,loyalt,2026-07-18 00:22:31
2026-07-13 23:50:13,1646591256033-01,Cuidados com o Cabelo | Cosméticos e Perfumaria,Elseve liso dos sonhos kit - condicionador + shampoo + máscara capilar + creme para pentear + sérum leave-in,13599,15925,1,2073406,loyalt,2026-07-18 00:22:31
2026-07-13 23:50:09,1646591256032-01,Cuidados com o Cabelo | Cosméticos e Perfumaria,Secador De Cabelo Britânia BSC1200 Bivolt 1200W SECADOR CAB BRITANIA BSC1200 BIVOLT 1200,6990,13990,1,798872,Philco,2026-07-18 00:22:32
2026-07-13 23:37:13,1646591256027-01,Panelas de Arroz | Eletroportáteis Especiais | Eletroportáteis,Panela de Pressão Elétrica Electrolux por Rita Lobo 6L Preta Experience Digital (PCC20) 220V,67990,81990,1,1107558,electrolux,2026-07-18 00:22:32
2026-07-13 23:28:21,1646581256024-02,Fogões | Fogões e Cooktops | Eletrodomésticos,Fogão 4 Bocas Atlas Coliseum Plus Mesa De Inox A Gás Manual Preto,65005,80900,1,2782165,webcontinentalmktplace,2026-07-18 00:22:33
2026-07-13 23:28:21,1646581256024-01,Cozinhas Completas | Cozinha | Móveis,Armário de Cozinha Completa Madesa Emilly 293001 com Balcão e Paneleiro Cor:Rustic/Branco,103999,153990,1,43145,madesacms,2026-07-18 00:22:33
2026-07-13 23:19:13,1646581256022-01,Bicicletas | Bicicleta e Ciclismo | Esporte e Lazer,Bicicleta 29 Aço 21 Marchas Freio A Disco Branco+preto,62211,69900,1,1103426,webcontinentalmktplace,2026-07-18 00:22:34
2026-07-13 23:18:44,1646581256020-01,Máquinas de Lavar Roupas | Máquinas de Lavar e Secadoras | Eletrodomésticos,Máquina de lavar brastemp bwf14ab 14kg smart sensor ciclo tira mancha cesto inox branca,192526,222821,1,2046471,loyalt,2026-07-18 00:22:34
2026-07-13 23:18:11,1646581256019-01,Escova Rotativa Modeladora | Cuidados com o Cabelo | Cosméticos e Perfumaria,Escova Rotativa Philco 5 em 1 Bivolt 1300W PER03 Bivolt,20990,33990,1,2544170,Philco,2026-07-18 00:22:35
2026-07-13 23:16:29,1646581256017-01,"Liquidificadores | Liquidificadores, Batedeiras e Processadores | Eletroportáteis",Liquidificador mondial turbo power l-99 fb copo san cristal 3 velocidades 550w preto,9990,12198,1,2046388,loyalt,2026-07-18 00:22:36
2026-07-13 23:13:26,1646581256016-01,Cobertores e Mantas | Cama e Banho | Casa e Cozinha,Cobertor Flannel Casal Lar E Lazer Verde UN,4999,4999,1,2656292,rovitex,2026-07-18 00:22:36
2026-07-13 23:12:33,1646581256015-01,Cama e Banho | Casa e Cozinha,Coberdrom apollo solteiro sherpa manta flannel toque lã de carneiro - verde alecrim,13990,13990,1,2315344,loyalt,2026-07-18 00:22:37
2026-07-13 23:11:00,1646581256013-01,Máquinas de Lavar Roupas | Máquinas de Lavar e Secadoras | Eletrodomésticos,Máquina de lavar brastemp bwf14ab 14kg smart sensor ciclo tira mancha cesto inox branca,192526,222821,1,2046471,loyalt,2026-07-18 00:22:37
2026-07-13 23:09:13,1646581256012-01,Hidráulico | Materiais de Construção,Torneira Elétrica Maxi Ultra 220v - Lorenzetti Branco,14890,14890,1,2581325,webcontinentalmktplace,2026-07-18 00:22:38
2026-07-13 23:03:14,1646581256009-01,Torradeiras | Eletroportáteis,Torradeira Elétrica Electrolux Inox Preta Efficient com 8 Níveis de Tostagem (ETS10) 127V,16990,20990,1,1107323,electrolux,2026-07-18 00:22:39
2026-07-13 23:02:07,1646581256008-01,Depilação | Depilação e Aparelhos de Barbear | Cosméticos e Perfumaria,Depilador Philco Aqua Deluxe Plus PDP02R Bivolt,11990,21990,1,1577,Philco,2026-07-18 00:22:39
2026-07-13 22:34:53,1646581255997-01,Fritadeiras Elétricas | Eletroportáteis,"Fritadeira Air Fryer Britânia 4,2L 1500W BFR38 Dura Mais 127V",21990,30990,1,419530,Philco,2026-07-18 00:22:40
2026-07-13 22:34:36,1646581255996-01,Varal | Utilidades Domésticas | Casa e Cozinha,VARAL CHAO ABAS BUENOS AIRES ACO PRETO 1.33M X 53CM X 95CM 9981 MAXEB,5990,5990,1,2117336,minipreco,2026-07-18 00:22:40
2026-07-13 22:34:36,1646581255996-01,Chuveiros e Duchas | Hidráulico | Materiais de Construção,Chuveiro Maxi Ducha Ultra Lorenzetti 127v~5500w,9499,9499,1,1637271,minipreco,2026-07-18 00:22:40
2026-07-13 22:27:27,1646571255991-01,Fritadeiras Elétricas | Eletroportáteis,Air Fryer Philco 16L 4 em 1 Painel Digital PAF16A 127V,59990,100990,1,1359968,Philco,2026-07-18 00:22:41
2026-07-13 22:21:48,1646571255985-01,"Talheres e Porta-Talheres | Louça, Copos e Talheres | Casa e Cozinha",JOGO GARFO MESA TULUM INOX TURQUESA 3UN 23272310 TRAMONTINA,95,799,6,801222,minipreco,2026-07-18 00:22:41
2026-07-13 22:21:48,1646571255985-01,"Talheres e Porta-Talheres | Louça, Copos e Talheres | Casa e Cozinha",JOGO COLHER MESA TULUM INOX PRETO 3UN 23273360 TRAMONTINA,95,799,10,797237,minipreco,2026-07-18 00:22:41
2026-07-13 22:19:34,1646571255981-01,Fritadeiras Elétricas | Eletroportáteis,Air Fryer Oven Electrolux por Rita Lobo 12L Digital Grafite Experience 1700W (EAF85) 127V,59990,87990,1,1804759,electrolux,2026-07-18 00:22:42
2026-07-13 22:19:34,1646571255981-02,Sanduicheiras e Grelhas Elétricas | Eletroportáteis,Mini grill elétrico oster ogrl230 2 em 1 com abertura 180° - inox,15990,18530,1,2047113,loyalt,2026-07-18 00:22:42
2026-07-13 22:18:18,1646571255980-01,"Cafeteiras e Máquinas de Expresso | Café, Chá e Expresso | Eletroportáteis",Moedor de grãos black+decker mg200 gourmand gris 220w inox,22990,26290,1,2046434,loyalt,2026-07-18 00:22:43
2026-07-13 22:15:36,1646571255978-01,Cuidados com o Cabelo | Cosméticos e Perfumaria,Máquina de cortar cabelo bcr18t 18w titanium britânia com 9 acessórios 127v,12090,12090,1,2107247,loyalt,2026-07-18 00:22:43
2026-07-13 22:04:28,1646571255971-01,Sanduicheiras e Grelhas Elétricas | Eletroportáteis,Grill e Sanduicheira Philco PGR21PI Maxx Clean 1000W 127V,11990,25990,1,3140,Philco,2026-07-18 00:22:44
2026-07-13 22:04:08,1646571255970-01,Estante | Sala de Estar | Móveis,Rack para TV até 80 Polegadas 180cm 2 Portas 1 Gaveta Branco/Rustic Toronto Madesa Cor:Branco/Rustic,49999,59999,1,2038387,madesacms,2026-07-18 00:22:45
2026-07-13 21:57:41,1646571255967-01,Ferramentas Elétricas | Materiais de Construção,Lavadora de alta pressão electrolux easywash 1650psi 1400w,31341,38840,1,2046757,loyalt,2026-07-18 00:22:46
2026-07-13 21:55:13,1646571255965-01,Smartphone | Celulares e Smartphones,USADO iPhone 11 64 GB Branco Muito Bom,128900,128900,1,1502391,armazemcircular,2026-07-18 00:22:46
2026-07-13 21:47:14,1646571255959-01,Sanduicheiras e Grelhas Elétricas | Eletroportáteis,Grill e Sanduicheira Philco PGR21PI Maxx Clean 1000W 127V,11990,25990,1,3140,Philco,2026-07-18 00:22:47
2026-07-13 21:43:37,1646571255955-01,Escova Rotativa Modeladora | Cuidados com o Cabelo | Cosméticos e Perfumaria,Escova Secadora Britânia 4 em 1 BELLA01 1300W Bivolt Bivolt,9990,15990,1,229761,Philco,2026-07-18 00:22:47
2026-07-13 21:39:04,1646571255951-01,Camas | Quarto | Móveis,Cama Baú Solteiro 88 Tecido Sintético Branco Com Colchão Toronto Molas Ensacadas Branco D33,103114,119900,1,1732196,webcontinentalmktplace,2026-07-18 00:22:48
2026-07-13 21:35:02,1646571255950-01,Penteadeiras | Quarto | Móveis,Penteadeira Moderna Elegante Floratta Branca,21658,30080,1,1193181,webcontinentalmktplace,2026-07-18 00:22:48
2026-07-13 21:29:14,1646561255949-01,Ventiladores | Eletroportáteis,Ventilador Britânia BVT301 Tecnologia Maxx Force 60W 127V,9990,19990,1,155335,Philco,2026-07-18 00:22:49
2026-07-13 21:19:57,1646561255944-01,Freezer | Geladeiras e Freezers | Eletrodomésticos,Freezer Vertical Electrolux Efficient 212L SmartBivolt Inverter (FEI23T) Bivolt,279900,279900,1,3295764,electrolux,2026-07-18 00:22:50
2026-07-13 21:17:46,1646561255943-01,"Liquidificadores | Liquidificadores, Batedeiras e Processadores | Eletroportáteis",Liquidificador mondial turbo power l-99 fb copo san cristal 3 velocidades 550w preto,9990,11990,1,2046388,loyalt,2026-07-18 00:22:50
2026-07-13 21:16:28,1646561255941-01,Máquinas de Lavar Roupas | Máquinas de Lavar e Secadoras | Eletrodomésticos,"Tanquinho de roupas semiautomático 20,1kg colormaq lcs20 com 6 programas de lavagem e reúso de Água - prata",62900,77667,1,2044981,loyalt,2026-07-18 00:22:51
2026-07-13 21:15:11,1646561255940-01,"Batedeiras | Liquidificadores, Batedeiras e Processadores | Eletroportáteis",Batedeira Planetária Philco Concept 5L 900W Turbo PBP90A 220V,29990,56990,1,1999713,Philco,2026-07-18 00:22:51
2026-07-13 21:12:53,1646561255938-01,Depuradores e Coifas | Eletrodomésticos,Coifa De Parede Oster Inox Touch Control 90cm 220V,145410,179900,1,1778144,webcontinentalmktplace,2026-07-18 00:22:51
2026-07-13 21:12:46,1646561255937-01,Iphone | Smartphone | Celulares e Smartphones,"iPhone 17 Pro Max (256GB) Laranja-Cósmico, Tela de 6,9"", 5G e Câmera de 48MP",930715,1010000,1,2108347,shophub,2026-07-18 00:22:52
2026-07-13 21:06:41,1646561255933-02,Medicamentos,Cloridrato Sibutramina 15mg com 30 Cápulas Genérico Eurofarma (B2),5174,9447,1,1644065,pensefarma,2026-07-18 00:22:52
2026-07-13 21:06:41,1646561255933-03,Varal | Utilidades Domésticas | Casa e Cozinha,VARAL CHAO ABAS BUENOS AIRES ACO PRETO 1.33M X 53CM X 95CM 9981 MAXEB,5990,5990,3,2117336,minipreco,2026-07-18 00:22:53
2026-07-13 21:06:41,1646561255933-01,Bolsas | Bolsas e Mochilas,Bolsa Feminina OEM Estilo Sacola com Fecho de Zíper 32 X 34 cm Marfim,4125,4125,1,3111309,webcontinentalmktplace,2026-07-18 00:22:53
2026-07-13 21:06:16,1646561255931-01,Travesseiros | Cama e Banho | Casa e Cozinha,Travesseiro Altenburg Fresh Ice Azul Branco UN,7999,11999,2,823956,rovitex,2026-07-18 00:22:54
2026-07-13 21:06:16,1646561255931-01,Roupa de Cama | Cama e Banho | Casa e Cozinha,Jogo De Fronhas Divertidas 2 Peças Vivaldi Vermelho UN,2699,6999,1,2636232,rovitex,2026-07-18 00:22:54
2026-07-13 21:05:39,1646561255930-01,Panificadora Elétrica | Eletroportáteis Especiais | Eletroportáteis,Panificadora Britânia Digital 12 Programas 3L BPNE01 220V,54990,83990,1,765836,Philco,2026-07-18 00:22:54
2026-07-13 21:03:30,1646561255929-01,Ventiladores | Eletroportáteis,Ventilador de mesa mondial maxis v30mxw 30cm 6 pás 3 velocidades 50w branco / azul,11900,11900,1,2044905,loyalt,2026-07-18 00:22:55
2026-07-13 21:02:37,1646561255928-01,Fornos de Micro-Ondas | Eletrodomésticos,Micro-ondas Electrolux 20L Branco com Função Tira Odor e Descongelar (MTO30) 127V,51900,73900,1,1107434,electrolux,2026-07-18 00:22:56
2026-07-13 21:02:36,1646561255927-01,Panelas e Utensílios para Cozinhar | Casa e Cozinha,Jogo de panelas tramontina ravena 5 peças alumínio tampa vidro starflon max azul,27990,30890,1,2048057,loyalt,2026-07-18 00:22:56
2026-07-13 20:45:24,1646561255924-01,Centrífugas de suco e alimento | Espremedores e Centrífugas | Eletroportáteis,Espremedor de frutas mondial premium e-02 - preto,6170,7340,1,2045149,loyalt,2026-07-18 00:22:57
2026-07-13 20:42:30,1646561255921-01,Smartphone | Celulares e Smartphones,USADO iPhone 11 128 GB Branco Muito Bom,149900,149900,1,1565153,armazemcircular,2026-07-18 00:22:57
2026-07-13 20:41:13,1646561255918-01,Cozinha Industrial | Eletrodomésticos,Espremedor de Limão CK6447 em Alumínio Resistente Compacto para Uso Diário na Cozinha Clink,2999,2999,1,3504513,webcontinentalmktplace,2026-07-18 00:22:58
2026-07-13 20:38:57,1646561255915-01,Guarda-Roupa E Roupeiros | Quarto | Móveis,Guarda-Roupa Solteiro 4 Portas 2 Gavetas Atalaia Evidência Móveis Cinamomo S/V,55590,79990,1,325654,multilojaonline,2026-07-18 00:22:58
2026-07-13 20:38:16,1646561255914-01,Aspiradores de Pó e Água | Eletroportáteis,Aspirador de Pó Philco PAS4000V Power Clean 127V,19990,44990,1,1027,Philco,2026-07-18 00:22:59
2026-07-13 20:35:32,1646561255909-01,Fornos Elétricos | Eletrodomésticos,Forno Elétrico Britânia 10L BFE11 2 Resistências 230° 127V,19990,23990,1,814832,Philco,2026-07-18 00:22:59
2026-07-13 20:32:24,1646561255908-01,Acessórios Sexuais | Cuidado Sexual | Saúde e Bem Estar,Vibrador Av Lamber Língua em Silicone para Estímulo do Ponto g com Frequência Ajustável OEM,6448,6448,1,3004159,webcontinentalmktplace,2026-07-18 00:23:00
2026-07-13 20:27:14,1646551255904-01,Aspiradores de Pó e Água | Eletroportáteis,Aspirador de Pó Philco PAS4000V Power Clean 220V,19990,44990,1,1027,Philco,2026-07-18 00:23:00
2026-07-13 20:21:05,1646551255902-01,Escova Rotativa Modeladora | Cuidados com o Cabelo | Cosméticos e Perfumaria,Escova Rotativa Philco 5 em 1 Bivolt 1300W PER03 Bivolt,20990,33990,1,2544170,Philco,2026-07-18 00:23:01
2026-07-13 20:17:01,1646551255898-01,Hidratante | Higiene | Saúde e Bem Estar,Perfume Ameerat Al Arab Asdaaf Edp Feminino 100ml,17690,17690,1,2531856,webcontinentalmktplace,2026-07-18 00:23:02
2026-07-13 20:17:01,1646551255898-01,Hidratante | Higiene | Saúde e Bem Estar,Perfume Manasik Al Arab Rose Edp Feminino 100ml,9390,9390,1,2829962,webcontinentalmktplace,2026-07-18 00:23:02
2026-07-13 20:13:53,1646551255897-01,Iphone | Smartphone | Celulares e Smartphones,iPhone 16 Apple (128GB) Branco + Fonte Turbo 20W Original,640200,760000,2,1895787,shophub,2026-07-18 00:23:02
2026-07-13 20:10:47,1646551255896-01,Panelas e Utensílios para Cozinhar | Casa e Cozinha,Jogo de panelas tramontina sicilia 5 peças revestimento antiaderente starflon excellent avelã,51397,70680,1,2048040,loyalt,2026-07-18 00:23:02
2026-07-13 20:09:08,1646551255895-01,Estante | Sala de Estar | Móveis,Estante Livreiro Madesa 6908 com 6 Nichos Cinza Cor:Branco,34999,49990,1,3326,madesacms,2026-07-18 00:23:03
