creationDate,orderId,categoryName,name,price,listPrice,quantity,productId,seller,data_extracao
2026-07-15 14:57:44,1646981256887-02,Roupa de Cama | Cama e Banho | Casa e Cozinha,Jogo De Cama Casal Floral 200 Fios Lar e Lazer Verde UN,5999,7999,1,2329795,rovitex,2026-07-18 00:19:06
2026-07-15 14:57:44,1646981256887-02,Roupa de Cama | Cama e Banho | Casa e Cozinha,Jogo De Cama Casal Floral 200 Fios Lar E Lazer Azul UN,5999,7999,1,2451660,rovitex,2026-07-18 00:19:06
2026-07-15 14:57:44,1646981256887-02,Roupa de Cama | Cama e Banho | Casa e Cozinha,Lençol Casal Com Elástico Liso Vivaldi Preto UN,4818,10499,1,73452,rovitex,2026-07-18 00:19:06
2026-07-15 14:57:44,1646981256887-02,Roupa de Cama | Cama e Banho | Casa e Cozinha,Fronha Avulsa Lisa Vivaldi Preto UN,1063,2999,2,108936,rovitex,2026-07-18 00:19:06
2026-07-15 14:57:44,1646981256887-02,Cobertores e Mantas | Cama e Banho | Casa e Cozinha,Manta Flannel Casal Lar E Lazer Cinza UN,4999,4999,1,2655972,rovitex,2026-07-18 00:19:06
2026-07-15 14:57:44,1646981256887-01,Tapetes | Decoração | Casa e Cozinha,Tapete Sala Felpudo Peludo Bege 200 X 240 Cm,17100,17100,1,1072709,webcontinentalmktplace,2026-07-18 00:19:07
2026-07-15 14:55:05,1646981256885-01,Computadores de Mesa | Computadores e Informática,"Computador Completo Tob Intel Core I3 Ssd 240gb Memória 8gb Windows 10 Pro Trial + Teclado E Mouse + Monitor 19"" Desktop",105559,131949,1,1513131,webcontinentalmktplace,2026-07-18 00:19:08
2026-07-15 14:53:05,1646981256884-01,Mamadeira e Acessórios | Bebês e Infantil,Mamadeira Mam Easy Start 2 Unidades Rosa,12589,16490,1,1044752,farmaciaindiana,2026-07-18 00:19:09
2026-07-15 14:53:04,1646981256883-01,Cooktops | Fogões e Cooktops | Eletrodomésticos,Cooktop Atlas 5 Bocas Ágile Up Mesa de Vidro Preto Bivolt,39990,51990,1,1965338,multilojaonline,2026-07-18 00:19:09
2026-07-15 14:51:40,1646981256882-01,"Batedeiras | Liquidificadores, Batedeiras e Processadores | Eletroportáteis",Batedeira mondial prática black b-44 com 3 velocidades – preta,7990,10957,2,2046400,loyalt,2026-07-18 00:19:10
2026-07-15 14:38:19,1646981256874-01,Fritadeiras Elétricas | Eletroportáteis,AirFryer Gallant Pizza MultiOven 127V (GFE18OPTA-PT127),52900,66125,1,2557356,webcontinental,2026-07-18 00:19:10
2026-07-15 14:33:46,1646981256873-01,"Alto-Falantes | Áudio | Cinema, TV e Áudio",Caixa de Som Speaker Philco PBS220BT 220W Preto Bivolt,51990,54990,1,1965891,multilojaonline,2026-07-18 00:19:11
2026-07-15 14:30:48,1646981256871-01,Fraldas | Bebês e Infantil,Fralda Babysec Premium Hiper Tamanho M 68 Unidades,6990,7990,1,843061,farmaciaindiana,2026-07-18 00:19:12
2026-07-15 14:14:58,1646971256868-01,Cobertores e Mantas | Cama e Banho | Casa e Cozinha,Coberdrom Pele De Carneiro Sherpa Everest Queen 01 Peça - Marinho,16016,20020,1,1215591,webcontinentalmktplace,2026-07-18 00:19:12
2026-07-15 14:13:56,1646971256864-02,Rack Com Painel | Sala de Estar | Móveis,Rack com Painel para TV até 65 Polegadas 2 Portas Cronos Madetec Cinamomo/Off White S/V,52590,63990,1,733620,multilojaonline,2026-07-18 00:19:13
2026-07-15 14:13:56,1646971256864-01,"Processadores de Alimentos | Liquidificadores, Batedeiras e Processadores | Eletroportáteis",Processador Philco 420W Jarra Para 500ml PMN04A 110V,11990,29690,1,2045902,webcontinentalmktplace,2026-07-18 00:19:13
2026-07-15 14:10:50,1646971256863-01,Ferramentas Elétricas | Materiais de Construção,Furadeira Impacto 1/2'' Fiv 519 Jogo 19 Acess 127V Vonder,58290,58290,1,901215,guimepa,2026-07-18 00:19:14
2026-07-15 14:04:46,1646971256859-01,Adaptadores | Periféricos | Computadores e Informática,Aquecedor Elétrico Portátil AQC440 1800W Branco com Cinza Cadence 220V,11076,13030,1,3203450,webcontinentalmktplace,2026-07-18 00:19:14
2026-07-15 14:00:56,1646971256857-01,"Talheres e Porta-Talheres | Louça, Copos e Talheres | Casa e Cozinha",JOGO GARFO MESA TULUM INOX TURQUESA 3UN 23272310 TRAMONTINA,95,799,7,801222,minipreco,2026-07-18 00:19:15
2026-07-15 14:00:56,1646971256857-01,"Talheres e Porta-Talheres | Louça, Copos e Talheres | Casa e Cozinha",JOGO COLHER MESA TULUM INOX PRETO 3UN 23273360 TRAMONTINA,95,799,11,797237,minipreco,2026-07-18 00:19:15
2026-07-15 14:00:56,1646971256857-01,"Talheres e Porta-Talheres | Louça, Copos e Talheres | Casa e Cozinha",COLHER CHA BRISA INOX PRETO 23157400 TRAMONTINA,5,199,6,801316,minipreco,2026-07-18 00:19:15
2026-07-15 13:50:58,1646971256855-01,"Liquidificadores | Liquidificadores, Batedeiras e Processadores | Eletroportáteis",Liquidificador Britânia BLQ1380P Pro Maxx 6 Inox 3L 1200W 220V,13990,20990,1,18045,Philco,2026-07-18 00:19:15
2026-07-15 13:49:43,1646971256854-01,Garrafas Térmicas | Utensílios para Cozinha | Casa e Cozinha,Garrafa Térmica Noruega com Cabo de Madeira 1L - BANANA TOYS,3990,7990,1,1605316,minipreco,2026-07-18 00:19:16
2026-07-15 13:48:09,1646971256853-01,Camas | Quarto | Móveis,Beliche Infantil  Branco Grenat Com Escorregador - Gabrielli Móveis,52785,70380,1,2466554,webcontinentalmktplace,2026-07-18 00:19:16
2026-07-15 13:48:00,1646971256852-01,"Aparelhos, Navalhas e Lâminas | Depilação e Aparelhos de Barbear | Cosméticos e Perfumaria",Barbeador Rscw-389B 3W Lamina Inox Recarregável 2V,4490,4490,1,2098303,webcontinentalmktplace,2026-07-18 00:19:17
2026-07-15 13:45:39,1646971256850-01,Motorola | Smartphone | Celulares e Smartphones,Smartphone Motorola Moto G35 5G 256GB 12GB de RAM Coral,104900,134900,1,1455312,webfones,2026-07-18 00:19:17
2026-07-15 13:45:39,1646971256850-02,"Vitaminas, Minerais e Suplementos | Saúde e Bem Estar",Salgadinho Elma Chips Popcorners White Cheddar 57g,1502,1502,2,2329293,pensefarma,2026-07-18 00:19:18
2026-07-15 13:41:59,1646971256848-01,Ferro de Passar e Passadeiras | Eletroportáteis,Passadeira a vapor mondial fast steam vp-09 - branco/azul,16990,19845,1,2045199,loyalt,2026-07-18 00:19:19
2026-07-15 13:36:43,1646971256847-01,"Liquidificadores | Liquidificadores, Batedeiras e Processadores | Eletroportáteis",Liquidificador mondial turbo full black l900fb preto 900w com 5 velocidades,10656,12733,1,2045261,loyalt,2026-07-18 00:19:19
2026-07-15 13:35:25,1646971256845-02,Escova Rotativa Modeladora | Cuidados com o Cabelo | Cosméticos e Perfumaria,Escova Secadora Britânia 4 em 1 BELLA01 1300W Bivolt Bivolt,9990,15990,1,229761,Philco,2026-07-18 00:19:20
2026-07-15 13:35:25,1646971256845-02,Conjuntos e Kits | Cuidados com o Cabelo | Cosméticos e Perfumaria,Kit Travel Shine Rosa Philco – Prancha + Secador Bivolt,12990,18990,1,991,Philco,2026-07-18 00:19:20
2026-07-15 13:35:25,1646971256845-01,"Vitaminas, Minerais e Suplementos | Saúde e Bem Estar",Creatina Monohidratada Dux Sem Sabor 300g,6990,8990,1,834851,farmaciaindiana,2026-07-18 00:19:20
2026-07-15 13:35:12,1646971256844-01,"TVs | Cinema, TV e Áudio",Smart TV 32” Philco PTV32K34RKGB LED Roku TV Bivolt,99990,119990,1,1015290,Philco,2026-07-18 00:19:21
2026-07-15 13:30:02,1646971256843-01,Fritadeiras Elétricas | Eletroportáteis,Air Fryer Philco 16L 4 em 1 Painel Digital PAF16A 127V,59990,100990,1,1359968,Philco,2026-07-18 00:19:21
2026-07-15 13:24:13,1646961256842-01,Chuveiros e Duchas | Hidráulico | Materiais de Construção,Chuveiro Maxi Ducha Ultra Lorenzetti 127v~5500w,9499,9499,1,1637271,minipreco,2026-07-18 00:19:22
2026-07-15 13:23:00,1646961256841-01,Centrífugas de suco e alimento | Espremedores e Centrífugas | Eletroportáteis,Espremedor de frutas mondial premium e-02 - preto,6170,7340,1,2045149,loyalt,2026-07-18 00:19:22
2026-07-15 13:15:54,1646961256838-01,Smartphone | Celulares e Smartphones,Redmi A3 X4 128GB Verde,106799,106799,1,1274982,webcontinentalmktplace,2026-07-18 00:19:23
2026-07-15 13:14:36,1646961256837-01,Enxoval | Bebês e Infantil,Toalha Com Capuz Aplique E Forro Em Fralda Toque Suave,5590,5590,1,1285560,webcontinentalmktplace,2026-07-18 00:19:23
2026-07-15 13:10:33,1646961256833-01,Fornos de Micro-Ondas | Eletrodomésticos,Micro-ondas electrolux efficient me23b função manter aquecido desidratar branco 23l,49800,126106,1,2046755,loyalt,2026-07-18 00:19:24
2026-07-15 13:10:22,1646961256832-01,Corpo e Banho | Cosméticos e Perfumaria,Rosa Selvagem Clareador De Pele Contra Manchas E Estrias 100ml,8590,11176,1,1281988,pensefarma,2026-07-18 00:19:24
2026-07-15 13:10:10,1646961256831-01,Motorola | Smartphone | Celulares e Smartphones,Motorola Moto G52 128GB Branco Bom Usado,79940,79940,1,3308129,eurenovo,2026-07-18 00:19:25
2026-07-15 13:07:27,1646961256827-01,Medicamentos | Pet Shop,"NexGard Cães 25,1-50Kg 1 Tablete",10299,10299,1,852406,farmaciaindiana,2026-07-18 00:19:25
2026-07-15 13:05:44,1646961256826-01,"Mixers | Liquidificadores, Batedeiras e Processadores | Eletroportáteis",Mixer Britânia BMX400P 3 em 1  400W Preto 127V,15990,27990,1,18223,Philco,2026-07-18 00:19:26
2026-07-15 12:53:35,1646961256824-01,Máquinas de Lavar Roupas | Máquinas de Lavar e Secadoras | Eletrodomésticos,Máquina de Lavar Electrolux 15kg Branca Essential Care com Cesto Inox e Jet&Clean (LED15) 127V,199900,316900,1,1107327,electrolux,2026-07-18 00:19:27
2026-07-15 12:52:24,1646961256823-01,Celulares e Smartphones,"Celular samsung galaxy a17 4g tela 6.7"" 128gb super amoled câmera tripla 50mp preto",82889,116900,1,2295619,loyalt,2026-07-18 00:19:27
2026-07-15 12:45:44,1646961256819-01,"Batedeiras | Liquidificadores, Batedeiras e Processadores | Eletroportáteis",Batedeira Planetária Philco Concept 5L 900W Turbo PBP90A - 220V,29990,56090,1,2121986,webcontinentalmktplace,2026-07-18 00:19:27
2026-07-15 12:43:59,1646961256817-01,"Talheres e Porta-Talheres | Louça, Copos e Talheres | Casa e Cozinha",Faqueiro Inox Tramontina Búzios 24 Peças,6490,15900,1,26116,funstock,2026-07-18 00:19:28
2026-07-15 12:38:27,1646961256815-01,"Liquidificadores | Liquidificadores, Batedeiras e Processadores | Eletroportáteis",Liquidificador mondial turbo power l-99 fb copo san cristal 3 velocidades 550w preto,9990,11990,1,2046388,loyalt,2026-07-18 00:19:28
2026-07-15 12:32:27,1646961256813-01,Colchões | Quarto | Móveis,Colchão Solteiro 88cm Espuma D20 Supreme Gazin Marrom S/V,24590,24590,1,1965724,multilojaonline,2026-07-18 00:19:29
2026-07-15 12:29:49,1646951256812-01,Panelas | Panelas e Utensílios para Cozinhar | Casa e Cozinha,"Panela de Pressão Magnific Vermelha 4,5L - ALCAST",12257,17880,2,1154606,loyalt,2026-07-18 00:19:29
2026-07-15 12:25:51,1646951256810-01,Aspiradores de Pó e Água | Eletroportáteis,Aspirador de pó e Água wap gtw10 com bocal de sopro 10 litros - 1400w,22408,31624,1,2046355,loyalt,2026-07-18 00:19:30
2026-07-15 12:18:54,1646951256808-01,Secador de Cabelo | Cuidados com o Cabelo | Cosméticos e Perfumaria,Secador de Cabelos Britânia Bivolt 2100W BSC2200 Bivolt,9990,19990,1,1132265,Philco,2026-07-18 00:19:30
2026-07-15 12:05:39,1646951256803-01,Mochilas | Bolsas e Mochilas,Mochila OEM Feminina em Tecido Oxford Grande à Prova D'água Rosa para Trabalho Estudos e Viagens,7498,7498,1,2966495,webcontinentalmktplace,2026-07-18 00:19:31
2026-07-15 12:00:25,1646951256799-01,Varal | Utilidades Domésticas | Casa e Cozinha,VARAL CHAO ABAS BUENOS AIRES ACO PRETO 1.33M X 53CM X 95CM 9981 MAXEB,5990,5990,2,2117336,minipreco,2026-07-18 00:19:31
2026-07-15 11:47:58,1646951256796-01,Fornos Elétricos | Eletrodomésticos,Forno Elétrico Britânia BFE41P 36L 1500W 127V,39590,39590,1,125563,webcontinentalmktplace,2026-07-18 00:19:32
2026-07-15 11:36:54,1646951256795-01,Escova Rotativa Modeladora | Cuidados com o Cabelo | Cosméticos e Perfumaria,Escova Secadora Britânia BEC02PR Bivolt 4 em 1 1300W Bivolt,8990,19990,1,155346,Philco,2026-07-18 00:19:32
2026-07-15 11:17:23,1646941256785-01,Aquecedores | Eletroportáteis,Aquecedor Britânia AB1500P 2 em 1 127V,13990,17990,1,136434,Philco,2026-07-18 00:19:33
2026-07-15 11:16:55,1646941256783-01,"Cafeteiras e Máquinas de Expresso | Café, Chá e Expresso | Eletroportáteis",Cafeteira Britânia 18 Cafezinhos BCF19 Jarra De Vidro 550W 110V,9990,17590,1,2523294,webcontinentalmktplace,2026-07-18 00:19:33
2026-07-15 11:16:55,1646941256783-01,Fritadeiras Elétricas | Eletroportáteis,"Air Fryer Britânia 4,2L Dura Mais 1500W BFR38 110V",22990,27490,1,1778319,webcontinentalmktplace,2026-07-18 00:19:33
2026-07-15 11:16:55,1646941256783-02,"Talheres e Porta-Talheres | Louça, Copos e Talheres | Casa e Cozinha",FAQUEIRO RIVIERA VERMELHO 16PCS 6025-359 BRINOX,1895,3990,1,853969,minipreco,2026-07-18 00:19:34
2026-07-15 11:15:42,1646941256782-01,Ventilador de parede | Eletrodomésticos,Exaustor Ventilador Industrial Axial 30cm Premium - Ventisol Voltagem:220V,22990,22990,1,2330195,webcontinentalmktplace,2026-07-18 00:19:35
2026-07-15 11:15:39,1646941256781-01,Motorola | Smartphone | Celulares e Smartphones,Smartphone Motorola Moto G15 256GB 12GB de RAM Grafite,98900,111100,1,1330562,webfones,2026-07-18 00:19:35
2026-07-15 11:14:19,1646941256777-01,Motorola | Smartphone | Celulares e Smartphones,Smartphone Motorola Moto G15 256GB 12GB de RAM Grafite,98900,111100,1,1330562,webfones,2026-07-18 00:19:36
2026-07-15 11:13:05,1646941256776-01,Smartphone | Celulares e Smartphones,USADO iPhone 12 Pro 256 GB Azul Muito Bom,262900,262900,1,1502378,armazemcircular,2026-07-18 00:19:37
2026-07-15 11:12:01,1646941256772-01,Computadores e Informática | Teste,TESTE - NÃO COMPRAR TESTE DOAÇÃO - NÃO COMPRAR TESTE DOAÇÃO,10,10,1,22387,1,2026-07-18 00:19:37
2026-07-15 11:11:44,1646941256771-01,Ventilador de parede | Eletrodomésticos,Exaustor Ventilador Industrial Axial 30cm Premium - Ventisol Voltagem:220V,22990,22990,1,2330195,webcontinentalmktplace,2026-07-18 00:19:38
2026-07-15 11:07:00,1646941256769-01,"Suplementos | Vitaminas, Minerais e Suplementos | Saúde e Bem Estar",Creatina Tropical Mais Mu Performace 210g,8549,8999,1,1143415,mundoverde,2026-07-18 00:19:38
2026-07-15 11:07:00,1646941256769-02,"Vitaminas, Minerais e Suplementos | Saúde e Bem Estar",Pasta de Amendoim com Whey Protein Avelã Dr Peanut 250g,2290,2990,1,1677131,farmaciaindiana,2026-07-18 00:19:39
2026-07-15 10:58:40,1646941256765-02,Cuidados com o Cabelo | Cosméticos e Perfumaria,Óleo Capilar Nutritivo 3 Em 1 Ox Nutre 120ml,3669,4199,1,831310,farmaciaindiana,2026-07-18 00:19:40
2026-07-15 10:58:40,1646941256765-01,Cuidados com o Cabelo | Cosméticos e Perfumaria,Modelador de Cachos 30W Startools Rosa Bivolt,7790,7790,1,3346024,webcontinentalmktplace,2026-07-18 00:19:40
2026-07-15 10:57:04,1646941256764-01,Panificadora Elétrica | Eletroportáteis Especiais | Eletroportáteis,Panificadora Britânia Digital 12 Programas 3L BPNE01 127V,54990,83990,1,765836,Philco,2026-07-18 00:19:41
2026-07-15 10:54:00,1646941256763-01,Banho do Bebê | Bebês e Infantil,Colônia Infantil João e Maria Cheirinho de Bebê Cimed 200ml,3090,3490,1,1632727,farmaciaindiana,2026-07-18 00:19:41
2026-07-15 10:54:00,1646941256763-01,Banho do Bebê | Bebês e Infantil,Shampoo Glicerina João e Maria Bebê Cimed 400ml,2199,2790,1,1631154,farmaciaindiana,2026-07-18 00:19:41
2026-07-15 10:54:00,1646941256763-01,Ginecológicos | Saúde Da Mulher | Medicamentos,Pomada Antiassaduras Nistatina + Óxido de Zinco Neo Química 60g,1198,3108,1,2115298,farmaciaindiana,2026-07-18 00:19:41
2026-07-15 10:53:28,1646941256762-01,Mesas Para Escritório / Escrivaninha | Escritório | Móveis,Mesa para Computador Gamer em L 3 Gavetas Preto Lisboa Madesa Cor:Preto,57992,66999,1,1748947,webcontinentalmktplace,2026-07-18 00:19:42
2026-07-15 10:53:11,1646941256760-01,Computadores e Informática | Teste,TESTE - NÃO COMPRAR TESTE DOAÇÃO - NÃO COMPRAR TESTE DOAÇÃO,10,10,1,22387,1,2026-07-18 00:19:43
2026-07-15 10:51:07,1646941256759-01,"Vitaminas, Minerais e Suplementos | Saúde e Bem Estar",Whey Protein Health Labs Morango e Banana 900g Whey Protein Health Morango e Banana 900g,9699,9699,1,830991,farmaciaindiana,2026-07-18 00:19:43
2026-07-15 10:45:52,1646941256756-02,Secador de Cabelo | Cuidados com o Cabelo | Cosméticos e Perfumaria,Secador de Cabelo Style Pro 2000W,25990,33990,1,1305554,lojataiff2,2026-07-18 00:19:44
2026-07-15 10:45:52,1646941256756-01,Casa e Cozinha,Jogo de Jantar 20 Peças Cerâmica Completo com Pratos e Xícaras Lilás OEM,11850,11850,1,3165773,webcontinentalmktplace,2026-07-18 00:19:44
2026-07-15 10:45:52,1646941256756-01,Chapinhas e Pranchas | Cuidados com o Cabelo | Cosméticos e Perfumaria,Prancha Progressiva Mondial Ultra Liss Pro 250°C P-02-PRO Bivolt,19900,22500,1,1904009,webcontinentalmktplace,2026-07-18 00:19:44
2026-07-15 10:43:45,1646941256751-01,Computadores e Informática | Teste,TESTE - NÃO COMPRAR TESTE DOAÇÃO - NÃO COMPRAR TESTE DOAÇÃO,10,10,1,22387,1,2026-07-18 00:19:45
2026-07-15 10:42:29,1646941256747-01,Computadores e Informática | Teste,TESTE - NÃO COMPRAR TESTE DOAÇÃO - NÃO COMPRAR TESTE DOAÇÃO,10,10,1,22387,1,2026-07-18 00:19:46
2026-07-15 10:37:51,1646941256745-01,Aspiradores de Pó e Água | Eletroportáteis,Aspirador de Pó Vertical com Fio Electrolux 1100W 2 em 1 Filtro HEPA Azul (STK13A) 127V,15990,25990,1,1107439,electrolux,2026-07-18 00:19:46
2026-07-15 10:35:10,1646941256743-01,Cadeiras De Jantar | Sala de Jantar | Móveis,Kit Cadeira Ditália Madeira Maciça Eucalipto 2unidades Preto,46517,52999,2,2525158,webcontinentalmktplace,2026-07-18 00:19:47
2026-07-15 10:34:53,1646941256741-01,Computadores e Informática | Teste,TESTE - NÃO COMPRAR TESTE DOAÇÃO - NÃO COMPRAR TESTE DOAÇÃO,10,10,1,22387,1,2026-07-18 00:19:48
2026-07-15 10:24:58,1646931256736-01,Computadores e Informática | Teste,TESTE - NÃO COMPRAR TESTE DOAÇÃO - NÃO COMPRAR TESTE DOAÇÃO,10,10,1,22387,1,2026-07-18 00:19:49
2026-07-15 10:24:54,1646931256735-01,Cobertores e Mantas | Cama e Banho | Casa e Cozinha,Manta Casal Brushed New Microfibra Flannel 100% Poliéster 180x230 Folha Seca,8890,8890,1,1898652,webcontinentalmktplace,2026-07-18 00:19:49
2026-07-15 10:24:54,1646931256735-01,Cobertores e Mantas | Cama e Banho | Casa e Cozinha,Cobertor Casal Queen e Manta 1 Peça Cinza,13363,14848,1,1530853,webcontinentalmktplace,2026-07-18 00:19:49
2026-07-15 10:22:51,1646931256734-01,Perfumes | Cosméticos e Perfumaria,Perfume Árabe Orygens Fragrances Harmah 100ml,10999,12990,1,2636189,farmaciaindiana,2026-07-18 00:19:50
2026-07-15 10:22:51,1646931256734-01,Perfumes | Cosméticos e Perfumaria,Perfume Árabe Orygens Fragrances Ameer Al Oud Intense 100ml,10999,12990,1,2636204,farmaciaindiana,2026-07-18 00:19:50
2026-07-15 10:11:34,1646931256729-01,Computadores e Informática | Teste,TESTE - NÃO COMPRAR TESTE DOAÇÃO - NÃO COMPRAR TESTE DOAÇÃO,10,10,1,22387,1,2026-07-18 00:19:51
2026-07-15 10:06:29,1646931256720-01,Brinquedos,Triciclo Infantil Nathor Bob Esponja 18 Meses,23490,38600,1,3405731,funstock,2026-07-18 00:19:51
2026-07-15 10:02:43,1646931256718-01,Hidratante | Higiene | Saúde e Bem Estar,Perfume Jorge Di Profumo Maison Alhambra Edp Masculino 100ml,11790,11790,1,3100458,webcontinentalmktplace,2026-07-18 00:19:51
2026-07-15 09:54:29,1646931256713-01,"Multiprocessador | Liquidificadores, Batedeiras e Processadores | Eletroportáteis",Multiprocessador Britânia 5 em 1 BMP2000 1300W 127V,28990,53990,1,403850,Philco,2026-07-18 00:19:52
2026-07-15 09:54:20,1646931256712-01,Colônias | Perfumes | Cosméticos e Perfumaria,Kit Masculino Phytoderm Victory Deo Colônia 100ml + Body Spray 120ml,8990,9590,1,2690961,farmaciaindiana,2026-07-18 00:19:52
2026-07-15 09:49:03,1646931256711-01,"Liquidificadores | Liquidificadores, Batedeiras e Processadores | Eletroportáteis",Liquidificador mondial turbo full black l900fb preto 900w com 5 velocidades,10656,12733,1,2045261,loyalt,2026-07-18 00:19:53
2026-07-15 09:40:15,1646931256708-01,"Batedeiras | Liquidificadores, Batedeiras e Processadores | Eletroportáteis",Batedeira mondial prática black b-44 com 3 velocidades – preta,7990,17980,1,2046400,loyalt,2026-07-18 00:19:53
2026-07-15 09:40:15,1646931256708-01,Fritadeiras Elétricas | Eletroportáteis,Fritadeira elétrica sem Óleo air fryer oven 2 em 1 mondial afon-12l-bi 12l digital – preta/inox,55900,60390,1,2047081,loyalt,2026-07-18 00:19:53
2026-07-15 09:38:41,1646931256707-01,Cuidados com o Cabelo | Cosméticos e Perfumaria,Kit shampoo + tratamento antiqueda + leave-in lola cosmetics rapunzel,9270,14470,1,2070698,loyalt,2026-07-18 00:19:54
2026-07-15 09:38:23,1646931256706-01,Celulares e Smartphones,"Celular samsung galaxy a17 4g tela 6.7"" 128gb super amoled câmera tripla 50mp preto",82889,116900,1,2295619,loyalt,2026-07-18 00:19:54
2026-07-15 09:31:50,1646931256705-01,Perfumes | Cosméticos e Perfumaria,Perfume Lattafa Asad Eau De Parfum Masculino 100ml,18999,24790,2,1180987,webcontinentalmktplace,2026-07-18 00:19:55
2026-07-15 09:30:51,1646931256704-01,Gin | Destilados | Bebidas,Gin tanqueray london dry - 750ml,12990,12990,1,2611571,loyalt,2026-07-18 00:19:55
2026-07-15 09:30:38,1646931256703-01,"Batedeiras | Liquidificadores, Batedeiras e Processadores | Eletroportáteis",Batedeira mondial prática black b-44 com 3 velocidades – preta,7990,17980,1,2046400,loyalt,2026-07-18 00:19:55
2026-07-15 09:30:38,1646931256703-01,"Liquidificadores | Liquidificadores, Batedeiras e Processadores | Eletroportáteis",Liquidificador mondial turbo power l-99 fb copo san cristal 3 velocidades 550w preto,9990,12198,2,2046388,loyalt,2026-07-18 00:19:55
2026-07-15 09:22:18,1646921256702-01,"Batedeiras | Liquidificadores, Batedeiras e Processadores | Eletroportáteis",Batedeira mondial prática black b-44 com 3 velocidades – preta,7990,10957,1,2046400,loyalt,2026-07-18 00:19:56
2026-07-15 09:21:32,1646921256700-01,"Liquidificadores | Liquidificadores, Batedeiras e Processadores | Eletroportáteis",Liquidificador mondial turbo power l-99 fb copo san cristal 3 velocidades 550w preto,9990,12198,1,2046388,loyalt,2026-07-18 00:19:56
2026-07-15 09:16:09,1646921256697-01,Aspiradores de Pó e Água | Eletroportáteis,Aspirador de Pó Vertical 2 em 1 Philco 1450W PAS1600P 127V,13990,27990,1,129612,Philco,2026-07-18 00:19:57
2026-07-15 09:07:07,1646921256695-01,"TVs | Cinema, TV e Áudio",Smart TV 32” Philco PTV32K34RKGB LED Roku TV Bivolt,99990,119990,1,1015290,Philco,2026-07-18 00:19:58
2026-07-15 09:03:14,1646921256694-01,Sistemas de som | Produtos automotivos,Central Multimídia Automotiva Android Auto Gm Corsa Moldura + Câm 7 Touch Screen Bluetooth Wi-Fi USB,63990,63990,1,3460317,webcontinentalmktplace,2026-07-18 00:19:58
2026-07-15 08:49:48,1646921256693-01,Camas | Quarto | Móveis,Cama Box Solteiro Conjugada Ortopédica 43x88x188 - 5cm,30900,30900,1,2950944,webcontinentalmktplace,2026-07-18 00:19:59
2026-07-15 08:43:29,1646921256692-01,"Acessórios de Áudio e Vídeo para Casa | Cinema, TV e Áudio",Fone de Ouvido Headphone com Fio Philco Extreme PFO02G Bivolt Dourado,8990,13190,1,3251762,webcontinentalmktplace,2026-07-18 00:19:59
2026-07-15 08:41:49,1646921256691-01,Panelas e Utensílios para Cozinhar | Casa e Cozinha,Conjunto de frigideiras tramontina turim com revestimento antiaderente – 2 peças,5140,5988,1,2047825,loyalt,2026-07-18 00:20:00
2026-07-15 08:08:30,1646911256685-01,Panelas de Pressão Elétricas | Eletroportáteis Especiais | Eletroportáteis,Panela de Pressão Digital Philco 6L Inox Preta 127V,41990,60990,1,1346,Philco,2026-07-18 00:20:00
2026-07-15 08:03:13,1646911256684-01,Ventiladores | Eletroportáteis,Ventilador Britânia BVT301 Tecnologia Maxx Force 60W 127V,9990,19990,1,155335,Philco,2026-07-18 00:20:00
2026-07-15 07:48:34,1646911256678-01,"Formas | Assadeiras, Fôrmas e Travessas | Casa e Cozinha",Conjunto de assadeiras marinex em vidro com tampa – 6 peças,12742,21390,1,2608603,loyalt,2026-07-18 00:20:01
2026-07-15 07:41:07,1646911256677-01,Motorola | Smartphone | Celulares e Smartphones,Smartphone Motorola Moto G15 256GB 12GB de RAM Verde,98900,111100,1,1330562,webfones,2026-07-18 00:20:02
2026-07-15 07:02:56,1646901256675-01,Aspiradores de Pó e Água | Eletroportáteis,Aspirador de Pó Vertical 2 em 1 Philco 1450W PAS1600P 220V,13990,27990,1,129612,Philco,2026-07-18 00:20:02
2026-07-15 06:59:42,1646901256674-01,"Liquidificadores | Liquidificadores, Batedeiras e Processadores | Eletroportáteis","Liquidificador philco plq11a 1050w 2,7l 4 velocidades função tritura gelo preto",11227,16900,1,2045236,loyalt,2026-07-18 00:20:03
2026-07-15 04:00:00,1646871256668-01,"Racks e Suportes de Parede para TV | Acessórios de Áudio e Vídeo para Casa | Cinema, TV e Áudio",Lixa Elétrica para Pés Usb Removedor de Calos Portátil Pedicure Shopmix,7490,8748,1,3252598,webcontinentalmktplace,2026-07-18 00:20:04
2026-07-15 02:54:01,1646861256667-01,"Formas | Assadeiras, Fôrmas e Travessas | Casa e Cozinha",Conjunto de travessas refratárias marinex em vidro - 10 peças,12257,14988,1,2135902,loyalt,2026-07-18 00:20:05
2026-07-15 02:01:35,1646851256662-01,Esfregões e Mops | Limpeza Doméstica | Casa e Cozinha,Mop Lava e Seca,6290,11700,1,800437,funstock,2026-07-18 00:20:05
2026-07-15 01:44:16,1646851256658-01,Fritadeiras Elétricas | Eletroportáteis,"Fritadeira Air Fryer Philco PFR15PI Redstone 4,4L 1500W 220V",28990,44990,1,390417,Philco,2026-07-18 00:20:06
2026-07-15 01:38:33,1646851256657-01,Sem gás | Água | Bebidas,Brinco Argola Com Ponto De Luz Oval Colorido Prata 925,14590,14590,1,2406290,webcontinentalmktplace,2026-07-18 00:20:06
2026-07-15 01:34:34,1646851256656-01,Smartphone | Celulares e Smartphones,USADO iPhone 11 128 GB Preto Bom,139900,139900,1,2772779,armazemcircular,2026-07-18 00:20:07
2026-07-15 01:34:14,1646851256655-01,Modelador de Cachos | Cuidados com o Cabelo | Cosméticos e Perfumaria,Modelador De Cachos By Juliette Mondial Golden Rose Bivolt,16290,17900,1,891897,webcontinentalmktplace,2026-07-18 00:20:07
2026-07-15 00:57:45,1646841256649-01,Camas | Quarto | Móveis,Cama Box Conjulgado Casal 138cm Multi Cristalflex Cinza S/V,66990,81990,1,973339,multilojaonline,2026-07-18 00:20:08
2026-07-15 00:50:17,1646841256647-01,Motorola | Smartphone | Celulares e Smartphones,Smartphone Motorola Moto G06 256GB 12GB de RAM Bege,88700,99900,1,2526656,webfones,2026-07-18 00:20:08
