creationDate,orderId,categoryName,name,price,listPrice,quantity,productId,seller,data_extracao
2026-07-08 19:06:51,1645341252879-01,Banho do Bebê | Bebês e Infantil,Roupão Plush Adulto Extra Macio Unissex Microfibra de Poliéster Tamanho Único Coral OEM,10485,10485,1,3467868,webcontinentalmktplace,2026-07-10 16:46:48
2026-07-08 19:06:32,1645341252878-01,Máquinas Desentupidoras | Ferramentas Elétricas | Materiais de Construção,"Extratora Portátil Britânia 1,9L 1600W BEX20A 220V",44990,77990,1,2705751,Philco,2026-07-10 16:46:48
2026-07-08 18:59:41,1645341252875-03,Roupa de Cama | Cama e Banho | Casa e Cozinha,Jogo De Lençol Micropercal 400 Fios Queen 3 Peças Barato - Avelã,7480,7480,1,2432667,webcontinentalmktplace,2026-07-10 16:46:48
2026-07-08 18:59:41,1645341252875-01,Potes | Utensílios para Cozinha | Casa e Cozinha,Potes Herméticos Porta-Mantimentos com Tampa de Bambu,9990,15990,1,1107933,electrolux,2026-07-10 16:46:48
2026-07-08 18:59:41,1645341252875-02,Roupa de Cama | Cama e Banho | Casa e Cozinha,Jogo De Cama Chevron Queen Lar E Lazer Rosa UN,5473,10999,1,1630353,rovitex,2026-07-10 16:46:49
2026-07-08 18:59:06,1645341252874-01,"TVs | Cinema, TV e Áudio","Smart tv 32"" lg hd 32lr600bpsa com processador a5 ger 6 ai, alexa integrado, lg channels, webos 23, compatível com controle smart magic",112955,140292,1,3133212,loyalt,2026-07-10 16:46:49
2026-07-08 18:57:57,1645341252872-02,Depuradores e Coifas | Eletrodomésticos,Depurador de Ar Colormaq Cook 80cm Preto Fosco Bivolt,39700,39700,1,1288746,webcontinentalmktplace,2026-07-10 16:46:49
2026-07-08 18:57:57,1645341252872-01,Cooktops | Fogões e Cooktops | Eletrodomésticos,Cooktop Atlas U Top 5 Bocas Acendimento Automático e Tripla Chama Preto Bivolt,54990,71990,1,136571,multilojaonline,2026-07-10 16:46:49
2026-07-08 18:57:38,1645341252871-01,Aquecedores | Eletroportáteis,Aquecedor Britânia AB1500P 2 em 1 220V,13990,17990,1,136434,Philco,2026-07-10 16:46:49
2026-07-08 18:55:32,1645341252870-01,Samsung | Smartphone | Celulares e Smartphones,Samsung Galaxy A34 5G 256GB Preto - Muito Bom Usado,99900,99900,1,1298918,eurenovo,2026-07-10 16:46:49
2026-07-08 18:50:26,1645341252869-01,Adaptadores | Periféricos | Computadores e Informática,Aquecedor Britânia 3 Níveis De Potência 1200W AB1200 Branco 220V,25990,27090,1,3106735,webcontinentalmktplace,2026-07-10 16:46:50
2026-07-08 18:41:35,1645341252866-01,Carrinhos | Meninos | Brinquedos,Kit 6 Carrinhos De Brinquedo Bombeiro Miniatura Colecionável,4390,4390,1,1809354,webcontinentalmktplace,2026-07-10 16:46:50
2026-07-08 18:40:51,1645341252865-01,Sofás | Sala de Estar | Móveis,Kit 01 Namoradeira Opala 02 Puff Quadrado 02 Almofadas Marrom,71990,71990,1,1058270,webcontinentalmktplace,2026-07-10 16:46:50
2026-07-08 18:40:24,1645341252864-01,Guarda-Roupa E Roupeiros | Quarto | Móveis,Guarda-Roupa Casal Madesa Reno 3 Portas de Correr com Espelho Cor:Branco,124999,154990,1,3768,madesacms,2026-07-10 16:46:50
2026-07-08 18:39:14,1645341252863-01,Secador de Cabelo | Cuidados com o Cabelo | Cosméticos e Perfumaria,Secador De Cabelo Eleganza Plus Ceramic Íon,21900,21900,1,151154,farmaciaindiana,2026-07-10 16:46:51
2026-07-08 18:25:19,1645331252856-01,Panelas Elétricas | Eletroportáteis Especiais | Eletroportáteis,Panela elétrica de pressão britânia bpp05p 5l revestimento redstone,37905,37905,1,3406288,loyalt,2026-07-10 16:46:51
2026-07-08 18:24:48,1645331252855-01,"Batedeiras | Liquidificadores, Batedeiras e Processadores | Eletroportáteis",Batedeira Planetária Britânia BBPE01 12 Velocidades 4L 500W 220V,27990,39990,1,229763,Philco,2026-07-10 16:46:51
2026-07-08 18:20:20,1645331252854-01,Secador de Cabelo | Cuidados com o Cabelo | Cosméticos e Perfumaria,Secador de Cabelo Style Black 2000W,24990,29990,1,1305543,lojataiff2,2026-07-10 16:46:51
2026-07-08 18:18:16,1645331252853-01,Máquinas de Lavar Roupas | Máquinas de Lavar e Secadoras | Eletrodomésticos,Máquina de Lavar Electrolux 13kg Branca Essential Care com Cesto Inox e Jet&Clean (LED13) 220V,179900,283900,1,1107329,electrolux,2026-07-10 16:46:51
2026-07-08 18:13:05,1645331252852-01,"Batedeiras | Liquidificadores, Batedeiras e Processadores | Eletroportáteis",Batedeira Britânia Perola 550 Turbo Double Bowl Preta 500W 127V,9990,23990,1,51914,Philco,2026-07-10 16:46:51
2026-07-08 18:11:00,1645331252851-01,"Bebedouros | Filtros, Bebedouros e Refrigeradores de Água | Eletroportáteis",Bebedouro De Água Britânia BBE50A Água Natural e Gelada 127V,42990,71990,1,1999704,Philco,2026-07-10 16:46:52
2026-07-08 18:06:24,1645331252848-01,"TVs | Cinema, TV e Áudio","Smart tv 32"" lg hd 32lr600bpsa com processador a5 ger 6 ai, alexa integrado, lg channels, webos 23, compatível com controle smart magic",112955,140292,1,3133212,loyalt,2026-07-10 16:46:52
2026-07-08 18:03:38,1645331252845-01,Fritadeiras Elétricas | Eletroportáteis,Air Fryer Philco 4L Revestimento Redstone 1500W PAF40A 127V,25990,34990,1,1363980,Philco,2026-07-10 16:46:52
2026-07-08 18:00:58,1645331252841-01,Panelas e Utensílios para Cozinhar | Casa e Cozinha,"Panela de pressão clock 4,5 litros eco polida fechamento interno prata",9776,13080,1,2655622,loyalt,2026-07-10 16:46:52
2026-07-08 18:00:58,1645331252841-03,"Jogos de Copos e Taças Mistos | Louça, Copos e Talheres | Casa e Cozinha",Copo de Vidro 220ML - MAHALO,295,899,6,1174299,minipreco,2026-07-10 16:46:52
2026-07-08 18:00:58,1645331252841-02,Casa e Cozinha,Copos Chicago de Vidro 360ML 3 Unidades Design Moderno 123Útil,1590,1590,2,3343351,webcontinentalmktplace,2026-07-10 16:46:52
2026-07-08 18:00:58,1645331252841-02,Facas de Cozinha e Acessórios | Panelas e Utensílios para Cozinhar | Casa e Cozinha,Jogo De Facas Faqueiro Profissional 6 Peças Everrich,4999,4999,1,1213904,webcontinentalmktplace,2026-07-10 16:46:52
2026-07-08 18:00:58,1645331252841-02,Casa e Cozinha,Jogo De Faqueiro 24 Peças - Inox,13800,13800,1,2531335,webcontinentalmktplace,2026-07-10 16:46:52
2026-07-08 17:59:54,1645331252839-01,"Formas | Assadeiras, Fôrmas e Travessas | Casa e Cozinha",Conjunto de assadeiras retangulares sempre em vidro temperado - 2 peças,4743,5868,1,2655626,loyalt,2026-07-10 16:46:52
2026-07-08 17:58:39,1645331252838-01,Sanduicheiras e Grelhas Elétricas | Eletroportáteis,Sanduicheira elétrica cadence click 750w com botão liga e desliga - san400,8990,13769,1,2046174,loyalt,2026-07-10 16:46:53
2026-07-08 17:53:58,1645331252836-01,Celulares e Smartphones,"Smartphone samsung galaxy a26 tela 6.7"" 256gb 5g câmera tripla 50mp preto",159900,197210,1,2046064,loyalt,2026-07-10 16:46:53
2026-07-08 17:52:22,1645331252835-01,"Formas | Assadeiras, Fôrmas e Travessas | Casa e Cozinha",Conjunto de assadeiras retangulares sempre em vidro temperado - 2 peças,4743,5868,1,2655626,loyalt,2026-07-10 16:46:53
2026-07-08 17:51:57,1645331252834-01,Climatizador | Eletroportáteis,Aquecedor De Ambiente Britânia Halógeno Ab800b Branco 127v,17990,17990,1,3065641,webcontinentalmktplace,2026-07-10 16:46:53
2026-07-08 17:51:27,1645331252833-01,Ar-condicionado | Eletrodomésticos,Ventilador de mesa mondial turbo nvt408pb 40cm 8 pás 3 velocidades preto/prata,16400,20895,2,2044902,loyalt,2026-07-10 16:46:53
2026-07-08 17:50:49,1645331252832-01,Celulares e Smartphones,"Celular samsung galaxy a17 4g tela 6.7"" 128gb super amoled câmera tripla 50mp azul",74600,116900,1,2555919,loyalt,2026-07-10 16:46:53
2026-07-08 17:50:42,1645331252831-01,Fritadeiras Elétricas | Eletroportáteis,Fritadeira air fryer wap barbecue digital 1700w 12 funções painel led graystone sem Óleo sem fumaça,113590,132905,1,2048193,loyalt,2026-07-10 16:46:53
2026-07-08 17:45:38,1645331252829-01,"Batedeiras | Liquidificadores, Batedeiras e Processadores | Eletroportáteis",Batedeira Planetária Philco Concept 5L 900W Turbo PBP90A - 220V,29990,56090,1,2121986,webcontinentalmktplace,2026-07-10 16:46:54
2026-07-08 17:42:30,1645331252827-01,"Batedeiras | Liquidificadores, Batedeiras e Processadores | Eletroportáteis",Batedeira planetária philco php500 turbo com 11 velocidades e 500w – preto,24900,37370,1,2650528,loyalt,2026-07-10 16:46:54
2026-07-08 17:34:01,1645331252823-01,Panelas e Utensílios para Cozinhar | Casa e Cozinha,Jogo de Panelas Revestimento Ceramica Indução 8 peças Extream Atami Red Light,41990,51990,1,3059864,tetrix,2026-07-10 16:46:54
2026-07-08 17:34:01,1645331252823-02,"Liquidificadores | Liquidificadores, Batedeiras e Processadores | Eletroportáteis",Liquidificador britânia blq1280p 1150 w com 4 velocidades - preto,12490,14990,1,2602402,loyalt,2026-07-10 16:46:54
2026-07-08 17:28:46,1645321252822-01,Fritadeiras Elétricas | Eletroportáteis,Fritadeira elétrica sem Óleo air fryer oven 2 em 1 mondial afon-12l-bi 12l digital – preta/inox,55900,60390,1,2047081,loyalt,2026-07-10 16:46:55
2026-07-08 17:27:13,1645321252821-01,Balcão | Cozinha | Móveis,Balcão De Cozinha 3 Portas 2 Gavetas Maísa Cinamomo-off White,40788,40788,1,2407247,webcontinentalmktplace,2026-07-10 16:46:55
2026-07-08 17:24:16,1645321252820-01,Cadeiras para Escritório | Escritório | Móveis,Cadeira Gamer Stillus Ergonômica Com Apoio Para Os Pés Preto,35199,72990,1,1052071,webcontinentalmktplace,2026-07-10 16:46:55
2026-07-08 17:22:39,1645321252817-01,"Pratos | Louça, Copos e Talheres | Casa e Cozinha",Kit Introdução Alimentar Bebe 8 Peças Silicone Iniciação Para Alimentos (rosa),10590,10590,1,1916203,webcontinentalmktplace,2026-07-10 16:46:55
2026-07-08 17:22:39,1645321252817-03,Amamentação e Alimentação | Bebês e Infantil,Mamadeira Kuka Tamanho 1 Ortodôntica Rosa 70ml,2814,2814,1,726928,pensefarma,2026-07-10 16:46:55
2026-07-08 17:22:39,1645321252817-02,Amamentação e Alimentação | Bebês e Infantil,Copo de Transição First Moments + Bico Extra + Alça Removível 150 ml Rosa Fisher Price - BB1056OUT [Reembalado] BB1056OUT,1200,1200,1,1157741,compreja,2026-07-10 16:46:55
2026-07-08 17:22:23,1645321252816-01,Aquecedores | Eletroportáteis,Aquecedor Britânia AB1500P 2 em 1 127V,13990,17990,1,136434,Philco,2026-07-10 16:46:55
2026-07-08 17:18:45,1645321252815-01,Panelas e Utensílios para Cozinhar | Casa e Cozinha,KIT TALHER 24PCS + PORTA TALHER C750-101 BANANA TOYS,4999,4999,1,1741194,minipreco,2026-07-10 16:46:56
2026-07-08 17:17:21,1645321252814-01,Celulares e Smartphones,"Smartphone motorola moto g06 4g tela 6,9” 256gb câmera 50mp bege",78300,100936,1,2988250,loyalt,2026-07-10 16:46:56
2026-07-08 17:12:08,1645321252813-01,Fritadeiras Elétricas | Eletroportáteis,"Fritadeira Air Fryer Britânia 4,2L 1500W BFR38 Dura Mais 220V",21990,30990,1,419530,Philco,2026-07-10 16:46:56
2026-07-08 16:59:13,1645321252803-01,Máquinas de Lavar Roupas | Máquinas de Lavar e Secadoras | Eletrodomésticos,Máquina de Lavar Electrolux 11kg Branca Essential Care com Easy Clean e Filtro Fiapos (LES11) 127V,162900,232900,1,1107930,electrolux,2026-07-10 16:46:56
2026-07-08 16:57:20,1645321252798-01,Panelas e Utensílios para Cozinhar | Casa e Cozinha,Jogo de panelas tramontina sicilia 5 peças revestimento antiaderente starflon excellent avelã,51397,70680,1,2048040,loyalt,2026-07-10 16:46:56
2026-07-08 16:57:20,1645321252798-02,"Pratos | Louça, Copos e Talheres | Casa e Cozinha",Aparelho de Jantar Porcelana Estaleiro Prata 20 Peças - NDI,39990,39990,1,1561252,minipreco,2026-07-10 16:46:56
2026-07-08 16:50:29,1645321252792-01,Casa e Cozinha,Torneira com Filtro Purificador de Água Lorenzetti parede,13925,13925,1,2746499,webcontinentalmktplace,2026-07-10 16:46:56
2026-07-08 16:43:40,1645321252790-01,Fritadeiras Elétricas | Eletroportáteis,"Air Fryer Fritadeira Elétrica Extream 5,5L Preto e Cobre, Air Fryer Fritadeira Elétrica Extream 5,5L Preto e Cobre , 127v",29900,39900,1,1360370,tetrix,2026-07-10 16:46:57
2026-07-08 16:41:04,1645321252787-01,Celulares e Smartphones,Smartphone X7 PRO 12GB De RAM 512GB 5G Poco Verde 2025 Xiaomi,237915,279900,1,1673600,webcontinentalmktplace,2026-07-10 16:46:57
2026-07-08 16:40:04,1645321252786-01,"Cafeteiras e Máquinas de Expresso | Café, Chá e Expresso | Eletroportáteis",Cafeteira Nescafé Dolce Gusto Genio S Plus Preta 110V,50990,77990,1,3093937,webcontinentalmktplace,2026-07-10 16:46:57
2026-07-08 16:40:04,1645321252786-01,"Vitaminas, Minerais e Suplementos | Saúde e Bem Estar",Whey Protein Dux Nutrition Isolado Pote 450g Chocolate Branco,29480,29480,1,2034887,webcontinentalmktplace,2026-07-10 16:46:57
2026-07-08 16:37:05,1645321252781-01,Computadores e Informática | Teste,TESTE - NÃO COMPRAR TESTE DOAÇÃO - NÃO COMPRAR TESTE DOAÇÃO,10,10,1,22387,1,2026-07-10 16:46:57
2026-07-08 16:34:50,1645321252779-01,Computadores e Informática | Teste,TESTE - NÃO COMPRAR TESTE DOAÇÃO - NÃO COMPRAR TESTE DOAÇÃO,10,10,1,22387,1,2026-07-10 16:46:57
2026-07-08 15:59:46,1645311252772-01,Bolsas | Bolsas e Mochilas,Bolsa Feminina Média OEM Shopbag Bordada Dubai Couro Sintético 24x19x10cm Rosê para Público,5385,5385,1,3490062,webcontinentalmktplace,2026-07-10 16:46:57
2026-07-08 15:59:46,1645311252772-02,Panelas e Utensílios para Cozinhar | Casa e Cozinha,Panela wolff de alumínio e cerâmica granilite cinza 24cm,15999,22100,1,2046006,loyalt,2026-07-10 16:46:58
2026-07-08 15:59:46,1645311252772-03,Espremedores Elétricos | Espremedores e Centrífugas | Eletroportáteis,Espremedor de Frutas Philco PEF750P 70W Automático 127V,12990,24990,1,52080,Philco,2026-07-10 16:46:58
2026-07-08 15:26:50,1645301252768-01,Motorola | Smartphone | Celulares e Smartphones,Smartphone Motorola Moto G35 5G 256GB 12GB de RAM Coral,134900,149900,1,1455312,webfones,2026-07-10 16:46:58
2026-07-08 15:26:50,1645301252768-02,Escova Rotativa Modeladora | Cuidados com o Cabelo | Cosméticos e Perfumaria,Escova Secadora Britânia BEC02PR Bivolt 4 em 1 1300W Bivolt,8990,19990,1,155346,Philco,2026-07-10 16:46:58
2026-07-08 15:14:25,1645301252767-01,Chuveiros e Duchas | Hidráulico | Materiais de Construção,Chuveiro Lorenzetti Advanced Multitemperaturas 7500w Branco 220v,22490,22490,1,1600401,webcontinentalmktplace,2026-07-10 16:46:58
2026-07-08 15:03:51,1645301252765-01,"Suplementos | Vitaminas, Minerais e Suplementos | Saúde e Bem Estar",100% Whey – Cookies & Cream - Max Titanium - 900g,13979,15990,1,139716,farmaciaindiana,2026-07-10 16:46:58
2026-07-08 14:56:43,1645301252761-01,Varal | Utilidades Domésticas | Casa e Cozinha,VARAL CHAO ABAS BUENOS AIRES ACO PRETO 1.33M X 53CM X 95CM 9981 MAXEB,5990,5990,1,2117336,minipreco,2026-07-10 16:46:59
2026-07-08 14:54:21,1645301252758-01,Shampoos e Condicionadores | Higiene | Saúde e Bem Estar,Shampoo Elseve Collagen Lifter 400ml,2919,3599,1,2405797,farmaciaindiana,2026-07-10 16:46:59
2026-07-08 14:46:58,1645301252757-01,"Cafeteiras e Máquinas de Expresso | Café, Chá e Expresso | Eletroportáteis",Cafeteira Elétrica 32 Xícaras Filtro Reutilizável e Colher Dosadora Multi 220V - GO038 GO038,13990,13990,1,1049805,compreja,2026-07-10 16:46:59
2026-07-08 14:42:27,1645301252754-01,Roupa de Cama | Cama e Banho | Casa e Cozinha,Jogo de Cama Solteiro Love Panda Vivaldi Verde UN,4999,12999,2,73413,rovitex,2026-07-10 16:46:59
2026-07-08 14:42:27,1645301252754-02,Capas de Mala | Malas | Bolsas e Mochilas,Manta para Sofá Luxo Gigante 120x210 Tipo Capa Protetora Bege 100% Algodão OEM,4990,4990,1,3476403,webcontinentalmktplace,2026-07-10 16:46:59
2026-07-08 14:42:27,1645301252754-02,Capas de Mala | Malas | Bolsas e Mochilas,"Manta Para Sofá Gigante Super King 3,00x1,80 Capa De Sofa Grande 2 E 3 Lugares De Luxo Cama Caramelo",9220,9220,1,2524335,webcontinentalmktplace,2026-07-10 16:46:59
2026-07-08 14:19:44,1645291252750-01,"Vitaminas, Minerais e Suplementos | Saúde e Bem Estar",Whey 100% Max Titanium Dr. Peanut Sabor Doce de Leite 450g,10599,10599,1,1623344,farmaciaindiana,2026-07-10 16:47:00
2026-07-08 14:18:29,1645291252747-01,Cozinhas Compactas | Cozinha | Móveis,"Cozinha Compacta Madesa Topazio Pop com Armário, Balcão e Tampo Cor:Branco/Rustic",99999,148990,1,15483,madesacms,2026-07-10 16:47:00
2026-07-08 14:17:13,1645291252746-01,Fornos de Micro-Ondas | Eletrodomésticos,Micro-Ondas Philco PMO23BB Multifunções Limpa Fácil 20L 1100W 127V,51990,62990,1,1273,Philco,2026-07-10 16:47:00
2026-07-08 14:14:45,1645291252745-01,"Chaleiras Elétricas | Café, Chá e Expresso | Eletroportáteis",Chaleira elétrica mondial pratic control ce-17-bc 17l preto 1200w 110v,14990,15490,1,3452812,loyalt,2026-07-10 16:47:00
2026-07-08 14:13:49,1645291252744-01,Smartphone | Celulares e Smartphones,USADO iPhone 11 128 GB Preto Muito Bom,144900,144900,1,1169113,armazemcircular,2026-07-10 16:47:00
2026-07-08 14:09:59,1645291252741-01,Fritadeiras Elétricas | Eletroportáteis,"Fritadeira Air Fryer Britânia 4,2L 1500W BFR38 Dura Mais 127V",21990,30990,1,419530,Philco,2026-07-10 16:47:00
2026-07-08 14:09:35,1645291252740-01,Pneus | Produtos automotivos,Pneu aro 13 goodyear direction touring 2 xl 165/70 83t,34773,36512,2,2607432,loyalt,2026-07-10 16:47:01
2026-07-08 14:05:02,1645291252739-01,Ficção Científica - Estrangeira | Literatura Estrangeira | Livros,O PROBLEMA DOS TRÊS CORPOS - VOL. 1,8990,8990,1,279694,martinsfontespaulista,2026-07-10 16:47:01
2026-07-08 14:02:17,1645291252738-01,Pipoqueiras | Eletroportáteis,Pipoqueira Elétrica Mallory Toy Story Pipocas Sem óleo 110V,14590,15390,1,3240000,webcontinentalmktplace,2026-07-10 16:47:01
2026-07-08 13:51:59,1645291252733-01,"TVs | Cinema, TV e Áudio",Smart TV 32” Philco PTV32K34RKGB LED Roku TV Bivolt,99990,119990,1,1015290,Philco,2026-07-10 16:47:01
2026-07-08 13:44:17,1645291252731-01,Perfumes | Cosméticos e Perfumaria,Zaad Intense Eau De Parfum 95ml,41351,46990,1,2150493,webcontinentalmktplace,2026-07-10 16:47:01
2026-07-08 13:37:30,1645291252729-01,"Liquidificadores | Liquidificadores, Batedeiras e Processadores | Eletroportáteis","Liquidificador mondial turbo power l99-fr 2,2l 500w 3 velocidades vermelho",9990,10490,1,2045259,loyalt,2026-07-10 16:47:01
2026-07-08 13:36:02,1645291252727-02,Cama e Banho | Casa e Cozinha,Jogo de Cama Lençol Casal King 04 Peças Microfibra Estampada Ayla - Rosa Floral Matura,12980,12980,1,1418964,shophub,2026-07-10 16:47:01
2026-07-08 13:36:02,1645291252727-01,Cama e Banho | Casa e Cozinha,Jogo cama lençol unique king micro percal 400 fios ponto palito 3 peças - lilás,9590,9590,1,2315445,loyalt,2026-07-10 16:47:02
2026-07-08 13:30:27,1645291252726-01,Celulares e Smartphones,"Relógio Smartwatch W34 Tela Hd 1,54 Preto + Caixa De Som Bluetooth",19990,19990,1,2216685,webcontinentalmktplace,2026-07-10 16:47:02
2026-07-08 13:29:45,1645281252725-01,Mamadeira e Acessórios | Bebês e Infantil,Kit Mamadeiras Lillo Evolution Primeiros Passos Rosa 50ml+120ml+260ml Kit Mamadeiras Primeiros Passos Rosa 50ml+120ml+260ml,7399,7399,1,831274,farmaciaindiana,2026-07-10 16:47:02
2026-07-08 13:25:35,1645281252720-01,Tiro Esportivo | Esporte e Lazer,Pistola Pressão Rossi Co2 Beretta M9 6mm Bbs Aço Kit,89990,89990,1,1695064,webcontinentalmktplace,2026-07-10 16:47:02
2026-07-08 13:23:17,1645281252719-01,Esfregões e Mops | Limpeza Doméstica | Casa e Cozinha,Mop Lava e Seca de Microfibra com Cabo e Balde 7L Noviça Bettanin,10990,13990,1,33260,inbettastore,2026-07-10 16:47:03
2026-07-08 13:22:35,1645281252717-01,Maquiagem | Cosméticos e Perfumaria,Corretivo líquido océane concealer,3490,6090,2,2071638,loyalt,2026-07-10 16:47:03
2026-07-08 13:22:35,1645281252717-02,Escovas de Dentes e Acessórios | Higiene Bucal | Higiene | Saúde e Bem Estar,Escova de Dente Curaprox 5460 Ultra Soft 2 Unidades,7499,7999,1,1725983,farmaciaindiana,2026-07-10 16:47:03
2026-07-08 13:18:40,1645281252714-01,Panelas Elétricas | Eletroportáteis Especiais | Eletroportáteis,Panela de pressão elétrica mondial 5l digital master cooker pe-38 5l preta,36900,52395,1,2046397,loyalt,2026-07-10 16:47:04
2026-07-08 13:01:36,1645281252713-01,Celulares e Smartphones,"Celular samsung galaxy a17 4g tela 6.7"" 128gb super amoled câmera tripla 50mp preto",96900,116900,1,2295619,loyalt,2026-07-10 16:47:04
2026-07-08 12:56:38,1645281252711-01,Eletrodomésticos,ASPIRADOR PO ROBO BIVOLT RB-08 MONDIAL,36999,36999,1,2240328,minipreco,2026-07-10 16:47:04
2026-07-08 12:56:38,1645281252711-02,Acessórios Automotivos | Produtos automotivos,Aspirador Carro 12V 60W Western,6290,11800,1,27781,funstock,2026-07-10 16:47:04
2026-07-08 12:53:39,1645281252708-01,"Liquidificadores | Liquidificadores, Batedeiras e Processadores | Eletroportáteis",Liquidificador mondial turbo power l-99 fb copo san cristal 3 velocidades 550w preto,9990,12198,1,2046388,loyalt,2026-07-10 16:47:04
2026-07-08 12:50:46,1645281252707-01,Fones de Ouvido | Celulares e Smartphones,Fone De Ouvido Headphone Aiwa Bluetooth Drive,18490,26400,1,1225984,webcontinentalmktplace,2026-07-10 16:47:04
2026-07-08 12:49:32,1645281252706-01,Aquecedores | Eletroportáteis,Aquecedor de Ar Mondial A-08 Cinza Aquecedor De Ar Mondial A-08 Aquecedor A Ar-220v-cinza,11900,11900,1,880098,loyalt,2026-07-10 16:47:05
2026-07-08 12:40:19,1645281252702-01,Mangueiras | Hidráulico | Materiais de Construção,Mangueira Magica Jardim Flexivel Expansivel 22.5m Irrigacao Esguicho Multifuncional Retratil Elastica Compacta Praticida,7300,7300,1,2279438,webcontinentalmktplace,2026-07-10 16:47:05
2026-07-08 12:40:19,1645281252702-02,Bules e Cafeteiras | Panelas e Utensílios para Cozinhar | Casa e Cozinha,Café Individual Caneca ceramica e coador - Demolição Bege,8790,8790,1,58452,utensiliosdochef,2026-07-10 16:47:05
2026-07-08 12:39:59,1645281252701-01,Fornos Elétricos | Eletrodomésticos,Forno elétrico mondial pratic cook fr-09 com 6 litros – preto,22700,26290,1,2706264,loyalt,2026-07-10 16:47:05
2026-07-08 12:35:38,1645281252699-01,Instrumentos Musicais | Meninos | Brinquedos,"Mini Bateria Musical Infantil, Estimular A Criatividade E O Senso Rítmico Das Crianças",7890,7890,1,2745897,webcontinentalmktplace,2026-07-10 16:47:05
2026-07-08 12:35:03,1645281252698-01,Fraldas | Bebês e Infantil,Lenços Umedecidos Huggies One & Done Leve 4 Pague 3 - 192 unidades,3590,3590,2,667613,farmaciaindiana,2026-07-10 16:47:05
2026-07-08 12:35:03,1645281252698-01,Fraldas | Bebês e Infantil,Fralda Huggies Supreme Care P - 48 Fraldas Fralda Huggies Supreme Care Mega P c/ 48 Unidades,4875,6399,1,725001,farmaciaindiana,2026-07-10 16:47:05
2026-07-08 12:35:03,1645281252698-01,Fraldas | Bebês e Infantil,Fralda Huggies Natural Care RN Com 34 Unidades FR HUGGIES NATURAL CARE RN 34UN,3899,4990,1,725277,farmaciaindiana,2026-07-10 16:47:05
2026-07-08 12:34:35,1645281252697-01,Motorola | Smartphone | Celulares e Smartphones,Smartphone Motorola Moto G15 256GB 12GB de RAM Grafite,99900,99900,1,1330562,webfones,2026-07-10 16:47:06
2026-07-08 12:26:42,1645271252694-01,Cozinha Industrial | Eletrodomésticos,"Panela de Pressão No20 com Visor Alumínio Antiaderente 4,5L MTA Alumínios",17499,17499,1,3209224,webcontinentalmktplace,2026-07-10 16:47:06
2026-07-08 12:20:49,1645271252693-01,Aspiradores de Pó e Água | Eletroportáteis,Aspirador de Pó Vertical com Fio Electrolux 1100W 2 em 1 Filtro HEPA Azul (STK13A) 127V,15990,25990,1,1107439,electrolux,2026-07-10 16:47:06
2026-07-08 12:00:44,1645271252690-01,Facas de Cozinha e Acessórios | Panelas e Utensílios para Cozinhar | Casa e Cozinha,Jogo Facas Tramontina Plenus Inox e Cabos de Polipropileno Preto 9 Peças,11316,18106,1,26254,tfdbn2,2026-07-10 16:47:06
2026-07-08 11:56:06,1645271252689-01,Hidráulico | Materiais de Construção,Torneira Elétrica Loren Easy de 5500 Watts 220 Volts 7550036 Lorenzetti Torn.elet.loren Easy 550,16042,20052,1,2630745,webcontinentalmktplace,2026-07-10 16:47:06
2026-07-08 11:51:59,1645271252688-01,"Formas | Assadeiras, Fôrmas e Travessas | Casa e Cozinha",Conjunto de assadeiras ovais marinex opaline em vidro temperado – 3 peças,6780,7401,1,2655427,loyalt,2026-07-10 16:47:06
2026-07-08 11:49:39,1645271252686-01,Panelas e Utensílios para Cozinhar | Casa e Cozinha,Jogo de Panelas Revestimento Ceramica Indução 8 peças Extream Hakone Gray Light,41990,51990,1,3059856,tetrix,2026-07-10 16:47:07
2026-07-08 11:48:49,1645271252683-01,Celulares e Smartphones,Relogio Smartwatch Z6 Camera Celular Cartao Musica Preto,14990,14990,1,1658975,webcontinentalmktplace,2026-07-10 16:47:07
2026-07-08 11:48:26,1645271252682-01,Ventilador de parede | Eletrodomésticos,Ventilador de Coluna Electrolux Efficient Duoforce para Quartos Salas e Escritórios 110V,28000,28000,1,3141103,webcontinentalmktplace,2026-07-10 16:47:07
2026-07-08 11:47:49,1645271252681-01,Sanduicheiras e Grelhas Elétricas | Eletroportáteis,Grill e Sanduicheira Philco PGR21PI Maxx Clean 1000W 127V,11990,25990,1,3140,Philco,2026-07-10 16:47:07
2026-07-08 11:34:52,1645271252678-01,"Áudio | Cinema, TV e Áudio",Fone de ouvido philips tah2209bk/00 headphone bluetooth 25h bateria dobrável preto,12900,16666,1,2988263,loyalt,2026-07-10 16:47:07
2026-07-08 11:26:26,1645261252674-01,Cadeiras Gamer | Artigos Gamer | Computadores e Informática,Cadeira Gamer Preta E Branca,40388,43900,1,2637921,webcontinentalmktplace,2026-07-10 16:47:07
2026-07-08 11:25:18,1645261252673-01,Escovas Alisadoras | Cuidados com o Cabelo | Cosméticos e Perfumaria,Escova alisadora mondial black gold argan ea06 cabo giratório 230°c - bivolt,8990,8990,1,2299555,loyalt,2026-07-10 16:47:07
2026-07-08 11:18:44,1645261252666-01,Mochilas | Bolsas e Mochilas,ESTOJO INFANTIL TOY STORY PTO VERM 2 ZIP  EI38985TY-PT MAXLOG,1999,3999,1,783393,minipreco,2026-07-10 16:47:08
2026-07-08 11:00:02,1645261252659-01,Colchões | Quarto | Móveis,Colchão Casal 138cm Espuma D23 Supreme Gazin Preto S/V,42990,59990,1,2495660,multilojaonline,2026-07-10 16:47:08
2026-07-08 10:59:44,1645261252658-01,Celulares e Smartphones,"Celular samsung galaxy a07 tela 6.7"" 128gb 4g 90hz câmera dupla 50mp verde",68500,133112,1,2652242,loyalt,2026-07-10 16:47:08
