creationDate,orderId,categoryName,name,price,listPrice,quantity,productId,seller,data_extracao
2026-07-16 21:15:39,1647281257571-01,Motorola | Smartphone | Celulares e Smartphones,Smartphone Motorola Moto G06 256GB 12GB de RAM Bege,88700,99900,1,2526656,webfones,2026-07-18 00:16:13
2026-07-16 21:09:35,1647281257568-01,Bem-Estar | Saúde e Bem Estar,Cúrcuma Longa (curcumina) 60 Cápsulas 500mg Muwiz,2956,3790,2,1608544,webcontinentalmktplace,2026-07-18 00:16:13
2026-07-16 21:06:03,1647281257566-01,Utensílios para Cozinha | Casa e Cozinha,Kit Utensílios De Cozinha Jogo Completo 19 Peças,15955,15955,1,2235293,webcontinentalmktplace,2026-07-18 00:16:14
2026-07-16 21:03:42,1647281257564-01,"Acessórios de Áudio e Vídeo para Casa | Cinema, TV e Áudio",Kit Aparelho Conversor Smart Box Tv Android Wifi Mini Tecl,19990,19990,1,2748195,webcontinentalmktplace,2026-07-18 00:16:14
2026-07-16 20:59:43,1647281257561-01,"Acessórios de Áudio e Vídeo para Casa | Cinema, TV e Áudio",Kit Aparelho Conversor Smart Box Tv Android Wifi Mini Tecl,19990,19990,1,2748195,webcontinentalmktplace,2026-07-18 00:16:15
2026-07-16 20:55:41,1647281257558-01,Sofás | Sala de Estar | Móveis,Sofá 3 Lugares Retrátil 210cm Sued York Flash Estofado Preto S/V,112990,126990,1,2660353,multilojaonline,2026-07-18 00:16:15
2026-07-16 20:53:32,1647281257557-01,Sanduicheiras e Grelhas Elétricas | Eletroportáteis,Grill e Sanduicheira Philco PGR21PI Maxx Clean 1000W 127V,11990,25990,1,3140,Philco,2026-07-18 00:16:16
2026-07-16 20:51:35,1647281257556-01,"Áudio | Cinema, TV e Áudio",Fone de ouvido philips tah2209bk/00 headphone bluetooth 25h bateria dobrável preto,15544,16666,1,2988263,loyalt,2026-07-18 00:16:16
2026-07-16 20:48:51,1647281257552-01,Computadores de Mesa | Computadores e Informática,Capa de Colchão Impermeável Box Dupla Camada Poliéster e Polipropileno Queen Preto OEM,7635,7635,1,3111301,webcontinentalmktplace,2026-07-18 00:16:17
2026-07-16 20:48:51,1647281257552-02,Cama e Banho | Casa e Cozinha,Jogo cama lençol unique queen micro percal 400 fios ponto palito 3 peças - preto,7490,7490,1,2315321,loyalt,2026-07-18 00:16:17
2026-07-16 20:40:26,1647281257546-01,Panelas Elétricas | Eletroportáteis Especiais | Eletroportáteis,Panela de Arroz Britânia BPA5BI 5 xícaras 127V,13990,18990,1,687451,Philco,2026-07-18 00:16:18
2026-07-16 20:33:59,1647281257544-01,Fornos de Micro-Ondas | Eletrodomésticos,Micro-ondas britânia bmo23 20l limpa fácil 1100w preto/branco,53111,58422,1,2612357,loyalt,2026-07-18 00:16:18
2026-07-16 20:32:33,1647281257541-01,Cuidados com o Cabelo | Cosméticos e Perfumaria,Kit Eudora Volume Imediato Shampoo Siàge 250ml + Condicionador 200ml + Máscara Capilar 250g,11758,11758,1,3089527,farmaciaindiana,2026-07-18 00:16:19
2026-07-16 20:32:33,1647281257541-02,Rack para TV | Sala de Estar | Móveis,Rack Madesa Dubai para TV até 65 Polegadas Cor:Rustic,27999,49990,1,3342,madesacms,2026-07-18 00:16:19
2026-07-16 20:32:29,1647281257540-01,Rosto | Pele | Cosméticos e Perfumaria,Kit Principia Facial Gel de Limpeza Facial 350ml+Sérum Facial 30ml + Protetor Solar Fps60 40ml Kit Principia Facial Gel de Limpeza Facial 350ml+Sérum Facial 30ml+Protetor Solar Fps60 40ml,16700,16700,1,2613845,farmaciaindiana,2026-07-18 00:16:20
2026-07-16 20:25:30,1647271257538-01,Escova Rotativa Modeladora | Cuidados com o Cabelo | Cosméticos e Perfumaria,Escova Rotativa Philco 5 em 1 Bivolt 1300W PER03 Bivolt,20990,33990,1,2544170,Philco,2026-07-18 00:16:20
2026-07-16 20:21:56,1647271257537-01,Celulares e Smartphones,"Smartphone samsung galaxy a36 5g branco 128gb, 6gb ram, câmera tripla até 50mp, tela super amoled 6.7"", ip67, nfc, recursos ai e snapdragon 6 gen 3",144097,182111,1,2046057,loyalt,2026-07-18 00:16:21
2026-07-16 20:20:57,1647271257536-01,Relógios Masculinos | Relógios,Relogio Prata Masculino Aço Inoxidavel Caixa Premium,6099,6099,1,2563716,webcontinentalmktplace,2026-07-18 00:16:21
2026-07-16 20:18:41,1647271257534-01,Máquinas de Massa Manuais | Panelas e Utensílios para Cozinhar | Casa e Cozinha,Kit Ferramentas Soquete 46 Peças Estojo Compacto,4990,4990,1,2263115,webcontinentalmktplace,2026-07-18 00:16:21
2026-07-16 20:04:56,1647271257528-01,Bicicletas Infantis | Bicicleta e Ciclismo | Esporte e Lazer,Bicicleta Aro 20 Gt Sprint Cross Infantil Freio V-brake Aro Aero Branco+laranja,52421,58900,1,1098473,webcontinentalmktplace,2026-07-18 00:16:22
2026-07-16 20:00:33,1647271257518-02,"Chaleiras Elétricas | Café, Chá e Expresso | Eletroportáteis","Chaleira elétrica black+decker kepg gourmand gris 1,7l seletor de temperatura led azul inox",19990,21900,1,2046424,loyalt,2026-07-18 00:16:22
2026-07-16 20:00:33,1647271257518-01,Ferro de Passar e Passadeiras | Eletroportáteis,Vaporizador Portátil E Higienizador Black+decker Bdv2000v Vermelho,19790,26100,1,1013138,webcontinentalmktplace,2026-07-18 00:16:23
2026-07-16 19:55:30,1647271257514-04,Cremes | Bem-Estar | Saúde e Bem Estar,Creme Facial Revitalift Hialurônico FPS20 Diurno - LOréal Paris - 25g,4599,4599,1,139056,farmaconde,2026-07-18 00:16:24
2026-07-16 19:55:30,1647271257514-03,Cuidados com o Cabelo | Cosméticos e Perfumaria,Escova Secadora Modeladora 3 em 1 Hair Styler 1000W Tecnologia Iônica Preto OEM 110V,7498,7498,1,3466363,webcontinentalmktplace,2026-07-18 00:16:24
2026-07-16 19:55:30,1647271257514-01,Rosto | Pele | Cosméticos e Perfumaria,Hidratante Facial Antimanchas Garnier Vitamina C Toque Seco 85g,2990,3989,1,1241909,farmaciaindiana,2026-07-18 00:16:24
2026-07-16 19:55:30,1647271257514-01,Cuidados com o Cabelo | Cosméticos e Perfumaria,Óleo + Sérum Bifásico Dove UV Repair & Glow + Ferúlico 110ml,3290,4890,1,2310563,farmaciaindiana,2026-07-18 00:16:24
2026-07-16 19:55:30,1647271257514-02,Perfumes | Cosméticos e Perfumaria,Queen of life la rive perfume feminino - eau de parfum,4355,4700,1,2051024,loyalt,2026-07-18 00:16:25
2026-07-16 19:48:08,1647271257513-01,Ferro de Passar e Passadeiras | Eletroportáteis,Passadeira A Vapor Cadence Lisser Pro 220V,31400,34990,1,1777984,webcontinentalmktplace,2026-07-18 00:16:26
2026-07-16 19:45:41,1647271257512-01,Smartphone | Celulares e Smartphones,USADO iPhone 11 128 GB Preto Bom,139900,139900,1,2772779,armazemcircular,2026-07-18 00:16:27
2026-07-16 19:42:32,1647271257511-01,Depuradores e Coifas | Eletrodomésticos,Depurador de Ar Continental 60cm Inox Alto Poder de Sucção e 3 Velocidades (DC6PG) 220V,32900,37900,1,3087442,electrolux,2026-07-18 00:16:27
2026-07-16 19:41:54,1647271257509-01,"Projetores | Cinema, TV e Áudio",Projetor 4K MDM Ultra Definido Portátil com Imagem Até 200 Polegadas e Conexão Wifi HDMI USB,28995,35360,1,3199140,webcontinentalmktplace,2026-07-18 00:16:28
2026-07-16 19:41:14,1647271257508-01,"Cafeteiras e Máquinas de Expresso | Café, Chá e Expresso | Eletroportáteis",Cafeteira Philco 40 cafezinhos 1000W Painel Digital PCF40B 220V,17990,34990,1,817529,Philco,2026-07-18 00:16:29
2026-07-16 19:40:05,1647271257504-01,Fraldas | Bebês e Infantil,Fralda Huggies Supreme Care Hiper XXXG 42 unidades,6999,10899,1,905716,farmaciaindiana,2026-07-18 00:16:29
2026-07-16 19:36:32,1647271257503-01,Tablets | Eletrônicos,"Tablet samsung galaxy s10 lite 10.9"" android 15 128gb exynos 1380 wi-fi 8mp caneta s pen capa protetora cinza",249900,299990,1,2045051,loyalt,2026-07-18 00:16:29
2026-07-16 19:30:53,1647271257499-01,"Vitaminas | Vitaminas, Minerais e Suplementos | Saúde e Bem Estar",CREATINA HARDCORE 300G INTEGRALMEDICA,4929,7990,1,734233,farmaciaindiana,2026-07-18 00:16:30
2026-07-16 19:25:58,1647261257498-01,Perfumes | Cosméticos e Perfumaria,Perfume Árabe Orygens Fragrances Ameer Al Oud Intense 100ml,10999,12990,1,2636204,farmaciaindiana,2026-07-18 00:16:30
2026-07-16 19:24:38,1647261257495-01,Aspiradores de Pó e Água | Eletroportáteis,Aspirador de Pó Vertical com Fio Electrolux 1450W 2 em 1 Filtro HEPA Branco (STK14B) 127V,17990,30990,1,1108180,electrolux,2026-07-18 00:16:31
2026-07-16 19:23:53,1647261257494-01,Fritadeiras Elétricas | Eletroportáteis,AIR FRYER BRITANIA 127V OSCAR,36900,36900,1,2332233,minipreco,2026-07-18 00:16:31
2026-07-16 19:21:06,1647261257493-01,Motorola | Smartphone | Celulares e Smartphones,Smartphone Motorola Moto G35 5G 256GB 12GB de RAM Coral,104900,134900,1,1455312,webfones,2026-07-18 00:16:32
2026-07-16 19:15:15,1647261257492-01,Aspiradores de Pó e Água | Eletroportáteis,"Extratora de sujeiras portátil wap spot cleaner w3 1450w 3 em 1 para tapetes, carpetes, estofados e colchões – cinza e roxo",54990,65989,1,2044877,loyalt,2026-07-18 00:16:32
2026-07-16 19:12:17,1647261257490-01,Fogões | Fogões e Cooktops | Eletrodomésticos,Fogão 5 Bocas Dako Diplomata Glass Grill Style Timer Bivolt,245290,377900,1,2031316,webcontinentalmktplace,2026-07-18 00:16:33
2026-07-16 19:12:04,1647261257489-01,Aspiradores de Pó e Água | Eletroportáteis,Aspirador de Pó Vertical 2 em 1 Philco 1450W PAS1600P 220V,13990,27990,1,129612,Philco,2026-07-18 00:16:33
2026-07-16 19:02:53,1647261257487-01,Anticoncepcional | Saúde Da Mulher | Medicamentos,Slinda 4mg Caixa 72 Comprimidos Revestidos + 12 Comprimidos Placebos,24248,31931,1,2438654,farmaconde,2026-07-18 00:16:34
2026-07-16 19:02:36,1647261257486-01,Potes | Utensílios para Cozinha | Casa e Cozinha,Potes Herméticos Porta-Mantimentos com Tampa de Bambu,9990,15990,1,1107933,electrolux,2026-07-18 00:16:34
2026-07-16 18:57:24,1647261257484-01,Ventiladores | Eletroportáteis,Ventilador Britânia BVT301 Tecnologia Maxx Force 60W 127V,9990,19990,1,155335,Philco,2026-07-18 00:16:35
2026-07-16 18:55:03,1647261257483-01,Fritadeiras Elétricas | Eletroportáteis,"Fritadeira elétrica britânia bfr51 gold 5,5l 1500w air flow preta",26900,35890,1,2604477,loyalt,2026-07-18 00:16:36
2026-07-16 18:45:08,1647261257481-01,Fornos Elétricos | Eletrodomésticos,Forno Elétrico Philco PFE44P Dupla Resistência 44L 127V,37990,49990,1,143109,Philco,2026-07-18 00:16:36
2026-07-16 18:38:48,1647261257480-01,Cuidados com o Cabelo | Cosméticos e Perfumaria,Eudora siage glow expert kit shampoo condicionador,6390,8599,1,2072667,loyalt,2026-07-18 00:16:37
2026-07-16 18:34:21,1647261257479-01,Pneus | Produtos automotivos,Pneu goodyear direction touring 2 aro 14 175/65 86h,34238,39130,2,2607242,loyalt,2026-07-18 00:16:37
2026-07-16 18:32:42,1647261257478-01,Panelas | Panelas e Utensílios para Cozinhar | Casa e Cozinha,Jogo 5 Panelas Cerâmica Antiaderente Roma Preto - Haüskraft,19295,49990,1,845427,minipreco,2026-07-18 00:16:38
2026-07-16 18:25:47,1647251257474-01,Smartphone | Celulares e Smartphones,"Smartphone samsung galaxy s25 fe 5g tela 6,7” amoled 256gb 8gb ram câmera 50mp jetblack",349900,457652,1,2045402,loyalt,2026-07-18 00:16:38
2026-07-16 18:20:32,1647251257472-01,Fritadeiras Elétricas | Eletroportáteis,Fritadeira elétrica sem Óleo air fryer oven 2 em 1 mondial afon-12l-bi 12l digital – preta/inox,55900,60390,1,2047081,loyalt,2026-07-18 00:16:39
2026-07-16 18:15:58,1647251257470-01,Furadeira | Ferramentas Elétricas | Materiais de Construção,furadeira Com Impacto Vonder 1/2 FIV550N 127V,30690,30690,1,860023,guimepa,2026-07-18 00:16:39
2026-07-16 18:09:10,1647251257468-01,"Jarras, Decantadores e Garrafas | Louça, Copos e Talheres | Casa e Cozinha",JARRA WAVE TAMPA 600ML V1084.J01 LEHAVI,695,2990,1,875444,minipreco,2026-07-18 00:16:40
2026-07-16 18:09:10,1647251257468-01,"Canecas | Louça, Copos e Talheres | Casa e Cozinha",CANECA CERAMICA MOD AD 300ML TUUT,990,1999,2,2660823,minipreco,2026-07-18 00:16:40
2026-07-16 18:09:10,1647251257468-02,Perfumes | Cosméticos e Perfumaria,Perfume Lattafa Asad Eau De Parfum Masculino 100ml,18999,24790,1,1180987,webcontinentalmktplace,2026-07-18 00:16:40
2026-07-16 18:08:02,1647251257467-01,Depuradores e Coifas | Eletrodomésticos,Depurador e Exaustor Philco 80cm PDR80P 3 Velocidades Preto 127V,49990,59990,1,696772,Philco,2026-07-18 00:16:41
2026-07-16 18:04:36,1647251257465-01,Panelas de Arroz | Eletroportáteis Especiais | Eletroportáteis,Panela de Arroz Britânia PA5 Prime Preta 127V,13990,23990,1,1189,Philco,2026-07-18 00:16:41
2026-07-16 17:56:40,1647251257459-01,"Liquidificadores | Liquidificadores, Batedeiras e Processadores | Eletroportáteis","Liquidificador mondial power l-550 1,9l 550w 2 velocidades pulsar preto",7990,10041,1,2045329,loyalt,2026-07-18 00:16:42
2026-07-16 17:52:54,1647251257458-01,Decoração | Casa e Cozinha,Papel de Parede Estampado Moderno 5 Metros x 45 Centímetros,4790,6300,2,1282554,funstock,2026-07-18 00:16:42
2026-07-16 17:46:21,1647251257456-01,Cuidados com o Cabelo | Cosméticos e Perfumaria,Secador de Cabelo Profissional Premium 3000W Vermelho Kapbom 110V,13498,13498,1,3196875,webcontinentalmktplace,2026-07-18 00:16:43
2026-07-16 17:41:53,1647251257453-01,Secador de Cabelo | Cuidados com o Cabelo | Cosméticos e Perfumaria,Secador de Cabelos Britânia Bivolt 2100W BSC2200 Bivolt,9990,19990,1,1132265,Philco,2026-07-18 00:16:44
2026-07-16 17:41:53,1647251257453-02,"Batedeiras | Liquidificadores, Batedeiras e Processadores | Eletroportáteis",Batedeira Planetária Philco Concept 5L 900W Turbo PBP90A - 220V,29990,56090,1,2121986,webcontinentalmktplace,2026-07-18 00:16:44
2026-07-16 17:41:53,1647251257453-02,Relógios Masculinos | Relógios,Relógio De Pulso Masculino Data Automática De Aço Inoxidável Esportivo Impermeavel Preto,32798,40997,1,2279540,webcontinentalmktplace,2026-07-18 00:16:44
2026-07-16 17:39:26,1647251257452-01,Fritadeiras Elétricas | Eletroportáteis,Air Fryer Philco 16L 4 em 1 Painel Digital PAF16A 127V,59990,100990,1,1359968,Philco,2026-07-18 00:16:45
2026-07-16 17:34:31,1647251257451-01,Escova Rotativa Modeladora | Cuidados com o Cabelo | Cosméticos e Perfumaria,Escova Secadora Britânia 4 em 1 BELLA01 1300W Bivolt Bivolt,9990,15990,1,229761,Philco,2026-07-18 00:16:45
2026-07-16 17:20:06,1647241257447-01,Impressoras | Impressoras e Acessórios | Computadores e Informática,Impressora Multifuncional Deskjet Ink Advantage AJ4Y4A Colorida com Wi-Fi Preto HP,51900,71990,1,3231930,webcontinentalmktplace,2026-07-18 00:16:45
2026-07-16 17:17:40,1647241257443-01,"Vitaminas | Vitaminas, Minerais e Suplementos | Saúde e Bem Estar",Suplemento Alimentar Vitamina B12 60 Comprimidos Mastigáveis,3590,5437,1,1679023,farmaciaindiana,2026-07-18 00:16:46
2026-07-16 17:17:40,1647241257443-01,Desodorante | Higiene | Saúde e Bem Estar,Desodorante Gel Stick Secret Powder Protect Cotton 45g Desodorante Gel Secret Powder Protect Cotton 45g,1990,2990,2,848110,farmaciaindiana,2026-07-18 00:16:46
2026-07-16 17:17:40,1647241257443-01,Protetores Solares e Bronzeadores | Pele | Cosméticos e Perfumaria,Protetor Solar Facial Helioderm Bege Médio Fps70 50g,2849,4299,1,1047944,farmaciaindiana,2026-07-18 00:16:46
2026-07-16 17:15:30,1647241257440-01,Panelas | Panelas e Utensílios para Cozinhar | Casa e Cozinha,Jogo de Panela Cerâmica Pratic Creme 10 Peças - MIMO,69990,69990,1,1726553,minipreco,2026-07-18 00:16:46
2026-07-16 17:11:11,1647241257436-01,Conjuntos e Kits | Cuidados com o Cabelo | Cosméticos e Perfumaria,Modelador de Cachos Philco Bivolt Rotação Automática PEC16VD Bivolt,19990,27490,1,1778302,webcontinentalmktplace,2026-07-18 00:16:47
2026-07-16 17:09:51,1647241257434-01,Secador de Cabelo | Cuidados com o Cabelo | Cosméticos e Perfumaria,Secador de Cabelos Philco 2100W PSA3300 Íons Tourmaline 127V,12990,23990,1,771689,Philco,2026-07-18 00:16:47
2026-07-16 17:04:50,1647241257430-01,Mesas Para Escritório / Escrivaninha | Escritório | Móveis,Escrivaninha Office Qmovi Freijo Toq/Off White Fosco S/V,17990,19990,1,2640566,multilojaonline,2026-07-18 00:16:48
2026-07-16 17:04:22,1647241257429-01,Fraldas | Bebês e Infantil,Fralda Turma da Mônica Baby M 80 Unidades,5890,7956,1,2764458,farmaciaindiana,2026-07-18 00:16:49
2026-07-16 17:04:22,1647241257429-01,Lenço Umedecido | Higiene | Saúde e Bem Estar,Lenço Umedecido Babysec Galinha Pintadinha Ultrafresh 192 Unidades,2499,3349,1,1372609,farmaciaindiana,2026-07-18 00:16:49
2026-07-16 17:04:22,1647241257429-01,Ginecológicos | Saúde Da Mulher | Medicamentos,Pomada Antiassaduras Nistatina + Óxido de Zinco Neo Química 60g,1198,3108,2,2115298,farmaciaindiana,2026-07-18 00:16:49
2026-07-16 17:04:22,1647241257429-01,Amamentação e Alimentação | Bebês e Infantil,Cereal Infantil Mucilon Arroz e Aveia 600g,2189,2459,1,832822,farmaciaindiana,2026-07-18 00:16:49
2026-07-16 16:56:16,1647241257426-01,Panelas e Utensílios para Cozinhar | Casa e Cozinha,Jogo de panelas tramontina ravena 5 peças alumínio tampa vidro starflon max azul,27990,30890,1,2048057,loyalt,2026-07-18 00:16:49
2026-07-16 16:56:16,1647241257426-02,Panelas Elétricas | Eletroportáteis Especiais | Eletroportáteis,Panela Elétrica Fast Rice 5 Xicaras 127V Preta Mondial,12999,12999,1,1249520,minipreco,2026-07-18 00:16:50
2026-07-16 16:54:22,1647241257425-01,Carrinhos de Passeio | Bebês e Infantil,Carrinho De Bebê Galzerano Nizi Até 15kg Preto,49390,49390,1,3106823,webcontinentalmktplace,2026-07-18 00:16:50
2026-07-16 16:52:32,1647241257424-01,"Liquidificadores | Liquidificadores, Batedeiras e Processadores | Eletroportáteis","Liquidificador Britânia BLQE01 2 copos 2,6L 900W 127V",12990,18990,1,263867,Philco,2026-07-18 00:16:51
2026-07-16 16:51:00,1647241257423-01,Cooktops | Fogões e Cooktops | Eletrodomésticos,Cooktop Atlas 5 Bocas Ágile Up Mesa de Vidro Preto Bivolt,39990,51990,1,1965338,multilojaonline,2026-07-18 00:16:51
2026-07-16 16:49:38,1647241257422-01,Cobertores e Mantas | Cama e Banho | Casa e Cozinha,Coberdrom Casa Scarpa Apollo Solteiro Sherpa Manta Flannel Toque Lã De Carneiro - Azul Quartzo,12471,13857,1,1661605,webcontinentalmktplace,2026-07-18 00:16:52
2026-07-16 16:43:59,1647241257421-01,Ventiladores | Eletroportáteis,Ventilador Britânia BVT301 Tecnologia Maxx Force 60W 220V,9990,19990,1,155335,Philco,2026-07-18 00:16:53
2026-07-16 16:43:17,1647241257420-01,Chapinhas e Pranchas | Cuidados com o Cabelo | Cosméticos e Perfumaria,Prancha De Cabelo Eleganza Plus Bivolt,12990,12990,1,151033,gamaitaly,2026-07-18 00:16:54
2026-07-16 16:41:38,1647241257418-02,Mesas Para Escritório / Escrivaninha | Escritório | Móveis,Escrivaninha Demóbile Office Morada Branco,27990,40990,1,49751,multilojaonline,2026-07-18 00:16:54
2026-07-16 16:41:38,1647241257418-01,Mesa de cabeceira | Quarto | Móveis,Kit 2 Mesas De Cabeceira Campeche Branco ? Henn,43510,49235,1,2522795,webcontinentalmktplace,2026-07-18 00:16:55
2026-07-16 16:41:38,1647241257418-01,Poltronas | Sala de Estar | Móveis,Poltrona Recepção Luxo Design Moderno Conforto Pétala Suede Rosa,27490,27490,1,2703650,webcontinentalmktplace,2026-07-18 00:16:55
2026-07-16 16:34:17,1647241257416-01,"Multiprocessador | Liquidificadores, Batedeiras e Processadores | Eletroportáteis",Multiprocessador Britânia All In One BMP900P Preto 900W 127V,23990,36990,1,1895,Philco,2026-07-18 00:16:55
2026-07-16 16:23:38,1647231257413-01,Cuidados com o Cabelo | Cosméticos e Perfumaria,Wella Fusion - Condicionador 200ml,19700,28900,1,2134039,webcontinentalmktplace,2026-07-18 00:16:56
2026-07-16 16:19:59,1647231257411-02,Garrafas Térmicas | Utensílios para Cozinha | Casa e Cozinha,Garrafa Térmica Islandia com Cabo de Madeira 1L - BANANA TOYS,3990,7990,1,1718796,minipreco,2026-07-18 00:16:56
2026-07-16 16:19:59,1647231257411-01,Fralda Geriátrica | Cuidado Adulto | Saúde e Bem Estar,Fralda Geriátrica Bigfral Roupa Íntima Moviment Nova P/M 16 Unidades,5890,5890,1,847638,farmaciaindiana,2026-07-18 00:16:57
2026-07-16 16:19:59,1647231257411-01,Copa 2026,Kit 10 Envelopes de Figurinhas Copa do Mundo FIFA 2026 Panini,5990,7000,1,3135900,farmaciaindiana,2026-07-18 00:16:57
2026-07-16 16:17:05,1647231257409-01,Fones de Ouvido | Celulares e Smartphones,Fone De Ouvido Earbud Aiwa EB-05-B Preto Bluetooth Enc App Bivolt,11290,13989,1,1848363,webcontinentalmktplace,2026-07-18 00:16:57
2026-07-16 16:10:06,1647231257406-01,Aquecedores | Eletroportáteis,Aquecedor Quartzo Comfort Air Ii A-15 220v/60hz,13900,18990,1,1719613,webcontinentalmktplace,2026-07-18 00:16:58
2026-07-16 16:09:14,1647231257404-01,Cobertores e Mantas | Cama e Banho | Casa e Cozinha,Coberdrom Casa Scarpa Apollo Queen Sherpa Pele De Carneiro + Manta Flannel - Rosa Alaranjado Apricot,16572,18413,1,2014476,webcontinentalmktplace,2026-07-18 00:16:58
2026-07-16 16:00:46,1647231257401-01,Aquecedores | Eletroportáteis,Aquecedor Britânia AB1500P 2 em 1 127V,13990,17990,1,136434,Philco,2026-07-18 00:16:59
2026-07-16 15:56:23,1647231257398-01,Panelas Elétricas | Eletroportáteis Especiais | Eletroportáteis,Panela De Arroz Britânia Prime Preta PA5 110V,13990,23090,1,1856781,webcontinentalmktplace,2026-07-18 00:16:59
2026-07-16 15:55:41,1647231257396-02,Panelas | Panelas e Utensílios para Cozinhar | Casa e Cozinha,Jogo De Panelas Alumínio Batido Fundido Tampa Pesada Belmar,46450,46450,1,1596606,webcontinentalmktplace,2026-07-18 00:17:00
2026-07-16 15:55:41,1647231257396-01,"Multiprocessador | Liquidificadores, Batedeiras e Processadores | Eletroportáteis",Multiprocessador Britânia 5 em 1 BMP2000 1300W 220V,28990,53990,1,403850,Philco,2026-07-18 00:17:00
2026-07-16 15:52:18,1647231257395-01,Copa 2026,Kit 20 Envelopes de Figurinhas Copa do Mundo FIFA 2026 Panini,11980,14000,1,3137856,farmaciaindiana,2026-07-18 00:17:01
2026-07-16 15:50:51,1647231257394-01,Secador de Cabelo | Cuidados com o Cabelo | Cosméticos e Perfumaria,Secador De Cabelo Com íons Tourmaline 2100W Philco PSA3250 220V,16490,16490,1,1832844,webcontinentalmktplace,2026-07-18 00:17:01
2026-07-16 15:39:13,1647231257392-01,Guarda-Roupa E Roupeiros | Quarto | Móveis,Guarda Roupa Casal 6 Portas 2 Gavetas Multi Poquema Branco S/V,55990,66990,1,64542,multilojaonline,2026-07-18 00:17:02
2026-07-16 15:32:17,1647231257390-01,Ar-condicionado | Eletrodomésticos,Ar Condicionado Split Inverter Hisense R-32 Hi-wall 12.000 Btus Quente E Frio Wi-fi 220V,205444,205444,1,2855677,webcontinentalmktplace,2026-07-18 00:17:02
2026-07-16 15:14:13,1647221257388-01,Penteadeiras | Quarto | Móveis,Penteadeira Camarim Lux Lux Suspensa Sofia 3 Gavetas C/ Led Branco,44910,59880,1,1642454,webcontinentalmktplace,2026-07-18 00:17:03
2026-07-16 14:59:57,1647221257383-01,Escova Rotativa Modeladora | Cuidados com o Cabelo | Cosméticos e Perfumaria,Escova Secadora Britânia BEC02PR Bivolt 4 em 1 1300W Bivolt,8990,19990,1,155346,Philco,2026-07-18 00:17:03
2026-07-16 14:53:28,1647221257382-01,Computadores de Mesa | Computadores e Informática,"Computador Completo Tob Intel Core I3 Ssd 240gb Memória 8gb Windows 10 Pro Trial + Teclado E Mouse + Monitor 19"" Desktop",105559,131949,1,1923515,webcontinentalmktplace,2026-07-18 00:17:03
2026-07-16 14:52:32,1647221257381-01,Escova Secadora | Cuidados com o Cabelo | Cosméticos e Perfumaria,Escova Secadora Britania Soft BES13VD Verde Bivolt 1300W Bivolt,11990,18990,1,1526,Philco,2026-07-18 00:17:04
2026-07-16 14:45:53,1647221257375-01,Cobertores e Mantas | Cama e Banho | Casa e Cozinha,Coberdrom Casa Scarpa Apollo Queen Sherpa Pele De Carneiro + Manta Flannel - Azul Quartzo,16572,18413,1,1666598,webcontinentalmktplace,2026-07-18 00:17:04
2026-07-16 14:39:21,1647221257372-01,Carrinhos de Passeio | Bebês e Infantil,Carrinho De Bebê Galzerano Nizi Até 15kg Preto,49390,49390,1,3106823,webcontinentalmktplace,2026-07-18 00:17:05
2026-07-16 14:26:35,1647211257369-01,Cooktops | Fogões e Cooktops | Eletrodomésticos,Cooktop Atlas U Top 5 Bocas Acendimento Automático Preto Bivolt,49990,65990,1,136388,multilojaonline,2026-07-18 00:17:05
2026-07-16 14:24:06,1647211257366-01,"TVs | Cinema, TV e Áudio","Smart tv 4k lg 43"" uhd 43ua7500psa processador a7 gen8 alexa integrado otimizador de jogos",192900,237492,2,2046120,loyalt,2026-07-18 00:17:06
2026-07-16 14:23:36,1647211257364-01,"Chaleiras Elétricas | Café, Chá e Expresso | Eletroportáteis","Chaleira Elétrica Britânia 2,1L de Vidro com Luz LED BCH21A 127V",19990,19990,1,2881662,Philco,2026-07-18 00:17:06
2026-07-16 14:15:11,1647211257361-01,"Processadores de Alimentos | Liquidificadores, Batedeiras e Processadores | Eletroportáteis",Processador Britânia Compacto BMP900 Turbo 250W 127V,15990,20990,1,17906,Philco,2026-07-18 00:17:07
2026-07-16 14:08:15,1647211257360-01,Bicicletas | Bicicleta e Ciclismo | Esporte e Lazer,Bicicleta 29 Aço 21 Marchas Freio A Disco Branco+preto,62211,69900,1,1103426,webcontinentalmktplace,2026-07-18 00:17:07
2026-07-16 14:07:22,1647211257358-02,Roupa de Cama | Cama e Banho | Casa e Cozinha,Lençol Casal Cintilante Percal 180 Fios 100% Algodão Com Elástico - Verde,4280,4280,2,1573081,webcontinentalmktplace,2026-07-18 00:17:08
2026-07-16 14:07:22,1647211257358-01,Pet Shop,"Ração Quatree Goumert 10,1KG Carne Gatoas Adultos",12791,14490,1,837142,farmaciaindiana,2026-07-18 00:17:08
2026-07-16 14:06:20,1647211257356-01,Panelas | Panelas e Utensílios para Cozinhar | Casa e Cozinha,"Panela de Pressão Magnific Vermelha 4,5L - ALCAST",12257,17880,1,1154606,loyalt,2026-07-18 00:17:09
2026-07-16 13:58:03,1647211257350-01,Fornos Elétricos | Eletrodomésticos,Forno Elétrico de Bancada Terim Top 60 Black 60L 1750W com Grill e Luz Interna Preto 220V,43140,48390,1,3195960,webcontinentalmktplace,2026-07-18 00:17:09
2026-07-16 13:55:05,1647211257349-01,Guarda-Roupa E Roupeiros | Quarto | Móveis,Guarda Roupa Solteiro 6 Portas 2 Gavetas Sidney Doripel Off White/Nogueira S/V,53990,65990,1,259789,multilojaonline,2026-07-18 00:17:10
2026-07-16 13:54:34,1647211257348-01,Fornos de Micro-Ondas | Eletrodomésticos,Micro-Ondas Philco PMO23BB Multifunções Limpa Fácil 20L 1100W 220V,43990,62990,1,1273,Philco,2026-07-18 00:17:10
2026-07-16 13:47:21,1647211257347-01,Cadeiras Gamer | Artigos Gamer | Computadores e Informática,Kit de Fotografia OEM Luz de Vídeo com Microfone de Lapela Tripé Dobrável e Controle Bluetooth,5997,5997,1,3468039,webcontinentalmktplace,2026-07-18 00:17:11
